[32m[I 2023-01-13 04:07:32,001][0m Trial 87 finished with value: 0.5354056496740572 and parameters: {'n_estimators': 8795, 'max_depth': 36, 'learning_rate': 0.03971505116922703, 'colsample_bytree': 0.40216935992560154, 'subsample': 0.6050303421033802, 'alpha': 8.019700670112815e-07, 'lambda': 0.3798205526509982}. Best is trial 86 with value: 0.5763263657865891.[0m
/Users/kevinmaikjablonka/git/kjappelbaum/gptchem/src/gptchem/baselines/xgboost.py:38: FutureWarning: suggest_loguniform has been deprecated in v3.0.0. This feature will be removed in v6.0.0. See https://github.com/optuna/optuna/releases/tag/v3.0.0. Use :func:`~optuna.trial.Trial.suggest_float` instead.
  "learning_rate": trial.suggest_loguniform("learning_rate", 0.001, 0.05),
/Users/kevinmaikjablonka/git/kjappelbaum/gptchem/src/gptchem/baselines/xgboost.py:39: FutureWarning: suggest_loguniform has been deprecated in v3.0.0. This feature will be removed in v6.0.0. See https://github.com/optuna/optuna/releases/tag/v3.0.0. Use :func:`~optuna.trial.Trial.suggest_float` instead.
  "colsample_bytree": trial.suggest_loguniform(
/Users/kevinmaikjablonka/git/kjappelbaum/gptchem/src/gptchem/baselines/xgboost.py:42: FutureWarning: suggest_loguniform has been deprecated in v3.0.0. This feature will be removed in v6.0.0. See https://github.com/optuna/optuna/releases/tag/v3.0.0. Use :func:`~optuna.trial.Trial.suggest_float` instead.
  "subsample": trial.suggest_loguniform("subsample", 0.00001, 1),
/Users/kevinmaikjablonka/git/kjappelbaum/gptchem/src/gptchem/baselines/xgboost.py:43: FutureWarning: suggest_loguniform has been deprecated in v3.0.0. This feature will be removed in v6.0.0. See https://github.com/optuna/optuna/releases/tag/v3.0.0. Use :func:`~optuna.trial.Trial.suggest_float` instead.
  "alpha": trial.suggest_loguniform("alpha", 1e-8, 10.0),
/Users/kevinmaikjablonka/git/kjappelbaum/gptchem/src/gptchem/baselines/xgboost.py:44: FutureWarning: suggest_loguniform has been deprecated in v3.0.0. This feature will be removed in v6.0.0. See https://github.com/optuna/optuna/releases/tag/v3.0.0. Use :func:`~optuna.trial.Trial.suggest_float` instead.
  "lambda": trial.suggest_loguniform("lambda", 1e-8, 10.0),
[32m[I 2023-01-13 04:07:46,245][0m Trial 88 finished with value: 0.5054811270600743 and parameters: {'n_estimators': 9504, 'max_depth': 37, 'learning_rate': 0.040271807937750655, 'colsample_bytree': 0.43097849814457323, 'subsample': 0.1247151438610802, 'alpha': 1.1994269628128856e-05, 'lambda': 2.9494840623228162}. Best is trial 86 with value: 0.5763263657865891.[0m
/Users/kevinmaikjablonka/git/kjappelbaum/gptchem/src/gptchem/baselines/xgboost.py:38: FutureWarning: suggest_loguniform has been deprecated in v3.0.0. This feature will be removed in v6.0.0. See https://github.com/optuna/optuna/releases/tag/v3.0.0. Use :func:`~optuna.trial.Trial.suggest_float` instead.
  "learning_rate": trial.suggest_loguniform("learning_rate", 0.001, 0.05),
/Users/kevinmaikjablonka/git/kjappelbaum/gptchem/src/gptchem/baselines/xgboost.py:39: FutureWarning: suggest_loguniform has been deprecated in v3.0.0. This feature will be removed in v6.0.0. See https://github.com/optuna/optuna/releases/tag/v3.0.0. Use :func:`~optuna.trial.Trial.suggest_float` instead.
  "colsample_bytree": trial.suggest_loguniform(
/Users/kevinmaikjablonka/git/kjappelbaum/gptchem/src/gptchem/baselines/xgboost.py:42: FutureWarning: suggest_loguniform has been deprecated in v3.0.0. This feature will be removed in v6.0.0. See https://github.com/optuna/optuna/releases/tag/v3.0.0. Use :func:`~optuna.trial.Trial.suggest_float` instead.
  "subsample": trial.suggest_loguniform("subsample", 0.00001, 1),
/Users/kevinmaikjablonka/git/kjappelbaum/gptchem/src/gptchem/baselines/xgboost.py:43: FutureWarning: suggest_loguniform has been deprecated in v3.0.0. This feature will be removed in v6.0.0. See https://github.com/optuna/optuna/releases/tag/v3.0.0. Use :func:`~optuna.trial.Trial.suggest_float` instead.
  "alpha": trial.suggest_loguniform("alpha", 1e-8, 10.0),
/Users/kevinmaikjablonka/git/kjappelbaum/gptchem/src/gptchem/baselines/xgboost.py:44: FutureWarning: suggest_loguniform has been deprecated in v3.0.0. This feature will be removed in v6.0.0. See https://github.com/optuna/optuna/releases/tag/v3.0.0. Use :func:`~optuna.trial.Trial.suggest_float` instead.
  "lambda": trial.suggest_loguniform("lambda", 1e-8, 10.0),
[32m[I 2023-01-13 04:08:03,702][0m Trial 89 finished with value: 0.5267208243813439 and parameters: {'n_estimators': 7933, 'max_depth': 39, 'learning_rate': 0.030778089224901703, 'colsample_bytree': 0.3835903627927034, 'subsample': 0.37227588883744206, 'alpha': 0.00014156220272421038, 'lambda': 2.318208951388479}. Best is trial 86 with value: 0.5763263657865891.[0m
/Users/kevinmaikjablonka/git/kjappelbaum/gptchem/src/gptchem/baselines/xgboost.py:38: FutureWarning: suggest_loguniform has been deprecated in v3.0.0. This feature will be removed in v6.0.0. See https://github.com/optuna/optuna/releases/tag/v3.0.0. Use :func:`~optuna.trial.Trial.suggest_float` instead.
  "learning_rate": trial.suggest_loguniform("learning_rate", 0.001, 0.05),
/Users/kevinmaikjablonka/git/kjappelbaum/gptchem/src/gptchem/baselines/xgboost.py:39: FutureWarning: suggest_loguniform has been deprecated in v3.0.0. This feature will be removed in v6.0.0. See https://github.com/optuna/optuna/releases/tag/v3.0.0. Use :func:`~optuna.trial.Trial.suggest_float` instead.
  "colsample_bytree": trial.suggest_loguniform(
/Users/kevinmaikjablonka/git/kjappelbaum/gptchem/src/gptchem/baselines/xgboost.py:42: FutureWarning: suggest_loguniform has been deprecated in v3.0.0. This feature will be removed in v6.0.0. See https://github.com/optuna/optuna/releases/tag/v3.0.0. Use :func:`~optuna.trial.Trial.suggest_float` instead.
  "subsample": trial.suggest_loguniform("subsample", 0.00001, 1),
/Users/kevinmaikjablonka/git/kjappelbaum/gptchem/src/gptchem/baselines/xgboost.py:43: FutureWarning: suggest_loguniform has been deprecated in v3.0.0. This feature will be removed in v6.0.0. See https://github.com/optuna/optuna/releases/tag/v3.0.0. Use :func:`~optuna.trial.Trial.suggest_float` instead.
  "alpha": trial.suggest_loguniform("alpha", 1e-8, 10.0),
/Users/kevinmaikjablonka/git/kjappelbaum/gptchem/src/gptchem/baselines/xgboost.py:44: FutureWarning: suggest_loguniform has been deprecated in v3.0.0. This feature will be removed in v6.0.0. See https://github.com/optuna/optuna/releases/tag/v3.0.0. Use :func:`~optuna.trial.Trial.suggest_float` instead.
  "lambda": trial.suggest_loguniform("lambda", 1e-8, 10.0),
[32m[I 2023-01-13 04:08:18,604][0m Trial 90 finished with value: 0.5171530818831935 and parameters: {'n_estimators': 9186, 'max_depth': 43, 'learning_rate': 0.03713026185034688, 'colsample_bytree': 0.3529748447906382, 'subsample': 0.2050742318527048, 'alpha': 1.9123039710003045e-06, 'lambda': 0.8070725440455346}. Best is trial 86 with value: 0.5763263657865891.[0m
/Users/kevinmaikjablonka/git/kjappelbaum/gptchem/src/gptchem/baselines/xgboost.py:38: FutureWarning: suggest_loguniform has been deprecated in v3.0.0. This feature will be removed in v6.0.0. See https://github.com/optuna/optuna/releases/tag/v3.0.0. Use :func:`~optuna.trial.Trial.suggest_float` instead.
  "learning_rate": trial.suggest_loguniform("learning_rate", 0.001, 0.05),
/Users/kevinmaikjablonka/git/kjappelbaum/gptchem/src/gptchem/baselines/xgboost.py:39: FutureWarning: suggest_loguniform has been deprecated in v3.0.0. This feature will be removed in v6.0.0. See https://github.com/optuna/optuna/releases/tag/v3.0.0. Use :func:`~optuna.trial.Trial.suggest_float` instead.
  "colsample_bytree": trial.suggest_loguniform(
/Users/kevinmaikjablonka/git/kjappelbaum/gptchem/src/gptchem/baselines/xgboost.py:42: FutureWarning: suggest_loguniform has been deprecated in v3.0.0. This feature will be removed in v6.0.0. See https://github.com/optuna/optuna/releases/tag/v3.0.0. Use :func:`~optuna.trial.Trial.suggest_float` instead.
  "subsample": trial.suggest_loguniform("subsample", 0.00001, 1),
/Users/kevinmaikjablonka/git/kjappelbaum/gptchem/src/gptchem/baselines/xgboost.py:43: FutureWarning: suggest_loguniform has been deprecated in v3.0.0. This feature will be removed in v6.0.0. See https://github.com/optuna/optuna/releases/tag/v3.0.0. Use :func:`~optuna.trial.Trial.suggest_float` instead.
  "alpha": trial.suggest_loguniform("alpha", 1e-8, 10.0),
/Users/kevinmaikjablonka/git/kjappelbaum/gptchem/src/gptchem/baselines/xgboost.py:44: FutureWarning: suggest_loguniform has been deprecated in v3.0.0. This feature will be removed in v6.0.0. See https://github.com/optuna/optuna/releases/tag/v3.0.0. Use :func:`~optuna.trial.Trial.suggest_float` instead.
  "lambda": trial.suggest_loguniform("lambda", 1e-8, 10.0),
[32m[I 2023-01-13 04:08:38,449][0m Trial 91 finished with value: 0.5342412136479305 and parameters: {'n_estimators': 8358, 'max_depth': 48, 'learning_rate': 0.042613943505999397, 'colsample_bytree': 0.4036132911895266, 'subsample': 0.541937677186372, 'alpha': 3.6217969777533813e-06, 'lambda': 0.12303805743966653}. Best is trial 86 with value: 0.5763263657865891.[0m
/Users/kevinmaikjablonka/git/kjappelbaum/gptchem/src/gptchem/baselines/xgboost.py:38: FutureWarning: suggest_loguniform has been deprecated in v3.0.0. This feature will be removed in v6.0.0. See https://github.com/optuna/optuna/releases/tag/v3.0.0. Use :func:`~optuna.trial.Trial.suggest_float` instead.
  "learning_rate": trial.suggest_loguniform("learning_rate", 0.001, 0.05),
/Users/kevinmaikjablonka/git/kjappelbaum/gptchem/src/gptchem/baselines/xgboost.py:39: FutureWarning: suggest_loguniform has been deprecated in v3.0.0. This feature will be removed in v6.0.0. See https://github.com/optuna/optuna/releases/tag/v3.0.0. Use :func:`~optuna.trial.Trial.suggest_float` instead.
  "colsample_bytree": trial.suggest_loguniform(
/Users/kevinmaikjablonka/git/kjappelbaum/gptchem/src/gptchem/baselines/xgboost.py:42: FutureWarning: suggest_loguniform has been deprecated in v3.0.0. This feature will be removed in v6.0.0. See https://github.com/optuna/optuna/releases/tag/v3.0.0. Use :func:`~optuna.trial.Trial.suggest_float` instead.
  "subsample": trial.suggest_loguniform("subsample", 0.00001, 1),
/Users/kevinmaikjablonka/git/kjappelbaum/gptchem/src/gptchem/baselines/xgboost.py:43: FutureWarning: suggest_loguniform has been deprecated in v3.0.0. This feature will be removed in v6.0.0. See https://github.com/optuna/optuna/releases/tag/v3.0.0. Use :func:`~optuna.trial.Trial.suggest_float` instead.
  "alpha": trial.suggest_loguniform("alpha", 1e-8, 10.0),
/Users/kevinmaikjablonka/git/kjappelbaum/gptchem/src/gptchem/baselines/xgboost.py:44: FutureWarning: suggest_loguniform has been deprecated in v3.0.0. This feature will be removed in v6.0.0. See https://github.com/optuna/optuna/releases/tag/v3.0.0. Use :func:`~optuna.trial.Trial.suggest_float` instead.
  "lambda": trial.suggest_loguniform("lambda", 1e-8, 10.0),
[32m[I 2023-01-13 04:09:00,469][0m Trial 92 finished with value: 0.5242984354826461 and parameters: {'n_estimators': 8519, 'max_depth': 46, 'learning_rate': 0.04733830351760155, 'colsample_bytree': 0.32213516160982775, 'subsample': 0.8161731649026952, 'alpha': 1.1156673870783994e-05, 'lambda': 4.200005655868465}. Best is trial 86 with value: 0.5763263657865891.[0m
/Users/kevinmaikjablonka/git/kjappelbaum/gptchem/src/gptchem/baselines/xgboost.py:38: FutureWarning: suggest_loguniform has been deprecated in v3.0.0. This feature will be removed in v6.0.0. See https://github.com/optuna/optuna/releases/tag/v3.0.0. Use :func:`~optuna.trial.Trial.suggest_float` instead.
  "learning_rate": trial.suggest_loguniform("learning_rate", 0.001, 0.05),
/Users/kevinmaikjablonka/git/kjappelbaum/gptchem/src/gptchem/baselines/xgboost.py:39: FutureWarning: suggest_loguniform has been deprecated in v3.0.0. This feature will be removed in v6.0.0. See https://github.com/optuna/optuna/releases/tag/v3.0.0. Use :func:`~optuna.trial.Trial.suggest_float` instead.
  "colsample_bytree": trial.suggest_loguniform(
/Users/kevinmaikjablonka/git/kjappelbaum/gptchem/src/gptchem/baselines/xgboost.py:42: FutureWarning: suggest_loguniform has been deprecated in v3.0.0. This feature will be removed in v6.0.0. See https://github.com/optuna/optuna/releases/tag/v3.0.0. Use :func:`~optuna.trial.Trial.suggest_float` instead.
  "subsample": trial.suggest_loguniform("subsample", 0.00001, 1),
/Users/kevinmaikjablonka/git/kjappelbaum/gptchem/src/gptchem/baselines/xgboost.py:43: FutureWarning: suggest_loguniform has been deprecated in v3.0.0. This feature will be removed in v6.0.0. See https://github.com/optuna/optuna/releases/tag/v3.0.0. Use :func:`~optuna.trial.Trial.suggest_float` instead.
  "alpha": trial.suggest_loguniform("alpha", 1e-8, 10.0),
/Users/kevinmaikjablonka/git/kjappelbaum/gptchem/src/gptchem/baselines/xgboost.py:44: FutureWarning: suggest_loguniform has been deprecated in v3.0.0. This feature will be removed in v6.0.0. See https://github.com/optuna/optuna/releases/tag/v3.0.0. Use :func:`~optuna.trial.Trial.suggest_float` instead.
  "lambda": trial.suggest_loguniform("lambda", 1e-8, 10.0),
[32m[I 2023-01-13 04:09:17,292][0m Trial 93 finished with value: 0.4873547505126453 and parameters: {'n_estimators': 9476, 'max_depth': 49, 'learning_rate': 0.044273915604333566, 'colsample_bytree': 0.33829919926511687, 'subsample': 0.31955221836615255, 'alpha': 5.71614344278386e-05, 'lambda': 0.06277685560454196}. Best is trial 86 with value: 0.5763263657865891.[0m
/Users/kevinmaikjablonka/git/kjappelbaum/gptchem/src/gptchem/baselines/xgboost.py:38: FutureWarning: suggest_loguniform has been deprecated in v3.0.0. This feature will be removed in v6.0.0. See https://github.com/optuna/optuna/releases/tag/v3.0.0. Use :func:`~optuna.trial.Trial.suggest_float` instead.
  "learning_rate": trial.suggest_loguniform("learning_rate", 0.001, 0.05),
/Users/kevinmaikjablonka/git/kjappelbaum/gptchem/src/gptchem/baselines/xgboost.py:39: FutureWarning: suggest_loguniform has been deprecated in v3.0.0. This feature will be removed in v6.0.0. See https://github.com/optuna/optuna/releases/tag/v3.0.0. Use :func:`~optuna.trial.Trial.suggest_float` instead.
  "colsample_bytree": trial.suggest_loguniform(
/Users/kevinmaikjablonka/git/kjappelbaum/gptchem/src/gptchem/baselines/xgboost.py:42: FutureWarning: suggest_loguniform has been deprecated in v3.0.0. This feature will be removed in v6.0.0. See https://github.com/optuna/optuna/releases/tag/v3.0.0. Use :func:`~optuna.trial.Trial.suggest_float` instead.
  "subsample": trial.suggest_loguniform("subsample", 0.00001, 1),
/Users/kevinmaikjablonka/git/kjappelbaum/gptchem/src/gptchem/baselines/xgboost.py:43: FutureWarning: suggest_loguniform has been deprecated in v3.0.0. This feature will be removed in v6.0.0. See https://github.com/optuna/optuna/releases/tag/v3.0.0. Use :func:`~optuna.trial.Trial.suggest_float` instead.
  "alpha": trial.suggest_loguniform("alpha", 1e-8, 10.0),
/Users/kevinmaikjablonka/git/kjappelbaum/gptchem/src/gptchem/baselines/xgboost.py:44: FutureWarning: suggest_loguniform has been deprecated in v3.0.0. This feature will be removed in v6.0.0. See https://github.com/optuna/optuna/releases/tag/v3.0.0. Use :func:`~optuna.trial.Trial.suggest_float` instead.
  "lambda": trial.suggest_loguniform("lambda", 1e-8, 10.0),
[32m[I 2023-01-13 04:09:33,638][0m Trial 94 finished with value: 0.5268210750079104 and parameters: {'n_estimators': 7042, 'max_depth': 43, 'learning_rate': 0.03207579711582579, 'colsample_bytree': 0.3651084240611605, 'subsample': 0.4691941394439936, 'alpha': 4.1549803258116406e-05, 'lambda': 1.5896422194557458}. Best is trial 86 with value: 0.5763263657865891.[0m
/Users/kevinmaikjablonka/git/kjappelbaum/gptchem/src/gptchem/baselines/xgboost.py:38: FutureWarning: suggest_loguniform has been deprecated in v3.0.0. This feature will be removed in v6.0.0. See https://github.com/optuna/optuna/releases/tag/v3.0.0. Use :func:`~optuna.trial.Trial.suggest_float` instead.
  "learning_rate": trial.suggest_loguniform("learning_rate", 0.001, 0.05),
/Users/kevinmaikjablonka/git/kjappelbaum/gptchem/src/gptchem/baselines/xgboost.py:39: FutureWarning: suggest_loguniform has been deprecated in v3.0.0. This feature will be removed in v6.0.0. See https://github.com/optuna/optuna/releases/tag/v3.0.0. Use :func:`~optuna.trial.Trial.suggest_float` instead.
  "colsample_bytree": trial.suggest_loguniform(
/Users/kevinmaikjablonka/git/kjappelbaum/gptchem/src/gptchem/baselines/xgboost.py:42: FutureWarning: suggest_loguniform has been deprecated in v3.0.0. This feature will be removed in v6.0.0. See https://github.com/optuna/optuna/releases/tag/v3.0.0. Use :func:`~optuna.trial.Trial.suggest_float` instead.
  "subsample": trial.suggest_loguniform("subsample", 0.00001, 1),
/Users/kevinmaikjablonka/git/kjappelbaum/gptchem/src/gptchem/baselines/xgboost.py:43: FutureWarning: suggest_loguniform has been deprecated in v3.0.0. This feature will be removed in v6.0.0. See https://github.com/optuna/optuna/releases/tag/v3.0.0. Use :func:`~optuna.trial.Trial.suggest_float` instead.
  "alpha": trial.suggest_loguniform("alpha", 1e-8, 10.0),
/Users/kevinmaikjablonka/git/kjappelbaum/gptchem/src/gptchem/baselines/xgboost.py:44: FutureWarning: suggest_loguniform has been deprecated in v3.0.0. This feature will be removed in v6.0.0. See https://github.com/optuna/optuna/releases/tag/v3.0.0. Use :func:`~optuna.trial.Trial.suggest_float` instead.
  "lambda": trial.suggest_loguniform("lambda", 1e-8, 10.0),
[32m[I 2023-01-13 04:09:59,263][0m Trial 95 finished with value: 0.5528822055137844 and parameters: {'n_estimators': 8930, 'max_depth': 47, 'learning_rate': 0.04961312709233445, 'colsample_bytree': 0.5014614296161243, 'subsample': 0.7200833597607685, 'alpha': 2.495774999533197e-07, 'lambda': 0.020491750144458462}. Best is trial 86 with value: 0.5763263657865891.[0m
/Users/kevinmaikjablonka/git/kjappelbaum/gptchem/src/gptchem/baselines/xgboost.py:38: FutureWarning: suggest_loguniform has been deprecated in v3.0.0. This feature will be removed in v6.0.0. See https://github.com/optuna/optuna/releases/tag/v3.0.0. Use :func:`~optuna.trial.Trial.suggest_float` instead.
  "learning_rate": trial.suggest_loguniform("learning_rate", 0.001, 0.05),
/Users/kevinmaikjablonka/git/kjappelbaum/gptchem/src/gptchem/baselines/xgboost.py:39: FutureWarning: suggest_loguniform has been deprecated in v3.0.0. This feature will be removed in v6.0.0. See https://github.com/optuna/optuna/releases/tag/v3.0.0. Use :func:`~optuna.trial.Trial.suggest_float` instead.
  "colsample_bytree": trial.suggest_loguniform(
/Users/kevinmaikjablonka/git/kjappelbaum/gptchem/src/gptchem/baselines/xgboost.py:42: FutureWarning: suggest_loguniform has been deprecated in v3.0.0. This feature will be removed in v6.0.0. See https://github.com/optuna/optuna/releases/tag/v3.0.0. Use :func:`~optuna.trial.Trial.suggest_float` instead.
  "subsample": trial.suggest_loguniform("subsample", 0.00001, 1),
/Users/kevinmaikjablonka/git/kjappelbaum/gptchem/src/gptchem/baselines/xgboost.py:43: FutureWarning: suggest_loguniform has been deprecated in v3.0.0. This feature will be removed in v6.0.0. See https://github.com/optuna/optuna/releases/tag/v3.0.0. Use :func:`~optuna.trial.Trial.suggest_float` instead.
  "alpha": trial.suggest_loguniform("alpha", 1e-8, 10.0),
/Users/kevinmaikjablonka/git/kjappelbaum/gptchem/src/gptchem/baselines/xgboost.py:44: FutureWarning: suggest_loguniform has been deprecated in v3.0.0. This feature will be removed in v6.0.0. See https://github.com/optuna/optuna/releases/tag/v3.0.0. Use :func:`~optuna.trial.Trial.suggest_float` instead.
  "lambda": trial.suggest_loguniform("lambda", 1e-8, 10.0),
[32m[I 2023-01-13 04:10:23,839][0m Trial 96 finished with value: 0.5539965162266279 and parameters: {'n_estimators': 8897, 'max_depth': 41, 'learning_rate': 0.0493453526194537, 'colsample_bytree': 0.4980841095474129, 'subsample': 0.6290055770568674, 'alpha': 5.751694470452551e-06, 'lambda': 0.006726977075617815}. Best is trial 86 with value: 0.5763263657865891.[0m
/Users/kevinmaikjablonka/git/kjappelbaum/gptchem/src/gptchem/baselines/xgboost.py:38: FutureWarning: suggest_loguniform has been deprecated in v3.0.0. This feature will be removed in v6.0.0. See https://github.com/optuna/optuna/releases/tag/v3.0.0. Use :func:`~optuna.trial.Trial.suggest_float` instead.
  "learning_rate": trial.suggest_loguniform("learning_rate", 0.001, 0.05),
/Users/kevinmaikjablonka/git/kjappelbaum/gptchem/src/gptchem/baselines/xgboost.py:39: FutureWarning: suggest_loguniform has been deprecated in v3.0.0. This feature will be removed in v6.0.0. See https://github.com/optuna/optuna/releases/tag/v3.0.0. Use :func:`~optuna.trial.Trial.suggest_float` instead.
  "colsample_bytree": trial.suggest_loguniform(
/Users/kevinmaikjablonka/git/kjappelbaum/gptchem/src/gptchem/baselines/xgboost.py:42: FutureWarning: suggest_loguniform has been deprecated in v3.0.0. This feature will be removed in v6.0.0. See https://github.com/optuna/optuna/releases/tag/v3.0.0. Use :func:`~optuna.trial.Trial.suggest_float` instead.
  "subsample": trial.suggest_loguniform("subsample", 0.00001, 1),
/Users/kevinmaikjablonka/git/kjappelbaum/gptchem/src/gptchem/baselines/xgboost.py:43: FutureWarning: suggest_loguniform has been deprecated in v3.0.0. This feature will be removed in v6.0.0. See https://github.com/optuna/optuna/releases/tag/v3.0.0. Use :func:`~optuna.trial.Trial.suggest_float` instead.
  "alpha": trial.suggest_loguniform("alpha", 1e-8, 10.0),
/Users/kevinmaikjablonka/git/kjappelbaum/gptchem/src/gptchem/baselines/xgboost.py:44: FutureWarning: suggest_loguniform has been deprecated in v3.0.0. This feature will be removed in v6.0.0. See https://github.com/optuna/optuna/releases/tag/v3.0.0. Use :func:`~optuna.trial.Trial.suggest_float` instead.
  "lambda": trial.suggest_loguniform("lambda", 1e-8, 10.0),
