[32m[I 2023-01-13 01:45:23,917][0m Trial 68 finished with value: 0.46924242424242424 and parameters: {'n_estimators': 4827, 'max_depth': 36, 'learning_rate': 0.03638702856100929, 'colsample_bytree': 0.39400037339380517, 'subsample': 0.13466220907202286, 'alpha': 3.051694538757445e-07, 'lambda': 0.3040055397785719}. Best is trial 31 with value: 0.6527777777777776.[0m
/Users/kevinmaikjablonka/git/kjappelbaum/gptchem/src/gptchem/baselines/xgboost.py:38: FutureWarning: suggest_loguniform has been deprecated in v3.0.0. This feature will be removed in v6.0.0. See https://github.com/optuna/optuna/releases/tag/v3.0.0. Use :func:`~optuna.trial.Trial.suggest_float` instead.
  "learning_rate": trial.suggest_loguniform("learning_rate", 0.001, 0.05),
/Users/kevinmaikjablonka/git/kjappelbaum/gptchem/src/gptchem/baselines/xgboost.py:39: FutureWarning: suggest_loguniform has been deprecated in v3.0.0. This feature will be removed in v6.0.0. See https://github.com/optuna/optuna/releases/tag/v3.0.0. Use :func:`~optuna.trial.Trial.suggest_float` instead.
  "colsample_bytree": trial.suggest_loguniform(
/Users/kevinmaikjablonka/git/kjappelbaum/gptchem/src/gptchem/baselines/xgboost.py:42: FutureWarning: suggest_loguniform has been deprecated in v3.0.0. This feature will be removed in v6.0.0. See https://github.com/optuna/optuna/releases/tag/v3.0.0. Use :func:`~optuna.trial.Trial.suggest_float` instead.
  "subsample": trial.suggest_loguniform("subsample", 0.00001, 1),
/Users/kevinmaikjablonka/git/kjappelbaum/gptchem/src/gptchem/baselines/xgboost.py:43: FutureWarning: suggest_loguniform has been deprecated in v3.0.0. This feature will be removed in v6.0.0. See https://github.com/optuna/optuna/releases/tag/v3.0.0. Use :func:`~optuna.trial.Trial.suggest_float` instead.
  "alpha": trial.suggest_loguniform("alpha", 1e-8, 10.0),
/Users/kevinmaikjablonka/git/kjappelbaum/gptchem/src/gptchem/baselines/xgboost.py:44: FutureWarning: suggest_loguniform has been deprecated in v3.0.0. This feature will be removed in v6.0.0. See https://github.com/optuna/optuna/releases/tag/v3.0.0. Use :func:`~optuna.trial.Trial.suggest_float` instead.
  "lambda": trial.suggest_loguniform("lambda", 1e-8, 10.0),
[32m[I 2023-01-13 01:45:36,863][0m Trial 69 finished with value: 0.5934343434343433 and parameters: {'n_estimators': 9733, 'max_depth': 17, 'learning_rate': 0.02301055242529777, 'colsample_bytree': 0.3010671745244456, 'subsample': 0.9925376856161694, 'alpha': 5.867206192494486e-05, 'lambda': 0.0013107812060727505}. Best is trial 31 with value: 0.6527777777777776.[0m
/Users/kevinmaikjablonka/git/kjappelbaum/gptchem/src/gptchem/baselines/xgboost.py:38: FutureWarning: suggest_loguniform has been deprecated in v3.0.0. This feature will be removed in v6.0.0. See https://github.com/optuna/optuna/releases/tag/v3.0.0. Use :func:`~optuna.trial.Trial.suggest_float` instead.
  "learning_rate": trial.suggest_loguniform("learning_rate", 0.001, 0.05),
/Users/kevinmaikjablonka/git/kjappelbaum/gptchem/src/gptchem/baselines/xgboost.py:39: FutureWarning: suggest_loguniform has been deprecated in v3.0.0. This feature will be removed in v6.0.0. See https://github.com/optuna/optuna/releases/tag/v3.0.0. Use :func:`~optuna.trial.Trial.suggest_float` instead.
  "colsample_bytree": trial.suggest_loguniform(
/Users/kevinmaikjablonka/git/kjappelbaum/gptchem/src/gptchem/baselines/xgboost.py:42: FutureWarning: suggest_loguniform has been deprecated in v3.0.0. This feature will be removed in v6.0.0. See https://github.com/optuna/optuna/releases/tag/v3.0.0. Use :func:`~optuna.trial.Trial.suggest_float` instead.
  "subsample": trial.suggest_loguniform("subsample", 0.00001, 1),
/Users/kevinmaikjablonka/git/kjappelbaum/gptchem/src/gptchem/baselines/xgboost.py:43: FutureWarning: suggest_loguniform has been deprecated in v3.0.0. This feature will be removed in v6.0.0. See https://github.com/optuna/optuna/releases/tag/v3.0.0. Use :func:`~optuna.trial.Trial.suggest_float` instead.
  "alpha": trial.suggest_loguniform("alpha", 1e-8, 10.0),
/Users/kevinmaikjablonka/git/kjappelbaum/gptchem/src/gptchem/baselines/xgboost.py:44: FutureWarning: suggest_loguniform has been deprecated in v3.0.0. This feature will be removed in v6.0.0. See https://github.com/optuna/optuna/releases/tag/v3.0.0. Use :func:`~optuna.trial.Trial.suggest_float` instead.
  "lambda": trial.suggest_loguniform("lambda", 1e-8, 10.0),
[32m[I 2023-01-13 01:45:45,017][0m Trial 70 finished with value: 0.48737373737373735 and parameters: {'n_estimators': 8906, 'max_depth': 17, 'learning_rate': 0.022204043272379716, 'colsample_bytree': 0.30245206207347697, 'subsample': 0.26577679240332375, 'alpha': 6.557653379725138e-05, 'lambda': 0.055944124698523126}. Best is trial 31 with value: 0.6527777777777776.[0m
/Users/kevinmaikjablonka/git/kjappelbaum/gptchem/src/gptchem/baselines/xgboost.py:38: FutureWarning: suggest_loguniform has been deprecated in v3.0.0. This feature will be removed in v6.0.0. See https://github.com/optuna/optuna/releases/tag/v3.0.0. Use :func:`~optuna.trial.Trial.suggest_float` instead.
  "learning_rate": trial.suggest_loguniform("learning_rate", 0.001, 0.05),
/Users/kevinmaikjablonka/git/kjappelbaum/gptchem/src/gptchem/baselines/xgboost.py:39: FutureWarning: suggest_loguniform has been deprecated in v3.0.0. This feature will be removed in v6.0.0. See https://github.com/optuna/optuna/releases/tag/v3.0.0. Use :func:`~optuna.trial.Trial.suggest_float` instead.
  "colsample_bytree": trial.suggest_loguniform(
/Users/kevinmaikjablonka/git/kjappelbaum/gptchem/src/gptchem/baselines/xgboost.py:42: FutureWarning: suggest_loguniform has been deprecated in v3.0.0. This feature will be removed in v6.0.0. See https://github.com/optuna/optuna/releases/tag/v3.0.0. Use :func:`~optuna.trial.Trial.suggest_float` instead.
  "subsample": trial.suggest_loguniform("subsample", 0.00001, 1),
/Users/kevinmaikjablonka/git/kjappelbaum/gptchem/src/gptchem/baselines/xgboost.py:43: FutureWarning: suggest_loguniform has been deprecated in v3.0.0. This feature will be removed in v6.0.0. See https://github.com/optuna/optuna/releases/tag/v3.0.0. Use :func:`~optuna.trial.Trial.suggest_float` instead.
  "alpha": trial.suggest_loguniform("alpha", 1e-8, 10.0),
/Users/kevinmaikjablonka/git/kjappelbaum/gptchem/src/gptchem/baselines/xgboost.py:44: FutureWarning: suggest_loguniform has been deprecated in v3.0.0. This feature will be removed in v6.0.0. See https://github.com/optuna/optuna/releases/tag/v3.0.0. Use :func:`~optuna.trial.Trial.suggest_float` instead.
  "lambda": trial.suggest_loguniform("lambda", 1e-8, 10.0),
[32m[I 2023-01-13 01:45:57,234][0m Trial 71 finished with value: 0.5694444444444444 and parameters: {'n_estimators': 9652, 'max_depth': 41, 'learning_rate': 0.03115555624834835, 'colsample_bytree': 0.34249197098108, 'subsample': 0.7330938781448433, 'alpha': 3.114608771691733e-05, 'lambda': 0.0015437827256694957}. Best is trial 31 with value: 0.6527777777777776.[0m
/Users/kevinmaikjablonka/git/kjappelbaum/gptchem/src/gptchem/baselines/xgboost.py:38: FutureWarning: suggest_loguniform has been deprecated in v3.0.0. This feature will be removed in v6.0.0. See https://github.com/optuna/optuna/releases/tag/v3.0.0. Use :func:`~optuna.trial.Trial.suggest_float` instead.
  "learning_rate": trial.suggest_loguniform("learning_rate", 0.001, 0.05),
/Users/kevinmaikjablonka/git/kjappelbaum/gptchem/src/gptchem/baselines/xgboost.py:39: FutureWarning: suggest_loguniform has been deprecated in v3.0.0. This feature will be removed in v6.0.0. See https://github.com/optuna/optuna/releases/tag/v3.0.0. Use :func:`~optuna.trial.Trial.suggest_float` instead.
  "colsample_bytree": trial.suggest_loguniform(
/Users/kevinmaikjablonka/git/kjappelbaum/gptchem/src/gptchem/baselines/xgboost.py:42: FutureWarning: suggest_loguniform has been deprecated in v3.0.0. This feature will be removed in v6.0.0. See https://github.com/optuna/optuna/releases/tag/v3.0.0. Use :func:`~optuna.trial.Trial.suggest_float` instead.
  "subsample": trial.suggest_loguniform("subsample", 0.00001, 1),
/Users/kevinmaikjablonka/git/kjappelbaum/gptchem/src/gptchem/baselines/xgboost.py:43: FutureWarning: suggest_loguniform has been deprecated in v3.0.0. This feature will be removed in v6.0.0. See https://github.com/optuna/optuna/releases/tag/v3.0.0. Use :func:`~optuna.trial.Trial.suggest_float` instead.
  "alpha": trial.suggest_loguniform("alpha", 1e-8, 10.0),
/Users/kevinmaikjablonka/git/kjappelbaum/gptchem/src/gptchem/baselines/xgboost.py:44: FutureWarning: suggest_loguniform has been deprecated in v3.0.0. This feature will be removed in v6.0.0. See https://github.com/optuna/optuna/releases/tag/v3.0.0. Use :func:`~optuna.trial.Trial.suggest_float` instead.
  "lambda": trial.suggest_loguniform("lambda", 1e-8, 10.0),
[32m[I 2023-01-13 01:46:13,025][0m Trial 72 finished with value: 0.630050505050505 and parameters: {'n_estimators': 9774, 'max_depth': 23, 'learning_rate': 0.026761122477371783, 'colsample_bytree': 0.4375991747252862, 'subsample': 0.9832511541976727, 'alpha': 1.1720722524420674e-05, 'lambda': 0.007170730826817035}. Best is trial 31 with value: 0.6527777777777776.[0m
/Users/kevinmaikjablonka/git/kjappelbaum/gptchem/src/gptchem/baselines/xgboost.py:38: FutureWarning: suggest_loguniform has been deprecated in v3.0.0. This feature will be removed in v6.0.0. See https://github.com/optuna/optuna/releases/tag/v3.0.0. Use :func:`~optuna.trial.Trial.suggest_float` instead.
  "learning_rate": trial.suggest_loguniform("learning_rate", 0.001, 0.05),
/Users/kevinmaikjablonka/git/kjappelbaum/gptchem/src/gptchem/baselines/xgboost.py:39: FutureWarning: suggest_loguniform has been deprecated in v3.0.0. This feature will be removed in v6.0.0. See https://github.com/optuna/optuna/releases/tag/v3.0.0. Use :func:`~optuna.trial.Trial.suggest_float` instead.
  "colsample_bytree": trial.suggest_loguniform(
/Users/kevinmaikjablonka/git/kjappelbaum/gptchem/src/gptchem/baselines/xgboost.py:42: FutureWarning: suggest_loguniform has been deprecated in v3.0.0. This feature will be removed in v6.0.0. See https://github.com/optuna/optuna/releases/tag/v3.0.0. Use :func:`~optuna.trial.Trial.suggest_float` instead.
  "subsample": trial.suggest_loguniform("subsample", 0.00001, 1),
/Users/kevinmaikjablonka/git/kjappelbaum/gptchem/src/gptchem/baselines/xgboost.py:43: FutureWarning: suggest_loguniform has been deprecated in v3.0.0. This feature will be removed in v6.0.0. See https://github.com/optuna/optuna/releases/tag/v3.0.0. Use :func:`~optuna.trial.Trial.suggest_float` instead.
  "alpha": trial.suggest_loguniform("alpha", 1e-8, 10.0),
/Users/kevinmaikjablonka/git/kjappelbaum/gptchem/src/gptchem/baselines/xgboost.py:44: FutureWarning: suggest_loguniform has been deprecated in v3.0.0. This feature will be removed in v6.0.0. See https://github.com/optuna/optuna/releases/tag/v3.0.0. Use :func:`~optuna.trial.Trial.suggest_float` instead.
  "lambda": trial.suggest_loguniform("lambda", 1e-8, 10.0),
[32m[I 2023-01-13 01:46:24,887][0m Trial 73 finished with value: 0.49111111111111105 and parameters: {'n_estimators': 9166, 'max_depth': 23, 'learning_rate': 0.017560181122667995, 'colsample_bytree': 0.4376927476794639, 'subsample': 0.48671733174325044, 'alpha': 0.0001897452606316005, 'lambda': 0.00026916016972882}. Best is trial 31 with value: 0.6527777777777776.[0m
/Users/kevinmaikjablonka/git/kjappelbaum/gptchem/src/gptchem/baselines/xgboost.py:38: FutureWarning: suggest_loguniform has been deprecated in v3.0.0. This feature will be removed in v6.0.0. See https://github.com/optuna/optuna/releases/tag/v3.0.0. Use :func:`~optuna.trial.Trial.suggest_float` instead.
  "learning_rate": trial.suggest_loguniform("learning_rate", 0.001, 0.05),
/Users/kevinmaikjablonka/git/kjappelbaum/gptchem/src/gptchem/baselines/xgboost.py:39: FutureWarning: suggest_loguniform has been deprecated in v3.0.0. This feature will be removed in v6.0.0. See https://github.com/optuna/optuna/releases/tag/v3.0.0. Use :func:`~optuna.trial.Trial.suggest_float` instead.
  "colsample_bytree": trial.suggest_loguniform(
/Users/kevinmaikjablonka/git/kjappelbaum/gptchem/src/gptchem/baselines/xgboost.py:42: FutureWarning: suggest_loguniform has been deprecated in v3.0.0. This feature will be removed in v6.0.0. See https://github.com/optuna/optuna/releases/tag/v3.0.0. Use :func:`~optuna.trial.Trial.suggest_float` instead.
  "subsample": trial.suggest_loguniform("subsample", 0.00001, 1),
/Users/kevinmaikjablonka/git/kjappelbaum/gptchem/src/gptchem/baselines/xgboost.py:43: FutureWarning: suggest_loguniform has been deprecated in v3.0.0. This feature will be removed in v6.0.0. See https://github.com/optuna/optuna/releases/tag/v3.0.0. Use :func:`~optuna.trial.Trial.suggest_float` instead.
  "alpha": trial.suggest_loguniform("alpha", 1e-8, 10.0),
/Users/kevinmaikjablonka/git/kjappelbaum/gptchem/src/gptchem/baselines/xgboost.py:44: FutureWarning: suggest_loguniform has been deprecated in v3.0.0. This feature will be removed in v6.0.0. See https://github.com/optuna/optuna/releases/tag/v3.0.0. Use :func:`~optuna.trial.Trial.suggest_float` instead.
  "lambda": trial.suggest_loguniform("lambda", 1e-8, 10.0),
[32m[I 2023-01-13 01:46:39,307][0m Trial 74 finished with value: 0.5229215229215229 and parameters: {'n_estimators': 9763, 'max_depth': 20, 'learning_rate': 0.023029151317597786, 'colsample_bytree': 0.45773972343754554, 'subsample': 0.6817166322723647, 'alpha': 1.8191440338613445e-05, 'lambda': 0.6669943403298249}. Best is trial 31 with value: 0.6527777777777776.[0m
/Users/kevinmaikjablonka/git/kjappelbaum/gptchem/src/gptchem/baselines/xgboost.py:38: FutureWarning: suggest_loguniform has been deprecated in v3.0.0. This feature will be removed in v6.0.0. See https://github.com/optuna/optuna/releases/tag/v3.0.0. Use :func:`~optuna.trial.Trial.suggest_float` instead.
  "learning_rate": trial.suggest_loguniform("learning_rate", 0.001, 0.05),
/Users/kevinmaikjablonka/git/kjappelbaum/gptchem/src/gptchem/baselines/xgboost.py:39: FutureWarning: suggest_loguniform has been deprecated in v3.0.0. This feature will be removed in v6.0.0. See https://github.com/optuna/optuna/releases/tag/v3.0.0. Use :func:`~optuna.trial.Trial.suggest_float` instead.
  "colsample_bytree": trial.suggest_loguniform(
/Users/kevinmaikjablonka/git/kjappelbaum/gptchem/src/gptchem/baselines/xgboost.py:42: FutureWarning: suggest_loguniform has been deprecated in v3.0.0. This feature will be removed in v6.0.0. See https://github.com/optuna/optuna/releases/tag/v3.0.0. Use :func:`~optuna.trial.Trial.suggest_float` instead.
  "subsample": trial.suggest_loguniform("subsample", 0.00001, 1),
/Users/kevinmaikjablonka/git/kjappelbaum/gptchem/src/gptchem/baselines/xgboost.py:43: FutureWarning: suggest_loguniform has been deprecated in v3.0.0. This feature will be removed in v6.0.0. See https://github.com/optuna/optuna/releases/tag/v3.0.0. Use :func:`~optuna.trial.Trial.suggest_float` instead.
  "alpha": trial.suggest_loguniform("alpha", 1e-8, 10.0),
/Users/kevinmaikjablonka/git/kjappelbaum/gptchem/src/gptchem/baselines/xgboost.py:44: FutureWarning: suggest_loguniform has been deprecated in v3.0.0. This feature will be removed in v6.0.0. See https://github.com/optuna/optuna/releases/tag/v3.0.0. Use :func:`~optuna.trial.Trial.suggest_float` instead.
  "lambda": trial.suggest_loguniform("lambda", 1e-8, 10.0),
[32m[I 2023-01-13 01:46:49,470][0m Trial 75 finished with value: 0.49111111111111105 and parameters: {'n_estimators': 8494, 'max_depth': 16, 'learning_rate': 0.03740541049419751, 'colsample_bytree': 0.5423043385019275, 'subsample': 0.3561411761353515, 'alpha': 0.0004435590134919573, 'lambda': 0.00104614432043013}. Best is trial 31 with value: 0.6527777777777776.[0m
/Users/kevinmaikjablonka/git/kjappelbaum/gptchem/src/gptchem/baselines/xgboost.py:38: FutureWarning: suggest_loguniform has been deprecated in v3.0.0. This feature will be removed in v6.0.0. See https://github.com/optuna/optuna/releases/tag/v3.0.0. Use :func:`~optuna.trial.Trial.suggest_float` instead.
  "learning_rate": trial.suggest_loguniform("learning_rate", 0.001, 0.05),
/Users/kevinmaikjablonka/git/kjappelbaum/gptchem/src/gptchem/baselines/xgboost.py:39: FutureWarning: suggest_loguniform has been deprecated in v3.0.0. This feature will be removed in v6.0.0. See https://github.com/optuna/optuna/releases/tag/v3.0.0. Use :func:`~optuna.trial.Trial.suggest_float` instead.
  "colsample_bytree": trial.suggest_loguniform(
/Users/kevinmaikjablonka/git/kjappelbaum/gptchem/src/gptchem/baselines/xgboost.py:42: FutureWarning: suggest_loguniform has been deprecated in v3.0.0. This feature will be removed in v6.0.0. See https://github.com/optuna/optuna/releases/tag/v3.0.0. Use :func:`~optuna.trial.Trial.suggest_float` instead.
  "subsample": trial.suggest_loguniform("subsample", 0.00001, 1),
/Users/kevinmaikjablonka/git/kjappelbaum/gptchem/src/gptchem/baselines/xgboost.py:43: FutureWarning: suggest_loguniform has been deprecated in v3.0.0. This feature will be removed in v6.0.0. See https://github.com/optuna/optuna/releases/tag/v3.0.0. Use :func:`~optuna.trial.Trial.suggest_float` instead.
  "alpha": trial.suggest_loguniform("alpha", 1e-8, 10.0),
/Users/kevinmaikjablonka/git/kjappelbaum/gptchem/src/gptchem/baselines/xgboost.py:44: FutureWarning: suggest_loguniform has been deprecated in v3.0.0. This feature will be removed in v6.0.0. See https://github.com/optuna/optuna/releases/tag/v3.0.0. Use :func:`~optuna.trial.Trial.suggest_float` instead.
  "lambda": trial.suggest_loguniform("lambda", 1e-8, 10.0),
[32m[I 2023-01-13 01:47:05,245][0m Trial 76 finished with value: 0.5845543345543345 and parameters: {'n_estimators': 9231, 'max_depth': 12, 'learning_rate': 0.04344339908721107, 'colsample_bytree': 0.4911611442907887, 'subsample': 0.9847667089342044, 'alpha': 8.981263564485049e-05, 'lambda': 0.003179382071135295}. Best is trial 31 with value: 0.6527777777777776.[0m
/Users/kevinmaikjablonka/git/kjappelbaum/gptchem/src/gptchem/baselines/xgboost.py:38: FutureWarning: suggest_loguniform has been deprecated in v3.0.0. This feature will be removed in v6.0.0. See https://github.com/optuna/optuna/releases/tag/v3.0.0. Use :func:`~optuna.trial.Trial.suggest_float` instead.
  "learning_rate": trial.suggest_loguniform("learning_rate", 0.001, 0.05),
/Users/kevinmaikjablonka/git/kjappelbaum/gptchem/src/gptchem/baselines/xgboost.py:39: FutureWarning: suggest_loguniform has been deprecated in v3.0.0. This feature will be removed in v6.0.0. See https://github.com/optuna/optuna/releases/tag/v3.0.0. Use :func:`~optuna.trial.Trial.suggest_float` instead.
  "colsample_bytree": trial.suggest_loguniform(
/Users/kevinmaikjablonka/git/kjappelbaum/gptchem/src/gptchem/baselines/xgboost.py:42: FutureWarning: suggest_loguniform has been deprecated in v3.0.0. This feature will be removed in v6.0.0. See https://github.com/optuna/optuna/releases/tag/v3.0.0. Use :func:`~optuna.trial.Trial.suggest_float` instead.
  "subsample": trial.suggest_loguniform("subsample", 0.00001, 1),
/Users/kevinmaikjablonka/git/kjappelbaum/gptchem/src/gptchem/baselines/xgboost.py:43: FutureWarning: suggest_loguniform has been deprecated in v3.0.0. This feature will be removed in v6.0.0. See https://github.com/optuna/optuna/releases/tag/v3.0.0. Use :func:`~optuna.trial.Trial.suggest_float` instead.
  "alpha": trial.suggest_loguniform("alpha", 1e-8, 10.0),
/Users/kevinmaikjablonka/git/kjappelbaum/gptchem/src/gptchem/baselines/xgboost.py:44: FutureWarning: suggest_loguniform has been deprecated in v3.0.0. This feature will be removed in v6.0.0. See https://github.com/optuna/optuna/releases/tag/v3.0.0. Use :func:`~optuna.trial.Trial.suggest_float` instead.
  "lambda": trial.suggest_loguniform("lambda", 1e-8, 10.0),
[32m[I 2023-01-13 01:47:13,102][0m Trial 77 finished with value: 0.3456582633053221 and parameters: {'n_estimators': 9771, 'max_depth': 14, 'learning_rate': 0.028060878678966093, 'colsample_bytree': 0.3874140234853039, 'subsample': 0.016015286213576868, 'alpha': 6.898646351185532e-06, 'lambda': 0.028864180306461994}. Best is trial 31 with value: 0.6527777777777776.[0m
/Users/kevinmaikjablonka/git/kjappelbaum/gptchem/src/gptchem/baselines/xgboost.py:38: FutureWarning: suggest_loguniform has been deprecated in v3.0.0. This feature will be removed in v6.0.0. See https://github.com/optuna/optuna/releases/tag/v3.0.0. Use :func:`~optuna.trial.Trial.suggest_float` instead.
  "learning_rate": trial.suggest_loguniform("learning_rate", 0.001, 0.05),
/Users/kevinmaikjablonka/git/kjappelbaum/gptchem/src/gptchem/baselines/xgboost.py:39: FutureWarning: suggest_loguniform has been deprecated in v3.0.0. This feature will be removed in v6.0.0. See https://github.com/optuna/optuna/releases/tag/v3.0.0. Use :func:`~optuna.trial.Trial.suggest_float` instead.
  "colsample_bytree": trial.suggest_loguniform(
/Users/kevinmaikjablonka/git/kjappelbaum/gptchem/src/gptchem/baselines/xgboost.py:42: FutureWarning: suggest_loguniform has been deprecated in v3.0.0. This feature will be removed in v6.0.0. See https://github.com/optuna/optuna/releases/tag/v3.0.0. Use :func:`~optuna.trial.Trial.suggest_float` instead.
  "subsample": trial.suggest_loguniform("subsample", 0.00001, 1),
/Users/kevinmaikjablonka/git/kjappelbaum/gptchem/src/gptchem/baselines/xgboost.py:43: FutureWarning: suggest_loguniform has been deprecated in v3.0.0. This feature will be removed in v6.0.0. See https://github.com/optuna/optuna/releases/tag/v3.0.0. Use :func:`~optuna.trial.Trial.suggest_float` instead.
  "alpha": trial.suggest_loguniform("alpha", 1e-8, 10.0),
/Users/kevinmaikjablonka/git/kjappelbaum/gptchem/src/gptchem/baselines/xgboost.py:44: FutureWarning: suggest_loguniform has been deprecated in v3.0.0. This feature will be removed in v6.0.0. See https://github.com/optuna/optuna/releases/tag/v3.0.0. Use :func:`~optuna.trial.Trial.suggest_float` instead.
  "lambda": trial.suggest_loguniform("lambda", 1e-8, 10.0),
