[32m[I 2023-01-13 01:50:55,545][0m Trial 98 finished with value: 0.5845543345543345 and parameters: {'n_estimators': 6165, 'max_depth': 45, 'learning_rate': 0.043293899683847094, 'colsample_bytree': 0.4171108947467778, 'subsample': 0.9753669635559477, 'alpha': 4.588680819765348e-05, 'lambda': 0.012878989846546307}. Best is trial 31 with value: 0.6527777777777776.[0m
/Users/kevinmaikjablonka/git/kjappelbaum/gptchem/src/gptchem/baselines/xgboost.py:38: FutureWarning: suggest_loguniform has been deprecated in v3.0.0. This feature will be removed in v6.0.0. See https://github.com/optuna/optuna/releases/tag/v3.0.0. Use :func:`~optuna.trial.Trial.suggest_float` instead.
  "learning_rate": trial.suggest_loguniform("learning_rate", 0.001, 0.05),
/Users/kevinmaikjablonka/git/kjappelbaum/gptchem/src/gptchem/baselines/xgboost.py:39: FutureWarning: suggest_loguniform has been deprecated in v3.0.0. This feature will be removed in v6.0.0. See https://github.com/optuna/optuna/releases/tag/v3.0.0. Use :func:`~optuna.trial.Trial.suggest_float` instead.
  "colsample_bytree": trial.suggest_loguniform(
/Users/kevinmaikjablonka/git/kjappelbaum/gptchem/src/gptchem/baselines/xgboost.py:42: FutureWarning: suggest_loguniform has been deprecated in v3.0.0. This feature will be removed in v6.0.0. See https://github.com/optuna/optuna/releases/tag/v3.0.0. Use :func:`~optuna.trial.Trial.suggest_float` instead.
  "subsample": trial.suggest_loguniform("subsample", 0.00001, 1),
/Users/kevinmaikjablonka/git/kjappelbaum/gptchem/src/gptchem/baselines/xgboost.py:43: FutureWarning: suggest_loguniform has been deprecated in v3.0.0. This feature will be removed in v6.0.0. See https://github.com/optuna/optuna/releases/tag/v3.0.0. Use :func:`~optuna.trial.Trial.suggest_float` instead.
  "alpha": trial.suggest_loguniform("alpha", 1e-8, 10.0),
/Users/kevinmaikjablonka/git/kjappelbaum/gptchem/src/gptchem/baselines/xgboost.py:44: FutureWarning: suggest_loguniform has been deprecated in v3.0.0. This feature will be removed in v6.0.0. See https://github.com/optuna/optuna/releases/tag/v3.0.0. Use :func:`~optuna.trial.Trial.suggest_float` instead.
  "lambda": trial.suggest_loguniform("lambda", 1e-8, 10.0),
[32m[I 2023-01-13 01:51:07,327][0m Trial 99 finished with value: 0.51010101010101 and parameters: {'n_estimators': 9144, 'max_depth': 44, 'learning_rate': 0.01548773088919628, 'colsample_bytree': 0.3854319223428465, 'subsample': 0.5572665924368767, 'alpha': 6.511174564737232e-06, 'lambda': 0.04292178124429411}. Best is trial 31 with value: 0.6527777777777776.[0m
[32m[I 2023-01-13 01:52:25,772][0m A new study created in memory with name: no-name-26bcc1e3-ea33-4450-9a0d-6a35e149c221[0m
[32m[I 2023-01-13 01:52:31,727][0m Trial 0 finished with value: 0.2732600732600733 and parameters: {'n_estimators': 2746, 'max_depth': 93, 'min_samples_split': 78, 'min_samples_leaf': 70, 'criterion': 'entropy'}. Best is trial 0 with value: 0.2732600732600733.[0m
[32m[I 2023-01-13 01:52:36,382][0m Trial 1 finished with value: 0.2732600732600733 and parameters: {'n_estimators': 2190, 'max_depth': 115, 'min_samples_split': 124, 'min_samples_leaf': 50, 'criterion': 'gini'}. Best is trial 0 with value: 0.2732600732600733.[0m
[32m[I 2023-01-13 01:52:42,575][0m Trial 2 finished with value: 0.3232600732600733 and parameters: {'n_estimators': 2842, 'max_depth': 119, 'min_samples_split': 11, 'min_samples_leaf': 12, 'criterion': 'entropy'}. Best is trial 2 with value: 0.3232600732600733.[0m
[32m[I 2023-01-13 01:52:50,854][0m Trial 3 finished with value: 0.2732600732600733 and parameters: {'n_estimators': 3892, 'max_depth': 112, 'min_samples_split': 126, 'min_samples_leaf': 103, 'criterion': 'entropy'}. Best is trial 2 with value: 0.3232600732600733.[0m
[32m[I 2023-01-13 01:52:52,125][0m Trial 4 finished with value: 0.2732600732600733 and parameters: {'n_estimators': 595, 'max_depth': 83, 'min_samples_split': 20, 'min_samples_leaf': 121, 'criterion': 'gini'}. Best is trial 2 with value: 0.3232600732600733.[0m
[32m[I 2023-01-13 01:52:54,942][0m Trial 5 finished with value: 0.2732600732600733 and parameters: {'n_estimators': 1325, 'max_depth': 100, 'min_samples_split': 59, 'min_samples_leaf': 73, 'criterion': 'entropy'}. Best is trial 2 with value: 0.3232600732600733.[0m
[32m[I 2023-01-13 01:53:01,549][0m Trial 6 finished with value: 0.2732600732600733 and parameters: {'n_estimators': 3062, 'max_depth': 81, 'min_samples_split': 121, 'min_samples_leaf': 88, 'criterion': 'entropy'}. Best is trial 2 with value: 0.3232600732600733.[0m
[32m[I 2023-01-13 01:53:08,984][0m Trial 7 finished with value: 0.2732600732600733 and parameters: {'n_estimators': 3490, 'max_depth': 11, 'min_samples_split': 86, 'min_samples_leaf': 86, 'criterion': 'gini'}. Best is trial 2 with value: 0.3232600732600733.[0m
[32m[I 2023-01-13 01:53:12,448][0m Trial 8 finished with value: 0.2732600732600733 and parameters: {'n_estimators': 1580, 'max_depth': 49, 'min_samples_split': 74, 'min_samples_leaf': 57, 'criterion': 'gini'}. Best is trial 2 with value: 0.3232600732600733.[0m
[32m[I 2023-01-13 01:53:14,675][0m Trial 9 finished with value: 0.2732600732600733 and parameters: {'n_estimators': 1047, 'max_depth': 24, 'min_samples_split': 84, 'min_samples_leaf': 33, 'criterion': 'gini'}. Best is trial 2 with value: 0.3232600732600733.[0m
[32m[I 2023-01-13 01:53:25,082][0m Trial 10 finished with value: 0.5163636363636364 and parameters: {'n_estimators': 4704, 'max_depth': 127, 'min_samples_split': 4, 'min_samples_leaf': 3, 'criterion': 'entropy'}. Best is trial 10 with value: 0.5163636363636364.[0m
[32m[I 2023-01-13 01:53:35,958][0m Trial 11 finished with value: 0.5228710178710179 and parameters: {'n_estimators': 4941, 'max_depth': 123, 'min_samples_split': 12, 'min_samples_leaf': 2, 'criterion': 'entropy'}. Best is trial 11 with value: 0.5228710178710179.[0m
[32m[I 2023-01-13 01:53:46,227][0m Trial 12 finished with value: 0.345987345987346 and parameters: {'n_estimators': 4775, 'max_depth': 127, 'min_samples_split': 30, 'min_samples_leaf': 5, 'criterion': 'entropy'}. Best is trial 11 with value: 0.5228710178710179.[0m
[32m[I 2023-01-13 01:53:56,897][0m Trial 13 finished with value: 0.2732600732600733 and parameters: {'n_estimators': 4976, 'max_depth': 55, 'min_samples_split': 2, 'min_samples_leaf': 26, 'criterion': 'entropy'}. Best is trial 11 with value: 0.5228710178710179.[0m
[32m[I 2023-01-13 01:54:05,746][0m Trial 14 finished with value: 0.2732600732600733 and parameters: {'n_estimators': 4120, 'max_depth': 102, 'min_samples_split': 36, 'min_samples_leaf': 1, 'criterion': 'entropy'}. Best is trial 11 with value: 0.5228710178710179.[0m
[32m[I 2023-01-13 01:54:14,892][0m Trial 15 finished with value: 0.2732600732600733 and parameters: {'n_estimators': 4264, 'max_depth': 73, 'min_samples_split': 51, 'min_samples_leaf': 23, 'criterion': 'entropy'}. Best is trial 11 with value: 0.5228710178710179.[0m
[32m[I 2023-01-13 01:54:24,675][0m Trial 16 finished with value: 0.2732600732600733 and parameters: {'n_estimators': 4534, 'max_depth': 128, 'min_samples_split': 41, 'min_samples_leaf': 45, 'criterion': 'entropy'}. Best is trial 11 with value: 0.5228710178710179.[0m
[32m[I 2023-01-13 01:54:24,737][0m Trial 17 finished with value: 0.2732600732600733 and parameters: {'n_estimators': 24, 'max_depth': 35, 'min_samples_split': 22, 'min_samples_leaf': 16, 'criterion': 'entropy'}. Best is trial 11 with value: 0.5228710178710179.[0m
[32m[I 2023-01-13 01:54:32,225][0m Trial 18 finished with value: 0.2732600732600733 and parameters: {'n_estimators': 3537, 'max_depth': 106, 'min_samples_split': 2, 'min_samples_leaf': 39, 'criterion': 'entropy'}. Best is trial 11 with value: 0.5228710178710179.[0m
[32m[I 2023-01-13 01:54:42,815][0m Trial 19 finished with value: 0.2732600732600733 and parameters: {'n_estimators': 4938, 'max_depth': 89, 'min_samples_split': 102, 'min_samples_leaf': 1, 'criterion': 'entropy'}. Best is trial 11 with value: 0.5228710178710179.[0m
[32m[I 2023-01-13 01:54:47,707][0m Trial 20 finished with value: 0.2732600732600733 and parameters: {'n_estimators': 2329, 'max_depth': 52, 'min_samples_split': 17, 'min_samples_leaf': 19, 'criterion': 'entropy'}. Best is trial 11 with value: 0.5228710178710179.[0m
[32m[I 2023-01-13 01:54:57,652][0m Trial 21 finished with value: 0.2732600732600733 and parameters: {'n_estimators': 4563, 'max_depth': 127, 'min_samples_split': 33, 'min_samples_leaf': 6, 'criterion': 'entropy'}. Best is trial 11 with value: 0.5228710178710179.[0m
[32m[I 2023-01-13 01:55:07,463][0m Trial 22 finished with value: 0.2732600732600733 and parameters: {'n_estimators': 4618, 'max_depth': 124, 'min_samples_split': 29, 'min_samples_leaf': 31, 'criterion': 'entropy'}. Best is trial 11 with value: 0.5228710178710179.[0m
[32m[I 2023-01-13 01:55:15,615][0m Trial 23 finished with value: 0.2732600732600733 and parameters: {'n_estimators': 3805, 'max_depth': 111, 'min_samples_split': 46, 'min_samples_leaf': 13, 'criterion': 'entropy'}. Best is trial 11 with value: 0.5228710178710179.[0m
[32m[I 2023-01-13 01:55:26,331][0m Trial 24 finished with value: 0.3232600732600733 and parameters: {'n_estimators': 4964, 'max_depth': 118, 'min_samples_split': 10, 'min_samples_leaf': 11, 'criterion': 'entropy'}. Best is trial 11 with value: 0.5228710178710179.[0m
[32m[I 2023-01-13 01:55:35,570][0m Trial 25 finished with value: 0.2732600732600733 and parameters: {'n_estimators': 4362, 'max_depth': 99, 'min_samples_split': 28, 'min_samples_leaf': 23, 'criterion': 'entropy'}. Best is trial 11 with value: 0.5228710178710179.[0m
[32m[I 2023-01-13 01:55:42,553][0m Trial 26 finished with value: 0.2732600732600733 and parameters: {'n_estimators': 3273, 'max_depth': 67, 'min_samples_split': 12, 'min_samples_leaf': 38, 'criterion': 'entropy'}. Best is trial 11 with value: 0.5228710178710179.[0m
[32m[I 2023-01-13 01:55:51,344][0m Trial 27 finished with value: 0.2732600732600733 and parameters: {'n_estimators': 4038, 'max_depth': 120, 'min_samples_split': 60, 'min_samples_leaf': 2, 'criterion': 'gini'}. Best is trial 11 with value: 0.5228710178710179.[0m
[32m[I 2023-01-13 01:56:01,209][0m Trial 28 finished with value: 0.2732600732600733 and parameters: {'n_estimators': 4641, 'max_depth': 109, 'min_samples_split': 24, 'min_samples_leaf': 56, 'criterion': 'entropy'}. Best is trial 11 with value: 0.5228710178710179.[0m
[32m[I 2023-01-13 01:56:05,708][0m Trial 29 finished with value: 0.3232600732600733 and parameters: {'n_estimators': 2044, 'max_depth': 90, 'min_samples_split': 4, 'min_samples_leaf': 10, 'criterion': 'entropy'}. Best is trial 11 with value: 0.5228710178710179.[0m
[32m[I 2023-01-13 01:56:13,668][0m Trial 30 finished with value: 0.2732600732600733 and parameters: {'n_estimators': 3773, 'max_depth': 128, 'min_samples_split': 37, 'min_samples_leaf': 28, 'criterion': 'entropy'}. Best is trial 11 with value: 0.5228710178710179.[0m
[32m[I 2023-01-13 01:56:19,879][0m Trial 31 finished with value: 0.29670329670329676 and parameters: {'n_estimators': 2897, 'max_depth': 119, 'min_samples_split': 12, 'min_samples_leaf': 14, 'criterion': 'entropy'}. Best is trial 11 with value: 0.5228710178710179.[0m
[32m[I 2023-01-13 01:56:23,849][0m Trial 32 finished with value: 0.3562271062271062 and parameters: {'n_estimators': 1852, 'max_depth': 92, 'min_samples_split': 2, 'min_samples_leaf': 8, 'criterion': 'entropy'}. Best is trial 11 with value: 0.5228710178710179.[0m
[32m[I 2023-01-13 01:56:27,854][0m Trial 33 finished with value: 0.34523809523809523 and parameters: {'n_estimators': 1864, 'max_depth': 96, 'min_samples_split': 16, 'min_samples_leaf': 7, 'criterion': 'entropy'}. Best is trial 11 with value: 0.5228710178710179.[0m
[32m[I 2023-01-13 01:56:33,258][0m Trial 34 finished with value: 0.2732600732600733 and parameters: {'n_estimators': 2538, 'max_depth': 115, 'min_samples_split': 8, 'min_samples_leaf': 18, 'criterion': 'entropy'}. Best is trial 11 with value: 0.5228710178710179.[0m
[32m[I 2023-01-13 01:56:38,717][0m Trial 35 finished with value: 0.3562271062271062 and parameters: {'n_estimators': 2573, 'max_depth': 109, 'min_samples_split': 21, 'min_samples_leaf': 8, 'criterion': 'gini'}. Best is trial 11 with value: 0.5228710178710179.[0m
[32m[I 2023-01-13 01:56:40,957][0m Trial 36 finished with value: 0.2732600732600733 and parameters: {'n_estimators': 1058, 'max_depth': 106, 'min_samples_split': 21, 'min_samples_leaf': 67, 'criterion': 'gini'}. Best is trial 11 with value: 0.5228710178710179.[0m
[32m[I 2023-01-13 01:56:44,597][0m Trial 37 finished with value: 0.2732600732600733 and parameters: {'n_estimators': 1736, 'max_depth': 83, 'min_samples_split': 8, 'min_samples_leaf': 103, 'criterion': 'gini'}. Best is trial 11 with value: 0.5228710178710179.[0m
[32m[I 2023-01-13 01:56:50,548][0m Trial 38 finished with value: 0.2732600732600733 and parameters: {'n_estimators': 2700, 'max_depth': 113, 'min_samples_split': 16, 'min_samples_leaf': 122, 'criterion': 'gini'}. Best is trial 11 with value: 0.5228710178710179.[0m
[32m[I 2023-01-13 01:56:53,419][0m Trial 39 finished with value: 0.2732600732600733 and parameters: {'n_estimators': 1371, 'max_depth': 93, 'min_samples_split': 106, 'min_samples_leaf': 46, 'criterion': 'gini'}. Best is trial 11 with value: 0.5228710178710179.[0m
[32m[I 2023-01-13 01:56:55,074][0m Trial 40 finished with value: 0.2732600732600733 and parameters: {'n_estimators': 784, 'max_depth': 78, 'min_samples_split': 50, 'min_samples_leaf': 23, 'criterion': 'gini'}. Best is trial 11 with value: 0.5228710178710179.[0m
[32m[I 2023-01-13 01:56:59,891][0m Trial 41 finished with value: 0.345987345987346 and parameters: {'n_estimators': 2278, 'max_depth': 122, 'min_samples_split': 26, 'min_samples_leaf': 5, 'criterion': 'gini'}. Best is trial 11 with value: 0.5228710178710179.[0m
[32m[I 2023-01-13 01:57:09,962][0m Trial 42 finished with value: 0.3562271062271062 and parameters: {'n_estimators': 4701, 'max_depth': 104, 'min_samples_split': 16, 'min_samples_leaf': 8, 'criterion': 'entropy'}. Best is trial 11 with value: 0.5228710178710179.[0m
[32m[I 2023-01-13 01:57:19,428][0m Trial 43 finished with value: 0.3232600732600733 and parameters: {'n_estimators': 4411, 'max_depth': 107, 'min_samples_split': 6, 'min_samples_leaf': 11, 'criterion': 'entropy'}. Best is trial 11 with value: 0.5228710178710179.[0m
[32m[I 2023-01-13 01:57:26,213][0m Trial 44 finished with value: 0.2732600732600733 and parameters: {'n_estimators': 3197, 'max_depth': 102, 'min_samples_split': 16, 'min_samples_leaf': 80, 'criterion': 'gini'}. Best is trial 11 with value: 0.5228710178710179.[0m
[32m[I 2023-01-13 01:57:35,290][0m Trial 45 finished with value: 0.2732600732600733 and parameters: {'n_estimators': 4217, 'max_depth': 115, 'min_samples_split': 2, 'min_samples_leaf': 20, 'criterion': 'entropy'}. Best is trial 11 with value: 0.5228710178710179.[0m
[32m[I 2023-01-13 01:57:45,450][0m Trial 46 finished with value: 0.2732600732600733 and parameters: {'n_estimators': 4744, 'max_depth': 88, 'min_samples_split': 69, 'min_samples_leaf': 34, 'criterion': 'entropy'}. Best is trial 11 with value: 0.5228710178710179.[0m
[32m[I 2023-01-13 01:57:53,253][0m Trial 47 finished with value: 0.3232600732600733 and parameters: {'n_estimators': 3597, 'max_depth': 98, 'min_samples_split': 12, 'min_samples_leaf': 9, 'criterion': 'gini'}. Best is trial 11 with value: 0.5228710178710179.[0m
[32m[I 2023-01-13 01:57:53,913][0m Trial 48 finished with value: 0.2732600732600733 and parameters: {'n_estimators': 310, 'max_depth': 4, 'min_samples_split': 19, 'min_samples_leaf': 15, 'criterion': 'entropy'}. Best is trial 11 with value: 0.5228710178710179.[0m
[32m[I 2023-01-13 01:57:57,133][0m Trial 49 finished with value: 0.4317399267399267 and parameters: {'n_estimators': 1482, 'max_depth': 103, 'min_samples_split': 24, 'min_samples_leaf': 1, 'criterion': 'entropy'}. Best is trial 11 with value: 0.5228710178710179.[0m
[32m[I 2023-01-13 01:58:00,021][0m Trial 50 finished with value: 0.2732600732600733 and parameters: {'n_estimators': 1365, 'max_depth': 59, 'min_samples_split': 42, 'min_samples_leaf': 113, 'criterion': 'entropy'}. Best is trial 11 with value: 0.5228710178710179.[0m
[32m[I 2023-01-13 01:58:04,553][0m Trial 51 finished with value: 0.5612043512043512 and parameters: {'n_estimators': 2002, 'max_depth': 103, 'min_samples_split': 8, 'min_samples_leaf': 1, 'criterion': 'entropy'}. Best is trial 51 with value: 0.5612043512043512.[0m
[32m[I 2023-01-13 01:58:09,001][0m Trial 52 finished with value: 0.534040404040404 and parameters: {'n_estimators': 2018, 'max_depth': 114, 'min_samples_split': 7, 'min_samples_leaf': 2, 'criterion': 'entropy'}. Best is trial 51 with value: 0.5612043512043512.[0m
[32m[I 2023-01-13 01:58:14,009][0m Trial 53 finished with value: 0.5786036186036186 and parameters: {'n_estimators': 2052, 'max_depth': 116, 'min_samples_split': 6, 'min_samples_leaf': 1, 'criterion': 'entropy'}. Best is trial 53 with value: 0.5786036186036186.[0m
[32m[I 2023-01-13 01:58:17,920][0m Trial 54 finished with value: 0.5125757575757575 and parameters: {'n_estimators': 1690, 'max_depth': 123, 'min_samples_split': 8, 'min_samples_leaf': 3, 'criterion': 'entropy'}. Best is trial 53 with value: 0.5786036186036186.[0m
[32m[I 2023-01-13 01:58:22,847][0m Trial 55 finished with value: 0.5612043512043512 and parameters: {'n_estimators': 2070, 'max_depth': 122, 'min_samples_split': 8, 'min_samples_leaf': 1, 'criterion': 'entropy'}. Best is trial 53 with value: 0.5786036186036186.[0m
[32m[I 2023-01-13 01:58:27,888][0m Trial 56 finished with value: 0.5645376845376846 and parameters: {'n_estimators': 2127, 'max_depth': 116, 'min_samples_split': 12, 'min_samples_leaf': 1, 'criterion': 'entropy'}. Best is trial 53 with value: 0.5786036186036186.[0m
[32m[I 2023-01-13 01:58:32,233][0m Trial 57 finished with value: 0.2732600732600733 and parameters: {'n_estimators': 2001, 'max_depth': 116, 'min_samples_split': 12, 'min_samples_leaf': 16, 'criterion': 'entropy'}. Best is trial 53 with value: 0.5786036186036186.[0m
[32m[I 2023-01-13 01:58:36,899][0m Trial 58 finished with value: 0.2732600732600733 and parameters: {'n_estimators': 2166, 'max_depth': 112, 'min_samples_split': 33, 'min_samples_leaf': 27, 'criterion': 'entropy'}. Best is trial 53 with value: 0.5786036186036186.[0m
[32m[I 2023-01-13 01:58:39,586][0m Trial 59 finished with value: 0.5962803862803863 and parameters: {'n_estimators': 1148, 'max_depth': 123, 'min_samples_split': 8, 'min_samples_leaf': 1, 'criterion': 'entropy'}. Best is trial 59 with value: 0.5962803862803863.[0m
[32m[I 2023-01-13 01:58:41,928][0m Trial 60 finished with value: 0.2732600732600733 and parameters: {'n_estimators': 1072, 'max_depth': 119, 'min_samples_split': 7, 'min_samples_leaf': 19, 'criterion': 'entropy'}. Best is trial 59 with value: 0.5962803862803863.[0m
[32m[I 2023-01-13 01:58:47,351][0m Trial 61 finished with value: 0.507979797979798 and parameters: {'n_estimators': 2300, 'max_depth': 123, 'min_samples_split': 14, 'min_samples_leaf': 1, 'criterion': 'entropy'}. Best is trial 59 with value: 0.5962803862803863.[0m
[32m[I 2023-01-13 01:58:51,974][0m Trial 62 finished with value: 0.4808003108003107 and parameters: {'n_estimators': 2088, 'max_depth': 124, 'min_samples_split': 6, 'min_samples_leaf': 5, 'criterion': 'entropy'}. Best is trial 59 with value: 0.5962803862803863.[0m
[32m[I 2023-01-13 01:58:57,279][0m Trial 63 finished with value: 0.3232600732600733 and parameters: {'n_estimators': 2443, 'max_depth': 45, 'min_samples_split': 10, 'min_samples_leaf': 12, 'criterion': 'entropy'}. Best is trial 59 with value: 0.5962803862803863.[0m
[32m[I 2023-01-13 01:59:03,739][0m Trial 64 finished with value: 0.5596137196137196 and parameters: {'n_estimators': 2791, 'max_depth': 112, 'min_samples_split': 2, 'min_samples_leaf': 1, 'criterion': 'entropy'}. Best is trial 59 with value: 0.5962803862803863.[0m
[32m[I 2023-01-13 01:59:10,059][0m Trial 65 finished with value: 0.2732600732600733 and parameters: {'n_estimators': 2866, 'max_depth': 112, 'min_samples_split': 86, 'min_samples_leaf': 5, 'criterion': 'entropy'}. Best is trial 59 with value: 0.5962803862803863.[0m
[32m[I 2023-01-13 01:59:15,943][0m Trial 66 finished with value: 0.3232600732600733 and parameters: {'n_estimators': 2715, 'max_depth': 117, 'min_samples_split': 20, 'min_samples_leaf': 13, 'criterion': 'entropy'}. Best is trial 59 with value: 0.5962803862803863.[0m
[32m[I 2023-01-13 01:59:20,398][0m Trial 67 finished with value: 0.5402197802197802 and parameters: {'n_estimators': 1907, 'max_depth': 109, 'min_samples_split': 2, 'min_samples_leaf': 1, 'criterion': 'entropy'}. Best is trial 59 with value: 0.5962803862803863.[0m
[32m[I 2023-01-13 01:59:24,357][0m Trial 68 finished with value: 0.2732600732600733 and parameters: {'n_estimators': 1877, 'max_depth': 109, 'min_samples_split': 2, 'min_samples_leaf': 22, 'criterion': 'entropy'}. Best is trial 59 with value: 0.5962803862803863.[0m
[32m[I 2023-01-13 01:59:26,936][0m Trial 69 finished with value: 0.36796536796536794 and parameters: {'n_estimators': 1205, 'max_depth': 99, 'min_samples_split': 5, 'min_samples_leaf': 6, 'criterion': 'entropy'}. Best is trial 59 with value: 0.5962803862803863.[0m
[32m[I 2023-01-13 01:59:28,567][0m Trial 70 finished with value: 0.32659340659340663 and parameters: {'n_estimators': 758, 'max_depth': 126, 'min_samples_split': 12, 'min_samples_leaf': 11, 'criterion': 'entropy'}. Best is trial 59 with value: 0.5962803862803863.[0m
[32m[I 2023-01-13 01:59:32,079][0m Trial 71 finished with value: 0.5786036186036186 and parameters: {'n_estimators': 1569, 'max_depth': 121, 'min_samples_split': 8, 'min_samples_leaf': 1, 'criterion': 'entropy'}. Best is trial 59 with value: 0.5962803862803863.[0m
