[32m[I 2023-01-13 02:58:40,587][0m Trial 91 finished with value: 0.5921717171717171 and parameters: {'n_estimators': 9130, 'max_depth': 30, 'learning_rate': 0.020679006970868, 'colsample_bytree': 0.4166932752346075, 'subsample': 0.7725624674102075, 'alpha': 1.0853153047725253e-05, 'lambda': 0.0027204828007065117}. Best is trial 31 with value: 0.6527777777777776.[0m
/Users/kevinmaikjablonka/git/kjappelbaum/gptchem/src/gptchem/baselines/xgboost.py:38: FutureWarning: suggest_loguniform has been deprecated in v3.0.0. This feature will be removed in v6.0.0. See https://github.com/optuna/optuna/releases/tag/v3.0.0. Use :func:`~optuna.trial.Trial.suggest_float` instead.
  "learning_rate": trial.suggest_loguniform("learning_rate", 0.001, 0.05),
/Users/kevinmaikjablonka/git/kjappelbaum/gptchem/src/gptchem/baselines/xgboost.py:39: FutureWarning: suggest_loguniform has been deprecated in v3.0.0. This feature will be removed in v6.0.0. See https://github.com/optuna/optuna/releases/tag/v3.0.0. Use :func:`~optuna.trial.Trial.suggest_float` instead.
  "colsample_bytree": trial.suggest_loguniform(
/Users/kevinmaikjablonka/git/kjappelbaum/gptchem/src/gptchem/baselines/xgboost.py:42: FutureWarning: suggest_loguniform has been deprecated in v3.0.0. This feature will be removed in v6.0.0. See https://github.com/optuna/optuna/releases/tag/v3.0.0. Use :func:`~optuna.trial.Trial.suggest_float` instead.
  "subsample": trial.suggest_loguniform("subsample", 0.00001, 1),
/Users/kevinmaikjablonka/git/kjappelbaum/gptchem/src/gptchem/baselines/xgboost.py:43: FutureWarning: suggest_loguniform has been deprecated in v3.0.0. This feature will be removed in v6.0.0. See https://github.com/optuna/optuna/releases/tag/v3.0.0. Use :func:`~optuna.trial.Trial.suggest_float` instead.
  "alpha": trial.suggest_loguniform("alpha", 1e-8, 10.0),
/Users/kevinmaikjablonka/git/kjappelbaum/gptchem/src/gptchem/baselines/xgboost.py:44: FutureWarning: suggest_loguniform has been deprecated in v3.0.0. This feature will be removed in v6.0.0. See https://github.com/optuna/optuna/releases/tag/v3.0.0. Use :func:`~optuna.trial.Trial.suggest_float` instead.
  "lambda": trial.suggest_loguniform("lambda", 1e-8, 10.0),
[32m[I 2023-01-13 02:58:52,493][0m Trial 92 finished with value: 0.51010101010101 and parameters: {'n_estimators': 9417, 'max_depth': 26, 'learning_rate': 0.0216594760826366, 'colsample_bytree': 0.3739920326223195, 'subsample': 0.6191838432902821, 'alpha': 2.5454796154322886e-05, 'lambda': 0.0014931519809128998}. Best is trial 31 with value: 0.6527777777777776.[0m
/Users/kevinmaikjablonka/git/kjappelbaum/gptchem/src/gptchem/baselines/xgboost.py:38: FutureWarning: suggest_loguniform has been deprecated in v3.0.0. This feature will be removed in v6.0.0. See https://github.com/optuna/optuna/releases/tag/v3.0.0. Use :func:`~optuna.trial.Trial.suggest_float` instead.
  "learning_rate": trial.suggest_loguniform("learning_rate", 0.001, 0.05),
/Users/kevinmaikjablonka/git/kjappelbaum/gptchem/src/gptchem/baselines/xgboost.py:39: FutureWarning: suggest_loguniform has been deprecated in v3.0.0. This feature will be removed in v6.0.0. See https://github.com/optuna/optuna/releases/tag/v3.0.0. Use :func:`~optuna.trial.Trial.suggest_float` instead.
  "colsample_bytree": trial.suggest_loguniform(
/Users/kevinmaikjablonka/git/kjappelbaum/gptchem/src/gptchem/baselines/xgboost.py:42: FutureWarning: suggest_loguniform has been deprecated in v3.0.0. This feature will be removed in v6.0.0. See https://github.com/optuna/optuna/releases/tag/v3.0.0. Use :func:`~optuna.trial.Trial.suggest_float` instead.
  "subsample": trial.suggest_loguniform("subsample", 0.00001, 1),
/Users/kevinmaikjablonka/git/kjappelbaum/gptchem/src/gptchem/baselines/xgboost.py:43: FutureWarning: suggest_loguniform has been deprecated in v3.0.0. This feature will be removed in v6.0.0. See https://github.com/optuna/optuna/releases/tag/v3.0.0. Use :func:`~optuna.trial.Trial.suggest_float` instead.
  "alpha": trial.suggest_loguniform("alpha", 1e-8, 10.0),
/Users/kevinmaikjablonka/git/kjappelbaum/gptchem/src/gptchem/baselines/xgboost.py:44: FutureWarning: suggest_loguniform has been deprecated in v3.0.0. This feature will be removed in v6.0.0. See https://github.com/optuna/optuna/releases/tag/v3.0.0. Use :func:`~optuna.trial.Trial.suggest_float` instead.
  "lambda": trial.suggest_loguniform("lambda", 1e-8, 10.0),
[32m[I 2023-01-13 02:59:06,393][0m Trial 93 finished with value: 0.5694444444444444 and parameters: {'n_estimators': 9713, 'max_depth': 23, 'learning_rate': 0.02959349287402882, 'colsample_bytree': 0.4050982995387805, 'subsample': 0.7895771265203548, 'alpha': 1.554869814024007e-05, 'lambda': 0.000741323640207748}. Best is trial 31 with value: 0.6527777777777776.[0m
/Users/kevinmaikjablonka/git/kjappelbaum/gptchem/src/gptchem/baselines/xgboost.py:38: FutureWarning: suggest_loguniform has been deprecated in v3.0.0. This feature will be removed in v6.0.0. See https://github.com/optuna/optuna/releases/tag/v3.0.0. Use :func:`~optuna.trial.Trial.suggest_float` instead.
  "learning_rate": trial.suggest_loguniform("learning_rate", 0.001, 0.05),
/Users/kevinmaikjablonka/git/kjappelbaum/gptchem/src/gptchem/baselines/xgboost.py:39: FutureWarning: suggest_loguniform has been deprecated in v3.0.0. This feature will be removed in v6.0.0. See https://github.com/optuna/optuna/releases/tag/v3.0.0. Use :func:`~optuna.trial.Trial.suggest_float` instead.
  "colsample_bytree": trial.suggest_loguniform(
/Users/kevinmaikjablonka/git/kjappelbaum/gptchem/src/gptchem/baselines/xgboost.py:42: FutureWarning: suggest_loguniform has been deprecated in v3.0.0. This feature will be removed in v6.0.0. See https://github.com/optuna/optuna/releases/tag/v3.0.0. Use :func:`~optuna.trial.Trial.suggest_float` instead.
  "subsample": trial.suggest_loguniform("subsample", 0.00001, 1),
/Users/kevinmaikjablonka/git/kjappelbaum/gptchem/src/gptchem/baselines/xgboost.py:43: FutureWarning: suggest_loguniform has been deprecated in v3.0.0. This feature will be removed in v6.0.0. See https://github.com/optuna/optuna/releases/tag/v3.0.0. Use :func:`~optuna.trial.Trial.suggest_float` instead.
  "alpha": trial.suggest_loguniform("alpha", 1e-8, 10.0),
/Users/kevinmaikjablonka/git/kjappelbaum/gptchem/src/gptchem/baselines/xgboost.py:44: FutureWarning: suggest_loguniform has been deprecated in v3.0.0. This feature will be removed in v6.0.0. See https://github.com/optuna/optuna/releases/tag/v3.0.0. Use :func:`~optuna.trial.Trial.suggest_float` instead.
  "lambda": trial.suggest_loguniform("lambda", 1e-8, 10.0),
[32m[I 2023-01-13 02:59:17,172][0m Trial 94 finished with value: 0.5039316239316239 and parameters: {'n_estimators': 9002, 'max_depth': 29, 'learning_rate': 0.03484542342300383, 'colsample_bytree': 0.4296563820933456, 'subsample': 0.4273868992730905, 'alpha': 0.00011768031283545201, 'lambda': 0.018324538285127263}. Best is trial 31 with value: 0.6527777777777776.[0m
/Users/kevinmaikjablonka/git/kjappelbaum/gptchem/src/gptchem/baselines/xgboost.py:38: FutureWarning: suggest_loguniform has been deprecated in v3.0.0. This feature will be removed in v6.0.0. See https://github.com/optuna/optuna/releases/tag/v3.0.0. Use :func:`~optuna.trial.Trial.suggest_float` instead.
  "learning_rate": trial.suggest_loguniform("learning_rate", 0.001, 0.05),
/Users/kevinmaikjablonka/git/kjappelbaum/gptchem/src/gptchem/baselines/xgboost.py:39: FutureWarning: suggest_loguniform has been deprecated in v3.0.0. This feature will be removed in v6.0.0. See https://github.com/optuna/optuna/releases/tag/v3.0.0. Use :func:`~optuna.trial.Trial.suggest_float` instead.
  "colsample_bytree": trial.suggest_loguniform(
/Users/kevinmaikjablonka/git/kjappelbaum/gptchem/src/gptchem/baselines/xgboost.py:42: FutureWarning: suggest_loguniform has been deprecated in v3.0.0. This feature will be removed in v6.0.0. See https://github.com/optuna/optuna/releases/tag/v3.0.0. Use :func:`~optuna.trial.Trial.suggest_float` instead.
  "subsample": trial.suggest_loguniform("subsample", 0.00001, 1),
/Users/kevinmaikjablonka/git/kjappelbaum/gptchem/src/gptchem/baselines/xgboost.py:43: FutureWarning: suggest_loguniform has been deprecated in v3.0.0. This feature will be removed in v6.0.0. See https://github.com/optuna/optuna/releases/tag/v3.0.0. Use :func:`~optuna.trial.Trial.suggest_float` instead.
  "alpha": trial.suggest_loguniform("alpha", 1e-8, 10.0),
/Users/kevinmaikjablonka/git/kjappelbaum/gptchem/src/gptchem/baselines/xgboost.py:44: FutureWarning: suggest_loguniform has been deprecated in v3.0.0. This feature will be removed in v6.0.0. See https://github.com/optuna/optuna/releases/tag/v3.0.0. Use :func:`~optuna.trial.Trial.suggest_float` instead.
  "lambda": trial.suggest_loguniform("lambda", 1e-8, 10.0),
[32m[I 2023-01-13 02:59:26,422][0m Trial 95 finished with value: 0.5087878787878787 and parameters: {'n_estimators': 9329, 'max_depth': 49, 'learning_rate': 0.024487034436115038, 'colsample_bytree': 0.3566302798859202, 'subsample': 0.3063333257364733, 'alpha': 2.3542772368834745e-06, 'lambda': 0.00026711599725706963}. Best is trial 31 with value: 0.6527777777777776.[0m
/Users/kevinmaikjablonka/git/kjappelbaum/gptchem/src/gptchem/baselines/xgboost.py:38: FutureWarning: suggest_loguniform has been deprecated in v3.0.0. This feature will be removed in v6.0.0. See https://github.com/optuna/optuna/releases/tag/v3.0.0. Use :func:`~optuna.trial.Trial.suggest_float` instead.
  "learning_rate": trial.suggest_loguniform("learning_rate", 0.001, 0.05),
/Users/kevinmaikjablonka/git/kjappelbaum/gptchem/src/gptchem/baselines/xgboost.py:39: FutureWarning: suggest_loguniform has been deprecated in v3.0.0. This feature will be removed in v6.0.0. See https://github.com/optuna/optuna/releases/tag/v3.0.0. Use :func:`~optuna.trial.Trial.suggest_float` instead.
  "colsample_bytree": trial.suggest_loguniform(
/Users/kevinmaikjablonka/git/kjappelbaum/gptchem/src/gptchem/baselines/xgboost.py:42: FutureWarning: suggest_loguniform has been deprecated in v3.0.0. This feature will be removed in v6.0.0. See https://github.com/optuna/optuna/releases/tag/v3.0.0. Use :func:`~optuna.trial.Trial.suggest_float` instead.
  "subsample": trial.suggest_loguniform("subsample", 0.00001, 1),
/Users/kevinmaikjablonka/git/kjappelbaum/gptchem/src/gptchem/baselines/xgboost.py:43: FutureWarning: suggest_loguniform has been deprecated in v3.0.0. This feature will be removed in v6.0.0. See https://github.com/optuna/optuna/releases/tag/v3.0.0. Use :func:`~optuna.trial.Trial.suggest_float` instead.
  "alpha": trial.suggest_loguniform("alpha", 1e-8, 10.0),
/Users/kevinmaikjablonka/git/kjappelbaum/gptchem/src/gptchem/baselines/xgboost.py:44: FutureWarning: suggest_loguniform has been deprecated in v3.0.0. This feature will be removed in v6.0.0. See https://github.com/optuna/optuna/releases/tag/v3.0.0. Use :func:`~optuna.trial.Trial.suggest_float` instead.
  "lambda": trial.suggest_loguniform("lambda", 1e-8, 10.0),
[32m[I 2023-01-13 02:59:37,654][0m Trial 96 finished with value: 0.49363636363636354 and parameters: {'n_estimators': 9634, 'max_depth': 22, 'learning_rate': 0.008762402254567614, 'colsample_bytree': 0.2825584148326846, 'subsample': 0.5529338459178513, 'alpha': 1.1603375501823827e-05, 'lambda': 0.004460005292554024}. Best is trial 31 with value: 0.6527777777777776.[0m
/Users/kevinmaikjablonka/git/kjappelbaum/gptchem/src/gptchem/baselines/xgboost.py:38: FutureWarning: suggest_loguniform has been deprecated in v3.0.0. This feature will be removed in v6.0.0. See https://github.com/optuna/optuna/releases/tag/v3.0.0. Use :func:`~optuna.trial.Trial.suggest_float` instead.
  "learning_rate": trial.suggest_loguniform("learning_rate", 0.001, 0.05),
/Users/kevinmaikjablonka/git/kjappelbaum/gptchem/src/gptchem/baselines/xgboost.py:39: FutureWarning: suggest_loguniform has been deprecated in v3.0.0. This feature will be removed in v6.0.0. See https://github.com/optuna/optuna/releases/tag/v3.0.0. Use :func:`~optuna.trial.Trial.suggest_float` instead.
  "colsample_bytree": trial.suggest_loguniform(
/Users/kevinmaikjablonka/git/kjappelbaum/gptchem/src/gptchem/baselines/xgboost.py:42: FutureWarning: suggest_loguniform has been deprecated in v3.0.0. This feature will be removed in v6.0.0. See https://github.com/optuna/optuna/releases/tag/v3.0.0. Use :func:`~optuna.trial.Trial.suggest_float` instead.
  "subsample": trial.suggest_loguniform("subsample", 0.00001, 1),
/Users/kevinmaikjablonka/git/kjappelbaum/gptchem/src/gptchem/baselines/xgboost.py:43: FutureWarning: suggest_loguniform has been deprecated in v3.0.0. This feature will be removed in v6.0.0. See https://github.com/optuna/optuna/releases/tag/v3.0.0. Use :func:`~optuna.trial.Trial.suggest_float` instead.
  "alpha": trial.suggest_loguniform("alpha", 1e-8, 10.0),
/Users/kevinmaikjablonka/git/kjappelbaum/gptchem/src/gptchem/baselines/xgboost.py:44: FutureWarning: suggest_loguniform has been deprecated in v3.0.0. This feature will be removed in v6.0.0. See https://github.com/optuna/optuna/releases/tag/v3.0.0. Use :func:`~optuna.trial.Trial.suggest_float` instead.
  "lambda": trial.suggest_loguniform("lambda", 1e-8, 10.0),
[32m[I 2023-01-13 02:59:49,350][0m Trial 97 finished with value: 0.5694444444444444 and parameters: {'n_estimators': 8565, 'max_depth': 33, 'learning_rate': 0.04981617432753866, 'colsample_bytree': 0.4006175901145225, 'subsample': 0.7665845791235297, 'alpha': 0.0003280880606942549, 'lambda': 0.025175228048450665}. Best is trial 31 with value: 0.6527777777777776.[0m
/Users/kevinmaikjablonka/git/kjappelbaum/gptchem/src/gptchem/baselines/xgboost.py:38: FutureWarning: suggest_loguniform has been deprecated in v3.0.0. This feature will be removed in v6.0.0. See https://github.com/optuna/optuna/releases/tag/v3.0.0. Use :func:`~optuna.trial.Trial.suggest_float` instead.
  "learning_rate": trial.suggest_loguniform("learning_rate", 0.001, 0.05),
/Users/kevinmaikjablonka/git/kjappelbaum/gptchem/src/gptchem/baselines/xgboost.py:39: FutureWarning: suggest_loguniform has been deprecated in v3.0.0. This feature will be removed in v6.0.0. See https://github.com/optuna/optuna/releases/tag/v3.0.0. Use :func:`~optuna.trial.Trial.suggest_float` instead.
  "colsample_bytree": trial.suggest_loguniform(
/Users/kevinmaikjablonka/git/kjappelbaum/gptchem/src/gptchem/baselines/xgboost.py:42: FutureWarning: suggest_loguniform has been deprecated in v3.0.0. This feature will be removed in v6.0.0. See https://github.com/optuna/optuna/releases/tag/v3.0.0. Use :func:`~optuna.trial.Trial.suggest_float` instead.
  "subsample": trial.suggest_loguniform("subsample", 0.00001, 1),
/Users/kevinmaikjablonka/git/kjappelbaum/gptchem/src/gptchem/baselines/xgboost.py:43: FutureWarning: suggest_loguniform has been deprecated in v3.0.0. This feature will be removed in v6.0.0. See https://github.com/optuna/optuna/releases/tag/v3.0.0. Use :func:`~optuna.trial.Trial.suggest_float` instead.
  "alpha": trial.suggest_loguniform("alpha", 1e-8, 10.0),
/Users/kevinmaikjablonka/git/kjappelbaum/gptchem/src/gptchem/baselines/xgboost.py:44: FutureWarning: suggest_loguniform has been deprecated in v3.0.0. This feature will be removed in v6.0.0. See https://github.com/optuna/optuna/releases/tag/v3.0.0. Use :func:`~optuna.trial.Trial.suggest_float` instead.
  "lambda": trial.suggest_loguniform("lambda", 1e-8, 10.0),
[32m[I 2023-01-13 02:59:58,989][0m Trial 98 finished with value: 0.5845543345543345 and parameters: {'n_estimators': 6165, 'max_depth': 45, 'learning_rate': 0.043293899683847094, 'colsample_bytree': 0.4171108947467778, 'subsample': 0.9753669635559477, 'alpha': 4.588680819765348e-05, 'lambda': 0.012878989846546307}. Best is trial 31 with value: 0.6527777777777776.[0m
/Users/kevinmaikjablonka/git/kjappelbaum/gptchem/src/gptchem/baselines/xgboost.py:38: FutureWarning: suggest_loguniform has been deprecated in v3.0.0. This feature will be removed in v6.0.0. See https://github.com/optuna/optuna/releases/tag/v3.0.0. Use :func:`~optuna.trial.Trial.suggest_float` instead.
  "learning_rate": trial.suggest_loguniform("learning_rate", 0.001, 0.05),
/Users/kevinmaikjablonka/git/kjappelbaum/gptchem/src/gptchem/baselines/xgboost.py:39: FutureWarning: suggest_loguniform has been deprecated in v3.0.0. This feature will be removed in v6.0.0. See https://github.com/optuna/optuna/releases/tag/v3.0.0. Use :func:`~optuna.trial.Trial.suggest_float` instead.
  "colsample_bytree": trial.suggest_loguniform(
/Users/kevinmaikjablonka/git/kjappelbaum/gptchem/src/gptchem/baselines/xgboost.py:42: FutureWarning: suggest_loguniform has been deprecated in v3.0.0. This feature will be removed in v6.0.0. See https://github.com/optuna/optuna/releases/tag/v3.0.0. Use :func:`~optuna.trial.Trial.suggest_float` instead.
  "subsample": trial.suggest_loguniform("subsample", 0.00001, 1),
/Users/kevinmaikjablonka/git/kjappelbaum/gptchem/src/gptchem/baselines/xgboost.py:43: FutureWarning: suggest_loguniform has been deprecated in v3.0.0. This feature will be removed in v6.0.0. See https://github.com/optuna/optuna/releases/tag/v3.0.0. Use :func:`~optuna.trial.Trial.suggest_float` instead.
  "alpha": trial.suggest_loguniform("alpha", 1e-8, 10.0),
/Users/kevinmaikjablonka/git/kjappelbaum/gptchem/src/gptchem/baselines/xgboost.py:44: FutureWarning: suggest_loguniform has been deprecated in v3.0.0. This feature will be removed in v6.0.0. See https://github.com/optuna/optuna/releases/tag/v3.0.0. Use :func:`~optuna.trial.Trial.suggest_float` instead.
  "lambda": trial.suggest_loguniform("lambda", 1e-8, 10.0),
[32m[I 2023-01-13 03:00:10,664][0m Trial 99 finished with value: 0.51010101010101 and parameters: {'n_estimators': 9144, 'max_depth': 44, 'learning_rate': 0.01548773088919628, 'colsample_bytree': 0.3854319223428465, 'subsample': 0.5572665924368767, 'alpha': 6.511174564737232e-06, 'lambda': 0.04292178124429411}. Best is trial 31 with value: 0.6527777777777776.[0m
[32m[I 2023-01-13 03:00:27,357][0m A new study created in memory with name: no-name-666dfbf6-6194-4c2e-aab4-c72de28074f9[0m
[32m[I 2023-01-13 03:00:33,211][0m Trial 0 finished with value: 0.2732600732600733 and parameters: {'n_estimators': 2746, 'max_depth': 93, 'min_samples_split': 78, 'min_samples_leaf': 70, 'criterion': 'entropy'}. Best is trial 0 with value: 0.2732600732600733.[0m
[32m[I 2023-01-13 03:00:38,037][0m Trial 1 finished with value: 0.2732600732600733 and parameters: {'n_estimators': 2190, 'max_depth': 115, 'min_samples_split': 124, 'min_samples_leaf': 50, 'criterion': 'gini'}. Best is trial 0 with value: 0.2732600732600733.[0m
[32m[I 2023-01-13 03:00:44,112][0m Trial 2 finished with value: 0.3232600732600733 and parameters: {'n_estimators': 2842, 'max_depth': 119, 'min_samples_split': 11, 'min_samples_leaf': 12, 'criterion': 'entropy'}. Best is trial 2 with value: 0.3232600732600733.[0m
[32m[I 2023-01-13 03:00:52,446][0m Trial 3 finished with value: 0.2732600732600733 and parameters: {'n_estimators': 3892, 'max_depth': 112, 'min_samples_split': 126, 'min_samples_leaf': 103, 'criterion': 'entropy'}. Best is trial 2 with value: 0.3232600732600733.[0m
[32m[I 2023-01-13 03:00:53,708][0m Trial 4 finished with value: 0.2732600732600733 and parameters: {'n_estimators': 595, 'max_depth': 83, 'min_samples_split': 20, 'min_samples_leaf': 121, 'criterion': 'gini'}. Best is trial 2 with value: 0.3232600732600733.[0m
[32m[I 2023-01-13 03:00:56,508][0m Trial 5 finished with value: 0.2732600732600733 and parameters: {'n_estimators': 1325, 'max_depth': 100, 'min_samples_split': 59, 'min_samples_leaf': 73, 'criterion': 'entropy'}. Best is trial 2 with value: 0.3232600732600733.[0m
[32m[I 2023-01-13 03:01:02,980][0m Trial 6 finished with value: 0.2732600732600733 and parameters: {'n_estimators': 3062, 'max_depth': 81, 'min_samples_split': 121, 'min_samples_leaf': 88, 'criterion': 'entropy'}. Best is trial 2 with value: 0.3232600732600733.[0m
[32m[I 2023-01-13 03:01:10,449][0m Trial 7 finished with value: 0.2732600732600733 and parameters: {'n_estimators': 3490, 'max_depth': 11, 'min_samples_split': 86, 'min_samples_leaf': 86, 'criterion': 'gini'}. Best is trial 2 with value: 0.3232600732600733.[0m
[32m[I 2023-01-13 03:01:13,764][0m Trial 8 finished with value: 0.2732600732600733 and parameters: {'n_estimators': 1580, 'max_depth': 49, 'min_samples_split': 74, 'min_samples_leaf': 57, 'criterion': 'gini'}. Best is trial 2 with value: 0.3232600732600733.[0m
[32m[I 2023-01-13 03:01:15,961][0m Trial 9 finished with value: 0.2732600732600733 and parameters: {'n_estimators': 1047, 'max_depth': 24, 'min_samples_split': 84, 'min_samples_leaf': 33, 'criterion': 'gini'}. Best is trial 2 with value: 0.3232600732600733.[0m
[32m[I 2023-01-13 03:01:26,321][0m Trial 10 finished with value: 0.5163636363636364 and parameters: {'n_estimators': 4704, 'max_depth': 127, 'min_samples_split': 4, 'min_samples_leaf': 3, 'criterion': 'entropy'}. Best is trial 10 with value: 0.5163636363636364.[0m
[32m[I 2023-01-13 03:01:37,234][0m Trial 11 finished with value: 0.5228710178710179 and parameters: {'n_estimators': 4941, 'max_depth': 123, 'min_samples_split': 12, 'min_samples_leaf': 2, 'criterion': 'entropy'}. Best is trial 11 with value: 0.5228710178710179.[0m
[32m[I 2023-01-13 03:01:47,432][0m Trial 12 finished with value: 0.345987345987346 and parameters: {'n_estimators': 4775, 'max_depth': 127, 'min_samples_split': 30, 'min_samples_leaf': 5, 'criterion': 'entropy'}. Best is trial 11 with value: 0.5228710178710179.[0m
[32m[I 2023-01-13 03:01:58,033][0m Trial 13 finished with value: 0.2732600732600733 and parameters: {'n_estimators': 4976, 'max_depth': 55, 'min_samples_split': 2, 'min_samples_leaf': 26, 'criterion': 'entropy'}. Best is trial 11 with value: 0.5228710178710179.[0m
