[32m[I 2023-01-13 04:58:52,590][0m Trial 14 finished with value: 0.2747673782156541 and parameters: {'n_estimators': 4126, 'max_depth': 103, 'min_samples_split': 40, 'min_samples_leaf': 36, 'criterion': 'entropy'}. Best is trial 11 with value: 0.5456077694235588.[0m
[32m[I 2023-01-13 04:59:01,973][0m Trial 15 finished with value: 0.5394987468671679 and parameters: {'n_estimators': 4159, 'max_depth': 126, 'min_samples_split': 29, 'min_samples_leaf': 3, 'criterion': 'entropy'}. Best is trial 11 with value: 0.5456077694235588.[0m
[32m[I 2023-01-13 04:59:11,129][0m Trial 16 finished with value: 0.2747673782156541 and parameters: {'n_estimators': 4306, 'max_depth': 71, 'min_samples_split': 57, 'min_samples_leaf': 19, 'criterion': 'entropy'}. Best is trial 11 with value: 0.5456077694235588.[0m
[32m[I 2023-01-13 04:59:18,982][0m Trial 17 finished with value: 0.2747673782156541 and parameters: {'n_estimators': 3661, 'max_depth': 49, 'min_samples_split': 22, 'min_samples_leaf': 46, 'criterion': 'entropy'}. Best is trial 11 with value: 0.5456077694235588.[0m
[32m[I 2023-01-13 04:59:23,353][0m Trial 18 finished with value: 0.2747673782156541 and parameters: {'n_estimators': 2088, 'max_depth': 107, 'min_samples_split': 47, 'min_samples_leaf': 29, 'criterion': 'entropy'}. Best is trial 11 with value: 0.5456077694235588.[0m
[32m[I 2023-01-13 04:59:32,821][0m Trial 19 finished with value: 0.2747673782156541 and parameters: {'n_estimators': 4408, 'max_depth': 93, 'min_samples_split': 102, 'min_samples_leaf': 1, 'criterion': 'entropy'}. Best is trial 11 with value: 0.5456077694235588.[0m
[32m[I 2023-01-13 04:59:40,219][0m Trial 20 finished with value: 0.3256902529127593 and parameters: {'n_estimators': 3405, 'max_depth': 38, 'min_samples_split': 4, 'min_samples_leaf': 15, 'criterion': 'entropy'}. Best is trial 11 with value: 0.5456077694235588.[0m
[32m[I 2023-01-13 04:59:51,376][0m Trial 21 finished with value: 0.5297744360902257 and parameters: {'n_estimators': 4950, 'max_depth': 127, 'min_samples_split': 27, 'min_samples_leaf': 3, 'criterion': 'entropy'}. Best is trial 11 with value: 0.5456077694235588.[0m
[32m[I 2023-01-13 05:00:01,051][0m Trial 22 finished with value: 0.33405555555555555 and parameters: {'n_estimators': 4486, 'max_depth': 125, 'min_samples_split': 28, 'min_samples_leaf': 14, 'criterion': 'entropy'}. Best is trial 11 with value: 0.5456077694235588.[0m
[32m[I 2023-01-13 05:00:11,504][0m Trial 23 finished with value: 0.2747673782156541 and parameters: {'n_estimators': 4861, 'max_depth': 114, 'min_samples_split': 14, 'min_samples_leaf': 41, 'criterion': 'entropy'}. Best is trial 11 with value: 0.5456077694235588.[0m
[32m[I 2023-01-13 05:00:19,955][0m Trial 24 finished with value: 0.2747673782156541 and parameters: {'n_estimators': 3945, 'max_depth': 95, 'min_samples_split': 50, 'min_samples_leaf': 25, 'criterion': 'entropy'}. Best is trial 11 with value: 0.5456077694235588.[0m
[32m[I 2023-01-13 05:00:20,066][0m Trial 25 finished with value: 0.4176306149990361 and parameters: {'n_estimators': 48, 'max_depth': 128, 'min_samples_split': 32, 'min_samples_leaf': 8, 'criterion': 'entropy'}. Best is trial 11 with value: 0.5456077694235588.[0m
[32m[I 2023-01-13 05:00:29,873][0m Trial 26 finished with value: 0.3001664433889498 and parameters: {'n_estimators': 4470, 'max_depth': 82, 'min_samples_split': 17, 'min_samples_leaf': 19, 'criterion': 'entropy'}. Best is trial 11 with value: 0.5456077694235588.[0m
[32m[I 2023-01-13 05:00:41,146][0m Trial 27 finished with value: 0.5161822404573784 and parameters: {'n_estimators': 4966, 'max_depth': 117, 'min_samples_split': 38, 'min_samples_leaf': 2, 'criterion': 'gini'}. Best is trial 11 with value: 0.5456077694235588.[0m
[32m[I 2023-01-13 05:00:47,945][0m Trial 28 finished with value: 0.2747673782156541 and parameters: {'n_estimators': 3223, 'max_depth': 108, 'min_samples_split': 46, 'min_samples_leaf': 56, 'criterion': 'entropy'}. Best is trial 11 with value: 0.5456077694235588.[0m
[32m[I 2023-01-13 05:00:56,017][0m Trial 29 finished with value: 0.2747673782156541 and parameters: {'n_estimators': 3784, 'max_depth': 92, 'min_samples_split': 24, 'min_samples_leaf': 27, 'criterion': 'entropy'}. Best is trial 11 with value: 0.5456077694235588.[0m
[32m[I 2023-01-13 05:01:01,560][0m Trial 30 finished with value: 0.3737076682459642 and parameters: {'n_estimators': 2562, 'max_depth': 120, 'min_samples_split': 9, 'min_samples_leaf': 10, 'criterion': 'entropy'}. Best is trial 11 with value: 0.5456077694235588.[0m
[32m[I 2023-01-13 05:01:12,670][0m Trial 31 finished with value: 0.511332616397228 and parameters: {'n_estimators': 5000, 'max_depth': 118, 'min_samples_split': 40, 'min_samples_leaf': 1, 'criterion': 'gini'}. Best is trial 11 with value: 0.5456077694235588.[0m
[32m[I 2023-01-13 05:01:22,619][0m Trial 32 finished with value: 0.3751123308348373 and parameters: {'n_estimators': 4592, 'max_depth': 112, 'min_samples_split': 35, 'min_samples_leaf': 10, 'criterion': 'gini'}. Best is trial 11 with value: 0.5456077694235588.[0m
[32m[I 2023-01-13 05:01:31,479][0m Trial 33 finished with value: 0.31013431013431014 and parameters: {'n_estimators': 4102, 'max_depth': 120, 'min_samples_split': 25, 'min_samples_leaf': 21, 'criterion': 'gini'}. Best is trial 11 with value: 0.5456077694235588.[0m
[32m[I 2023-01-13 05:01:41,648][0m Trial 34 finished with value: 0.5285623148781043 and parameters: {'n_estimators': 4209, 'max_depth': 102, 'min_samples_split': 12, 'min_samples_leaf': 1, 'criterion': 'gini'}. Best is trial 11 with value: 0.5456077694235588.[0m
[32m[I 2023-01-13 05:01:51,165][0m Trial 35 finished with value: 0.3372121212121212 and parameters: {'n_estimators': 4207, 'max_depth': 100, 'min_samples_split': 13, 'min_samples_leaf': 13, 'criterion': 'gini'}. Best is trial 11 with value: 0.5456077694235588.[0m
[32m[I 2023-01-13 05:02:00,178][0m Trial 36 finished with value: 0.2747673782156541 and parameters: {'n_estimators': 3896, 'max_depth': 108, 'min_samples_split': 3, 'min_samples_leaf': 39, 'criterion': 'gini'}. Best is trial 11 with value: 0.5456077694235588.[0m
[32m[I 2023-01-13 05:02:10,182][0m Trial 37 finished with value: 0.2747673782156541 and parameters: {'n_estimators': 4573, 'max_depth': 122, 'min_samples_split': 16, 'min_samples_leaf': 127, 'criterion': 'gini'}. Best is trial 11 with value: 0.5456077694235588.[0m
[32m[I 2023-01-13 05:02:14,605][0m Trial 38 finished with value: 0.2747673782156541 and parameters: {'n_estimators': 2068, 'max_depth': 73, 'min_samples_split': 70, 'min_samples_leaf': 71, 'criterion': 'entropy'}. Best is trial 11 with value: 0.5456077694235588.[0m
[32m[I 2023-01-13 05:02:20,535][0m Trial 39 finished with value: 0.2747673782156541 and parameters: {'n_estimators': 2745, 'max_depth': 87, 'min_samples_split': 9, 'min_samples_leaf': 104, 'criterion': 'gini'}. Best is trial 11 with value: 0.5456077694235588.[0m
[32m[I 2023-01-13 05:02:28,275][0m Trial 40 finished with value: 0.3737076682459642 and parameters: {'n_estimators': 3547, 'max_depth': 113, 'min_samples_split': 20, 'min_samples_leaf': 10, 'criterion': 'entropy'}. Best is trial 11 with value: 0.5456077694235588.[0m
[32m[I 2023-01-13 05:02:38,464][0m Trial 41 finished with value: 0.2747673782156541 and parameters: {'n_estimators': 4746, 'max_depth': 116, 'min_samples_split': 54, 'min_samples_leaf': 1, 'criterion': 'gini'}. Best is trial 11 with value: 0.5456077694235588.[0m
[32m[I 2023-01-13 05:02:47,902][0m Trial 42 finished with value: 0.3001664433889498 and parameters: {'n_estimators': 4339, 'max_depth': 101, 'min_samples_split': 28, 'min_samples_leaf': 17, 'criterion': 'gini'}. Best is trial 11 with value: 0.5456077694235588.[0m
[32m[I 2023-01-13 05:02:58,556][0m Trial 43 finished with value: 0.2747673782156541 and parameters: {'n_estimators': 4997, 'max_depth': 121, 'min_samples_split': 66, 'min_samples_leaf': 7, 'criterion': 'gini'}. Best is trial 11 with value: 0.5456077694235588.[0m
[32m[I 2023-01-13 05:03:08,909][0m Trial 44 finished with value: 0.4083356643356644 and parameters: {'n_estimators': 4742, 'max_depth': 106, 'min_samples_split': 43, 'min_samples_leaf': 5, 'criterion': 'gini'}. Best is trial 11 with value: 0.5456077694235588.[0m
[32m[I 2023-01-13 05:03:17,397][0m Trial 45 finished with value: 0.2747673782156541 and parameters: {'n_estimators': 4024, 'max_depth': 112, 'min_samples_split': 8, 'min_samples_leaf': 30, 'criterion': 'gini'}. Best is trial 11 with value: 0.5456077694235588.[0m
[32m[I 2023-01-13 05:03:27,604][0m Trial 46 finished with value: 0.31013431013431014 and parameters: {'n_estimators': 4621, 'max_depth': 126, 'min_samples_split': 34, 'min_samples_leaf': 21, 'criterion': 'gini'}. Best is trial 11 with value: 0.5456077694235588.[0m
[32m[I 2023-01-13 05:03:34,280][0m Trial 47 finished with value: 0.2747673782156541 and parameters: {'n_estimators': 3125, 'max_depth': 128, 'min_samples_split': 19, 'min_samples_leaf': 64, 'criterion': 'entropy'}. Best is trial 11 with value: 0.5456077694235588.[0m
[32m[I 2023-01-13 05:03:43,279][0m Trial 48 finished with value: 0.2747673782156541 and parameters: {'n_estimators': 4253, 'max_depth': 4, 'min_samples_split': 118, 'min_samples_leaf': 86, 'criterion': 'gini'}. Best is trial 11 with value: 0.5456077694235588.[0m
[32m[I 2023-01-13 05:03:53,801][0m Trial 49 finished with value: 0.3331334763559827 and parameters: {'n_estimators': 4849, 'max_depth': 97, 'min_samples_split': 25, 'min_samples_leaf': 15, 'criterion': 'entropy'}. Best is trial 11 with value: 0.5456077694235588.[0m
[32m[I 2023-01-13 05:04:01,705][0m Trial 50 finished with value: 0.2747673782156541 and parameters: {'n_estimators': 3717, 'max_depth': 117, 'min_samples_split': 37, 'min_samples_leaf': 98, 'criterion': 'entropy'}. Best is trial 11 with value: 0.5456077694235588.[0m
[32m[I 2023-01-13 05:04:12,995][0m Trial 51 finished with value: 0.52785448469659 and parameters: {'n_estimators': 4967, 'max_depth': 122, 'min_samples_split': 31, 'min_samples_leaf': 1, 'criterion': 'gini'}. Best is trial 11 with value: 0.5456077694235588.[0m
[32m[I 2023-01-13 05:04:23,587][0m Trial 52 finished with value: 0.4641591190251845 and parameters: {'n_estimators': 4830, 'max_depth': 124, 'min_samples_split': 21, 'min_samples_leaf': 6, 'criterion': 'gini'}. Best is trial 11 with value: 0.5456077694235588.[0m
[32m[I 2023-01-13 05:04:33,667][0m Trial 53 finished with value: 0.52785448469659 and parameters: {'n_estimators': 4406, 'max_depth': 110, 'min_samples_split': 30, 'min_samples_leaf': 1, 'criterion': 'gini'}. Best is trial 11 with value: 0.5456077694235588.[0m
[32m[I 2023-01-13 05:04:43,603][0m Trial 54 finished with value: 0.4377041087567403 and parameters: {'n_estimators': 4461, 'max_depth': 110, 'min_samples_split': 31, 'min_samples_leaf': 6, 'criterion': 'gini'}. Best is trial 11 with value: 0.5456077694235588.[0m
[32m[I 2023-01-13 05:04:52,910][0m Trial 55 finished with value: 0.3420134852359916 and parameters: {'n_estimators': 4226, 'max_depth': 103, 'min_samples_split': 12, 'min_samples_leaf': 12, 'criterion': 'gini'}. Best is trial 11 with value: 0.5456077694235588.[0m
[32m[I 2023-01-13 05:05:02,824][0m Trial 56 finished with value: 0.2747673782156541 and parameters: {'n_estimators': 4647, 'max_depth': 123, 'min_samples_split': 89, 'min_samples_leaf': 79, 'criterion': 'entropy'}. Best is trial 11 with value: 0.5456077694235588.[0m
[32m[I 2023-01-13 05:05:07,277][0m Trial 57 finished with value: 0.5396491228070175 and parameters: {'n_estimators': 1782, 'max_depth': 88, 'min_samples_split': 2, 'min_samples_leaf': 1, 'criterion': 'entropy'}. Best is trial 11 with value: 0.5456077694235588.[0m
[32m[I 2023-01-13 05:05:11,212][0m Trial 58 finished with value: 0.2747673782156541 and parameters: {'n_estimators': 1832, 'max_depth': 89, 'min_samples_split': 2, 'min_samples_leaf': 22, 'criterion': 'entropy'}. Best is trial 11 with value: 0.5456077694235588.[0m
[32m[I 2023-01-13 05:05:13,888][0m Trial 59 finished with value: 0.3256902529127593 and parameters: {'n_estimators': 1252, 'max_depth': 75, 'min_samples_split': 8, 'min_samples_leaf': 15, 'criterion': 'entropy'}. Best is trial 11 with value: 0.5456077694235588.[0m
[32m[I 2023-01-13 05:05:16,003][0m Trial 60 finished with value: 0.4282866256550467 and parameters: {'n_estimators': 960, 'max_depth': 62, 'min_samples_split': 15, 'min_samples_leaf': 7, 'criterion': 'entropy'}. Best is trial 11 with value: 0.5456077694235588.[0m
[32m[I 2023-01-13 05:05:19,814][0m Trial 61 finished with value: 0.5497744360902255 and parameters: {'n_estimators': 1460, 'max_depth': 106, 'min_samples_split': 6, 'min_samples_leaf': 1, 'criterion': 'entropy'}. Best is trial 61 with value: 0.5497744360902255.[0m
[32m[I 2023-01-13 05:05:23,491][0m Trial 62 finished with value: 0.5084149768360294 and parameters: {'n_estimators': 1670, 'max_depth': 104, 'min_samples_split': 4, 'min_samples_leaf': 5, 'criterion': 'entropy'}. Best is trial 61 with value: 0.5497744360902255.[0m
[32m[I 2023-01-13 05:05:25,011][0m Trial 63 finished with value: 0.3831251513476578 and parameters: {'n_estimators': 703, 'max_depth': 97, 'min_samples_split': 6, 'min_samples_leaf': 11, 'criterion': 'entropy'}. Best is trial 61 with value: 0.5497744360902255.[0m
[32m[I 2023-01-13 05:05:28,261][0m Trial 64 finished with value: 0.5674680306905371 and parameters: {'n_estimators': 1364, 'max_depth': 115, 'min_samples_split': 12, 'min_samples_leaf': 1, 'criterion': 'entropy'}. Best is trial 64 with value: 0.5674680306905371.[0m
[32m[I 2023-01-13 05:05:30,940][0m Trial 65 finished with value: 0.31669841269841276 and parameters: {'n_estimators': 1247, 'max_depth': 86, 'min_samples_split': 11, 'min_samples_leaf': 18, 'criterion': 'entropy'}. Best is trial 64 with value: 0.5674680306905371.[0m
[32m[I 2023-01-13 05:05:34,918][0m Trial 66 finished with value: 0.3946470196470197 and parameters: {'n_estimators': 1811, 'max_depth': 77, 'min_samples_split': 17, 'min_samples_leaf': 9, 'criterion': 'entropy'}. Best is trial 64 with value: 0.5674680306905371.[0m
[32m[I 2023-01-13 05:05:38,186][0m Trial 67 finished with value: 0.5261102069286213 and parameters: {'n_estimators': 1453, 'max_depth': 27, 'min_samples_split': 12, 'min_samples_leaf': 4, 'criterion': 'entropy'}. Best is trial 64 with value: 0.5674680306905371.[0m
[32m[I 2023-01-13 05:05:43,038][0m Trial 68 finished with value: 0.2747673782156541 and parameters: {'n_estimators': 2247, 'max_depth': 115, 'min_samples_split': 2, 'min_samples_leaf': 34, 'criterion': 'entropy'}. Best is trial 64 with value: 0.5674680306905371.[0m
[32m[I 2023-01-13 05:05:45,103][0m Trial 69 finished with value: 0.2747673782156541 and parameters: {'n_estimators': 983, 'max_depth': 106, 'min_samples_split': 22, 'min_samples_leaf': 26, 'criterion': 'entropy'}. Best is trial 64 with value: 0.5674680306905371.[0m
[32m[I 2023-01-13 05:05:46,812][0m Trial 70 finished with value: 0.33964311486562127 and parameters: {'n_estimators': 792, 'max_depth': 92, 'min_samples_split': 7, 'min_samples_leaf': 12, 'criterion': 'entropy'}. Best is trial 64 with value: 0.5674680306905371.[0m
[32m[I 2023-01-13 05:05:47,963][0m Trial 71 finished with value: 0.5573427174073291 and parameters: {'n_estimators': 481, 'max_depth': 120, 'min_samples_split': 15, 'min_samples_leaf': 1, 'criterion': 'entropy'}. Best is trial 64 with value: 0.5674680306905371.[0m
[32m[I 2023-01-13 05:05:48,734][0m Trial 72 finished with value: 0.5081081491607807 and parameters: {'n_estimators': 326, 'max_depth': 118, 'min_samples_split': 16, 'min_samples_leaf': 4, 'criterion': 'entropy'}. Best is trial 64 with value: 0.5674680306905371.[0m
[32m[I 2023-01-13 05:05:49,688][0m Trial 73 finished with value: 0.3744449994449995 and parameters: {'n_estimators': 389, 'max_depth': 126, 'min_samples_split': 24, 'min_samples_leaf': 8, 'criterion': 'entropy'}. Best is trial 64 with value: 0.5674680306905371.[0m
[32m[I 2023-01-13 05:05:53,018][0m Trial 74 finished with value: 0.5485623148781043 and parameters: {'n_estimators': 1395, 'max_depth': 113, 'min_samples_split': 11, 'min_samples_leaf': 1, 'criterion': 'entropy'}. Best is trial 64 with value: 0.5674680306905371.[0m
[32m[I 2023-01-13 05:05:56,179][0m Trial 75 finished with value: 0.3176674608899673 and parameters: {'n_estimators': 1483, 'max_depth': 115, 'min_samples_split': 19, 'min_samples_leaf': 16, 'criterion': 'entropy'}. Best is trial 64 with value: 0.5674680306905371.[0m
[32m[I 2023-01-13 05:05:58,577][0m Trial 76 finished with value: 0.3946470196470197 and parameters: {'n_estimators': 1105, 'max_depth': 119, 'min_samples_split': 7, 'min_samples_leaf': 9, 'criterion': 'entropy'}. Best is trial 64 with value: 0.5674680306905371.[0m
[32m[I 2023-01-13 05:06:02,334][0m Trial 77 finished with value: 0.5281081491607807 and parameters: {'n_estimators': 1700, 'max_depth': 111, 'min_samples_split': 27, 'min_samples_leaf': 4, 'criterion': 'entropy'}. Best is trial 64 with value: 0.5674680306905371.[0m
[32m[I 2023-01-13 05:06:06,605][0m Trial 78 finished with value: 0.35095197499289577 and parameters: {'n_estimators': 1941, 'max_depth': 124, 'min_samples_split': 14, 'min_samples_leaf': 12, 'criterion': 'entropy'}. Best is trial 64 with value: 0.5674680306905371.[0m
[32m[I 2023-01-13 05:06:12,317][0m Trial 79 finished with value: 0.5594486215538848 and parameters: {'n_estimators': 2309, 'max_depth': 128, 'min_samples_split': 5, 'min_samples_leaf': 1, 'criterion': 'entropy'}. Best is trial 64 with value: 0.5674680306905371.[0m
[32m[I 2023-01-13 05:06:17,960][0m Trial 80 finished with value: 0.5594486215538848 and parameters: {'n_estimators': 2320, 'max_depth': 128, 'min_samples_split': 5, 'min_samples_leaf': 1, 'criterion': 'entropy'}. Best is trial 64 with value: 0.5674680306905371.[0m
[32m[I 2023-01-13 05:06:23,008][0m Trial 81 finished with value: 0.5685623148781043 and parameters: {'n_estimators': 2062, 'max_depth': 121, 'min_samples_split': 10, 'min_samples_leaf': 1, 'criterion': 'entropy'}. Best is trial 81 with value: 0.5685623148781043.[0m
[32m[I 2023-01-13 05:06:28,702][0m Trial 82 finished with value: 0.5594486215538848 and parameters: {'n_estimators': 2335, 'max_depth': 122, 'min_samples_split': 5, 'min_samples_leaf': 1, 'criterion': 'entropy'}. Best is trial 81 with value: 0.5685623148781043.[0m
[32m[I 2023-01-13 05:06:34,075][0m Trial 83 finished with value: 0.43755221386800336 and parameters: {'n_estimators': 2426, 'max_depth': 120, 'min_samples_split': 5, 'min_samples_leaf': 7, 'criterion': 'entropy'}. Best is trial 81 with value: 0.5685623148781043.[0m
[32m[I 2023-01-13 05:06:39,363][0m Trial 84 finished with value: 0.3946470196470197 and parameters: {'n_estimators': 2374, 'max_depth': 123, 'min_samples_split': 10, 'min_samples_leaf': 9, 'criterion': 'entropy'}. Best is trial 81 with value: 0.5685623148781043.[0m
[32m[I 2023-01-13 05:06:45,572][0m Trial 85 finished with value: 0.5168446187156647 and parameters: {'n_estimators': 2748, 'max_depth': 115, 'min_samples_split': 6, 'min_samples_leaf': 4, 'criterion': 'entropy'}. Best is trial 81 with value: 0.5685623148781043.[0m
[32m[I 2023-01-13 05:06:50,904][0m Trial 86 finished with value: 0.2747673782156541 and parameters: {'n_estimators': 2545, 'max_depth': 128, 'min_samples_split': 11, 'min_samples_leaf': 49, 'criterion': 'entropy'}. Best is trial 81 with value: 0.5685623148781043.[0m
[32m[I 2023-01-13 05:06:55,651][0m Trial 87 finished with value: 0.3372121212121212 and parameters: {'n_estimators': 2158, 'max_depth': 53, 'min_samples_split': 16, 'min_samples_leaf': 13, 'criterion': 'entropy'}. Best is trial 81 with value: 0.5685623148781043.[0m
[32m[I 2023-01-13 05:07:01,809][0m Trial 88 finished with value: 0.3001664433889498 and parameters: {'n_estimators': 2885, 'max_depth': 119, 'min_samples_split': 9, 'min_samples_leaf': 18, 'criterion': 'entropy'}. Best is trial 81 with value: 0.5685623148781043.[0m
[32m[I 2023-01-13 05:07:07,128][0m Trial 89 finished with value: 0.5293734335839599 and parameters: {'n_estimators': 2302, 'max_depth': 113, 'min_samples_split': 18, 'min_samples_leaf': 3, 'criterion': 'entropy'}. Best is trial 81 with value: 0.5685623148781043.[0m
[32m[I 2023-01-13 05:07:11,464][0m Trial 90 finished with value: 0.4503932198356078 and parameters: {'n_estimators': 1960, 'max_depth': 125, 'min_samples_split': 14, 'min_samples_leaf': 7, 'criterion': 'entropy'}. Best is trial 81 with value: 0.5685623148781043.[0m
[32m[I 2023-01-13 05:07:16,522][0m Trial 91 finished with value: 0.5497744360902255 and parameters: {'n_estimators': 2061, 'max_depth': 109, 'min_samples_split': 2, 'min_samples_leaf': 1, 'criterion': 'entropy'}. Best is trial 81 with value: 0.5685623148781043.[0m
[32m[I 2023-01-13 05:07:21,644][0m Trial 92 finished with value: 0.5696741854636592 and parameters: {'n_estimators': 2111, 'max_depth': 108, 'min_samples_split': 5, 'min_samples_leaf': 1, 'criterion': 'entropy'}. Best is trial 92 with value: 0.5696741854636592.[0m
[32m[I 2023-01-13 05:07:26,722][0m Trial 93 finished with value: 0.5497744360902256 and parameters: {'n_estimators': 2033, 'max_depth': 107, 'min_samples_split': 5, 'min_samples_leaf': 1, 'criterion': 'entropy'}. Best is trial 92 with value: 0.5696741854636592.[0m
[32m[I 2023-01-13 05:07:31,275][0m Trial 94 finished with value: 0.5084149768360294 and parameters: {'n_estimators': 2046, 'max_depth': 106, 'min_samples_split': 4, 'min_samples_leaf': 5, 'criterion': 'entropy'}. Best is trial 92 with value: 0.5696741854636592.[0m
[32m[I 2023-01-13 05:07:36,582][0m Trial 95 finished with value: 0.3737076682459642 and parameters: {'n_estimators': 2461, 'max_depth': 109, 'min_samples_split': 2, 'min_samples_leaf': 10, 'criterion': 'entropy'}. Best is trial 92 with value: 0.5696741854636592.[0m
