[32m[I 2023-01-13 02:26:29,934][0m Trial 95 finished with value: 0.5087878787878787 and parameters: {'n_estimators': 9329, 'max_depth': 49, 'learning_rate': 0.024487034436115038, 'colsample_bytree': 0.3566302798859202, 'subsample': 0.3063333257364733, 'alpha': 2.3542772368834745e-06, 'lambda': 0.00026711599725706963}. Best is trial 31 with value: 0.6527777777777776.[0m
/Users/kevinmaikjablonka/git/kjappelbaum/gptchem/src/gptchem/baselines/xgboost.py:38: FutureWarning: suggest_loguniform has been deprecated in v3.0.0. This feature will be removed in v6.0.0. See https://github.com/optuna/optuna/releases/tag/v3.0.0. Use :func:`~optuna.trial.Trial.suggest_float` instead.
  "learning_rate": trial.suggest_loguniform("learning_rate", 0.001, 0.05),
/Users/kevinmaikjablonka/git/kjappelbaum/gptchem/src/gptchem/baselines/xgboost.py:39: FutureWarning: suggest_loguniform has been deprecated in v3.0.0. This feature will be removed in v6.0.0. See https://github.com/optuna/optuna/releases/tag/v3.0.0. Use :func:`~optuna.trial.Trial.suggest_float` instead.
  "colsample_bytree": trial.suggest_loguniform(
/Users/kevinmaikjablonka/git/kjappelbaum/gptchem/src/gptchem/baselines/xgboost.py:42: FutureWarning: suggest_loguniform has been deprecated in v3.0.0. This feature will be removed in v6.0.0. See https://github.com/optuna/optuna/releases/tag/v3.0.0. Use :func:`~optuna.trial.Trial.suggest_float` instead.
  "subsample": trial.suggest_loguniform("subsample", 0.00001, 1),
/Users/kevinmaikjablonka/git/kjappelbaum/gptchem/src/gptchem/baselines/xgboost.py:43: FutureWarning: suggest_loguniform has been deprecated in v3.0.0. This feature will be removed in v6.0.0. See https://github.com/optuna/optuna/releases/tag/v3.0.0. Use :func:`~optuna.trial.Trial.suggest_float` instead.
  "alpha": trial.suggest_loguniform("alpha", 1e-8, 10.0),
/Users/kevinmaikjablonka/git/kjappelbaum/gptchem/src/gptchem/baselines/xgboost.py:44: FutureWarning: suggest_loguniform has been deprecated in v3.0.0. This feature will be removed in v6.0.0. See https://github.com/optuna/optuna/releases/tag/v3.0.0. Use :func:`~optuna.trial.Trial.suggest_float` instead.
  "lambda": trial.suggest_loguniform("lambda", 1e-8, 10.0),
[32m[I 2023-01-13 02:26:41,123][0m Trial 96 finished with value: 0.49363636363636354 and parameters: {'n_estimators': 9634, 'max_depth': 22, 'learning_rate': 0.008762402254567614, 'colsample_bytree': 0.2825584148326846, 'subsample': 0.5529338459178513, 'alpha': 1.1603375501823827e-05, 'lambda': 0.004460005292554024}. Best is trial 31 with value: 0.6527777777777776.[0m
/Users/kevinmaikjablonka/git/kjappelbaum/gptchem/src/gptchem/baselines/xgboost.py:38: FutureWarning: suggest_loguniform has been deprecated in v3.0.0. This feature will be removed in v6.0.0. See https://github.com/optuna/optuna/releases/tag/v3.0.0. Use :func:`~optuna.trial.Trial.suggest_float` instead.
  "learning_rate": trial.suggest_loguniform("learning_rate", 0.001, 0.05),
/Users/kevinmaikjablonka/git/kjappelbaum/gptchem/src/gptchem/baselines/xgboost.py:39: FutureWarning: suggest_loguniform has been deprecated in v3.0.0. This feature will be removed in v6.0.0. See https://github.com/optuna/optuna/releases/tag/v3.0.0. Use :func:`~optuna.trial.Trial.suggest_float` instead.
  "colsample_bytree": trial.suggest_loguniform(
/Users/kevinmaikjablonka/git/kjappelbaum/gptchem/src/gptchem/baselines/xgboost.py:42: FutureWarning: suggest_loguniform has been deprecated in v3.0.0. This feature will be removed in v6.0.0. See https://github.com/optuna/optuna/releases/tag/v3.0.0. Use :func:`~optuna.trial.Trial.suggest_float` instead.
  "subsample": trial.suggest_loguniform("subsample", 0.00001, 1),
/Users/kevinmaikjablonka/git/kjappelbaum/gptchem/src/gptchem/baselines/xgboost.py:43: FutureWarning: suggest_loguniform has been deprecated in v3.0.0. This feature will be removed in v6.0.0. See https://github.com/optuna/optuna/releases/tag/v3.0.0. Use :func:`~optuna.trial.Trial.suggest_float` instead.
  "alpha": trial.suggest_loguniform("alpha", 1e-8, 10.0),
/Users/kevinmaikjablonka/git/kjappelbaum/gptchem/src/gptchem/baselines/xgboost.py:44: FutureWarning: suggest_loguniform has been deprecated in v3.0.0. This feature will be removed in v6.0.0. See https://github.com/optuna/optuna/releases/tag/v3.0.0. Use :func:`~optuna.trial.Trial.suggest_float` instead.
  "lambda": trial.suggest_loguniform("lambda", 1e-8, 10.0),
[32m[I 2023-01-13 02:26:52,741][0m Trial 97 finished with value: 0.5694444444444444 and parameters: {'n_estimators': 8565, 'max_depth': 33, 'learning_rate': 0.04981617432753866, 'colsample_bytree': 0.4006175901145225, 'subsample': 0.7665845791235297, 'alpha': 0.0003280880606942549, 'lambda': 0.025175228048450665}. Best is trial 31 with value: 0.6527777777777776.[0m
/Users/kevinmaikjablonka/git/kjappelbaum/gptchem/src/gptchem/baselines/xgboost.py:38: FutureWarning: suggest_loguniform has been deprecated in v3.0.0. This feature will be removed in v6.0.0. See https://github.com/optuna/optuna/releases/tag/v3.0.0. Use :func:`~optuna.trial.Trial.suggest_float` instead.
  "learning_rate": trial.suggest_loguniform("learning_rate", 0.001, 0.05),
/Users/kevinmaikjablonka/git/kjappelbaum/gptchem/src/gptchem/baselines/xgboost.py:39: FutureWarning: suggest_loguniform has been deprecated in v3.0.0. This feature will be removed in v6.0.0. See https://github.com/optuna/optuna/releases/tag/v3.0.0. Use :func:`~optuna.trial.Trial.suggest_float` instead.
  "colsample_bytree": trial.suggest_loguniform(
/Users/kevinmaikjablonka/git/kjappelbaum/gptchem/src/gptchem/baselines/xgboost.py:42: FutureWarning: suggest_loguniform has been deprecated in v3.0.0. This feature will be removed in v6.0.0. See https://github.com/optuna/optuna/releases/tag/v3.0.0. Use :func:`~optuna.trial.Trial.suggest_float` instead.
  "subsample": trial.suggest_loguniform("subsample", 0.00001, 1),
/Users/kevinmaikjablonka/git/kjappelbaum/gptchem/src/gptchem/baselines/xgboost.py:43: FutureWarning: suggest_loguniform has been deprecated in v3.0.0. This feature will be removed in v6.0.0. See https://github.com/optuna/optuna/releases/tag/v3.0.0. Use :func:`~optuna.trial.Trial.suggest_float` instead.
  "alpha": trial.suggest_loguniform("alpha", 1e-8, 10.0),
/Users/kevinmaikjablonka/git/kjappelbaum/gptchem/src/gptchem/baselines/xgboost.py:44: FutureWarning: suggest_loguniform has been deprecated in v3.0.0. This feature will be removed in v6.0.0. See https://github.com/optuna/optuna/releases/tag/v3.0.0. Use :func:`~optuna.trial.Trial.suggest_float` instead.
  "lambda": trial.suggest_loguniform("lambda", 1e-8, 10.0),
[32m[I 2023-01-13 02:27:02,412][0m Trial 98 finished with value: 0.5845543345543345 and parameters: {'n_estimators': 6165, 'max_depth': 45, 'learning_rate': 0.043293899683847094, 'colsample_bytree': 0.4171108947467778, 'subsample': 0.9753669635559477, 'alpha': 4.588680819765348e-05, 'lambda': 0.012878989846546307}. Best is trial 31 with value: 0.6527777777777776.[0m
/Users/kevinmaikjablonka/git/kjappelbaum/gptchem/src/gptchem/baselines/xgboost.py:38: FutureWarning: suggest_loguniform has been deprecated in v3.0.0. This feature will be removed in v6.0.0. See https://github.com/optuna/optuna/releases/tag/v3.0.0. Use :func:`~optuna.trial.Trial.suggest_float` instead.
  "learning_rate": trial.suggest_loguniform("learning_rate", 0.001, 0.05),
/Users/kevinmaikjablonka/git/kjappelbaum/gptchem/src/gptchem/baselines/xgboost.py:39: FutureWarning: suggest_loguniform has been deprecated in v3.0.0. This feature will be removed in v6.0.0. See https://github.com/optuna/optuna/releases/tag/v3.0.0. Use :func:`~optuna.trial.Trial.suggest_float` instead.
  "colsample_bytree": trial.suggest_loguniform(
/Users/kevinmaikjablonka/git/kjappelbaum/gptchem/src/gptchem/baselines/xgboost.py:42: FutureWarning: suggest_loguniform has been deprecated in v3.0.0. This feature will be removed in v6.0.0. See https://github.com/optuna/optuna/releases/tag/v3.0.0. Use :func:`~optuna.trial.Trial.suggest_float` instead.
  "subsample": trial.suggest_loguniform("subsample", 0.00001, 1),
/Users/kevinmaikjablonka/git/kjappelbaum/gptchem/src/gptchem/baselines/xgboost.py:43: FutureWarning: suggest_loguniform has been deprecated in v3.0.0. This feature will be removed in v6.0.0. See https://github.com/optuna/optuna/releases/tag/v3.0.0. Use :func:`~optuna.trial.Trial.suggest_float` instead.
  "alpha": trial.suggest_loguniform("alpha", 1e-8, 10.0),
/Users/kevinmaikjablonka/git/kjappelbaum/gptchem/src/gptchem/baselines/xgboost.py:44: FutureWarning: suggest_loguniform has been deprecated in v3.0.0. This feature will be removed in v6.0.0. See https://github.com/optuna/optuna/releases/tag/v3.0.0. Use :func:`~optuna.trial.Trial.suggest_float` instead.
  "lambda": trial.suggest_loguniform("lambda", 1e-8, 10.0),
[32m[I 2023-01-13 02:27:14,071][0m Trial 99 finished with value: 0.51010101010101 and parameters: {'n_estimators': 9144, 'max_depth': 44, 'learning_rate': 0.01548773088919628, 'colsample_bytree': 0.3854319223428465, 'subsample': 0.5572665924368767, 'alpha': 6.511174564737232e-06, 'lambda': 0.04292178124429411}. Best is trial 31 with value: 0.6527777777777776.[0m
[32m[I 2023-01-13 02:27:32,315][0m A new study created in memory with name: no-name-ef6a5d2b-7cf4-4767-87ab-d79d2c788a48[0m
[32m[I 2023-01-13 02:27:38,315][0m Trial 0 finished with value: 0.2732600732600733 and parameters: {'n_estimators': 2746, 'max_depth': 93, 'min_samples_split': 78, 'min_samples_leaf': 70, 'criterion': 'entropy'}. Best is trial 0 with value: 0.2732600732600733.[0m
[32m[I 2023-01-13 02:27:42,998][0m Trial 1 finished with value: 0.2732600732600733 and parameters: {'n_estimators': 2190, 'max_depth': 115, 'min_samples_split': 124, 'min_samples_leaf': 50, 'criterion': 'gini'}. Best is trial 0 with value: 0.2732600732600733.[0m
[32m[I 2023-01-13 02:27:49,108][0m Trial 2 finished with value: 0.3232600732600733 and parameters: {'n_estimators': 2842, 'max_depth': 119, 'min_samples_split': 11, 'min_samples_leaf': 12, 'criterion': 'entropy'}. Best is trial 2 with value: 0.3232600732600733.[0m
[32m[I 2023-01-13 02:27:57,476][0m Trial 3 finished with value: 0.2732600732600733 and parameters: {'n_estimators': 3892, 'max_depth': 112, 'min_samples_split': 126, 'min_samples_leaf': 103, 'criterion': 'entropy'}. Best is trial 2 with value: 0.3232600732600733.[0m
[32m[I 2023-01-13 02:27:58,743][0m Trial 4 finished with value: 0.2732600732600733 and parameters: {'n_estimators': 595, 'max_depth': 83, 'min_samples_split': 20, 'min_samples_leaf': 121, 'criterion': 'gini'}. Best is trial 2 with value: 0.3232600732600733.[0m
[32m[I 2023-01-13 02:28:01,560][0m Trial 5 finished with value: 0.2732600732600733 and parameters: {'n_estimators': 1325, 'max_depth': 100, 'min_samples_split': 59, 'min_samples_leaf': 73, 'criterion': 'entropy'}. Best is trial 2 with value: 0.3232600732600733.[0m
[32m[I 2023-01-13 02:28:08,140][0m Trial 6 finished with value: 0.2732600732600733 and parameters: {'n_estimators': 3062, 'max_depth': 81, 'min_samples_split': 121, 'min_samples_leaf': 88, 'criterion': 'entropy'}. Best is trial 2 with value: 0.3232600732600733.[0m
[32m[I 2023-01-13 02:28:15,506][0m Trial 7 finished with value: 0.2732600732600733 and parameters: {'n_estimators': 3490, 'max_depth': 11, 'min_samples_split': 86, 'min_samples_leaf': 86, 'criterion': 'gini'}. Best is trial 2 with value: 0.3232600732600733.[0m
[32m[I 2023-01-13 02:28:18,938][0m Trial 8 finished with value: 0.2732600732600733 and parameters: {'n_estimators': 1580, 'max_depth': 49, 'min_samples_split': 74, 'min_samples_leaf': 57, 'criterion': 'gini'}. Best is trial 2 with value: 0.3232600732600733.[0m
[32m[I 2023-01-13 02:28:21,154][0m Trial 9 finished with value: 0.2732600732600733 and parameters: {'n_estimators': 1047, 'max_depth': 24, 'min_samples_split': 84, 'min_samples_leaf': 33, 'criterion': 'gini'}. Best is trial 2 with value: 0.3232600732600733.[0m
[32m[I 2023-01-13 02:28:31,606][0m Trial 10 finished with value: 0.5163636363636364 and parameters: {'n_estimators': 4704, 'max_depth': 127, 'min_samples_split': 4, 'min_samples_leaf': 3, 'criterion': 'entropy'}. Best is trial 10 with value: 0.5163636363636364.[0m
[32m[I 2023-01-13 02:28:42,511][0m Trial 11 finished with value: 0.5228710178710179 and parameters: {'n_estimators': 4941, 'max_depth': 123, 'min_samples_split': 12, 'min_samples_leaf': 2, 'criterion': 'entropy'}. Best is trial 11 with value: 0.5228710178710179.[0m
[32m[I 2023-01-13 02:28:52,558][0m Trial 12 finished with value: 0.345987345987346 and parameters: {'n_estimators': 4775, 'max_depth': 127, 'min_samples_split': 30, 'min_samples_leaf': 5, 'criterion': 'entropy'}. Best is trial 11 with value: 0.5228710178710179.[0m
[32m[I 2023-01-13 02:29:03,146][0m Trial 13 finished with value: 0.2732600732600733 and parameters: {'n_estimators': 4976, 'max_depth': 55, 'min_samples_split': 2, 'min_samples_leaf': 26, 'criterion': 'entropy'}. Best is trial 11 with value: 0.5228710178710179.[0m
[32m[I 2023-01-13 02:29:12,152][0m Trial 14 finished with value: 0.2732600732600733 and parameters: {'n_estimators': 4120, 'max_depth': 102, 'min_samples_split': 36, 'min_samples_leaf': 1, 'criterion': 'entropy'}. Best is trial 11 with value: 0.5228710178710179.[0m
[32m[I 2023-01-13 02:29:21,210][0m Trial 15 finished with value: 0.2732600732600733 and parameters: {'n_estimators': 4264, 'max_depth': 73, 'min_samples_split': 51, 'min_samples_leaf': 23, 'criterion': 'entropy'}. Best is trial 11 with value: 0.5228710178710179.[0m
[32m[I 2023-01-13 02:29:30,816][0m Trial 16 finished with value: 0.2732600732600733 and parameters: {'n_estimators': 4534, 'max_depth': 128, 'min_samples_split': 41, 'min_samples_leaf': 45, 'criterion': 'entropy'}. Best is trial 11 with value: 0.5228710178710179.[0m
[32m[I 2023-01-13 02:29:30,874][0m Trial 17 finished with value: 0.2732600732600733 and parameters: {'n_estimators': 24, 'max_depth': 35, 'min_samples_split': 22, 'min_samples_leaf': 16, 'criterion': 'entropy'}. Best is trial 11 with value: 0.5228710178710179.[0m
[32m[I 2023-01-13 02:29:38,331][0m Trial 18 finished with value: 0.2732600732600733 and parameters: {'n_estimators': 3537, 'max_depth': 106, 'min_samples_split': 2, 'min_samples_leaf': 39, 'criterion': 'entropy'}. Best is trial 11 with value: 0.5228710178710179.[0m
[32m[I 2023-01-13 02:29:48,823][0m Trial 19 finished with value: 0.2732600732600733 and parameters: {'n_estimators': 4938, 'max_depth': 89, 'min_samples_split': 102, 'min_samples_leaf': 1, 'criterion': 'entropy'}. Best is trial 11 with value: 0.5228710178710179.[0m
[32m[I 2023-01-13 02:29:53,978][0m Trial 20 finished with value: 0.2732600732600733 and parameters: {'n_estimators': 2329, 'max_depth': 52, 'min_samples_split': 17, 'min_samples_leaf': 19, 'criterion': 'entropy'}. Best is trial 11 with value: 0.5228710178710179.[0m
[32m[I 2023-01-13 02:30:03,643][0m Trial 21 finished with value: 0.2732600732600733 and parameters: {'n_estimators': 4563, 'max_depth': 127, 'min_samples_split': 33, 'min_samples_leaf': 6, 'criterion': 'entropy'}. Best is trial 11 with value: 0.5228710178710179.[0m
[32m[I 2023-01-13 02:30:13,505][0m Trial 22 finished with value: 0.2732600732600733 and parameters: {'n_estimators': 4618, 'max_depth': 124, 'min_samples_split': 29, 'min_samples_leaf': 31, 'criterion': 'entropy'}. Best is trial 11 with value: 0.5228710178710179.[0m
[32m[I 2023-01-13 02:30:21,726][0m Trial 23 finished with value: 0.2732600732600733 and parameters: {'n_estimators': 3805, 'max_depth': 111, 'min_samples_split': 46, 'min_samples_leaf': 13, 'criterion': 'entropy'}. Best is trial 11 with value: 0.5228710178710179.[0m
[32m[I 2023-01-13 02:30:32,303][0m Trial 24 finished with value: 0.3232600732600733 and parameters: {'n_estimators': 4964, 'max_depth': 118, 'min_samples_split': 10, 'min_samples_leaf': 11, 'criterion': 'entropy'}. Best is trial 11 with value: 0.5228710178710179.[0m
[32m[I 2023-01-13 02:30:41,577][0m Trial 25 finished with value: 0.2732600732600733 and parameters: {'n_estimators': 4362, 'max_depth': 99, 'min_samples_split': 28, 'min_samples_leaf': 23, 'criterion': 'entropy'}. Best is trial 11 with value: 0.5228710178710179.[0m
[32m[I 2023-01-13 02:30:48,431][0m Trial 26 finished with value: 0.2732600732600733 and parameters: {'n_estimators': 3273, 'max_depth': 67, 'min_samples_split': 12, 'min_samples_leaf': 38, 'criterion': 'entropy'}. Best is trial 11 with value: 0.5228710178710179.[0m
[32m[I 2023-01-13 02:30:57,112][0m Trial 27 finished with value: 0.2732600732600733 and parameters: {'n_estimators': 4038, 'max_depth': 120, 'min_samples_split': 60, 'min_samples_leaf': 2, 'criterion': 'gini'}. Best is trial 11 with value: 0.5228710178710179.[0m
[32m[I 2023-01-13 02:31:06,976][0m Trial 28 finished with value: 0.2732600732600733 and parameters: {'n_estimators': 4641, 'max_depth': 109, 'min_samples_split': 24, 'min_samples_leaf': 56, 'criterion': 'entropy'}. Best is trial 11 with value: 0.5228710178710179.[0m
[32m[I 2023-01-13 02:31:11,298][0m Trial 29 finished with value: 0.3232600732600733 and parameters: {'n_estimators': 2044, 'max_depth': 90, 'min_samples_split': 4, 'min_samples_leaf': 10, 'criterion': 'entropy'}. Best is trial 11 with value: 0.5228710178710179.[0m
[32m[I 2023-01-13 02:31:19,303][0m Trial 30 finished with value: 0.2732600732600733 and parameters: {'n_estimators': 3773, 'max_depth': 128, 'min_samples_split': 37, 'min_samples_leaf': 28, 'criterion': 'entropy'}. Best is trial 11 with value: 0.5228710178710179.[0m
[32m[I 2023-01-13 02:31:25,387][0m Trial 31 finished with value: 0.29670329670329676 and parameters: {'n_estimators': 2897, 'max_depth': 119, 'min_samples_split': 12, 'min_samples_leaf': 14, 'criterion': 'entropy'}. Best is trial 11 with value: 0.5228710178710179.[0m
[32m[I 2023-01-13 02:31:29,329][0m Trial 32 finished with value: 0.3562271062271062 and parameters: {'n_estimators': 1852, 'max_depth': 92, 'min_samples_split': 2, 'min_samples_leaf': 8, 'criterion': 'entropy'}. Best is trial 11 with value: 0.5228710178710179.[0m
[32m[I 2023-01-13 02:31:33,405][0m Trial 33 finished with value: 0.34523809523809523 and parameters: {'n_estimators': 1864, 'max_depth': 96, 'min_samples_split': 16, 'min_samples_leaf': 7, 'criterion': 'entropy'}. Best is trial 11 with value: 0.5228710178710179.[0m
[32m[I 2023-01-13 02:31:38,784][0m Trial 34 finished with value: 0.2732600732600733 and parameters: {'n_estimators': 2538, 'max_depth': 115, 'min_samples_split': 8, 'min_samples_leaf': 18, 'criterion': 'entropy'}. Best is trial 11 with value: 0.5228710178710179.[0m
[32m[I 2023-01-13 02:31:44,241][0m Trial 35 finished with value: 0.3562271062271062 and parameters: {'n_estimators': 2573, 'max_depth': 109, 'min_samples_split': 21, 'min_samples_leaf': 8, 'criterion': 'gini'}. Best is trial 11 with value: 0.5228710178710179.[0m
[32m[I 2023-01-13 02:31:46,458][0m Trial 36 finished with value: 0.2732600732600733 and parameters: {'n_estimators': 1058, 'max_depth': 106, 'min_samples_split': 21, 'min_samples_leaf': 67, 'criterion': 'gini'}. Best is trial 11 with value: 0.5228710178710179.[0m
[32m[I 2023-01-13 02:31:50,130][0m Trial 37 finished with value: 0.2732600732600733 and parameters: {'n_estimators': 1736, 'max_depth': 83, 'min_samples_split': 8, 'min_samples_leaf': 103, 'criterion': 'gini'}. Best is trial 11 with value: 0.5228710178710179.[0m
[32m[I 2023-01-13 02:31:55,900][0m Trial 38 finished with value: 0.2732600732600733 and parameters: {'n_estimators': 2700, 'max_depth': 113, 'min_samples_split': 16, 'min_samples_leaf': 122, 'criterion': 'gini'}. Best is trial 11 with value: 0.5228710178710179.[0m
[32m[I 2023-01-13 02:31:58,758][0m Trial 39 finished with value: 0.2732600732600733 and parameters: {'n_estimators': 1371, 'max_depth': 93, 'min_samples_split': 106, 'min_samples_leaf': 46, 'criterion': 'gini'}. Best is trial 11 with value: 0.5228710178710179.[0m
[32m[I 2023-01-13 02:32:00,393][0m Trial 40 finished with value: 0.2732600732600733 and parameters: {'n_estimators': 784, 'max_depth': 78, 'min_samples_split': 50, 'min_samples_leaf': 23, 'criterion': 'gini'}. Best is trial 11 with value: 0.5228710178710179.[0m
[32m[I 2023-01-13 02:32:05,182][0m Trial 41 finished with value: 0.345987345987346 and parameters: {'n_estimators': 2278, 'max_depth': 122, 'min_samples_split': 26, 'min_samples_leaf': 5, 'criterion': 'gini'}. Best is trial 11 with value: 0.5228710178710179.[0m
[32m[I 2023-01-13 02:32:15,523][0m Trial 42 finished with value: 0.3562271062271062 and parameters: {'n_estimators': 4701, 'max_depth': 104, 'min_samples_split': 16, 'min_samples_leaf': 8, 'criterion': 'entropy'}. Best is trial 11 with value: 0.5228710178710179.[0m
[32m[I 2023-01-13 02:32:25,146][0m Trial 43 finished with value: 0.3232600732600733 and parameters: {'n_estimators': 4411, 'max_depth': 107, 'min_samples_split': 6, 'min_samples_leaf': 11, 'criterion': 'entropy'}. Best is trial 11 with value: 0.5228710178710179.[0m
[32m[I 2023-01-13 02:32:31,834][0m Trial 44 finished with value: 0.2732600732600733 and parameters: {'n_estimators': 3197, 'max_depth': 102, 'min_samples_split': 16, 'min_samples_leaf': 80, 'criterion': 'gini'}. Best is trial 11 with value: 0.5228710178710179.[0m
[32m[I 2023-01-13 02:32:40,757][0m Trial 45 finished with value: 0.2732600732600733 and parameters: {'n_estimators': 4217, 'max_depth': 115, 'min_samples_split': 2, 'min_samples_leaf': 20, 'criterion': 'entropy'}. Best is trial 11 with value: 0.5228710178710179.[0m
[32m[I 2023-01-13 02:32:50,838][0m Trial 46 finished with value: 0.2732600732600733 and parameters: {'n_estimators': 4744, 'max_depth': 88, 'min_samples_split': 69, 'min_samples_leaf': 34, 'criterion': 'entropy'}. Best is trial 11 with value: 0.5228710178710179.[0m
