[32m[I 2023-01-13 00:03:47,937][0m Trial 9 finished with value: 0.39999999999999997 and parameters: {'n_estimators': 1385, 'max_depth': 13, 'learning_rate': 0.004231097223438996, 'colsample_bytree': 0.7496864080682166, 'subsample': 3.05848516954853e-05, 'alpha': 0.34793984646334997, 'lambda': 7.326316408987164e-08}. Best is trial 0 with value: 0.39999999999999997.[0m
/Users/kevinmaikjablonka/git/kjappelbaum/gptchem/src/gptchem/baselines/xgboost.py:38: FutureWarning: suggest_loguniform has been deprecated in v3.0.0. This feature will be removed in v6.0.0. See https://github.com/optuna/optuna/releases/tag/v3.0.0. Use :func:`~optuna.trial.Trial.suggest_float` instead.
  "learning_rate": trial.suggest_loguniform("learning_rate", 0.001, 0.05),
/Users/kevinmaikjablonka/git/kjappelbaum/gptchem/src/gptchem/baselines/xgboost.py:39: FutureWarning: suggest_loguniform has been deprecated in v3.0.0. This feature will be removed in v6.0.0. See https://github.com/optuna/optuna/releases/tag/v3.0.0. Use :func:`~optuna.trial.Trial.suggest_float` instead.
  "colsample_bytree": trial.suggest_loguniform(
/Users/kevinmaikjablonka/git/kjappelbaum/gptchem/src/gptchem/baselines/xgboost.py:42: FutureWarning: suggest_loguniform has been deprecated in v3.0.0. This feature will be removed in v6.0.0. See https://github.com/optuna/optuna/releases/tag/v3.0.0. Use :func:`~optuna.trial.Trial.suggest_float` instead.
  "subsample": trial.suggest_loguniform("subsample", 0.00001, 1),
/Users/kevinmaikjablonka/git/kjappelbaum/gptchem/src/gptchem/baselines/xgboost.py:43: FutureWarning: suggest_loguniform has been deprecated in v3.0.0. This feature will be removed in v6.0.0. See https://github.com/optuna/optuna/releases/tag/v3.0.0. Use :func:`~optuna.trial.Trial.suggest_float` instead.
  "alpha": trial.suggest_loguniform("alpha", 1e-8, 10.0),
/Users/kevinmaikjablonka/git/kjappelbaum/gptchem/src/gptchem/baselines/xgboost.py:44: FutureWarning: suggest_loguniform has been deprecated in v3.0.0. This feature will be removed in v6.0.0. See https://github.com/optuna/optuna/releases/tag/v3.0.0. Use :func:`~optuna.trial.Trial.suggest_float` instead.
  "lambda": trial.suggest_loguniform("lambda", 1e-8, 10.0),
[32m[I 2023-01-13 00:03:49,855][0m Trial 10 finished with value: 0.2 and parameters: {'n_estimators': 3527, 'max_depth': 48, 'learning_rate': 0.04156633045765211, 'colsample_bytree': 0.4165254184098851, 'subsample': 0.557700096582404, 'alpha': 0.009427986582419416, 'lambda': 0.012164858025197709}. Best is trial 0 with value: 0.39999999999999997.[0m
/Users/kevinmaikjablonka/git/kjappelbaum/gptchem/src/gptchem/baselines/xgboost.py:38: FutureWarning: suggest_loguniform has been deprecated in v3.0.0. This feature will be removed in v6.0.0. See https://github.com/optuna/optuna/releases/tag/v3.0.0. Use :func:`~optuna.trial.Trial.suggest_float` instead.
  "learning_rate": trial.suggest_loguniform("learning_rate", 0.001, 0.05),
/Users/kevinmaikjablonka/git/kjappelbaum/gptchem/src/gptchem/baselines/xgboost.py:39: FutureWarning: suggest_loguniform has been deprecated in v3.0.0. This feature will be removed in v6.0.0. See https://github.com/optuna/optuna/releases/tag/v3.0.0. Use :func:`~optuna.trial.Trial.suggest_float` instead.
  "colsample_bytree": trial.suggest_loguniform(
/Users/kevinmaikjablonka/git/kjappelbaum/gptchem/src/gptchem/baselines/xgboost.py:42: FutureWarning: suggest_loguniform has been deprecated in v3.0.0. This feature will be removed in v6.0.0. See https://github.com/optuna/optuna/releases/tag/v3.0.0. Use :func:`~optuna.trial.Trial.suggest_float` instead.
  "subsample": trial.suggest_loguniform("subsample", 0.00001, 1),
/Users/kevinmaikjablonka/git/kjappelbaum/gptchem/src/gptchem/baselines/xgboost.py:43: FutureWarning: suggest_loguniform has been deprecated in v3.0.0. This feature will be removed in v6.0.0. See https://github.com/optuna/optuna/releases/tag/v3.0.0. Use :func:`~optuna.trial.Trial.suggest_float` instead.
  "alpha": trial.suggest_loguniform("alpha", 1e-8, 10.0),
/Users/kevinmaikjablonka/git/kjappelbaum/gptchem/src/gptchem/baselines/xgboost.py:44: FutureWarning: suggest_loguniform has been deprecated in v3.0.0. This feature will be removed in v6.0.0. See https://github.com/optuna/optuna/releases/tag/v3.0.0. Use :func:`~optuna.trial.Trial.suggest_float` instead.
  "lambda": trial.suggest_loguniform("lambda", 1e-8, 10.0),
[32m[I 2023-01-13 00:03:54,622][0m Trial 11 finished with value: 0.39999999999999997 and parameters: {'n_estimators': 9774, 'max_depth': 50, 'learning_rate': 0.0020192400857495184, 'colsample_bytree': 0.4108393875579916, 'subsample': 0.0010014729634260742, 'alpha': 0.014517565225742933, 'lambda': 0.019639142594928855}. Best is trial 0 with value: 0.39999999999999997.[0m
/Users/kevinmaikjablonka/git/kjappelbaum/gptchem/src/gptchem/baselines/xgboost.py:38: FutureWarning: suggest_loguniform has been deprecated in v3.0.0. This feature will be removed in v6.0.0. See https://github.com/optuna/optuna/releases/tag/v3.0.0. Use :func:`~optuna.trial.Trial.suggest_float` instead.
  "learning_rate": trial.suggest_loguniform("learning_rate", 0.001, 0.05),
/Users/kevinmaikjablonka/git/kjappelbaum/gptchem/src/gptchem/baselines/xgboost.py:39: FutureWarning: suggest_loguniform has been deprecated in v3.0.0. This feature will be removed in v6.0.0. See https://github.com/optuna/optuna/releases/tag/v3.0.0. Use :func:`~optuna.trial.Trial.suggest_float` instead.
  "colsample_bytree": trial.suggest_loguniform(
/Users/kevinmaikjablonka/git/kjappelbaum/gptchem/src/gptchem/baselines/xgboost.py:42: FutureWarning: suggest_loguniform has been deprecated in v3.0.0. This feature will be removed in v6.0.0. See https://github.com/optuna/optuna/releases/tag/v3.0.0. Use :func:`~optuna.trial.Trial.suggest_float` instead.
  "subsample": trial.suggest_loguniform("subsample", 0.00001, 1),
/Users/kevinmaikjablonka/git/kjappelbaum/gptchem/src/gptchem/baselines/xgboost.py:43: FutureWarning: suggest_loguniform has been deprecated in v3.0.0. This feature will be removed in v6.0.0. See https://github.com/optuna/optuna/releases/tag/v3.0.0. Use :func:`~optuna.trial.Trial.suggest_float` instead.
  "alpha": trial.suggest_loguniform("alpha", 1e-8, 10.0),
/Users/kevinmaikjablonka/git/kjappelbaum/gptchem/src/gptchem/baselines/xgboost.py:44: FutureWarning: suggest_loguniform has been deprecated in v3.0.0. This feature will be removed in v6.0.0. See https://github.com/optuna/optuna/releases/tag/v3.0.0. Use :func:`~optuna.trial.Trial.suggest_float` instead.
  "lambda": trial.suggest_loguniform("lambda", 1e-8, 10.0),
[32m[I 2023-01-13 00:03:59,515][0m Trial 12 finished with value: 0.39999999999999997 and parameters: {'n_estimators': 9218, 'max_depth': 41, 'learning_rate': 0.010161764818175751, 'colsample_bytree': 0.5702956404316456, 'subsample': 0.0005037623482671288, 'alpha': 9.320552761439929e-05, 'lambda': 0.00036248258990223016}. Best is trial 0 with value: 0.39999999999999997.[0m
/Users/kevinmaikjablonka/git/kjappelbaum/gptchem/src/gptchem/baselines/xgboost.py:38: FutureWarning: suggest_loguniform has been deprecated in v3.0.0. This feature will be removed in v6.0.0. See https://github.com/optuna/optuna/releases/tag/v3.0.0. Use :func:`~optuna.trial.Trial.suggest_float` instead.
  "learning_rate": trial.suggest_loguniform("learning_rate", 0.001, 0.05),
/Users/kevinmaikjablonka/git/kjappelbaum/gptchem/src/gptchem/baselines/xgboost.py:39: FutureWarning: suggest_loguniform has been deprecated in v3.0.0. This feature will be removed in v6.0.0. See https://github.com/optuna/optuna/releases/tag/v3.0.0. Use :func:`~optuna.trial.Trial.suggest_float` instead.
  "colsample_bytree": trial.suggest_loguniform(
/Users/kevinmaikjablonka/git/kjappelbaum/gptchem/src/gptchem/baselines/xgboost.py:42: FutureWarning: suggest_loguniform has been deprecated in v3.0.0. This feature will be removed in v6.0.0. See https://github.com/optuna/optuna/releases/tag/v3.0.0. Use :func:`~optuna.trial.Trial.suggest_float` instead.
  "subsample": trial.suggest_loguniform("subsample", 0.00001, 1),
/Users/kevinmaikjablonka/git/kjappelbaum/gptchem/src/gptchem/baselines/xgboost.py:43: FutureWarning: suggest_loguniform has been deprecated in v3.0.0. This feature will be removed in v6.0.0. See https://github.com/optuna/optuna/releases/tag/v3.0.0. Use :func:`~optuna.trial.Trial.suggest_float` instead.
  "alpha": trial.suggest_loguniform("alpha", 1e-8, 10.0),
/Users/kevinmaikjablonka/git/kjappelbaum/gptchem/src/gptchem/baselines/xgboost.py:44: FutureWarning: suggest_loguniform has been deprecated in v3.0.0. This feature will be removed in v6.0.0. See https://github.com/optuna/optuna/releases/tag/v3.0.0. Use :func:`~optuna.trial.Trial.suggest_float` instead.
  "lambda": trial.suggest_loguniform("lambda", 1e-8, 10.0),
[32m[I 2023-01-13 00:04:03,740][0m Trial 13 finished with value: 0.39999999999999997 and parameters: {'n_estimators': 8125, 'max_depth': 40, 'learning_rate': 0.022904257663117825, 'colsample_bytree': 0.5307307429779641, 'subsample': 0.006804103404932582, 'alpha': 6.8272898649018146, 'lambda': 0.2191984735587496}. Best is trial 0 with value: 0.39999999999999997.[0m
/Users/kevinmaikjablonka/git/kjappelbaum/gptchem/src/gptchem/baselines/xgboost.py:38: FutureWarning: suggest_loguniform has been deprecated in v3.0.0. This feature will be removed in v6.0.0. See https://github.com/optuna/optuna/releases/tag/v3.0.0. Use :func:`~optuna.trial.Trial.suggest_float` instead.
  "learning_rate": trial.suggest_loguniform("learning_rate", 0.001, 0.05),
/Users/kevinmaikjablonka/git/kjappelbaum/gptchem/src/gptchem/baselines/xgboost.py:39: FutureWarning: suggest_loguniform has been deprecated in v3.0.0. This feature will be removed in v6.0.0. See https://github.com/optuna/optuna/releases/tag/v3.0.0. Use :func:`~optuna.trial.Trial.suggest_float` instead.
  "colsample_bytree": trial.suggest_loguniform(
/Users/kevinmaikjablonka/git/kjappelbaum/gptchem/src/gptchem/baselines/xgboost.py:42: FutureWarning: suggest_loguniform has been deprecated in v3.0.0. This feature will be removed in v6.0.0. See https://github.com/optuna/optuna/releases/tag/v3.0.0. Use :func:`~optuna.trial.Trial.suggest_float` instead.
  "subsample": trial.suggest_loguniform("subsample", 0.00001, 1),
/Users/kevinmaikjablonka/git/kjappelbaum/gptchem/src/gptchem/baselines/xgboost.py:43: FutureWarning: suggest_loguniform has been deprecated in v3.0.0. This feature will be removed in v6.0.0. See https://github.com/optuna/optuna/releases/tag/v3.0.0. Use :func:`~optuna.trial.Trial.suggest_float` instead.
  "alpha": trial.suggest_loguniform("alpha", 1e-8, 10.0),
/Users/kevinmaikjablonka/git/kjappelbaum/gptchem/src/gptchem/baselines/xgboost.py:44: FutureWarning: suggest_loguniform has been deprecated in v3.0.0. This feature will be removed in v6.0.0. See https://github.com/optuna/optuna/releases/tag/v3.0.0. Use :func:`~optuna.trial.Trial.suggest_float` instead.
  "lambda": trial.suggest_loguniform("lambda", 1e-8, 10.0),
[32m[I 2023-01-13 00:04:05,439][0m Trial 14 finished with value: 0.39999999999999997 and parameters: {'n_estimators': 3575, 'max_depth': 40, 'learning_rate': 0.0031580506314630346, 'colsample_bytree': 0.33672714108148194, 'subsample': 0.00047356863745014747, 'alpha': 1.479359615105313e-05, 'lambda': 2.260216279243193e-05}. Best is trial 0 with value: 0.39999999999999997.[0m
/Users/kevinmaikjablonka/git/kjappelbaum/gptchem/src/gptchem/baselines/xgboost.py:38: FutureWarning: suggest_loguniform has been deprecated in v3.0.0. This feature will be removed in v6.0.0. See https://github.com/optuna/optuna/releases/tag/v3.0.0. Use :func:`~optuna.trial.Trial.suggest_float` instead.
  "learning_rate": trial.suggest_loguniform("learning_rate", 0.001, 0.05),
/Users/kevinmaikjablonka/git/kjappelbaum/gptchem/src/gptchem/baselines/xgboost.py:39: FutureWarning: suggest_loguniform has been deprecated in v3.0.0. This feature will be removed in v6.0.0. See https://github.com/optuna/optuna/releases/tag/v3.0.0. Use :func:`~optuna.trial.Trial.suggest_float` instead.
  "colsample_bytree": trial.suggest_loguniform(
/Users/kevinmaikjablonka/git/kjappelbaum/gptchem/src/gptchem/baselines/xgboost.py:42: FutureWarning: suggest_loguniform has been deprecated in v3.0.0. This feature will be removed in v6.0.0. See https://github.com/optuna/optuna/releases/tag/v3.0.0. Use :func:`~optuna.trial.Trial.suggest_float` instead.
  "subsample": trial.suggest_loguniform("subsample", 0.00001, 1),
/Users/kevinmaikjablonka/git/kjappelbaum/gptchem/src/gptchem/baselines/xgboost.py:43: FutureWarning: suggest_loguniform has been deprecated in v3.0.0. This feature will be removed in v6.0.0. See https://github.com/optuna/optuna/releases/tag/v3.0.0. Use :func:`~optuna.trial.Trial.suggest_float` instead.
  "alpha": trial.suggest_loguniform("alpha", 1e-8, 10.0),
/Users/kevinmaikjablonka/git/kjappelbaum/gptchem/src/gptchem/baselines/xgboost.py:44: FutureWarning: suggest_loguniform has been deprecated in v3.0.0. This feature will be removed in v6.0.0. See https://github.com/optuna/optuna/releases/tag/v3.0.0. Use :func:`~optuna.trial.Trial.suggest_float` instead.
  "lambda": trial.suggest_loguniform("lambda", 1e-8, 10.0),
[32m[I 2023-01-13 00:04:06,630][0m Trial 15 finished with value: 0.39999999999999997 and parameters: {'n_estimators': 2255, 'max_depth': 45, 'learning_rate': 0.0017853515945766413, 'colsample_bytree': 0.4673958085028408, 'subsample': 0.00458848312103558, 'alpha': 0.002032133033030406, 'lambda': 0.0007987355615578855}. Best is trial 0 with value: 0.39999999999999997.[0m
/Users/kevinmaikjablonka/git/kjappelbaum/gptchem/src/gptchem/baselines/xgboost.py:38: FutureWarning: suggest_loguniform has been deprecated in v3.0.0. This feature will be removed in v6.0.0. See https://github.com/optuna/optuna/releases/tag/v3.0.0. Use :func:`~optuna.trial.Trial.suggest_float` instead.
  "learning_rate": trial.suggest_loguniform("learning_rate", 0.001, 0.05),
/Users/kevinmaikjablonka/git/kjappelbaum/gptchem/src/gptchem/baselines/xgboost.py:39: FutureWarning: suggest_loguniform has been deprecated in v3.0.0. This feature will be removed in v6.0.0. See https://github.com/optuna/optuna/releases/tag/v3.0.0. Use :func:`~optuna.trial.Trial.suggest_float` instead.
  "colsample_bytree": trial.suggest_loguniform(
/Users/kevinmaikjablonka/git/kjappelbaum/gptchem/src/gptchem/baselines/xgboost.py:42: FutureWarning: suggest_loguniform has been deprecated in v3.0.0. This feature will be removed in v6.0.0. See https://github.com/optuna/optuna/releases/tag/v3.0.0. Use :func:`~optuna.trial.Trial.suggest_float` instead.
  "subsample": trial.suggest_loguniform("subsample", 0.00001, 1),
/Users/kevinmaikjablonka/git/kjappelbaum/gptchem/src/gptchem/baselines/xgboost.py:43: FutureWarning: suggest_loguniform has been deprecated in v3.0.0. This feature will be removed in v6.0.0. See https://github.com/optuna/optuna/releases/tag/v3.0.0. Use :func:`~optuna.trial.Trial.suggest_float` instead.
  "alpha": trial.suggest_loguniform("alpha", 1e-8, 10.0),
/Users/kevinmaikjablonka/git/kjappelbaum/gptchem/src/gptchem/baselines/xgboost.py:44: FutureWarning: suggest_loguniform has been deprecated in v3.0.0. This feature will be removed in v6.0.0. See https://github.com/optuna/optuna/releases/tag/v3.0.0. Use :func:`~optuna.trial.Trial.suggest_float` instead.
  "lambda": trial.suggest_loguniform("lambda", 1e-8, 10.0),
[32m[I 2023-01-13 00:04:09,221][0m Trial 16 finished with value: 0.2 and parameters: {'n_estimators': 5312, 'max_depth': 35, 'learning_rate': 0.008203044830484264, 'colsample_bytree': 0.3487446143843509, 'subsample': 0.11750190181423378, 'alpha': 0.06387254885741372, 'lambda': 2.5262670257456024e-06}. Best is trial 0 with value: 0.39999999999999997.[0m
/Users/kevinmaikjablonka/git/kjappelbaum/gptchem/src/gptchem/baselines/xgboost.py:38: FutureWarning: suggest_loguniform has been deprecated in v3.0.0. This feature will be removed in v6.0.0. See https://github.com/optuna/optuna/releases/tag/v3.0.0. Use :func:`~optuna.trial.Trial.suggest_float` instead.
  "learning_rate": trial.suggest_loguniform("learning_rate", 0.001, 0.05),
/Users/kevinmaikjablonka/git/kjappelbaum/gptchem/src/gptchem/baselines/xgboost.py:39: FutureWarning: suggest_loguniform has been deprecated in v3.0.0. This feature will be removed in v6.0.0. See https://github.com/optuna/optuna/releases/tag/v3.0.0. Use :func:`~optuna.trial.Trial.suggest_float` instead.
  "colsample_bytree": trial.suggest_loguniform(
/Users/kevinmaikjablonka/git/kjappelbaum/gptchem/src/gptchem/baselines/xgboost.py:42: FutureWarning: suggest_loguniform has been deprecated in v3.0.0. This feature will be removed in v6.0.0. See https://github.com/optuna/optuna/releases/tag/v3.0.0. Use :func:`~optuna.trial.Trial.suggest_float` instead.
  "subsample": trial.suggest_loguniform("subsample", 0.00001, 1),
/Users/kevinmaikjablonka/git/kjappelbaum/gptchem/src/gptchem/baselines/xgboost.py:43: FutureWarning: suggest_loguniform has been deprecated in v3.0.0. This feature will be removed in v6.0.0. See https://github.com/optuna/optuna/releases/tag/v3.0.0. Use :func:`~optuna.trial.Trial.suggest_float` instead.
  "alpha": trial.suggest_loguniform("alpha", 1e-8, 10.0),
/Users/kevinmaikjablonka/git/kjappelbaum/gptchem/src/gptchem/baselines/xgboost.py:44: FutureWarning: suggest_loguniform has been deprecated in v3.0.0. This feature will be removed in v6.0.0. See https://github.com/optuna/optuna/releases/tag/v3.0.0. Use :func:`~optuna.trial.Trial.suggest_float` instead.
  "lambda": trial.suggest_loguniform("lambda", 1e-8, 10.0),
[32m[I 2023-01-13 00:04:10,878][0m Trial 17 finished with value: 0.39999999999999997 and parameters: {'n_estimators': 3693, 'max_depth': 39, 'learning_rate': 0.0030938637446663564, 'colsample_bytree': 0.24203173218111412, 'subsample': 0.0002679524067044654, 'alpha': 6.2291396284682605e-06, 'lambda': 2.6178865206902646e-05}. Best is trial 0 with value: 0.39999999999999997.[0m
/Users/kevinmaikjablonka/git/kjappelbaum/gptchem/src/gptchem/baselines/xgboost.py:38: FutureWarning: suggest_loguniform has been deprecated in v3.0.0. This feature will be removed in v6.0.0. See https://github.com/optuna/optuna/releases/tag/v3.0.0. Use :func:`~optuna.trial.Trial.suggest_float` instead.
  "learning_rate": trial.suggest_loguniform("learning_rate", 0.001, 0.05),
/Users/kevinmaikjablonka/git/kjappelbaum/gptchem/src/gptchem/baselines/xgboost.py:39: FutureWarning: suggest_loguniform has been deprecated in v3.0.0. This feature will be removed in v6.0.0. See https://github.com/optuna/optuna/releases/tag/v3.0.0. Use :func:`~optuna.trial.Trial.suggest_float` instead.
  "colsample_bytree": trial.suggest_loguniform(
/Users/kevinmaikjablonka/git/kjappelbaum/gptchem/src/gptchem/baselines/xgboost.py:42: FutureWarning: suggest_loguniform has been deprecated in v3.0.0. This feature will be removed in v6.0.0. See https://github.com/optuna/optuna/releases/tag/v3.0.0. Use :func:`~optuna.trial.Trial.suggest_float` instead.
  "subsample": trial.suggest_loguniform("subsample", 0.00001, 1),
/Users/kevinmaikjablonka/git/kjappelbaum/gptchem/src/gptchem/baselines/xgboost.py:43: FutureWarning: suggest_loguniform has been deprecated in v3.0.0. This feature will be removed in v6.0.0. See https://github.com/optuna/optuna/releases/tag/v3.0.0. Use :func:`~optuna.trial.Trial.suggest_float` instead.
  "alpha": trial.suggest_loguniform("alpha", 1e-8, 10.0),
/Users/kevinmaikjablonka/git/kjappelbaum/gptchem/src/gptchem/baselines/xgboost.py:44: FutureWarning: suggest_loguniform has been deprecated in v3.0.0. This feature will be removed in v6.0.0. See https://github.com/optuna/optuna/releases/tag/v3.0.0. Use :func:`~optuna.trial.Trial.suggest_float` instead.
  "lambda": trial.suggest_loguniform("lambda", 1e-8, 10.0),
[32m[I 2023-01-13 00:04:11,941][0m Trial 18 finished with value: 0.39999999999999997 and parameters: {'n_estimators': 1930, 'max_depth': 45, 'learning_rate': 0.001078055244238528, 'colsample_bytree': 0.5011649054242593, 'subsample': 1.234046637721076e-05, 'alpha': 0.00037455434906706397, 'lambda': 0.00042136476032207215}. Best is trial 0 with value: 0.39999999999999997.[0m
/Users/kevinmaikjablonka/git/kjappelbaum/gptchem/src/gptchem/baselines/xgboost.py:38: FutureWarning: suggest_loguniform has been deprecated in v3.0.0. This feature will be removed in v6.0.0. See https://github.com/optuna/optuna/releases/tag/v3.0.0. Use :func:`~optuna.trial.Trial.suggest_float` instead.
  "learning_rate": trial.suggest_loguniform("learning_rate", 0.001, 0.05),
/Users/kevinmaikjablonka/git/kjappelbaum/gptchem/src/gptchem/baselines/xgboost.py:39: FutureWarning: suggest_loguniform has been deprecated in v3.0.0. This feature will be removed in v6.0.0. See https://github.com/optuna/optuna/releases/tag/v3.0.0. Use :func:`~optuna.trial.Trial.suggest_float` instead.
  "colsample_bytree": trial.suggest_loguniform(
/Users/kevinmaikjablonka/git/kjappelbaum/gptchem/src/gptchem/baselines/xgboost.py:42: FutureWarning: suggest_loguniform has been deprecated in v3.0.0. This feature will be removed in v6.0.0. See https://github.com/optuna/optuna/releases/tag/v3.0.0. Use :func:`~optuna.trial.Trial.suggest_float` instead.
  "subsample": trial.suggest_loguniform("subsample", 0.00001, 1),
/Users/kevinmaikjablonka/git/kjappelbaum/gptchem/src/gptchem/baselines/xgboost.py:43: FutureWarning: suggest_loguniform has been deprecated in v3.0.0. This feature will be removed in v6.0.0. See https://github.com/optuna/optuna/releases/tag/v3.0.0. Use :func:`~optuna.trial.Trial.suggest_float` instead.
  "alpha": trial.suggest_loguniform("alpha", 1e-8, 10.0),
/Users/kevinmaikjablonka/git/kjappelbaum/gptchem/src/gptchem/baselines/xgboost.py:44: FutureWarning: suggest_loguniform has been deprecated in v3.0.0. This feature will be removed in v6.0.0. See https://github.com/optuna/optuna/releases/tag/v3.0.0. Use :func:`~optuna.trial.Trial.suggest_float` instead.
  "lambda": trial.suggest_loguniform("lambda", 1e-8, 10.0),
