[32m[I 2023-01-13 01:59:35,775][0m Trial 72 finished with value: 0.5822144522144523 and parameters: {'n_estimators': 1649, 'max_depth': 120, 'min_samples_split': 5, 'min_samples_leaf': 1, 'criterion': 'entropy'}. Best is trial 59 with value: 0.5962803862803863.[0m
[32m[I 2023-01-13 01:59:39,269][0m Trial 73 finished with value: 0.2732600732600733 and parameters: {'n_estimators': 1635, 'max_depth': 121, 'min_samples_split': 10, 'min_samples_leaf': 16, 'criterion': 'entropy'}. Best is trial 59 with value: 0.5962803862803863.[0m
[32m[I 2023-01-13 01:59:42,476][0m Trial 74 finished with value: 0.2732600732600733 and parameters: {'n_estimators': 1465, 'max_depth': 117, 'min_samples_split': 78, 'min_samples_leaf': 6, 'criterion': 'entropy'}. Best is trial 59 with value: 0.5962803862803863.[0m
[32m[I 2023-01-13 01:59:45,779][0m Trial 75 finished with value: 0.3232600732600733 and parameters: {'n_estimators': 1554, 'max_depth': 128, 'min_samples_split': 19, 'min_samples_leaf': 9, 'criterion': 'entropy'}. Best is trial 59 with value: 0.5962803862803863.[0m
[32m[I 2023-01-13 01:59:50,929][0m Trial 76 finished with value: 0.2732600732600733 and parameters: {'n_estimators': 2433, 'max_depth': 120, 'min_samples_split': 14, 'min_samples_leaf': 57, 'criterion': 'entropy'}. Best is trial 59 with value: 0.5962803862803863.[0m
[32m[I 2023-01-13 01:59:53,451][0m Trial 77 finished with value: 0.2732600732600733 and parameters: {'n_estimators': 1195, 'max_depth': 125, 'min_samples_split': 117, 'min_samples_leaf': 4, 'criterion': 'entropy'}. Best is trial 59 with value: 0.5962803862803863.[0m
[32m[I 2023-01-13 01:59:57,135][0m Trial 78 finished with value: 0.2732600732600733 and parameters: {'n_estimators': 1749, 'max_depth': 112, 'min_samples_split': 25, 'min_samples_leaf': 97, 'criterion': 'entropy'}. Best is trial 59 with value: 0.5962803862803863.[0m
[32m[I 2023-01-13 02:00:01,997][0m Trial 79 finished with value: 0.2732600732600733 and parameters: {'n_estimators': 2252, 'max_depth': 119, 'min_samples_split': 92, 'min_samples_leaf': 13, 'criterion': 'entropy'}. Best is trial 59 with value: 0.5962803862803863.[0m
[32m[I 2023-01-13 02:00:06,576][0m Trial 80 finished with value: 0.3232600732600733 and parameters: {'n_estimators': 2140, 'max_depth': 23, 'min_samples_split': 5, 'min_samples_leaf': 9, 'criterion': 'entropy'}. Best is trial 59 with value: 0.5962803862803863.[0m
[32m[I 2023-01-13 02:00:10,698][0m Trial 81 finished with value: 0.5402197802197802 and parameters: {'n_estimators': 1818, 'max_depth': 106, 'min_samples_split': 2, 'min_samples_leaf': 1, 'criterion': 'entropy'}. Best is trial 59 with value: 0.5962803862803863.[0m
[32m[I 2023-01-13 02:00:14,799][0m Trial 82 finished with value: 0.5612043512043512 and parameters: {'n_estimators': 1787, 'max_depth': 106, 'min_samples_split': 9, 'min_samples_leaf': 1, 'criterion': 'entropy'}. Best is trial 59 with value: 0.5962803862803863.[0m
[32m[I 2023-01-13 02:00:17,419][0m Trial 83 finished with value: 0.4762043512043512 and parameters: {'n_estimators': 1227, 'max_depth': 115, 'min_samples_split': 15, 'min_samples_leaf': 5, 'criterion': 'entropy'}. Best is trial 59 with value: 0.5962803862803863.[0m
[32m[I 2023-01-13 02:00:22,905][0m Trial 84 finished with value: 0.3562271062271062 and parameters: {'n_estimators': 2584, 'max_depth': 122, 'min_samples_split': 9, 'min_samples_leaf': 8, 'criterion': 'entropy'}. Best is trial 59 with value: 0.5962803862803863.[0m
[32m[I 2023-01-13 02:00:26,361][0m Trial 85 finished with value: 0.4886363636363636 and parameters: {'n_estimators': 1585, 'max_depth': 96, 'min_samples_split': 5, 'min_samples_leaf': 4, 'criterion': 'entropy'}. Best is trial 59 with value: 0.5962803862803863.[0m
[32m[I 2023-01-13 02:00:30,662][0m Trial 86 finished with value: 0.3232600732600733 and parameters: {'n_estimators': 2014, 'max_depth': 103, 'min_samples_split': 18, 'min_samples_leaf': 12, 'criterion': 'entropy'}. Best is trial 59 with value: 0.5962803862803863.[0m
[32m[I 2023-01-13 02:00:32,419][0m Trial 87 finished with value: 0.2732600732600733 and parameters: {'n_estimators': 831, 'max_depth': 110, 'min_samples_split': 10, 'min_samples_leaf': 128, 'criterion': 'entropy'}. Best is trial 59 with value: 0.5962803862803863.[0m
[32m[I 2023-01-13 02:00:35,741][0m Trial 88 finished with value: 0.2732600732600733 and parameters: {'n_estimators': 1491, 'max_depth': 118, 'min_samples_split': 23, 'min_samples_leaf': 17, 'criterion': 'entropy'}. Best is trial 59 with value: 0.5962803862803863.[0m
[32m[I 2023-01-13 02:00:40,922][0m Trial 89 finished with value: 0.3562271062271062 and parameters: {'n_estimators': 2421, 'max_depth': 107, 'min_samples_split': 14, 'min_samples_leaf': 8, 'criterion': 'entropy'}. Best is trial 59 with value: 0.5962803862803863.[0m
[32m[I 2023-01-13 02:00:47,189][0m Trial 90 finished with value: 0.2732600732600733 and parameters: {'n_estimators': 2959, 'max_depth': 125, 'min_samples_split': 28, 'min_samples_leaf': 72, 'criterion': 'entropy'}. Best is trial 59 with value: 0.5962803862803863.[0m
[32m[I 2023-01-13 02:00:51,805][0m Trial 91 finished with value: 0.5822144522144523 and parameters: {'n_estimators': 1916, 'max_depth': 109, 'min_samples_split': 4, 'min_samples_leaf': 1, 'criterion': 'entropy'}. Best is trial 59 with value: 0.5962803862803863.[0m
[32m[I 2023-01-13 02:00:55,736][0m Trial 92 finished with value: 0.5612043512043512 and parameters: {'n_estimators': 1758, 'max_depth': 113, 'min_samples_split': 5, 'min_samples_leaf': 1, 'criterion': 'entropy'}. Best is trial 59 with value: 0.5962803862803863.[0m
[32m[I 2023-01-13 02:00:59,953][0m Trial 93 finished with value: 0.45979020979020974 and parameters: {'n_estimators': 1963, 'max_depth': 115, 'min_samples_split': 9, 'min_samples_leaf': 4, 'criterion': 'entropy'}. Best is trial 59 with value: 0.5962803862803863.[0m
[32m[I 2023-01-13 02:01:03,585][0m Trial 94 finished with value: 0.34523809523809523 and parameters: {'n_estimators': 1718, 'max_depth': 121, 'min_samples_split': 5, 'min_samples_leaf': 7, 'criterion': 'entropy'}. Best is trial 59 with value: 0.5962803862803863.[0m
[32m[I 2023-01-13 02:01:07,321][0m Trial 95 finished with value: 0.3232600732600733 and parameters: {'n_estimators': 1764, 'max_depth': 117, 'min_samples_split': 13, 'min_samples_leaf': 10, 'criterion': 'entropy'}. Best is trial 59 with value: 0.5962803862803863.[0m
[32m[I 2023-01-13 02:01:12,027][0m Trial 96 finished with value: 0.505050505050505 and parameters: {'n_estimators': 2133, 'max_depth': 105, 'min_samples_split': 18, 'min_samples_leaf': 3, 'criterion': 'entropy'}. Best is trial 59 with value: 0.5962803862803863.[0m
[32m[I 2023-01-13 02:01:15,029][0m Trial 97 finished with value: 0.2732600732600733 and parameters: {'n_estimators': 1420, 'max_depth': 74, 'min_samples_split': 57, 'min_samples_leaf': 6, 'criterion': 'entropy'}. Best is trial 59 with value: 0.5962803862803863.[0m
[32m[I 2023-01-13 02:01:17,781][0m Trial 98 finished with value: 0.29670329670329676 and parameters: {'n_estimators': 1310, 'max_depth': 100, 'min_samples_split': 7, 'min_samples_leaf': 14, 'criterion': 'entropy'}. Best is trial 59 with value: 0.5962803862803863.[0m
[32m[I 2023-01-13 02:01:21,421][0m Trial 99 finished with value: 0.5822144522144523 and parameters: {'n_estimators': 1639, 'max_depth': 128, 'min_samples_split': 11, 'min_samples_leaf': 1, 'criterion': 'entropy'}. Best is trial 59 with value: 0.5962803862803863.[0m
Uploaded file from /Users/kevinmaikjablonka/git/kjappelbaum/gptchem/experiments/03_classification/opv/out/20230113_012230/train.jsonl: file-gZqIYHO596bDIGEEYW0rqKq7
Ran train size 10 and got accuracy 0.564, XGB baseline 0.5, and TabPFN baseline 0.548
Computing morgan fingerprints...
Loading model that can be used for inference only
Using a Transformer with 25.82 M parameters
╒═════════════════════════╤═══════════╤══════════════════╤═════════╤═════════════╤═════════╤═════════╤═════════╕
│ name                    │ class     │ transform        │ prior   │ trainable   │ shape   │ dtype   │   value │
╞═════════════════════════╪═══════════╪══════════════════╪═════════╪═════════════╪═════════╪═════════╪═════════╡
│ GPR.mean_function.c     │ Parameter │ Identity         │         │ True        │ ()      │ float64 │       0 │
├─────────────────────────┼───────────┼──────────────────┼─────────┼─────────────┼─────────┼─────────┼─────────┤
│ GPR.kernel.variance     │ Parameter │ Softplus         │         │ True        │ ()      │ float64 │       0 │
├─────────────────────────┼───────────┼──────────────────┼─────────┼─────────────┼─────────┼─────────┼─────────┤
│ GPR.likelihood.variance │ Parameter │ Softplus + Shift │         │ True        │ ()      │ float64 │       1 │
╘═════════════════════════╧═══════════╧══════════════════╧═════════╧═════════════╧═════════╧═════════╧═════════╛
Upload progress:   0%|          | 0.00/17.9k [00:00<?, ?it/s]Upload progress: 100%|██████████| 17.9k/17.9k [00:00<00:00, 6.57Mit/s]
[32m[I 2023-01-13 02:11:35,408][0m A new study created in memory with name: no-name-2f7aef69-b4b5-4f93-8554-a3d1ddfa5753[0m
/Users/kevinmaikjablonka/git/kjappelbaum/gptchem/src/gptchem/baselines/xgboost.py:38: FutureWarning: suggest_loguniform has been deprecated in v3.0.0. This feature will be removed in v6.0.0. See https://github.com/optuna/optuna/releases/tag/v3.0.0. Use :func:`~optuna.trial.Trial.suggest_float` instead.
  "learning_rate": trial.suggest_loguniform("learning_rate", 0.001, 0.05),
/Users/kevinmaikjablonka/git/kjappelbaum/gptchem/src/gptchem/baselines/xgboost.py:39: FutureWarning: suggest_loguniform has been deprecated in v3.0.0. This feature will be removed in v6.0.0. See https://github.com/optuna/optuna/releases/tag/v3.0.0. Use :func:`~optuna.trial.Trial.suggest_float` instead.
  "colsample_bytree": trial.suggest_loguniform(
/Users/kevinmaikjablonka/git/kjappelbaum/gptchem/src/gptchem/baselines/xgboost.py:42: FutureWarning: suggest_loguniform has been deprecated in v3.0.0. This feature will be removed in v6.0.0. See https://github.com/optuna/optuna/releases/tag/v3.0.0. Use :func:`~optuna.trial.Trial.suggest_float` instead.
  "subsample": trial.suggest_loguniform("subsample", 0.00001, 1),
/Users/kevinmaikjablonka/git/kjappelbaum/gptchem/src/gptchem/baselines/xgboost.py:43: FutureWarning: suggest_loguniform has been deprecated in v3.0.0. This feature will be removed in v6.0.0. See https://github.com/optuna/optuna/releases/tag/v3.0.0. Use :func:`~optuna.trial.Trial.suggest_float` instead.
  "alpha": trial.suggest_loguniform("alpha", 1e-8, 10.0),
/Users/kevinmaikjablonka/git/kjappelbaum/gptchem/src/gptchem/baselines/xgboost.py:44: FutureWarning: suggest_loguniform has been deprecated in v3.0.0. This feature will be removed in v6.0.0. See https://github.com/optuna/optuna/releases/tag/v3.0.0. Use :func:`~optuna.trial.Trial.suggest_float` instead.
  "lambda": trial.suggest_loguniform("lambda", 1e-8, 10.0),
[32m[I 2023-01-13 02:11:39,896][0m Trial 0 finished with value: 0.32731631113984055 and parameters: {'n_estimators': 5490, 'max_depth': 37, 'learning_rate': 0.010570046446158271, 'colsample_bytree': 0.48071425018349023, 'subsample': 0.0013130280280658588, 'alpha': 0.006502000785097662, 'lambda': 8.675307976899775e-05}. Best is trial 0 with value: 0.32731631113984055.[0m
/Users/kevinmaikjablonka/git/kjappelbaum/gptchem/src/gptchem/baselines/xgboost.py:38: FutureWarning: suggest_loguniform has been deprecated in v3.0.0. This feature will be removed in v6.0.0. See https://github.com/optuna/optuna/releases/tag/v3.0.0. Use :func:`~optuna.trial.Trial.suggest_float` instead.
  "learning_rate": trial.suggest_loguniform("learning_rate", 0.001, 0.05),
/Users/kevinmaikjablonka/git/kjappelbaum/gptchem/src/gptchem/baselines/xgboost.py:39: FutureWarning: suggest_loguniform has been deprecated in v3.0.0. This feature will be removed in v6.0.0. See https://github.com/optuna/optuna/releases/tag/v3.0.0. Use :func:`~optuna.trial.Trial.suggest_float` instead.
  "colsample_bytree": trial.suggest_loguniform(
/Users/kevinmaikjablonka/git/kjappelbaum/gptchem/src/gptchem/baselines/xgboost.py:42: FutureWarning: suggest_loguniform has been deprecated in v3.0.0. This feature will be removed in v6.0.0. See https://github.com/optuna/optuna/releases/tag/v3.0.0. Use :func:`~optuna.trial.Trial.suggest_float` instead.
  "subsample": trial.suggest_loguniform("subsample", 0.00001, 1),
/Users/kevinmaikjablonka/git/kjappelbaum/gptchem/src/gptchem/baselines/xgboost.py:43: FutureWarning: suggest_loguniform has been deprecated in v3.0.0. This feature will be removed in v6.0.0. See https://github.com/optuna/optuna/releases/tag/v3.0.0. Use :func:`~optuna.trial.Trial.suggest_float` instead.
  "alpha": trial.suggest_loguniform("alpha", 1e-8, 10.0),
/Users/kevinmaikjablonka/git/kjappelbaum/gptchem/src/gptchem/baselines/xgboost.py:44: FutureWarning: suggest_loguniform has been deprecated in v3.0.0. This feature will be removed in v6.0.0. See https://github.com/optuna/optuna/releases/tag/v3.0.0. Use :func:`~optuna.trial.Trial.suggest_float` instead.
  "lambda": trial.suggest_loguniform("lambda", 1e-8, 10.0),
[32m[I 2023-01-13 02:11:47,935][0m Trial 1 finished with value: 0.363515406162465 and parameters: {'n_estimators': 8919, 'max_depth': 49, 'learning_rate': 0.00448183267887628, 'colsample_bytree': 0.7151910137131439, 'subsample': 0.004410365667970984, 'alpha': 0.001295391520396607, 'lambda': 2.13978305808933}. Best is trial 1 with value: 0.363515406162465.[0m
/Users/kevinmaikjablonka/git/kjappelbaum/gptchem/src/gptchem/baselines/xgboost.py:38: FutureWarning: suggest_loguniform has been deprecated in v3.0.0. This feature will be removed in v6.0.0. See https://github.com/optuna/optuna/releases/tag/v3.0.0. Use :func:`~optuna.trial.Trial.suggest_float` instead.
  "learning_rate": trial.suggest_loguniform("learning_rate", 0.001, 0.05),
/Users/kevinmaikjablonka/git/kjappelbaum/gptchem/src/gptchem/baselines/xgboost.py:39: FutureWarning: suggest_loguniform has been deprecated in v3.0.0. This feature will be removed in v6.0.0. See https://github.com/optuna/optuna/releases/tag/v3.0.0. Use :func:`~optuna.trial.Trial.suggest_float` instead.
  "colsample_bytree": trial.suggest_loguniform(
/Users/kevinmaikjablonka/git/kjappelbaum/gptchem/src/gptchem/baselines/xgboost.py:42: FutureWarning: suggest_loguniform has been deprecated in v3.0.0. This feature will be removed in v6.0.0. See https://github.com/optuna/optuna/releases/tag/v3.0.0. Use :func:`~optuna.trial.Trial.suggest_float` instead.
  "subsample": trial.suggest_loguniform("subsample", 0.00001, 1),
/Users/kevinmaikjablonka/git/kjappelbaum/gptchem/src/gptchem/baselines/xgboost.py:43: FutureWarning: suggest_loguniform has been deprecated in v3.0.0. This feature will be removed in v6.0.0. See https://github.com/optuna/optuna/releases/tag/v3.0.0. Use :func:`~optuna.trial.Trial.suggest_float` instead.
  "alpha": trial.suggest_loguniform("alpha", 1e-8, 10.0),
/Users/kevinmaikjablonka/git/kjappelbaum/gptchem/src/gptchem/baselines/xgboost.py:44: FutureWarning: suggest_loguniform has been deprecated in v3.0.0. This feature will be removed in v6.0.0. See https://github.com/optuna/optuna/releases/tag/v3.0.0. Use :func:`~optuna.trial.Trial.suggest_float` instead.
  "lambda": trial.suggest_loguniform("lambda", 1e-8, 10.0),
[32m[I 2023-01-13 02:11:48,683][0m Trial 2 finished with value: 0.2732600732600733 and parameters: {'n_estimators': 714, 'max_depth': 8, 'learning_rate': 0.0010823069587789706, 'colsample_bytree': 0.7638468512687414, 'subsample': 0.07776492451078383, 'alpha': 0.6762532016190338, 'lambda': 6.42044426233932}. Best is trial 1 with value: 0.363515406162465.[0m
/Users/kevinmaikjablonka/git/kjappelbaum/gptchem/src/gptchem/baselines/xgboost.py:38: FutureWarning: suggest_loguniform has been deprecated in v3.0.0. This feature will be removed in v6.0.0. See https://github.com/optuna/optuna/releases/tag/v3.0.0. Use :func:`~optuna.trial.Trial.suggest_float` instead.
  "learning_rate": trial.suggest_loguniform("learning_rate", 0.001, 0.05),
/Users/kevinmaikjablonka/git/kjappelbaum/gptchem/src/gptchem/baselines/xgboost.py:39: FutureWarning: suggest_loguniform has been deprecated in v3.0.0. This feature will be removed in v6.0.0. See https://github.com/optuna/optuna/releases/tag/v3.0.0. Use :func:`~optuna.trial.Trial.suggest_float` instead.
  "colsample_bytree": trial.suggest_loguniform(
/Users/kevinmaikjablonka/git/kjappelbaum/gptchem/src/gptchem/baselines/xgboost.py:42: FutureWarning: suggest_loguniform has been deprecated in v3.0.0. This feature will be removed in v6.0.0. See https://github.com/optuna/optuna/releases/tag/v3.0.0. Use :func:`~optuna.trial.Trial.suggest_float` instead.
  "subsample": trial.suggest_loguniform("subsample", 0.00001, 1),
/Users/kevinmaikjablonka/git/kjappelbaum/gptchem/src/gptchem/baselines/xgboost.py:43: FutureWarning: suggest_loguniform has been deprecated in v3.0.0. This feature will be removed in v6.0.0. See https://github.com/optuna/optuna/releases/tag/v3.0.0. Use :func:`~optuna.trial.Trial.suggest_float` instead.
  "alpha": trial.suggest_loguniform("alpha", 1e-8, 10.0),
/Users/kevinmaikjablonka/git/kjappelbaum/gptchem/src/gptchem/baselines/xgboost.py:44: FutureWarning: suggest_loguniform has been deprecated in v3.0.0. This feature will be removed in v6.0.0. See https://github.com/optuna/optuna/releases/tag/v3.0.0. Use :func:`~optuna.trial.Trial.suggest_float` instead.
  "lambda": trial.suggest_loguniform("lambda", 1e-8, 10.0),
[32m[I 2023-01-13 02:11:54,582][0m Trial 3 finished with value: 0.3456582633053221 and parameters: {'n_estimators': 7993, 'max_depth': 25, 'learning_rate': 0.021188277784090766, 'colsample_bytree': 0.24193587497780455, 'subsample': 0.015834527427829734, 'alpha': 1.9506510537765813e-07, 'lambda': 3.177022228527139}. Best is trial 1 with value: 0.363515406162465.[0m
/Users/kevinmaikjablonka/git/kjappelbaum/gptchem/src/gptchem/baselines/xgboost.py:38: FutureWarning: suggest_loguniform has been deprecated in v3.0.0. This feature will be removed in v6.0.0. See https://github.com/optuna/optuna/releases/tag/v3.0.0. Use :func:`~optuna.trial.Trial.suggest_float` instead.
  "learning_rate": trial.suggest_loguniform("learning_rate", 0.001, 0.05),
/Users/kevinmaikjablonka/git/kjappelbaum/gptchem/src/gptchem/baselines/xgboost.py:39: FutureWarning: suggest_loguniform has been deprecated in v3.0.0. This feature will be removed in v6.0.0. See https://github.com/optuna/optuna/releases/tag/v3.0.0. Use :func:`~optuna.trial.Trial.suggest_float` instead.
  "colsample_bytree": trial.suggest_loguniform(
/Users/kevinmaikjablonka/git/kjappelbaum/gptchem/src/gptchem/baselines/xgboost.py:42: FutureWarning: suggest_loguniform has been deprecated in v3.0.0. This feature will be removed in v6.0.0. See https://github.com/optuna/optuna/releases/tag/v3.0.0. Use :func:`~optuna.trial.Trial.suggest_float` instead.
  "subsample": trial.suggest_loguniform("subsample", 0.00001, 1),
/Users/kevinmaikjablonka/git/kjappelbaum/gptchem/src/gptchem/baselines/xgboost.py:43: FutureWarning: suggest_loguniform has been deprecated in v3.0.0. This feature will be removed in v6.0.0. See https://github.com/optuna/optuna/releases/tag/v3.0.0. Use :func:`~optuna.trial.Trial.suggest_float` instead.
  "alpha": trial.suggest_loguniform("alpha", 1e-8, 10.0),
/Users/kevinmaikjablonka/git/kjappelbaum/gptchem/src/gptchem/baselines/xgboost.py:44: FutureWarning: suggest_loguniform has been deprecated in v3.0.0. This feature will be removed in v6.0.0. See https://github.com/optuna/optuna/releases/tag/v3.0.0. Use :func:`~optuna.trial.Trial.suggest_float` instead.
  "lambda": trial.suggest_loguniform("lambda", 1e-8, 10.0),
[32m[I 2023-01-13 02:11:59,282][0m Trial 4 finished with value: 0.32731631113984055 and parameters: {'n_estimators': 5220, 'max_depth': 23, 'learning_rate': 0.0028149588426834913, 'colsample_bytree': 0.6953382511058659, 'subsample': 0.0019087614756145956, 'alpha': 0.001305886823451577, 'lambda': 1.4760742495197955e-08}. Best is trial 1 with value: 0.363515406162465.[0m
/Users/kevinmaikjablonka/git/kjappelbaum/gptchem/src/gptchem/baselines/xgboost.py:38: FutureWarning: suggest_loguniform has been deprecated in v3.0.0. This feature will be removed in v6.0.0. See https://github.com/optuna/optuna/releases/tag/v3.0.0. Use :func:`~optuna.trial.Trial.suggest_float` instead.
  "learning_rate": trial.suggest_loguniform("learning_rate", 0.001, 0.05),
/Users/kevinmaikjablonka/git/kjappelbaum/gptchem/src/gptchem/baselines/xgboost.py:39: FutureWarning: suggest_loguniform has been deprecated in v3.0.0. This feature will be removed in v6.0.0. See https://github.com/optuna/optuna/releases/tag/v3.0.0. Use :func:`~optuna.trial.Trial.suggest_float` instead.
  "colsample_bytree": trial.suggest_loguniform(
/Users/kevinmaikjablonka/git/kjappelbaum/gptchem/src/gptchem/baselines/xgboost.py:42: FutureWarning: suggest_loguniform has been deprecated in v3.0.0. This feature will be removed in v6.0.0. See https://github.com/optuna/optuna/releases/tag/v3.0.0. Use :func:`~optuna.trial.Trial.suggest_float` instead.
  "subsample": trial.suggest_loguniform("subsample", 0.00001, 1),
/Users/kevinmaikjablonka/git/kjappelbaum/gptchem/src/gptchem/baselines/xgboost.py:43: FutureWarning: suggest_loguniform has been deprecated in v3.0.0. This feature will be removed in v6.0.0. See https://github.com/optuna/optuna/releases/tag/v3.0.0. Use :func:`~optuna.trial.Trial.suggest_float` instead.
  "alpha": trial.suggest_loguniform("alpha", 1e-8, 10.0),
/Users/kevinmaikjablonka/git/kjappelbaum/gptchem/src/gptchem/baselines/xgboost.py:44: FutureWarning: suggest_loguniform has been deprecated in v3.0.0. This feature will be removed in v6.0.0. See https://github.com/optuna/optuna/releases/tag/v3.0.0. Use :func:`~optuna.trial.Trial.suggest_float` instead.
  "lambda": trial.suggest_loguniform("lambda", 1e-8, 10.0),
