[32m[I 2023-01-13 00:05:38,025][0m Trial 57 finished with value: 0.39999999999999997 and parameters: {'n_estimators': 7526, 'max_depth': 7, 'learning_rate': 0.007507944032257347, 'colsample_bytree': 0.3855981600151348, 'subsample': 0.004443813158866512, 'alpha': 1.5093504556477464, 'lambda': 3.8244937494228757}. Best is trial 0 with value: 0.39999999999999997.[0m
/Users/kevinmaikjablonka/git/kjappelbaum/gptchem/src/gptchem/baselines/xgboost.py:38: FutureWarning: suggest_loguniform has been deprecated in v3.0.0. This feature will be removed in v6.0.0. See https://github.com/optuna/optuna/releases/tag/v3.0.0. Use :func:`~optuna.trial.Trial.suggest_float` instead.
  "learning_rate": trial.suggest_loguniform("learning_rate", 0.001, 0.05),
/Users/kevinmaikjablonka/git/kjappelbaum/gptchem/src/gptchem/baselines/xgboost.py:39: FutureWarning: suggest_loguniform has been deprecated in v3.0.0. This feature will be removed in v6.0.0. See https://github.com/optuna/optuna/releases/tag/v3.0.0. Use :func:`~optuna.trial.Trial.suggest_float` instead.
  "colsample_bytree": trial.suggest_loguniform(
/Users/kevinmaikjablonka/git/kjappelbaum/gptchem/src/gptchem/baselines/xgboost.py:42: FutureWarning: suggest_loguniform has been deprecated in v3.0.0. This feature will be removed in v6.0.0. See https://github.com/optuna/optuna/releases/tag/v3.0.0. Use :func:`~optuna.trial.Trial.suggest_float` instead.
  "subsample": trial.suggest_loguniform("subsample", 0.00001, 1),
/Users/kevinmaikjablonka/git/kjappelbaum/gptchem/src/gptchem/baselines/xgboost.py:43: FutureWarning: suggest_loguniform has been deprecated in v3.0.0. This feature will be removed in v6.0.0. See https://github.com/optuna/optuna/releases/tag/v3.0.0. Use :func:`~optuna.trial.Trial.suggest_float` instead.
  "alpha": trial.suggest_loguniform("alpha", 1e-8, 10.0),
/Users/kevinmaikjablonka/git/kjappelbaum/gptchem/src/gptchem/baselines/xgboost.py:44: FutureWarning: suggest_loguniform has been deprecated in v3.0.0. This feature will be removed in v6.0.0. See https://github.com/optuna/optuna/releases/tag/v3.0.0. Use :func:`~optuna.trial.Trial.suggest_float` instead.
  "lambda": trial.suggest_loguniform("lambda", 1e-8, 10.0),
[32m[I 2023-01-13 00:05:41,657][0m Trial 58 finished with value: 0.39999999999999997 and parameters: {'n_estimators': 8002, 'max_depth': 9, 'learning_rate': 0.024785624285681356, 'colsample_bytree': 0.317634170188012, 'subsample': 0.0038334656087182814, 'alpha': 3.363397603873521, 'lambda': 6.815504440373061}. Best is trial 0 with value: 0.39999999999999997.[0m
/Users/kevinmaikjablonka/git/kjappelbaum/gptchem/src/gptchem/baselines/xgboost.py:38: FutureWarning: suggest_loguniform has been deprecated in v3.0.0. This feature will be removed in v6.0.0. See https://github.com/optuna/optuna/releases/tag/v3.0.0. Use :func:`~optuna.trial.Trial.suggest_float` instead.
  "learning_rate": trial.suggest_loguniform("learning_rate", 0.001, 0.05),
/Users/kevinmaikjablonka/git/kjappelbaum/gptchem/src/gptchem/baselines/xgboost.py:39: FutureWarning: suggest_loguniform has been deprecated in v3.0.0. This feature will be removed in v6.0.0. See https://github.com/optuna/optuna/releases/tag/v3.0.0. Use :func:`~optuna.trial.Trial.suggest_float` instead.
  "colsample_bytree": trial.suggest_loguniform(
/Users/kevinmaikjablonka/git/kjappelbaum/gptchem/src/gptchem/baselines/xgboost.py:42: FutureWarning: suggest_loguniform has been deprecated in v3.0.0. This feature will be removed in v6.0.0. See https://github.com/optuna/optuna/releases/tag/v3.0.0. Use :func:`~optuna.trial.Trial.suggest_float` instead.
  "subsample": trial.suggest_loguniform("subsample", 0.00001, 1),
/Users/kevinmaikjablonka/git/kjappelbaum/gptchem/src/gptchem/baselines/xgboost.py:43: FutureWarning: suggest_loguniform has been deprecated in v3.0.0. This feature will be removed in v6.0.0. See https://github.com/optuna/optuna/releases/tag/v3.0.0. Use :func:`~optuna.trial.Trial.suggest_float` instead.
  "alpha": trial.suggest_loguniform("alpha", 1e-8, 10.0),
/Users/kevinmaikjablonka/git/kjappelbaum/gptchem/src/gptchem/baselines/xgboost.py:44: FutureWarning: suggest_loguniform has been deprecated in v3.0.0. This feature will be removed in v6.0.0. See https://github.com/optuna/optuna/releases/tag/v3.0.0. Use :func:`~optuna.trial.Trial.suggest_float` instead.
  "lambda": trial.suggest_loguniform("lambda", 1e-8, 10.0),
[32m[I 2023-01-13 00:05:45,966][0m Trial 59 finished with value: 0.39999999999999997 and parameters: {'n_estimators': 9045, 'max_depth': 11, 'learning_rate': 0.04970333661550039, 'colsample_bytree': 0.43562727309214827, 'subsample': 0.0055623027662589026, 'alpha': 1.4308508088393468, 'lambda': 1.6562595909015754}. Best is trial 0 with value: 0.39999999999999997.[0m
/Users/kevinmaikjablonka/git/kjappelbaum/gptchem/src/gptchem/baselines/xgboost.py:38: FutureWarning: suggest_loguniform has been deprecated in v3.0.0. This feature will be removed in v6.0.0. See https://github.com/optuna/optuna/releases/tag/v3.0.0. Use :func:`~optuna.trial.Trial.suggest_float` instead.
  "learning_rate": trial.suggest_loguniform("learning_rate", 0.001, 0.05),
/Users/kevinmaikjablonka/git/kjappelbaum/gptchem/src/gptchem/baselines/xgboost.py:39: FutureWarning: suggest_loguniform has been deprecated in v3.0.0. This feature will be removed in v6.0.0. See https://github.com/optuna/optuna/releases/tag/v3.0.0. Use :func:`~optuna.trial.Trial.suggest_float` instead.
  "colsample_bytree": trial.suggest_loguniform(
/Users/kevinmaikjablonka/git/kjappelbaum/gptchem/src/gptchem/baselines/xgboost.py:42: FutureWarning: suggest_loguniform has been deprecated in v3.0.0. This feature will be removed in v6.0.0. See https://github.com/optuna/optuna/releases/tag/v3.0.0. Use :func:`~optuna.trial.Trial.suggest_float` instead.
  "subsample": trial.suggest_loguniform("subsample", 0.00001, 1),
/Users/kevinmaikjablonka/git/kjappelbaum/gptchem/src/gptchem/baselines/xgboost.py:43: FutureWarning: suggest_loguniform has been deprecated in v3.0.0. This feature will be removed in v6.0.0. See https://github.com/optuna/optuna/releases/tag/v3.0.0. Use :func:`~optuna.trial.Trial.suggest_float` instead.
  "alpha": trial.suggest_loguniform("alpha", 1e-8, 10.0),
/Users/kevinmaikjablonka/git/kjappelbaum/gptchem/src/gptchem/baselines/xgboost.py:44: FutureWarning: suggest_loguniform has been deprecated in v3.0.0. This feature will be removed in v6.0.0. See https://github.com/optuna/optuna/releases/tag/v3.0.0. Use :func:`~optuna.trial.Trial.suggest_float` instead.
  "lambda": trial.suggest_loguniform("lambda", 1e-8, 10.0),
[32m[I 2023-01-13 00:05:49,638][0m Trial 60 finished with value: 0.39999999999999997 and parameters: {'n_estimators': 8692, 'max_depth': 47, 'learning_rate': 0.0049823947199622454, 'colsample_bytree': 0.22106912471756476, 'subsample': 0.001499772553024051, 'alpha': 0.005059542795454786, 'lambda': 0.00016704794616648704}. Best is trial 0 with value: 0.39999999999999997.[0m
/Users/kevinmaikjablonka/git/kjappelbaum/gptchem/src/gptchem/baselines/xgboost.py:38: FutureWarning: suggest_loguniform has been deprecated in v3.0.0. This feature will be removed in v6.0.0. See https://github.com/optuna/optuna/releases/tag/v3.0.0. Use :func:`~optuna.trial.Trial.suggest_float` instead.
  "learning_rate": trial.suggest_loguniform("learning_rate", 0.001, 0.05),
/Users/kevinmaikjablonka/git/kjappelbaum/gptchem/src/gptchem/baselines/xgboost.py:39: FutureWarning: suggest_loguniform has been deprecated in v3.0.0. This feature will be removed in v6.0.0. See https://github.com/optuna/optuna/releases/tag/v3.0.0. Use :func:`~optuna.trial.Trial.suggest_float` instead.
  "colsample_bytree": trial.suggest_loguniform(
/Users/kevinmaikjablonka/git/kjappelbaum/gptchem/src/gptchem/baselines/xgboost.py:42: FutureWarning: suggest_loguniform has been deprecated in v3.0.0. This feature will be removed in v6.0.0. See https://github.com/optuna/optuna/releases/tag/v3.0.0. Use :func:`~optuna.trial.Trial.suggest_float` instead.
  "subsample": trial.suggest_loguniform("subsample", 0.00001, 1),
/Users/kevinmaikjablonka/git/kjappelbaum/gptchem/src/gptchem/baselines/xgboost.py:43: FutureWarning: suggest_loguniform has been deprecated in v3.0.0. This feature will be removed in v6.0.0. See https://github.com/optuna/optuna/releases/tag/v3.0.0. Use :func:`~optuna.trial.Trial.suggest_float` instead.
  "alpha": trial.suggest_loguniform("alpha", 1e-8, 10.0),
/Users/kevinmaikjablonka/git/kjappelbaum/gptchem/src/gptchem/baselines/xgboost.py:44: FutureWarning: suggest_loguniform has been deprecated in v3.0.0. This feature will be removed in v6.0.0. See https://github.com/optuna/optuna/releases/tag/v3.0.0. Use :func:`~optuna.trial.Trial.suggest_float` instead.
  "lambda": trial.suggest_loguniform("lambda", 1e-8, 10.0),
[32m[I 2023-01-13 00:05:53,096][0m Trial 61 finished with value: 0.39999999999999997 and parameters: {'n_estimators': 8257, 'max_depth': 33, 'learning_rate': 0.002479133105111008, 'colsample_bytree': 0.20020406759604564, 'subsample': 0.00039763269519572177, 'alpha': 0.002529326405318249, 'lambda': 5.772979808693808e-05}. Best is trial 0 with value: 0.39999999999999997.[0m
/Users/kevinmaikjablonka/git/kjappelbaum/gptchem/src/gptchem/baselines/xgboost.py:38: FutureWarning: suggest_loguniform has been deprecated in v3.0.0. This feature will be removed in v6.0.0. See https://github.com/optuna/optuna/releases/tag/v3.0.0. Use :func:`~optuna.trial.Trial.suggest_float` instead.
  "learning_rate": trial.suggest_loguniform("learning_rate", 0.001, 0.05),
/Users/kevinmaikjablonka/git/kjappelbaum/gptchem/src/gptchem/baselines/xgboost.py:39: FutureWarning: suggest_loguniform has been deprecated in v3.0.0. This feature will be removed in v6.0.0. See https://github.com/optuna/optuna/releases/tag/v3.0.0. Use :func:`~optuna.trial.Trial.suggest_float` instead.
  "colsample_bytree": trial.suggest_loguniform(
/Users/kevinmaikjablonka/git/kjappelbaum/gptchem/src/gptchem/baselines/xgboost.py:42: FutureWarning: suggest_loguniform has been deprecated in v3.0.0. This feature will be removed in v6.0.0. See https://github.com/optuna/optuna/releases/tag/v3.0.0. Use :func:`~optuna.trial.Trial.suggest_float` instead.
  "subsample": trial.suggest_loguniform("subsample", 0.00001, 1),
/Users/kevinmaikjablonka/git/kjappelbaum/gptchem/src/gptchem/baselines/xgboost.py:43: FutureWarning: suggest_loguniform has been deprecated in v3.0.0. This feature will be removed in v6.0.0. See https://github.com/optuna/optuna/releases/tag/v3.0.0. Use :func:`~optuna.trial.Trial.suggest_float` instead.
  "alpha": trial.suggest_loguniform("alpha", 1e-8, 10.0),
/Users/kevinmaikjablonka/git/kjappelbaum/gptchem/src/gptchem/baselines/xgboost.py:44: FutureWarning: suggest_loguniform has been deprecated in v3.0.0. This feature will be removed in v6.0.0. See https://github.com/optuna/optuna/releases/tag/v3.0.0. Use :func:`~optuna.trial.Trial.suggest_float` instead.
  "lambda": trial.suggest_loguniform("lambda", 1e-8, 10.0),
[32m[I 2023-01-13 00:05:53,453][0m Trial 62 finished with value: 0.39999999999999997 and parameters: {'n_estimators': 554, 'max_depth': 37, 'learning_rate': 0.010435417829442382, 'colsample_bytree': 0.24183586736132412, 'subsample': 0.0022256163487220978, 'alpha': 0.0005937606159661103, 'lambda': 1.2426228956102483e-05}. Best is trial 0 with value: 0.39999999999999997.[0m
/Users/kevinmaikjablonka/git/kjappelbaum/gptchem/src/gptchem/baselines/xgboost.py:38: FutureWarning: suggest_loguniform has been deprecated in v3.0.0. This feature will be removed in v6.0.0. See https://github.com/optuna/optuna/releases/tag/v3.0.0. Use :func:`~optuna.trial.Trial.suggest_float` instead.
  "learning_rate": trial.suggest_loguniform("learning_rate", 0.001, 0.05),
/Users/kevinmaikjablonka/git/kjappelbaum/gptchem/src/gptchem/baselines/xgboost.py:39: FutureWarning: suggest_loguniform has been deprecated in v3.0.0. This feature will be removed in v6.0.0. See https://github.com/optuna/optuna/releases/tag/v3.0.0. Use :func:`~optuna.trial.Trial.suggest_float` instead.
  "colsample_bytree": trial.suggest_loguniform(
/Users/kevinmaikjablonka/git/kjappelbaum/gptchem/src/gptchem/baselines/xgboost.py:42: FutureWarning: suggest_loguniform has been deprecated in v3.0.0. This feature will be removed in v6.0.0. See https://github.com/optuna/optuna/releases/tag/v3.0.0. Use :func:`~optuna.trial.Trial.suggest_float` instead.
  "subsample": trial.suggest_loguniform("subsample", 0.00001, 1),
/Users/kevinmaikjablonka/git/kjappelbaum/gptchem/src/gptchem/baselines/xgboost.py:43: FutureWarning: suggest_loguniform has been deprecated in v3.0.0. This feature will be removed in v6.0.0. See https://github.com/optuna/optuna/releases/tag/v3.0.0. Use :func:`~optuna.trial.Trial.suggest_float` instead.
  "alpha": trial.suggest_loguniform("alpha", 1e-8, 10.0),
/Users/kevinmaikjablonka/git/kjappelbaum/gptchem/src/gptchem/baselines/xgboost.py:44: FutureWarning: suggest_loguniform has been deprecated in v3.0.0. This feature will be removed in v6.0.0. See https://github.com/optuna/optuna/releases/tag/v3.0.0. Use :func:`~optuna.trial.Trial.suggest_float` instead.
  "lambda": trial.suggest_loguniform("lambda", 1e-8, 10.0),
[32m[I 2023-01-13 00:05:53,760][0m Trial 63 finished with value: 0.39999999999999997 and parameters: {'n_estimators': 445, 'max_depth': 38, 'learning_rate': 0.0025548912833157117, 'colsample_bytree': 0.23020253882521535, 'subsample': 0.00028656777798160383, 'alpha': 0.003154097468691991, 'lambda': 7.316519388882949e-06}. Best is trial 0 with value: 0.39999999999999997.[0m
/Users/kevinmaikjablonka/git/kjappelbaum/gptchem/src/gptchem/baselines/xgboost.py:38: FutureWarning: suggest_loguniform has been deprecated in v3.0.0. This feature will be removed in v6.0.0. See https://github.com/optuna/optuna/releases/tag/v3.0.0. Use :func:`~optuna.trial.Trial.suggest_float` instead.
  "learning_rate": trial.suggest_loguniform("learning_rate", 0.001, 0.05),
/Users/kevinmaikjablonka/git/kjappelbaum/gptchem/src/gptchem/baselines/xgboost.py:39: FutureWarning: suggest_loguniform has been deprecated in v3.0.0. This feature will be removed in v6.0.0. See https://github.com/optuna/optuna/releases/tag/v3.0.0. Use :func:`~optuna.trial.Trial.suggest_float` instead.
  "colsample_bytree": trial.suggest_loguniform(
/Users/kevinmaikjablonka/git/kjappelbaum/gptchem/src/gptchem/baselines/xgboost.py:42: FutureWarning: suggest_loguniform has been deprecated in v3.0.0. This feature will be removed in v6.0.0. See https://github.com/optuna/optuna/releases/tag/v3.0.0. Use :func:`~optuna.trial.Trial.suggest_float` instead.
  "subsample": trial.suggest_loguniform("subsample", 0.00001, 1),
/Users/kevinmaikjablonka/git/kjappelbaum/gptchem/src/gptchem/baselines/xgboost.py:43: FutureWarning: suggest_loguniform has been deprecated in v3.0.0. This feature will be removed in v6.0.0. See https://github.com/optuna/optuna/releases/tag/v3.0.0. Use :func:`~optuna.trial.Trial.suggest_float` instead.
  "alpha": trial.suggest_loguniform("alpha", 1e-8, 10.0),
/Users/kevinmaikjablonka/git/kjappelbaum/gptchem/src/gptchem/baselines/xgboost.py:44: FutureWarning: suggest_loguniform has been deprecated in v3.0.0. This feature will be removed in v6.0.0. See https://github.com/optuna/optuna/releases/tag/v3.0.0. Use :func:`~optuna.trial.Trial.suggest_float` instead.
  "lambda": trial.suggest_loguniform("lambda", 1e-8, 10.0),
[32m[I 2023-01-13 00:05:54,526][0m Trial 64 finished with value: 0.39999999999999997 and parameters: {'n_estimators': 1518, 'max_depth': 42, 'learning_rate': 0.002323319470119022, 'colsample_bytree': 0.24974781754573383, 'subsample': 0.0018398604233128258, 'alpha': 0.010200421025396542, 'lambda': 1.508751610814801e-08}. Best is trial 0 with value: 0.39999999999999997.[0m
/Users/kevinmaikjablonka/git/kjappelbaum/gptchem/src/gptchem/baselines/xgboost.py:38: FutureWarning: suggest_loguniform has been deprecated in v3.0.0. This feature will be removed in v6.0.0. See https://github.com/optuna/optuna/releases/tag/v3.0.0. Use :func:`~optuna.trial.Trial.suggest_float` instead.
  "learning_rate": trial.suggest_loguniform("learning_rate", 0.001, 0.05),
/Users/kevinmaikjablonka/git/kjappelbaum/gptchem/src/gptchem/baselines/xgboost.py:39: FutureWarning: suggest_loguniform has been deprecated in v3.0.0. This feature will be removed in v6.0.0. See https://github.com/optuna/optuna/releases/tag/v3.0.0. Use :func:`~optuna.trial.Trial.suggest_float` instead.
  "colsample_bytree": trial.suggest_loguniform(
/Users/kevinmaikjablonka/git/kjappelbaum/gptchem/src/gptchem/baselines/xgboost.py:42: FutureWarning: suggest_loguniform has been deprecated in v3.0.0. This feature will be removed in v6.0.0. See https://github.com/optuna/optuna/releases/tag/v3.0.0. Use :func:`~optuna.trial.Trial.suggest_float` instead.
  "subsample": trial.suggest_loguniform("subsample", 0.00001, 1),
/Users/kevinmaikjablonka/git/kjappelbaum/gptchem/src/gptchem/baselines/xgboost.py:43: FutureWarning: suggest_loguniform has been deprecated in v3.0.0. This feature will be removed in v6.0.0. See https://github.com/optuna/optuna/releases/tag/v3.0.0. Use :func:`~optuna.trial.Trial.suggest_float` instead.
  "alpha": trial.suggest_loguniform("alpha", 1e-8, 10.0),
/Users/kevinmaikjablonka/git/kjappelbaum/gptchem/src/gptchem/baselines/xgboost.py:44: FutureWarning: suggest_loguniform has been deprecated in v3.0.0. This feature will be removed in v6.0.0. See https://github.com/optuna/optuna/releases/tag/v3.0.0. Use :func:`~optuna.trial.Trial.suggest_float` instead.
  "lambda": trial.suggest_loguniform("lambda", 1e-8, 10.0),
[32m[I 2023-01-13 00:05:58,508][0m Trial 65 finished with value: 0.39999999999999997 and parameters: {'n_estimators': 9447, 'max_depth': 41, 'learning_rate': 0.003948376645267918, 'colsample_bytree': 0.2097594327771829, 'subsample': 0.000644840468591371, 'alpha': 0.027345104018026107, 'lambda': 0.00010237774317239094}. Best is trial 0 with value: 0.39999999999999997.[0m
/Users/kevinmaikjablonka/git/kjappelbaum/gptchem/src/gptchem/baselines/xgboost.py:38: FutureWarning: suggest_loguniform has been deprecated in v3.0.0. This feature will be removed in v6.0.0. See https://github.com/optuna/optuna/releases/tag/v3.0.0. Use :func:`~optuna.trial.Trial.suggest_float` instead.
  "learning_rate": trial.suggest_loguniform("learning_rate", 0.001, 0.05),
/Users/kevinmaikjablonka/git/kjappelbaum/gptchem/src/gptchem/baselines/xgboost.py:39: FutureWarning: suggest_loguniform has been deprecated in v3.0.0. This feature will be removed in v6.0.0. See https://github.com/optuna/optuna/releases/tag/v3.0.0. Use :func:`~optuna.trial.Trial.suggest_float` instead.
  "colsample_bytree": trial.suggest_loguniform(
/Users/kevinmaikjablonka/git/kjappelbaum/gptchem/src/gptchem/baselines/xgboost.py:42: FutureWarning: suggest_loguniform has been deprecated in v3.0.0. This feature will be removed in v6.0.0. See https://github.com/optuna/optuna/releases/tag/v3.0.0. Use :func:`~optuna.trial.Trial.suggest_float` instead.
  "subsample": trial.suggest_loguniform("subsample", 0.00001, 1),
/Users/kevinmaikjablonka/git/kjappelbaum/gptchem/src/gptchem/baselines/xgboost.py:43: FutureWarning: suggest_loguniform has been deprecated in v3.0.0. This feature will be removed in v6.0.0. See https://github.com/optuna/optuna/releases/tag/v3.0.0. Use :func:`~optuna.trial.Trial.suggest_float` instead.
  "alpha": trial.suggest_loguniform("alpha", 1e-8, 10.0),
/Users/kevinmaikjablonka/git/kjappelbaum/gptchem/src/gptchem/baselines/xgboost.py:44: FutureWarning: suggest_loguniform has been deprecated in v3.0.0. This feature will be removed in v6.0.0. See https://github.com/optuna/optuna/releases/tag/v3.0.0. Use :func:`~optuna.trial.Trial.suggest_float` instead.
  "lambda": trial.suggest_loguniform("lambda", 1e-8, 10.0),
