[32m[I 2023-01-13 03:02:06,666][0m Trial 14 finished with value: 0.2732600732600733 and parameters: {'n_estimators': 4120, 'max_depth': 102, 'min_samples_split': 36, 'min_samples_leaf': 1, 'criterion': 'entropy'}. Best is trial 11 with value: 0.5228710178710179.[0m
[32m[I 2023-01-13 03:02:15,817][0m Trial 15 finished with value: 0.2732600732600733 and parameters: {'n_estimators': 4264, 'max_depth': 73, 'min_samples_split': 51, 'min_samples_leaf': 23, 'criterion': 'entropy'}. Best is trial 11 with value: 0.5228710178710179.[0m
[32m[I 2023-01-13 03:02:25,465][0m Trial 16 finished with value: 0.2732600732600733 and parameters: {'n_estimators': 4534, 'max_depth': 128, 'min_samples_split': 41, 'min_samples_leaf': 45, 'criterion': 'entropy'}. Best is trial 11 with value: 0.5228710178710179.[0m
[32m[I 2023-01-13 03:02:25,523][0m Trial 17 finished with value: 0.2732600732600733 and parameters: {'n_estimators': 24, 'max_depth': 35, 'min_samples_split': 22, 'min_samples_leaf': 16, 'criterion': 'entropy'}. Best is trial 11 with value: 0.5228710178710179.[0m
[32m[I 2023-01-13 03:02:32,947][0m Trial 18 finished with value: 0.2732600732600733 and parameters: {'n_estimators': 3537, 'max_depth': 106, 'min_samples_split': 2, 'min_samples_leaf': 39, 'criterion': 'entropy'}. Best is trial 11 with value: 0.5228710178710179.[0m
[32m[I 2023-01-13 03:02:43,516][0m Trial 19 finished with value: 0.2732600732600733 and parameters: {'n_estimators': 4938, 'max_depth': 89, 'min_samples_split': 102, 'min_samples_leaf': 1, 'criterion': 'entropy'}. Best is trial 11 with value: 0.5228710178710179.[0m
[32m[I 2023-01-13 03:02:48,580][0m Trial 20 finished with value: 0.2732600732600733 and parameters: {'n_estimators': 2329, 'max_depth': 52, 'min_samples_split': 17, 'min_samples_leaf': 19, 'criterion': 'entropy'}. Best is trial 11 with value: 0.5228710178710179.[0m
[32m[I 2023-01-13 03:02:58,151][0m Trial 21 finished with value: 0.2732600732600733 and parameters: {'n_estimators': 4563, 'max_depth': 127, 'min_samples_split': 33, 'min_samples_leaf': 6, 'criterion': 'entropy'}. Best is trial 11 with value: 0.5228710178710179.[0m
[32m[I 2023-01-13 03:03:07,960][0m Trial 22 finished with value: 0.2732600732600733 and parameters: {'n_estimators': 4618, 'max_depth': 124, 'min_samples_split': 29, 'min_samples_leaf': 31, 'criterion': 'entropy'}. Best is trial 11 with value: 0.5228710178710179.[0m
[32m[I 2023-01-13 03:03:16,060][0m Trial 23 finished with value: 0.2732600732600733 and parameters: {'n_estimators': 3805, 'max_depth': 111, 'min_samples_split': 46, 'min_samples_leaf': 13, 'criterion': 'entropy'}. Best is trial 11 with value: 0.5228710178710179.[0m
[32m[I 2023-01-13 03:03:26,659][0m Trial 24 finished with value: 0.3232600732600733 and parameters: {'n_estimators': 4964, 'max_depth': 118, 'min_samples_split': 10, 'min_samples_leaf': 11, 'criterion': 'entropy'}. Best is trial 11 with value: 0.5228710178710179.[0m
[32m[I 2023-01-13 03:03:35,974][0m Trial 25 finished with value: 0.2732600732600733 and parameters: {'n_estimators': 4362, 'max_depth': 99, 'min_samples_split': 28, 'min_samples_leaf': 23, 'criterion': 'entropy'}. Best is trial 11 with value: 0.5228710178710179.[0m
[32m[I 2023-01-13 03:03:42,878][0m Trial 26 finished with value: 0.2732600732600733 and parameters: {'n_estimators': 3273, 'max_depth': 67, 'min_samples_split': 12, 'min_samples_leaf': 38, 'criterion': 'entropy'}. Best is trial 11 with value: 0.5228710178710179.[0m
[32m[I 2023-01-13 03:03:51,496][0m Trial 27 finished with value: 0.2732600732600733 and parameters: {'n_estimators': 4038, 'max_depth': 120, 'min_samples_split': 60, 'min_samples_leaf': 2, 'criterion': 'gini'}. Best is trial 11 with value: 0.5228710178710179.[0m
[32m[I 2023-01-13 03:04:01,317][0m Trial 28 finished with value: 0.2732600732600733 and parameters: {'n_estimators': 4641, 'max_depth': 109, 'min_samples_split': 24, 'min_samples_leaf': 56, 'criterion': 'entropy'}. Best is trial 11 with value: 0.5228710178710179.[0m
[32m[I 2023-01-13 03:04:05,668][0m Trial 29 finished with value: 0.3232600732600733 and parameters: {'n_estimators': 2044, 'max_depth': 90, 'min_samples_split': 4, 'min_samples_leaf': 10, 'criterion': 'entropy'}. Best is trial 11 with value: 0.5228710178710179.[0m
[32m[I 2023-01-13 03:04:13,719][0m Trial 30 finished with value: 0.2732600732600733 and parameters: {'n_estimators': 3773, 'max_depth': 128, 'min_samples_split': 37, 'min_samples_leaf': 28, 'criterion': 'entropy'}. Best is trial 11 with value: 0.5228710178710179.[0m
[32m[I 2023-01-13 03:04:19,856][0m Trial 31 finished with value: 0.29670329670329676 and parameters: {'n_estimators': 2897, 'max_depth': 119, 'min_samples_split': 12, 'min_samples_leaf': 14, 'criterion': 'entropy'}. Best is trial 11 with value: 0.5228710178710179.[0m
[32m[I 2023-01-13 03:04:23,808][0m Trial 32 finished with value: 0.3562271062271062 and parameters: {'n_estimators': 1852, 'max_depth': 92, 'min_samples_split': 2, 'min_samples_leaf': 8, 'criterion': 'entropy'}. Best is trial 11 with value: 0.5228710178710179.[0m
[32m[I 2023-01-13 03:04:28,003][0m Trial 33 finished with value: 0.34523809523809523 and parameters: {'n_estimators': 1864, 'max_depth': 96, 'min_samples_split': 16, 'min_samples_leaf': 7, 'criterion': 'entropy'}. Best is trial 11 with value: 0.5228710178710179.[0m
[32m[I 2023-01-13 03:04:33,338][0m Trial 34 finished with value: 0.2732600732600733 and parameters: {'n_estimators': 2538, 'max_depth': 115, 'min_samples_split': 8, 'min_samples_leaf': 18, 'criterion': 'entropy'}. Best is trial 11 with value: 0.5228710178710179.[0m
[32m[I 2023-01-13 03:04:39,035][0m Trial 35 finished with value: 0.3562271062271062 and parameters: {'n_estimators': 2573, 'max_depth': 109, 'min_samples_split': 21, 'min_samples_leaf': 8, 'criterion': 'gini'}. Best is trial 11 with value: 0.5228710178710179.[0m
[32m[I 2023-01-13 03:04:41,285][0m Trial 36 finished with value: 0.2732600732600733 and parameters: {'n_estimators': 1058, 'max_depth': 106, 'min_samples_split': 21, 'min_samples_leaf': 67, 'criterion': 'gini'}. Best is trial 11 with value: 0.5228710178710179.[0m
[32m[I 2023-01-13 03:04:45,207][0m Trial 37 finished with value: 0.2732600732600733 and parameters: {'n_estimators': 1736, 'max_depth': 83, 'min_samples_split': 8, 'min_samples_leaf': 103, 'criterion': 'gini'}. Best is trial 11 with value: 0.5228710178710179.[0m
[32m[I 2023-01-13 03:04:51,147][0m Trial 38 finished with value: 0.2732600732600733 and parameters: {'n_estimators': 2700, 'max_depth': 113, 'min_samples_split': 16, 'min_samples_leaf': 122, 'criterion': 'gini'}. Best is trial 11 with value: 0.5228710178710179.[0m
[32m[I 2023-01-13 03:04:54,018][0m Trial 39 finished with value: 0.2732600732600733 and parameters: {'n_estimators': 1371, 'max_depth': 93, 'min_samples_split': 106, 'min_samples_leaf': 46, 'criterion': 'gini'}. Best is trial 11 with value: 0.5228710178710179.[0m
[32m[I 2023-01-13 03:04:55,667][0m Trial 40 finished with value: 0.2732600732600733 and parameters: {'n_estimators': 784, 'max_depth': 78, 'min_samples_split': 50, 'min_samples_leaf': 23, 'criterion': 'gini'}. Best is trial 11 with value: 0.5228710178710179.[0m
[32m[I 2023-01-13 03:05:00,465][0m Trial 41 finished with value: 0.345987345987346 and parameters: {'n_estimators': 2278, 'max_depth': 122, 'min_samples_split': 26, 'min_samples_leaf': 5, 'criterion': 'gini'}. Best is trial 11 with value: 0.5228710178710179.[0m
[32m[I 2023-01-13 03:05:10,591][0m Trial 42 finished with value: 0.3562271062271062 and parameters: {'n_estimators': 4701, 'max_depth': 104, 'min_samples_split': 16, 'min_samples_leaf': 8, 'criterion': 'entropy'}. Best is trial 11 with value: 0.5228710178710179.[0m
[32m[I 2023-01-13 03:05:20,016][0m Trial 43 finished with value: 0.3232600732600733 and parameters: {'n_estimators': 4411, 'max_depth': 107, 'min_samples_split': 6, 'min_samples_leaf': 11, 'criterion': 'entropy'}. Best is trial 11 with value: 0.5228710178710179.[0m
[32m[I 2023-01-13 03:05:26,927][0m Trial 44 finished with value: 0.2732600732600733 and parameters: {'n_estimators': 3197, 'max_depth': 102, 'min_samples_split': 16, 'min_samples_leaf': 80, 'criterion': 'gini'}. Best is trial 11 with value: 0.5228710178710179.[0m
[32m[I 2023-01-13 03:05:35,805][0m Trial 45 finished with value: 0.2732600732600733 and parameters: {'n_estimators': 4217, 'max_depth': 115, 'min_samples_split': 2, 'min_samples_leaf': 20, 'criterion': 'entropy'}. Best is trial 11 with value: 0.5228710178710179.[0m
[32m[I 2023-01-13 03:05:46,020][0m Trial 46 finished with value: 0.2732600732600733 and parameters: {'n_estimators': 4744, 'max_depth': 88, 'min_samples_split': 69, 'min_samples_leaf': 34, 'criterion': 'entropy'}. Best is trial 11 with value: 0.5228710178710179.[0m
[32m[I 2023-01-13 03:05:53,860][0m Trial 47 finished with value: 0.3232600732600733 and parameters: {'n_estimators': 3597, 'max_depth': 98, 'min_samples_split': 12, 'min_samples_leaf': 9, 'criterion': 'gini'}. Best is trial 11 with value: 0.5228710178710179.[0m
[32m[I 2023-01-13 03:05:54,520][0m Trial 48 finished with value: 0.2732600732600733 and parameters: {'n_estimators': 310, 'max_depth': 4, 'min_samples_split': 19, 'min_samples_leaf': 15, 'criterion': 'entropy'}. Best is trial 11 with value: 0.5228710178710179.[0m
[32m[I 2023-01-13 03:05:57,707][0m Trial 49 finished with value: 0.4317399267399267 and parameters: {'n_estimators': 1482, 'max_depth': 103, 'min_samples_split': 24, 'min_samples_leaf': 1, 'criterion': 'entropy'}. Best is trial 11 with value: 0.5228710178710179.[0m
[32m[I 2023-01-13 03:06:00,574][0m Trial 50 finished with value: 0.2732600732600733 and parameters: {'n_estimators': 1365, 'max_depth': 59, 'min_samples_split': 42, 'min_samples_leaf': 113, 'criterion': 'entropy'}. Best is trial 11 with value: 0.5228710178710179.[0m
[32m[I 2023-01-13 03:06:05,071][0m Trial 51 finished with value: 0.5612043512043512 and parameters: {'n_estimators': 2002, 'max_depth': 103, 'min_samples_split': 8, 'min_samples_leaf': 1, 'criterion': 'entropy'}. Best is trial 51 with value: 0.5612043512043512.[0m
[32m[I 2023-01-13 03:06:09,618][0m Trial 52 finished with value: 0.534040404040404 and parameters: {'n_estimators': 2018, 'max_depth': 114, 'min_samples_split': 7, 'min_samples_leaf': 2, 'criterion': 'entropy'}. Best is trial 51 with value: 0.5612043512043512.[0m
[32m[I 2023-01-13 03:06:14,486][0m Trial 53 finished with value: 0.5786036186036186 and parameters: {'n_estimators': 2052, 'max_depth': 116, 'min_samples_split': 6, 'min_samples_leaf': 1, 'criterion': 'entropy'}. Best is trial 53 with value: 0.5786036186036186.[0m
[32m[I 2023-01-13 03:06:18,436][0m Trial 54 finished with value: 0.5125757575757575 and parameters: {'n_estimators': 1690, 'max_depth': 123, 'min_samples_split': 8, 'min_samples_leaf': 3, 'criterion': 'entropy'}. Best is trial 53 with value: 0.5786036186036186.[0m
[32m[I 2023-01-13 03:06:23,117][0m Trial 55 finished with value: 0.5612043512043512 and parameters: {'n_estimators': 2070, 'max_depth': 122, 'min_samples_split': 8, 'min_samples_leaf': 1, 'criterion': 'entropy'}. Best is trial 53 with value: 0.5786036186036186.[0m
[32m[I 2023-01-13 03:06:27,925][0m Trial 56 finished with value: 0.5645376845376846 and parameters: {'n_estimators': 2127, 'max_depth': 116, 'min_samples_split': 12, 'min_samples_leaf': 1, 'criterion': 'entropy'}. Best is trial 53 with value: 0.5786036186036186.[0m
[32m[I 2023-01-13 03:06:32,136][0m Trial 57 finished with value: 0.2732600732600733 and parameters: {'n_estimators': 2001, 'max_depth': 116, 'min_samples_split': 12, 'min_samples_leaf': 16, 'criterion': 'entropy'}. Best is trial 53 with value: 0.5786036186036186.[0m
[32m[I 2023-01-13 03:06:36,717][0m Trial 58 finished with value: 0.2732600732600733 and parameters: {'n_estimators': 2166, 'max_depth': 112, 'min_samples_split': 33, 'min_samples_leaf': 27, 'criterion': 'entropy'}. Best is trial 53 with value: 0.5786036186036186.[0m
[32m[I 2023-01-13 03:06:39,281][0m Trial 59 finished with value: 0.5962803862803863 and parameters: {'n_estimators': 1148, 'max_depth': 123, 'min_samples_split': 8, 'min_samples_leaf': 1, 'criterion': 'entropy'}. Best is trial 59 with value: 0.5962803862803863.[0m
[32m[I 2023-01-13 03:06:41,593][0m Trial 60 finished with value: 0.2732600732600733 and parameters: {'n_estimators': 1072, 'max_depth': 119, 'min_samples_split': 7, 'min_samples_leaf': 19, 'criterion': 'entropy'}. Best is trial 59 with value: 0.5962803862803863.[0m
[32m[I 2023-01-13 03:06:46,639][0m Trial 61 finished with value: 0.507979797979798 and parameters: {'n_estimators': 2300, 'max_depth': 123, 'min_samples_split': 14, 'min_samples_leaf': 1, 'criterion': 'entropy'}. Best is trial 59 with value: 0.5962803862803863.[0m
[32m[I 2023-01-13 03:06:51,217][0m Trial 62 finished with value: 0.4808003108003107 and parameters: {'n_estimators': 2088, 'max_depth': 124, 'min_samples_split': 6, 'min_samples_leaf': 5, 'criterion': 'entropy'}. Best is trial 59 with value: 0.5962803862803863.[0m
[32m[I 2023-01-13 03:06:56,385][0m Trial 63 finished with value: 0.3232600732600733 and parameters: {'n_estimators': 2443, 'max_depth': 45, 'min_samples_split': 10, 'min_samples_leaf': 12, 'criterion': 'entropy'}. Best is trial 59 with value: 0.5962803862803863.[0m
[32m[I 2023-01-13 03:07:02,733][0m Trial 64 finished with value: 0.5596137196137196 and parameters: {'n_estimators': 2791, 'max_depth': 112, 'min_samples_split': 2, 'min_samples_leaf': 1, 'criterion': 'entropy'}. Best is trial 59 with value: 0.5962803862803863.[0m
[32m[I 2023-01-13 03:07:08,907][0m Trial 65 finished with value: 0.2732600732600733 and parameters: {'n_estimators': 2866, 'max_depth': 112, 'min_samples_split': 86, 'min_samples_leaf': 5, 'criterion': 'entropy'}. Best is trial 59 with value: 0.5962803862803863.[0m
[32m[I 2023-01-13 03:07:14,647][0m Trial 66 finished with value: 0.3232600732600733 and parameters: {'n_estimators': 2715, 'max_depth': 117, 'min_samples_split': 20, 'min_samples_leaf': 13, 'criterion': 'entropy'}. Best is trial 59 with value: 0.5962803862803863.[0m
[32m[I 2023-01-13 03:07:18,996][0m Trial 67 finished with value: 0.5402197802197802 and parameters: {'n_estimators': 1907, 'max_depth': 109, 'min_samples_split': 2, 'min_samples_leaf': 1, 'criterion': 'entropy'}. Best is trial 59 with value: 0.5962803862803863.[0m
[32m[I 2023-01-13 03:07:23,078][0m Trial 68 finished with value: 0.2732600732600733 and parameters: {'n_estimators': 1877, 'max_depth': 109, 'min_samples_split': 2, 'min_samples_leaf': 22, 'criterion': 'entropy'}. Best is trial 59 with value: 0.5962803862803863.[0m
[32m[I 2023-01-13 03:07:25,649][0m Trial 69 finished with value: 0.36796536796536794 and parameters: {'n_estimators': 1205, 'max_depth': 99, 'min_samples_split': 5, 'min_samples_leaf': 6, 'criterion': 'entropy'}. Best is trial 59 with value: 0.5962803862803863.[0m
[32m[I 2023-01-13 03:07:27,253][0m Trial 70 finished with value: 0.32659340659340663 and parameters: {'n_estimators': 758, 'max_depth': 126, 'min_samples_split': 12, 'min_samples_leaf': 11, 'criterion': 'entropy'}. Best is trial 59 with value: 0.5962803862803863.[0m
[32m[I 2023-01-13 03:07:30,784][0m Trial 71 finished with value: 0.5786036186036186 and parameters: {'n_estimators': 1569, 'max_depth': 121, 'min_samples_split': 8, 'min_samples_leaf': 1, 'criterion': 'entropy'}. Best is trial 59 with value: 0.5962803862803863.[0m
[32m[I 2023-01-13 03:07:34,538][0m Trial 72 finished with value: 0.5822144522144523 and parameters: {'n_estimators': 1649, 'max_depth': 120, 'min_samples_split': 5, 'min_samples_leaf': 1, 'criterion': 'entropy'}. Best is trial 59 with value: 0.5962803862803863.[0m
[32m[I 2023-01-13 03:07:37,988][0m Trial 73 finished with value: 0.2732600732600733 and parameters: {'n_estimators': 1635, 'max_depth': 121, 'min_samples_split': 10, 'min_samples_leaf': 16, 'criterion': 'entropy'}. Best is trial 59 with value: 0.5962803862803863.[0m
[32m[I 2023-01-13 03:07:41,234][0m Trial 74 finished with value: 0.2732600732600733 and parameters: {'n_estimators': 1465, 'max_depth': 117, 'min_samples_split': 78, 'min_samples_leaf': 6, 'criterion': 'entropy'}. Best is trial 59 with value: 0.5962803862803863.[0m
[32m[I 2023-01-13 03:07:44,853][0m Trial 75 finished with value: 0.3232600732600733 and parameters: {'n_estimators': 1554, 'max_depth': 128, 'min_samples_split': 19, 'min_samples_leaf': 9, 'criterion': 'entropy'}. Best is trial 59 with value: 0.5962803862803863.[0m
[32m[I 2023-01-13 03:07:50,021][0m Trial 76 finished with value: 0.2732600732600733 and parameters: {'n_estimators': 2433, 'max_depth': 120, 'min_samples_split': 14, 'min_samples_leaf': 57, 'criterion': 'entropy'}. Best is trial 59 with value: 0.5962803862803863.[0m
[32m[I 2023-01-13 03:07:52,548][0m Trial 77 finished with value: 0.2732600732600733 and parameters: {'n_estimators': 1195, 'max_depth': 125, 'min_samples_split': 117, 'min_samples_leaf': 4, 'criterion': 'entropy'}. Best is trial 59 with value: 0.5962803862803863.[0m
[32m[I 2023-01-13 03:07:56,213][0m Trial 78 finished with value: 0.2732600732600733 and parameters: {'n_estimators': 1749, 'max_depth': 112, 'min_samples_split': 25, 'min_samples_leaf': 97, 'criterion': 'entropy'}. Best is trial 59 with value: 0.5962803862803863.[0m
[32m[I 2023-01-13 03:08:01,174][0m Trial 79 finished with value: 0.2732600732600733 and parameters: {'n_estimators': 2252, 'max_depth': 119, 'min_samples_split': 92, 'min_samples_leaf': 13, 'criterion': 'entropy'}. Best is trial 59 with value: 0.5962803862803863.[0m
[32m[I 2023-01-13 03:08:05,717][0m Trial 80 finished with value: 0.3232600732600733 and parameters: {'n_estimators': 2140, 'max_depth': 23, 'min_samples_split': 5, 'min_samples_leaf': 9, 'criterion': 'entropy'}. Best is trial 59 with value: 0.5962803862803863.[0m
[32m[I 2023-01-13 03:08:09,858][0m Trial 81 finished with value: 0.5402197802197802 and parameters: {'n_estimators': 1818, 'max_depth': 106, 'min_samples_split': 2, 'min_samples_leaf': 1, 'criterion': 'entropy'}. Best is trial 59 with value: 0.5962803862803863.[0m
[32m[I 2023-01-13 03:08:13,950][0m Trial 82 finished with value: 0.5612043512043512 and parameters: {'n_estimators': 1787, 'max_depth': 106, 'min_samples_split': 9, 'min_samples_leaf': 1, 'criterion': 'entropy'}. Best is trial 59 with value: 0.5962803862803863.[0m
[32m[I 2023-01-13 03:08:16,583][0m Trial 83 finished with value: 0.4762043512043512 and parameters: {'n_estimators': 1227, 'max_depth': 115, 'min_samples_split': 15, 'min_samples_leaf': 5, 'criterion': 'entropy'}. Best is trial 59 with value: 0.5962803862803863.[0m
[32m[I 2023-01-13 03:08:22,326][0m Trial 84 finished with value: 0.3562271062271062 and parameters: {'n_estimators': 2584, 'max_depth': 122, 'min_samples_split': 9, 'min_samples_leaf': 8, 'criterion': 'entropy'}. Best is trial 59 with value: 0.5962803862803863.[0m
[32m[I 2023-01-13 03:08:25,755][0m Trial 85 finished with value: 0.4886363636363636 and parameters: {'n_estimators': 1585, 'max_depth': 96, 'min_samples_split': 5, 'min_samples_leaf': 4, 'criterion': 'entropy'}. Best is trial 59 with value: 0.5962803862803863.[0m
[32m[I 2023-01-13 03:08:30,008][0m Trial 86 finished with value: 0.3232600732600733 and parameters: {'n_estimators': 2014, 'max_depth': 103, 'min_samples_split': 18, 'min_samples_leaf': 12, 'criterion': 'entropy'}. Best is trial 59 with value: 0.5962803862803863.[0m
[32m[I 2023-01-13 03:08:31,766][0m Trial 87 finished with value: 0.2732600732600733 and parameters: {'n_estimators': 831, 'max_depth': 110, 'min_samples_split': 10, 'min_samples_leaf': 128, 'criterion': 'entropy'}. Best is trial 59 with value: 0.5962803862803863.[0m
[32m[I 2023-01-13 03:08:34,897][0m Trial 88 finished with value: 0.2732600732600733 and parameters: {'n_estimators': 1491, 'max_depth': 118, 'min_samples_split': 23, 'min_samples_leaf': 17, 'criterion': 'entropy'}. Best is trial 59 with value: 0.5962803862803863.[0m
[32m[I 2023-01-13 03:08:40,069][0m Trial 89 finished with value: 0.3562271062271062 and parameters: {'n_estimators': 2421, 'max_depth': 107, 'min_samples_split': 14, 'min_samples_leaf': 8, 'criterion': 'entropy'}. Best is trial 59 with value: 0.5962803862803863.[0m
[32m[I 2023-01-13 03:08:46,440][0m Trial 90 finished with value: 0.2732600732600733 and parameters: {'n_estimators': 2959, 'max_depth': 125, 'min_samples_split': 28, 'min_samples_leaf': 72, 'criterion': 'entropy'}. Best is trial 59 with value: 0.5962803862803863.[0m
[32m[I 2023-01-13 03:08:50,728][0m Trial 91 finished with value: 0.5822144522144523 and parameters: {'n_estimators': 1916, 'max_depth': 109, 'min_samples_split': 4, 'min_samples_leaf': 1, 'criterion': 'entropy'}. Best is trial 59 with value: 0.5962803862803863.[0m
[32m[I 2023-01-13 03:08:54,662][0m Trial 92 finished with value: 0.5612043512043512 and parameters: {'n_estimators': 1758, 'max_depth': 113, 'min_samples_split': 5, 'min_samples_leaf': 1, 'criterion': 'entropy'}. Best is trial 59 with value: 0.5962803862803863.[0m
[32m[I 2023-01-13 03:08:59,034][0m Trial 93 finished with value: 0.45979020979020974 and parameters: {'n_estimators': 1963, 'max_depth': 115, 'min_samples_split': 9, 'min_samples_leaf': 4, 'criterion': 'entropy'}. Best is trial 59 with value: 0.5962803862803863.[0m
[32m[I 2023-01-13 03:09:02,686][0m Trial 94 finished with value: 0.34523809523809523 and parameters: {'n_estimators': 1718, 'max_depth': 121, 'min_samples_split': 5, 'min_samples_leaf': 7, 'criterion': 'entropy'}. Best is trial 59 with value: 0.5962803862803863.[0m
