[32m[I 2023-01-13 00:30:48,614][0m Trial 96 finished with value: 0.39999999999999997 and parameters: {'n_estimators': 2211, 'max_depth': 50, 'learning_rate': 0.0026616524752021355, 'colsample_bytree': 0.22060286810655705, 'subsample': 0.0002872089345263342, 'alpha': 0.0014642378411732215, 'lambda': 4.0243950900711254e-05}. Best is trial 0 with value: 0.39999999999999997.[0m
/Users/kevinmaikjablonka/git/kjappelbaum/gptchem/src/gptchem/baselines/xgboost.py:38: FutureWarning: suggest_loguniform has been deprecated in v3.0.0. This feature will be removed in v6.0.0. See https://github.com/optuna/optuna/releases/tag/v3.0.0. Use :func:`~optuna.trial.Trial.suggest_float` instead.
  "learning_rate": trial.suggest_loguniform("learning_rate", 0.001, 0.05),
/Users/kevinmaikjablonka/git/kjappelbaum/gptchem/src/gptchem/baselines/xgboost.py:39: FutureWarning: suggest_loguniform has been deprecated in v3.0.0. This feature will be removed in v6.0.0. See https://github.com/optuna/optuna/releases/tag/v3.0.0. Use :func:`~optuna.trial.Trial.suggest_float` instead.
  "colsample_bytree": trial.suggest_loguniform(
/Users/kevinmaikjablonka/git/kjappelbaum/gptchem/src/gptchem/baselines/xgboost.py:42: FutureWarning: suggest_loguniform has been deprecated in v3.0.0. This feature will be removed in v6.0.0. See https://github.com/optuna/optuna/releases/tag/v3.0.0. Use :func:`~optuna.trial.Trial.suggest_float` instead.
  "subsample": trial.suggest_loguniform("subsample", 0.00001, 1),
/Users/kevinmaikjablonka/git/kjappelbaum/gptchem/src/gptchem/baselines/xgboost.py:43: FutureWarning: suggest_loguniform has been deprecated in v3.0.0. This feature will be removed in v6.0.0. See https://github.com/optuna/optuna/releases/tag/v3.0.0. Use :func:`~optuna.trial.Trial.suggest_float` instead.
  "alpha": trial.suggest_loguniform("alpha", 1e-8, 10.0),
/Users/kevinmaikjablonka/git/kjappelbaum/gptchem/src/gptchem/baselines/xgboost.py:44: FutureWarning: suggest_loguniform has been deprecated in v3.0.0. This feature will be removed in v6.0.0. See https://github.com/optuna/optuna/releases/tag/v3.0.0. Use :func:`~optuna.trial.Trial.suggest_float` instead.
  "lambda": trial.suggest_loguniform("lambda", 1e-8, 10.0),
[32m[I 2023-01-13 00:30:48,963][0m Trial 97 finished with value: 0.39999999999999997 and parameters: {'n_estimators': 535, 'max_depth': 39, 'learning_rate': 0.0010553451155768147, 'colsample_bytree': 0.26114011795955083, 'subsample': 0.0010321688998296114, 'alpha': 0.00027591093552626646, 'lambda': 9.792934608726469e-06}. Best is trial 0 with value: 0.39999999999999997.[0m
/Users/kevinmaikjablonka/git/kjappelbaum/gptchem/src/gptchem/baselines/xgboost.py:38: FutureWarning: suggest_loguniform has been deprecated in v3.0.0. This feature will be removed in v6.0.0. See https://github.com/optuna/optuna/releases/tag/v3.0.0. Use :func:`~optuna.trial.Trial.suggest_float` instead.
  "learning_rate": trial.suggest_loguniform("learning_rate", 0.001, 0.05),
/Users/kevinmaikjablonka/git/kjappelbaum/gptchem/src/gptchem/baselines/xgboost.py:39: FutureWarning: suggest_loguniform has been deprecated in v3.0.0. This feature will be removed in v6.0.0. See https://github.com/optuna/optuna/releases/tag/v3.0.0. Use :func:`~optuna.trial.Trial.suggest_float` instead.
  "colsample_bytree": trial.suggest_loguniform(
/Users/kevinmaikjablonka/git/kjappelbaum/gptchem/src/gptchem/baselines/xgboost.py:42: FutureWarning: suggest_loguniform has been deprecated in v3.0.0. This feature will be removed in v6.0.0. See https://github.com/optuna/optuna/releases/tag/v3.0.0. Use :func:`~optuna.trial.Trial.suggest_float` instead.
  "subsample": trial.suggest_loguniform("subsample", 0.00001, 1),
/Users/kevinmaikjablonka/git/kjappelbaum/gptchem/src/gptchem/baselines/xgboost.py:43: FutureWarning: suggest_loguniform has been deprecated in v3.0.0. This feature will be removed in v6.0.0. See https://github.com/optuna/optuna/releases/tag/v3.0.0. Use :func:`~optuna.trial.Trial.suggest_float` instead.
  "alpha": trial.suggest_loguniform("alpha", 1e-8, 10.0),
/Users/kevinmaikjablonka/git/kjappelbaum/gptchem/src/gptchem/baselines/xgboost.py:44: FutureWarning: suggest_loguniform has been deprecated in v3.0.0. This feature will be removed in v6.0.0. See https://github.com/optuna/optuna/releases/tag/v3.0.0. Use :func:`~optuna.trial.Trial.suggest_float` instead.
  "lambda": trial.suggest_loguniform("lambda", 1e-8, 10.0),
[32m[I 2023-01-13 00:30:49,186][0m Trial 98 finished with value: 0.39999999999999997 and parameters: {'n_estimators': 243, 'max_depth': 37, 'learning_rate': 0.0015695954973494594, 'colsample_bytree': 0.2564178343225274, 'subsample': 0.0005484585607188166, 'alpha': 0.035609948143923424, 'lambda': 1.5773475760831745e-05}. Best is trial 0 with value: 0.39999999999999997.[0m
/Users/kevinmaikjablonka/git/kjappelbaum/gptchem/src/gptchem/baselines/xgboost.py:38: FutureWarning: suggest_loguniform has been deprecated in v3.0.0. This feature will be removed in v6.0.0. See https://github.com/optuna/optuna/releases/tag/v3.0.0. Use :func:`~optuna.trial.Trial.suggest_float` instead.
  "learning_rate": trial.suggest_loguniform("learning_rate", 0.001, 0.05),
/Users/kevinmaikjablonka/git/kjappelbaum/gptchem/src/gptchem/baselines/xgboost.py:39: FutureWarning: suggest_loguniform has been deprecated in v3.0.0. This feature will be removed in v6.0.0. See https://github.com/optuna/optuna/releases/tag/v3.0.0. Use :func:`~optuna.trial.Trial.suggest_float` instead.
  "colsample_bytree": trial.suggest_loguniform(
/Users/kevinmaikjablonka/git/kjappelbaum/gptchem/src/gptchem/baselines/xgboost.py:42: FutureWarning: suggest_loguniform has been deprecated in v3.0.0. This feature will be removed in v6.0.0. See https://github.com/optuna/optuna/releases/tag/v3.0.0. Use :func:`~optuna.trial.Trial.suggest_float` instead.
  "subsample": trial.suggest_loguniform("subsample", 0.00001, 1),
/Users/kevinmaikjablonka/git/kjappelbaum/gptchem/src/gptchem/baselines/xgboost.py:43: FutureWarning: suggest_loguniform has been deprecated in v3.0.0. This feature will be removed in v6.0.0. See https://github.com/optuna/optuna/releases/tag/v3.0.0. Use :func:`~optuna.trial.Trial.suggest_float` instead.
  "alpha": trial.suggest_loguniform("alpha", 1e-8, 10.0),
/Users/kevinmaikjablonka/git/kjappelbaum/gptchem/src/gptchem/baselines/xgboost.py:44: FutureWarning: suggest_loguniform has been deprecated in v3.0.0. This feature will be removed in v6.0.0. See https://github.com/optuna/optuna/releases/tag/v3.0.0. Use :func:`~optuna.trial.Trial.suggest_float` instead.
  "lambda": trial.suggest_loguniform("lambda", 1e-8, 10.0),
[32m[I 2023-01-13 00:30:50,052][0m Trial 99 finished with value: 0.39999999999999997 and parameters: {'n_estimators': 1691, 'max_depth': 34, 'learning_rate': 0.001177800123802732, 'colsample_bytree': 0.28116400137308434, 'subsample': 0.00019901189225529075, 'alpha': 0.00016049988522611437, 'lambda': 8.455659927165622e-05}. Best is trial 0 with value: 0.39999999999999997.[0m
[32m[I 2023-01-13 00:33:45,509][0m A new study created in memory with name: no-name-998ff2d5-b108-4d52-aa1d-bb65dccbd7fb[0m
[32m[I 2023-01-13 00:33:51,561][0m Trial 0 finished with value: 0.2 and parameters: {'n_estimators': 2746, 'max_depth': 93, 'min_samples_split': 78, 'min_samples_leaf': 70, 'criterion': 'entropy'}. Best is trial 0 with value: 0.2.[0m
[32m[I 2023-01-13 00:33:56,380][0m Trial 1 finished with value: 0.2 and parameters: {'n_estimators': 2190, 'max_depth': 115, 'min_samples_split': 124, 'min_samples_leaf': 50, 'criterion': 'gini'}. Best is trial 0 with value: 0.2.[0m
[32m[I 2023-01-13 00:34:02,751][0m Trial 2 finished with value: 0.2 and parameters: {'n_estimators': 2842, 'max_depth': 119, 'min_samples_split': 11, 'min_samples_leaf': 12, 'criterion': 'entropy'}. Best is trial 0 with value: 0.2.[0m
[32m[I 2023-01-13 00:34:11,407][0m Trial 3 finished with value: 0.2 and parameters: {'n_estimators': 3892, 'max_depth': 112, 'min_samples_split': 126, 'min_samples_leaf': 103, 'criterion': 'entropy'}. Best is trial 0 with value: 0.2.[0m
[32m[I 2023-01-13 00:34:12,722][0m Trial 4 finished with value: 0.2 and parameters: {'n_estimators': 595, 'max_depth': 83, 'min_samples_split': 20, 'min_samples_leaf': 121, 'criterion': 'gini'}. Best is trial 0 with value: 0.2.[0m
[32m[I 2023-01-13 00:34:15,738][0m Trial 5 finished with value: 0.2 and parameters: {'n_estimators': 1325, 'max_depth': 100, 'min_samples_split': 59, 'min_samples_leaf': 73, 'criterion': 'entropy'}. Best is trial 0 with value: 0.2.[0m
[32m[I 2023-01-13 00:34:22,488][0m Trial 6 finished with value: 0.2 and parameters: {'n_estimators': 3062, 'max_depth': 81, 'min_samples_split': 121, 'min_samples_leaf': 88, 'criterion': 'entropy'}. Best is trial 0 with value: 0.2.[0m
[32m[I 2023-01-13 00:34:30,276][0m Trial 7 finished with value: 0.2 and parameters: {'n_estimators': 3490, 'max_depth': 11, 'min_samples_split': 86, 'min_samples_leaf': 86, 'criterion': 'gini'}. Best is trial 0 with value: 0.2.[0m
[32m[I 2023-01-13 00:34:33,749][0m Trial 8 finished with value: 0.2 and parameters: {'n_estimators': 1580, 'max_depth': 49, 'min_samples_split': 74, 'min_samples_leaf': 57, 'criterion': 'gini'}. Best is trial 0 with value: 0.2.[0m
[32m[I 2023-01-13 00:34:36,059][0m Trial 9 finished with value: 0.2 and parameters: {'n_estimators': 1047, 'max_depth': 24, 'min_samples_split': 84, 'min_samples_leaf': 33, 'criterion': 'gini'}. Best is trial 0 with value: 0.2.[0m
[32m[I 2023-01-13 00:34:46,461][0m Trial 10 finished with value: 0.2 and parameters: {'n_estimators': 4704, 'max_depth': 52, 'min_samples_split': 41, 'min_samples_leaf': 3, 'criterion': 'entropy'}. Best is trial 0 with value: 0.2.[0m
[32m[I 2023-01-13 00:34:51,104][0m Trial 11 finished with value: 0.2 and parameters: {'n_estimators': 2191, 'max_depth': 92, 'min_samples_split': 99, 'min_samples_leaf': 48, 'criterion': 'gini'}. Best is trial 0 with value: 0.2.[0m
[32m[I 2023-01-13 00:34:55,760][0m Trial 12 finished with value: 0.2 and parameters: {'n_estimators': 2200, 'max_depth': 126, 'min_samples_split': 106, 'min_samples_leaf': 36, 'criterion': 'entropy'}. Best is trial 0 with value: 0.2.[0m
[32m[I 2023-01-13 00:34:55,870][0m Trial 13 finished with value: 0.2 and parameters: {'n_estimators': 48, 'max_depth': 68, 'min_samples_split': 51, 'min_samples_leaf': 69, 'criterion': 'gini'}. Best is trial 0 with value: 0.2.[0m
[32m[I 2023-01-13 00:35:00,661][0m Trial 14 finished with value: 0.2 and parameters: {'n_estimators': 2211, 'max_depth': 103, 'min_samples_split': 104, 'min_samples_leaf': 30, 'criterion': 'entropy'}. Best is trial 0 with value: 0.2.[0m
[32m[I 2023-01-13 00:35:09,190][0m Trial 15 finished with value: 0.2 and parameters: {'n_estimators': 3989, 'max_depth': 73, 'min_samples_split': 33, 'min_samples_leaf': 51, 'criterion': 'gini'}. Best is trial 0 with value: 0.2.[0m
[32m[I 2023-01-13 00:35:12,887][0m Trial 16 finished with value: 0.2 and parameters: {'n_estimators': 1685, 'max_depth': 128, 'min_samples_split': 74, 'min_samples_leaf': 83, 'criterion': 'entropy'}. Best is trial 0 with value: 0.2.[0m
[32m[I 2023-01-13 00:35:18,348][0m Trial 17 finished with value: 0.2 and parameters: {'n_estimators': 2576, 'max_depth': 102, 'min_samples_split': 104, 'min_samples_leaf': 26, 'criterion': 'entropy'}. Best is trial 0 with value: 0.2.[0m
[32m[I 2023-01-13 00:35:27,939][0m Trial 18 finished with value: 0.2 and parameters: {'n_estimators': 4363, 'max_depth': 63, 'min_samples_split': 33, 'min_samples_leaf': 108, 'criterion': 'gini'}. Best is trial 0 with value: 0.2.[0m
[32m[I 2023-01-13 00:35:31,623][0m Trial 19 finished with value: 0.2 and parameters: {'n_estimators': 1722, 'max_depth': 128, 'min_samples_split': 72, 'min_samples_leaf': 79, 'criterion': 'entropy'}. Best is trial 0 with value: 0.2.[0m
[32m[I 2023-01-13 00:35:38,399][0m Trial 20 finished with value: 0.2 and parameters: {'n_estimators': 3188, 'max_depth': 92, 'min_samples_split': 88, 'min_samples_leaf': 19, 'criterion': 'entropy'}. Best is trial 0 with value: 0.2.[0m
[32m[I 2023-01-13 00:35:48,665][0m Trial 21 finished with value: 0.2 and parameters: {'n_estimators': 4773, 'max_depth': 46, 'min_samples_split': 57, 'min_samples_leaf': 127, 'criterion': 'entropy'}. Best is trial 0 with value: 0.2.[0m
[32m[I 2023-01-13 00:35:57,759][0m Trial 22 finished with value: 0.2 and parameters: {'n_estimators': 4251, 'max_depth': 61, 'min_samples_split': 42, 'min_samples_leaf': 105, 'criterion': 'entropy'}. Best is trial 0 with value: 0.2.[0m
[32m[I 2023-01-13 00:36:05,286][0m Trial 23 finished with value: 0.2 and parameters: {'n_estimators': 3496, 'max_depth': 90, 'min_samples_split': 92, 'min_samples_leaf': 77, 'criterion': 'entropy'}. Best is trial 0 with value: 0.2.[0m
[32m[I 2023-01-13 00:36:16,041][0m Trial 24 finished with value: 0.2 and parameters: {'n_estimators': 4947, 'max_depth': 35, 'min_samples_split': 62, 'min_samples_leaf': 17, 'criterion': 'entropy'}. Best is trial 0 with value: 0.2.[0m
[32m[I 2023-01-13 00:36:25,855][0m Trial 25 finished with value: 0.2 and parameters: {'n_estimators': 4485, 'max_depth': 52, 'min_samples_split': 49, 'min_samples_leaf': 127, 'criterion': 'entropy'}. Best is trial 0 with value: 0.2.[0m
[32m[I 2023-01-13 00:36:33,845][0m Trial 26 finished with value: 0.2 and parameters: {'n_estimators': 3608, 'max_depth': 78, 'min_samples_split': 93, 'min_samples_leaf': 98, 'criterion': 'entropy'}. Best is trial 0 with value: 0.2.[0m
[32m[I 2023-01-13 00:36:41,257][0m Trial 27 finished with value: 0.2 and parameters: {'n_estimators': 3441, 'max_depth': 35, 'min_samples_split': 66, 'min_samples_leaf': 64, 'criterion': 'entropy'}. Best is trial 0 with value: 0.2.[0m
[32m[I 2023-01-13 00:36:51,882][0m Trial 28 finished with value: 0.2 and parameters: {'n_estimators': 4964, 'max_depth': 34, 'min_samples_split': 48, 'min_samples_leaf': 114, 'criterion': 'entropy'}. Best is trial 0 with value: 0.2.[0m
[32m[I 2023-01-13 00:36:59,822][0m Trial 29 finished with value: 0.2 and parameters: {'n_estimators': 3751, 'max_depth': 76, 'min_samples_split': 112, 'min_samples_leaf': 96, 'criterion': 'entropy'}. Best is trial 0 with value: 0.2.[0m
[32m[I 2023-01-13 00:37:05,714][0m Trial 30 finished with value: 0.2 and parameters: {'n_estimators': 2719, 'max_depth': 22, 'min_samples_split': 80, 'min_samples_leaf': 56, 'criterion': 'entropy'}. Best is trial 0 with value: 0.2.[0m
[32m[I 2023-01-13 00:37:12,855][0m Trial 31 finished with value: 0.2 and parameters: {'n_estimators': 3360, 'max_depth': 38, 'min_samples_split': 67, 'min_samples_leaf': 114, 'criterion': 'entropy'}. Best is trial 0 with value: 0.2.[0m
[32m[I 2023-01-13 00:37:21,372][0m Trial 32 finished with value: 0.2 and parameters: {'n_estimators': 3875, 'max_depth': 10, 'min_samples_split': 113, 'min_samples_leaf': 97, 'criterion': 'entropy'}. Best is trial 0 with value: 0.2.[0m
[32m[I 2023-01-13 00:37:26,992][0m Trial 33 finished with value: 0.2 and parameters: {'n_estimators': 2653, 'max_depth': 18, 'min_samples_split': 80, 'min_samples_leaf': 62, 'criterion': 'entropy'}. Best is trial 0 with value: 0.2.[0m
[32m[I 2023-01-13 00:37:33,422][0m Trial 34 finished with value: 0.2 and parameters: {'n_estimators': 2980, 'max_depth': 4, 'min_samples_split': 113, 'min_samples_leaf': 93, 'criterion': 'entropy'}. Best is trial 0 with value: 0.2.[0m
[32m[I 2023-01-13 00:37:36,999][0m Trial 35 finished with value: 0.2 and parameters: {'n_estimators': 1673, 'max_depth': 114, 'min_samples_split': 72, 'min_samples_leaf': 40, 'criterion': 'entropy'}. Best is trial 0 with value: 0.2.[0m
[32m[I 2023-01-13 00:37:46,203][0m Trial 36 finished with value: 0.2 and parameters: {'n_estimators': 4274, 'max_depth': 60, 'min_samples_split': 11, 'min_samples_leaf': 128, 'criterion': 'entropy'}. Best is trial 0 with value: 0.2.[0m
[32m[I 2023-01-13 00:37:55,112][0m Trial 37 finished with value: 0.2 and parameters: {'n_estimators': 4199, 'max_depth': 91, 'min_samples_split': 25, 'min_samples_leaf': 120, 'criterion': 'entropy'}. Best is trial 0 with value: 0.2.[0m
[32m[I 2023-01-13 00:38:05,178][0m Trial 38 finished with value: 0.2 and parameters: {'n_estimators': 4629, 'max_depth': 56, 'min_samples_split': 57, 'min_samples_leaf': 73, 'criterion': 'entropy'}. Best is trial 0 with value: 0.2.[0m
[32m[I 2023-01-13 00:38:14,018][0m Trial 39 finished with value: 0.2 and parameters: {'n_estimators': 4072, 'max_depth': 43, 'min_samples_split': 37, 'min_samples_leaf': 106, 'criterion': 'entropy'}. Best is trial 0 with value: 0.2.[0m
[32m[I 2023-01-13 00:38:20,798][0m Trial 40 finished with value: 0.2 and parameters: {'n_estimators': 3190, 'max_depth': 86, 'min_samples_split': 62, 'min_samples_leaf': 80, 'criterion': 'entropy'}. Best is trial 0 with value: 0.2.[0m
[32m[I 2023-01-13 00:38:30,132][0m Trial 41 finished with value: 0.2 and parameters: {'n_estimators': 4361, 'max_depth': 55, 'min_samples_split': 48, 'min_samples_leaf': 113, 'criterion': 'entropy'}. Best is trial 0 with value: 0.2.[0m
[32m[I 2023-01-13 00:38:38,134][0m Trial 42 finished with value: 0.2 and parameters: {'n_estimators': 3730, 'max_depth': 80, 'min_samples_split': 95, 'min_samples_leaf': 90, 'criterion': 'entropy'}. Best is trial 0 with value: 0.2.[0m
[32m[I 2023-01-13 00:38:48,855][0m Trial 43 finished with value: 0.2 and parameters: {'n_estimators': 4997, 'max_depth': 109, 'min_samples_split': 93, 'min_samples_leaf': 69, 'criterion': 'entropy'}. Best is trial 0 with value: 0.2.[0m
[32m[I 2023-01-13 00:38:58,521][0m Trial 44 finished with value: 0.2 and parameters: {'n_estimators': 4543, 'max_depth': 30, 'min_samples_split': 67, 'min_samples_leaf': 8, 'criterion': 'entropy'}. Best is trial 0 with value: 0.2.[0m
[32m[I 2023-01-13 00:39:06,112][0m Trial 45 finished with value: 0.2 and parameters: {'n_estimators': 3516, 'max_depth': 41, 'min_samples_split': 81, 'min_samples_leaf': 42, 'criterion': 'entropy'}. Best is trial 0 with value: 0.2.[0m
[32m[I 2023-01-13 00:39:12,430][0m Trial 46 finished with value: 0.2 and parameters: {'n_estimators': 2917, 'max_depth': 70, 'min_samples_split': 44, 'min_samples_leaf': 119, 'criterion': 'gini'}. Best is trial 0 with value: 0.2.[0m
[32m[I 2023-01-13 00:39:20,240][0m Trial 47 finished with value: 0.2 and parameters: {'n_estimators': 3681, 'max_depth': 31, 'min_samples_split': 53, 'min_samples_leaf': 99, 'criterion': 'entropy'}. Best is trial 0 with value: 0.2.[0m
[32m[I 2023-01-13 00:39:25,408][0m Trial 48 finished with value: 0.2 and parameters: {'n_estimators': 2423, 'max_depth': 75, 'min_samples_split': 128, 'min_samples_leaf': 97, 'criterion': 'entropy'}. Best is trial 0 with value: 0.2.[0m
[32m[I 2023-01-13 00:39:32,634][0m Trial 49 finished with value: 0.2 and parameters: {'n_estimators': 3279, 'max_depth': 79, 'min_samples_split': 121, 'min_samples_leaf': 64, 'criterion': 'gini'}. Best is trial 0 with value: 0.2.[0m
[32m[I 2023-01-13 00:39:36,837][0m Trial 50 finished with value: 0.2 and parameters: {'n_estimators': 1979, 'max_depth': 25, 'min_samples_split': 76, 'min_samples_leaf': 53, 'criterion': 'entropy'}. Best is trial 0 with value: 0.2.[0m
[32m[I 2023-01-13 00:39:42,801][0m Trial 51 finished with value: 0.2 and parameters: {'n_estimators': 2758, 'max_depth': 20, 'min_samples_split': 3, 'min_samples_leaf': 57, 'criterion': 'entropy'}. Best is trial 0 with value: 0.2.[0m
[32m[I 2023-01-13 00:39:50,955][0m Trial 52 finished with value: 0.2 and parameters: {'n_estimators': 3840, 'max_depth': 13, 'min_samples_split': 115, 'min_samples_leaf': 115, 'criterion': 'entropy'}. Best is trial 0 with value: 0.2.[0m
[32m[I 2023-01-13 00:39:59,433][0m Trial 53 finished with value: 0.2 and parameters: {'n_estimators': 3955, 'max_depth': 13, 'min_samples_split': 111, 'min_samples_leaf': 111, 'criterion': 'entropy'}. Best is trial 0 with value: 0.2.[0m
[32m[I 2023-01-13 00:40:05,506][0m Trial 54 finished with value: 0.2 and parameters: {'n_estimators': 2833, 'max_depth': 4, 'min_samples_split': 80, 'min_samples_leaf': 60, 'criterion': 'entropy'}. Best is trial 0 with value: 0.2.[0m
[32m[I 2023-01-13 00:40:10,706][0m Trial 55 finished with value: 0.2 and parameters: {'n_estimators': 2465, 'max_depth': 17, 'min_samples_split': 101, 'min_samples_leaf': 46, 'criterion': 'entropy'}. Best is trial 0 with value: 0.2.[0m
[32m[I 2023-01-13 00:40:16,318][0m Trial 56 finished with value: 0.2 and parameters: {'n_estimators': 2650, 'max_depth': 5, 'min_samples_split': 87, 'min_samples_leaf': 84, 'criterion': 'gini'}. Best is trial 0 with value: 0.2.[0m
[32m[I 2023-01-13 00:40:20,660][0m Trial 57 finished with value: 0.2 and parameters: {'n_estimators': 2007, 'max_depth': 9, 'min_samples_split': 121, 'min_samples_leaf': 93, 'criterion': 'entropy'}. Best is trial 0 with value: 0.2.[0m
[32m[I 2023-01-13 00:40:22,953][0m Trial 58 finished with value: 0.2 and parameters: {'n_estimators': 1074, 'max_depth': 108, 'min_samples_split': 73, 'min_samples_leaf': 87, 'criterion': 'entropy'}. Best is trial 0 with value: 0.2.[0m
[32m[I 2023-01-13 00:40:29,253][0m Trial 59 finished with value: 0.2 and parameters: {'n_estimators': 2974, 'max_depth': 119, 'min_samples_split': 68, 'min_samples_leaf': 36, 'criterion': 'entropy'}. Best is trial 0 with value: 0.2.[0m
[32m[I 2023-01-13 00:40:30,417][0m Trial 60 finished with value: 0.2 and parameters: {'n_estimators': 548, 'max_depth': 96, 'min_samples_split': 109, 'min_samples_leaf': 43, 'criterion': 'entropy'}. Best is trial 0 with value: 0.2.[0m
[32m[I 2023-01-13 00:40:39,191][0m Trial 61 finished with value: 0.2 and parameters: {'n_estimators': 4107, 'max_depth': 118, 'min_samples_split': 18, 'min_samples_leaf': 121, 'criterion': 'entropy'}. Best is trial 0 with value: 0.2.[0m
