[32m[I 2023-01-13 00:07:30,252][0m Trial 94 finished with value: 0.39999999999999997 and parameters: {'n_estimators': 9537, 'max_depth': 44, 'learning_rate': 0.0033579531871768186, 'colsample_bytree': 0.24701178149487515, 'subsample': 0.0005251373019432076, 'alpha': 0.0027801641524163017, 'lambda': 4.758318883871578e-05}. Best is trial 0 with value: 0.39999999999999997.[0m
/Users/kevinmaikjablonka/git/kjappelbaum/gptchem/src/gptchem/baselines/xgboost.py:38: FutureWarning: suggest_loguniform has been deprecated in v3.0.0. This feature will be removed in v6.0.0. See https://github.com/optuna/optuna/releases/tag/v3.0.0. Use :func:`~optuna.trial.Trial.suggest_float` instead.
  "learning_rate": trial.suggest_loguniform("learning_rate", 0.001, 0.05),
/Users/kevinmaikjablonka/git/kjappelbaum/gptchem/src/gptchem/baselines/xgboost.py:39: FutureWarning: suggest_loguniform has been deprecated in v3.0.0. This feature will be removed in v6.0.0. See https://github.com/optuna/optuna/releases/tag/v3.0.0. Use :func:`~optuna.trial.Trial.suggest_float` instead.
  "colsample_bytree": trial.suggest_loguniform(
/Users/kevinmaikjablonka/git/kjappelbaum/gptchem/src/gptchem/baselines/xgboost.py:42: FutureWarning: suggest_loguniform has been deprecated in v3.0.0. This feature will be removed in v6.0.0. See https://github.com/optuna/optuna/releases/tag/v3.0.0. Use :func:`~optuna.trial.Trial.suggest_float` instead.
  "subsample": trial.suggest_loguniform("subsample", 0.00001, 1),
/Users/kevinmaikjablonka/git/kjappelbaum/gptchem/src/gptchem/baselines/xgboost.py:43: FutureWarning: suggest_loguniform has been deprecated in v3.0.0. This feature will be removed in v6.0.0. See https://github.com/optuna/optuna/releases/tag/v3.0.0. Use :func:`~optuna.trial.Trial.suggest_float` instead.
  "alpha": trial.suggest_loguniform("alpha", 1e-8, 10.0),
/Users/kevinmaikjablonka/git/kjappelbaum/gptchem/src/gptchem/baselines/xgboost.py:44: FutureWarning: suggest_loguniform has been deprecated in v3.0.0. This feature will be removed in v6.0.0. See https://github.com/optuna/optuna/releases/tag/v3.0.0. Use :func:`~optuna.trial.Trial.suggest_float` instead.
  "lambda": trial.suggest_loguniform("lambda", 1e-8, 10.0),
[32m[I 2023-01-13 00:07:30,974][0m Trial 95 finished with value: 0.39999999999999997 and parameters: {'n_estimators': 1557, 'max_depth': 47, 'learning_rate': 0.003647047808012866, 'colsample_bytree': 0.23592493176556353, 'subsample': 0.0001467426739071682, 'alpha': 0.0002884727652178116, 'lambda': 3.0741325446426073e-06}. Best is trial 0 with value: 0.39999999999999997.[0m
/Users/kevinmaikjablonka/git/kjappelbaum/gptchem/src/gptchem/baselines/xgboost.py:38: FutureWarning: suggest_loguniform has been deprecated in v3.0.0. This feature will be removed in v6.0.0. See https://github.com/optuna/optuna/releases/tag/v3.0.0. Use :func:`~optuna.trial.Trial.suggest_float` instead.
  "learning_rate": trial.suggest_loguniform("learning_rate", 0.001, 0.05),
/Users/kevinmaikjablonka/git/kjappelbaum/gptchem/src/gptchem/baselines/xgboost.py:39: FutureWarning: suggest_loguniform has been deprecated in v3.0.0. This feature will be removed in v6.0.0. See https://github.com/optuna/optuna/releases/tag/v3.0.0. Use :func:`~optuna.trial.Trial.suggest_float` instead.
  "colsample_bytree": trial.suggest_loguniform(
/Users/kevinmaikjablonka/git/kjappelbaum/gptchem/src/gptchem/baselines/xgboost.py:42: FutureWarning: suggest_loguniform has been deprecated in v3.0.0. This feature will be removed in v6.0.0. See https://github.com/optuna/optuna/releases/tag/v3.0.0. Use :func:`~optuna.trial.Trial.suggest_float` instead.
  "subsample": trial.suggest_loguniform("subsample", 0.00001, 1),
/Users/kevinmaikjablonka/git/kjappelbaum/gptchem/src/gptchem/baselines/xgboost.py:43: FutureWarning: suggest_loguniform has been deprecated in v3.0.0. This feature will be removed in v6.0.0. See https://github.com/optuna/optuna/releases/tag/v3.0.0. Use :func:`~optuna.trial.Trial.suggest_float` instead.
  "alpha": trial.suggest_loguniform("alpha", 1e-8, 10.0),
/Users/kevinmaikjablonka/git/kjappelbaum/gptchem/src/gptchem/baselines/xgboost.py:44: FutureWarning: suggest_loguniform has been deprecated in v3.0.0. This feature will be removed in v6.0.0. See https://github.com/optuna/optuna/releases/tag/v3.0.0. Use :func:`~optuna.trial.Trial.suggest_float` instead.
  "lambda": trial.suggest_loguniform("lambda", 1e-8, 10.0),
[32m[I 2023-01-13 00:07:31,991][0m Trial 96 finished with value: 0.39999999999999997 and parameters: {'n_estimators': 2211, 'max_depth': 50, 'learning_rate': 0.0026616524752021355, 'colsample_bytree': 0.22060286810655705, 'subsample': 0.0002872089345263342, 'alpha': 0.0014642378411732215, 'lambda': 4.0243950900711254e-05}. Best is trial 0 with value: 0.39999999999999997.[0m
/Users/kevinmaikjablonka/git/kjappelbaum/gptchem/src/gptchem/baselines/xgboost.py:38: FutureWarning: suggest_loguniform has been deprecated in v3.0.0. This feature will be removed in v6.0.0. See https://github.com/optuna/optuna/releases/tag/v3.0.0. Use :func:`~optuna.trial.Trial.suggest_float` instead.
  "learning_rate": trial.suggest_loguniform("learning_rate", 0.001, 0.05),
/Users/kevinmaikjablonka/git/kjappelbaum/gptchem/src/gptchem/baselines/xgboost.py:39: FutureWarning: suggest_loguniform has been deprecated in v3.0.0. This feature will be removed in v6.0.0. See https://github.com/optuna/optuna/releases/tag/v3.0.0. Use :func:`~optuna.trial.Trial.suggest_float` instead.
  "colsample_bytree": trial.suggest_loguniform(
/Users/kevinmaikjablonka/git/kjappelbaum/gptchem/src/gptchem/baselines/xgboost.py:42: FutureWarning: suggest_loguniform has been deprecated in v3.0.0. This feature will be removed in v6.0.0. See https://github.com/optuna/optuna/releases/tag/v3.0.0. Use :func:`~optuna.trial.Trial.suggest_float` instead.
  "subsample": trial.suggest_loguniform("subsample", 0.00001, 1),
/Users/kevinmaikjablonka/git/kjappelbaum/gptchem/src/gptchem/baselines/xgboost.py:43: FutureWarning: suggest_loguniform has been deprecated in v3.0.0. This feature will be removed in v6.0.0. See https://github.com/optuna/optuna/releases/tag/v3.0.0. Use :func:`~optuna.trial.Trial.suggest_float` instead.
  "alpha": trial.suggest_loguniform("alpha", 1e-8, 10.0),
/Users/kevinmaikjablonka/git/kjappelbaum/gptchem/src/gptchem/baselines/xgboost.py:44: FutureWarning: suggest_loguniform has been deprecated in v3.0.0. This feature will be removed in v6.0.0. See https://github.com/optuna/optuna/releases/tag/v3.0.0. Use :func:`~optuna.trial.Trial.suggest_float` instead.
  "lambda": trial.suggest_loguniform("lambda", 1e-8, 10.0),
[32m[I 2023-01-13 00:07:32,288][0m Trial 97 finished with value: 0.39999999999999997 and parameters: {'n_estimators': 535, 'max_depth': 39, 'learning_rate': 0.0010553451155768147, 'colsample_bytree': 0.26114011795955083, 'subsample': 0.0010321688998296114, 'alpha': 0.00027591093552626646, 'lambda': 9.792934608726469e-06}. Best is trial 0 with value: 0.39999999999999997.[0m
/Users/kevinmaikjablonka/git/kjappelbaum/gptchem/src/gptchem/baselines/xgboost.py:38: FutureWarning: suggest_loguniform has been deprecated in v3.0.0. This feature will be removed in v6.0.0. See https://github.com/optuna/optuna/releases/tag/v3.0.0. Use :func:`~optuna.trial.Trial.suggest_float` instead.
  "learning_rate": trial.suggest_loguniform("learning_rate", 0.001, 0.05),
/Users/kevinmaikjablonka/git/kjappelbaum/gptchem/src/gptchem/baselines/xgboost.py:39: FutureWarning: suggest_loguniform has been deprecated in v3.0.0. This feature will be removed in v6.0.0. See https://github.com/optuna/optuna/releases/tag/v3.0.0. Use :func:`~optuna.trial.Trial.suggest_float` instead.
  "colsample_bytree": trial.suggest_loguniform(
/Users/kevinmaikjablonka/git/kjappelbaum/gptchem/src/gptchem/baselines/xgboost.py:42: FutureWarning: suggest_loguniform has been deprecated in v3.0.0. This feature will be removed in v6.0.0. See https://github.com/optuna/optuna/releases/tag/v3.0.0. Use :func:`~optuna.trial.Trial.suggest_float` instead.
  "subsample": trial.suggest_loguniform("subsample", 0.00001, 1),
/Users/kevinmaikjablonka/git/kjappelbaum/gptchem/src/gptchem/baselines/xgboost.py:43: FutureWarning: suggest_loguniform has been deprecated in v3.0.0. This feature will be removed in v6.0.0. See https://github.com/optuna/optuna/releases/tag/v3.0.0. Use :func:`~optuna.trial.Trial.suggest_float` instead.
  "alpha": trial.suggest_loguniform("alpha", 1e-8, 10.0),
/Users/kevinmaikjablonka/git/kjappelbaum/gptchem/src/gptchem/baselines/xgboost.py:44: FutureWarning: suggest_loguniform has been deprecated in v3.0.0. This feature will be removed in v6.0.0. See https://github.com/optuna/optuna/releases/tag/v3.0.0. Use :func:`~optuna.trial.Trial.suggest_float` instead.
  "lambda": trial.suggest_loguniform("lambda", 1e-8, 10.0),
[32m[I 2023-01-13 00:07:32,410][0m Trial 98 finished with value: 0.39999999999999997 and parameters: {'n_estimators': 243, 'max_depth': 37, 'learning_rate': 0.0015695954973494594, 'colsample_bytree': 0.2564178343225274, 'subsample': 0.0005484585607188166, 'alpha': 0.035609948143923424, 'lambda': 1.5773475760831745e-05}. Best is trial 0 with value: 0.39999999999999997.[0m
/Users/kevinmaikjablonka/git/kjappelbaum/gptchem/src/gptchem/baselines/xgboost.py:38: FutureWarning: suggest_loguniform has been deprecated in v3.0.0. This feature will be removed in v6.0.0. See https://github.com/optuna/optuna/releases/tag/v3.0.0. Use :func:`~optuna.trial.Trial.suggest_float` instead.
  "learning_rate": trial.suggest_loguniform("learning_rate", 0.001, 0.05),
/Users/kevinmaikjablonka/git/kjappelbaum/gptchem/src/gptchem/baselines/xgboost.py:39: FutureWarning: suggest_loguniform has been deprecated in v3.0.0. This feature will be removed in v6.0.0. See https://github.com/optuna/optuna/releases/tag/v3.0.0. Use :func:`~optuna.trial.Trial.suggest_float` instead.
  "colsample_bytree": trial.suggest_loguniform(
/Users/kevinmaikjablonka/git/kjappelbaum/gptchem/src/gptchem/baselines/xgboost.py:42: FutureWarning: suggest_loguniform has been deprecated in v3.0.0. This feature will be removed in v6.0.0. See https://github.com/optuna/optuna/releases/tag/v3.0.0. Use :func:`~optuna.trial.Trial.suggest_float` instead.
  "subsample": trial.suggest_loguniform("subsample", 0.00001, 1),
/Users/kevinmaikjablonka/git/kjappelbaum/gptchem/src/gptchem/baselines/xgboost.py:43: FutureWarning: suggest_loguniform has been deprecated in v3.0.0. This feature will be removed in v6.0.0. See https://github.com/optuna/optuna/releases/tag/v3.0.0. Use :func:`~optuna.trial.Trial.suggest_float` instead.
  "alpha": trial.suggest_loguniform("alpha", 1e-8, 10.0),
/Users/kevinmaikjablonka/git/kjappelbaum/gptchem/src/gptchem/baselines/xgboost.py:44: FutureWarning: suggest_loguniform has been deprecated in v3.0.0. This feature will be removed in v6.0.0. See https://github.com/optuna/optuna/releases/tag/v3.0.0. Use :func:`~optuna.trial.Trial.suggest_float` instead.
  "lambda": trial.suggest_loguniform("lambda", 1e-8, 10.0),
[32m[I 2023-01-13 00:07:33,207][0m Trial 99 finished with value: 0.39999999999999997 and parameters: {'n_estimators': 1691, 'max_depth': 34, 'learning_rate': 0.001177800123802732, 'colsample_bytree': 0.28116400137308434, 'subsample': 0.00019901189225529075, 'alpha': 0.00016049988522611437, 'lambda': 8.455659927165622e-05}. Best is trial 0 with value: 0.39999999999999997.[0m
[32m[I 2023-01-13 00:09:26,524][0m A new study created in memory with name: no-name-48206e6b-2a3d-4e6d-aca3-d6487144c3bc[0m
[32m[I 2023-01-13 00:09:32,387][0m Trial 0 finished with value: 0.2 and parameters: {'n_estimators': 2746, 'max_depth': 93, 'min_samples_split': 78, 'min_samples_leaf': 70, 'criterion': 'entropy'}. Best is trial 0 with value: 0.2.[0m
[32m[I 2023-01-13 00:09:37,119][0m Trial 1 finished with value: 0.2 and parameters: {'n_estimators': 2190, 'max_depth': 115, 'min_samples_split': 124, 'min_samples_leaf': 50, 'criterion': 'gini'}. Best is trial 0 with value: 0.2.[0m
[32m[I 2023-01-13 00:09:43,147][0m Trial 2 finished with value: 0.2 and parameters: {'n_estimators': 2842, 'max_depth': 119, 'min_samples_split': 11, 'min_samples_leaf': 12, 'criterion': 'entropy'}. Best is trial 0 with value: 0.2.[0m
[32m[I 2023-01-13 00:09:51,475][0m Trial 3 finished with value: 0.2 and parameters: {'n_estimators': 3892, 'max_depth': 112, 'min_samples_split': 126, 'min_samples_leaf': 103, 'criterion': 'entropy'}. Best is trial 0 with value: 0.2.[0m
[32m[I 2023-01-13 00:09:52,744][0m Trial 4 finished with value: 0.2 and parameters: {'n_estimators': 595, 'max_depth': 83, 'min_samples_split': 20, 'min_samples_leaf': 121, 'criterion': 'gini'}. Best is trial 0 with value: 0.2.[0m
[32m[I 2023-01-13 00:09:55,558][0m Trial 5 finished with value: 0.2 and parameters: {'n_estimators': 1325, 'max_depth': 100, 'min_samples_split': 59, 'min_samples_leaf': 73, 'criterion': 'entropy'}. Best is trial 0 with value: 0.2.[0m
[32m[I 2023-01-13 00:10:02,059][0m Trial 6 finished with value: 0.2 and parameters: {'n_estimators': 3062, 'max_depth': 81, 'min_samples_split': 121, 'min_samples_leaf': 88, 'criterion': 'entropy'}. Best is trial 0 with value: 0.2.[0m
[32m[I 2023-01-13 00:10:09,535][0m Trial 7 finished with value: 0.2 and parameters: {'n_estimators': 3490, 'max_depth': 11, 'min_samples_split': 86, 'min_samples_leaf': 86, 'criterion': 'gini'}. Best is trial 0 with value: 0.2.[0m
[32m[I 2023-01-13 00:10:12,890][0m Trial 8 finished with value: 0.2 and parameters: {'n_estimators': 1580, 'max_depth': 49, 'min_samples_split': 74, 'min_samples_leaf': 57, 'criterion': 'gini'}. Best is trial 0 with value: 0.2.[0m
[32m[I 2023-01-13 00:10:15,108][0m Trial 9 finished with value: 0.2 and parameters: {'n_estimators': 1047, 'max_depth': 24, 'min_samples_split': 84, 'min_samples_leaf': 33, 'criterion': 'gini'}. Best is trial 0 with value: 0.2.[0m
[32m[I 2023-01-13 00:10:25,217][0m Trial 10 finished with value: 0.2 and parameters: {'n_estimators': 4704, 'max_depth': 52, 'min_samples_split': 41, 'min_samples_leaf': 3, 'criterion': 'entropy'}. Best is trial 0 with value: 0.2.[0m
[32m[I 2023-01-13 00:10:29,879][0m Trial 11 finished with value: 0.2 and parameters: {'n_estimators': 2191, 'max_depth': 92, 'min_samples_split': 99, 'min_samples_leaf': 48, 'criterion': 'gini'}. Best is trial 0 with value: 0.2.[0m
[32m[I 2023-01-13 00:10:34,548][0m Trial 12 finished with value: 0.2 and parameters: {'n_estimators': 2200, 'max_depth': 126, 'min_samples_split': 106, 'min_samples_leaf': 36, 'criterion': 'entropy'}. Best is trial 0 with value: 0.2.[0m
[32m[I 2023-01-13 00:10:34,658][0m Trial 13 finished with value: 0.2 and parameters: {'n_estimators': 48, 'max_depth': 68, 'min_samples_split': 51, 'min_samples_leaf': 69, 'criterion': 'gini'}. Best is trial 0 with value: 0.2.[0m
[32m[I 2023-01-13 00:10:39,436][0m Trial 14 finished with value: 0.2 and parameters: {'n_estimators': 2211, 'max_depth': 103, 'min_samples_split': 104, 'min_samples_leaf': 30, 'criterion': 'entropy'}. Best is trial 0 with value: 0.2.[0m
[32m[I 2023-01-13 00:10:47,910][0m Trial 15 finished with value: 0.2 and parameters: {'n_estimators': 3989, 'max_depth': 73, 'min_samples_split': 33, 'min_samples_leaf': 51, 'criterion': 'gini'}. Best is trial 0 with value: 0.2.[0m
[32m[I 2023-01-13 00:10:51,724][0m Trial 16 finished with value: 0.2 and parameters: {'n_estimators': 1685, 'max_depth': 128, 'min_samples_split': 74, 'min_samples_leaf': 83, 'criterion': 'entropy'}. Best is trial 0 with value: 0.2.[0m
[32m[I 2023-01-13 00:10:57,193][0m Trial 17 finished with value: 0.2 and parameters: {'n_estimators': 2576, 'max_depth': 102, 'min_samples_split': 104, 'min_samples_leaf': 26, 'criterion': 'entropy'}. Best is trial 0 with value: 0.2.[0m
[32m[I 2023-01-13 00:11:06,539][0m Trial 18 finished with value: 0.2 and parameters: {'n_estimators': 4363, 'max_depth': 63, 'min_samples_split': 33, 'min_samples_leaf': 108, 'criterion': 'gini'}. Best is trial 0 with value: 0.2.[0m
[32m[I 2023-01-13 00:11:10,188][0m Trial 19 finished with value: 0.2 and parameters: {'n_estimators': 1722, 'max_depth': 128, 'min_samples_split': 72, 'min_samples_leaf': 79, 'criterion': 'entropy'}. Best is trial 0 with value: 0.2.[0m
[32m[I 2023-01-13 00:11:16,928][0m Trial 20 finished with value: 0.2 and parameters: {'n_estimators': 3188, 'max_depth': 92, 'min_samples_split': 88, 'min_samples_leaf': 19, 'criterion': 'entropy'}. Best is trial 0 with value: 0.2.[0m
[32m[I 2023-01-13 00:11:27,147][0m Trial 21 finished with value: 0.2 and parameters: {'n_estimators': 4773, 'max_depth': 46, 'min_samples_split': 57, 'min_samples_leaf': 127, 'criterion': 'entropy'}. Best is trial 0 with value: 0.2.[0m
[32m[I 2023-01-13 00:11:36,354][0m Trial 22 finished with value: 0.2 and parameters: {'n_estimators': 4251, 'max_depth': 61, 'min_samples_split': 42, 'min_samples_leaf': 105, 'criterion': 'entropy'}. Best is trial 0 with value: 0.2.[0m
[32m[I 2023-01-13 00:11:44,240][0m Trial 23 finished with value: 0.2 and parameters: {'n_estimators': 3496, 'max_depth': 90, 'min_samples_split': 92, 'min_samples_leaf': 77, 'criterion': 'entropy'}. Best is trial 0 with value: 0.2.[0m
[32m[I 2023-01-13 00:11:55,087][0m Trial 24 finished with value: 0.2 and parameters: {'n_estimators': 4947, 'max_depth': 35, 'min_samples_split': 62, 'min_samples_leaf': 17, 'criterion': 'entropy'}. Best is trial 0 with value: 0.2.[0m
[32m[I 2023-01-13 00:12:04,675][0m Trial 25 finished with value: 0.2 and parameters: {'n_estimators': 4485, 'max_depth': 52, 'min_samples_split': 49, 'min_samples_leaf': 127, 'criterion': 'entropy'}. Best is trial 0 with value: 0.2.[0m
[32m[I 2023-01-13 00:12:12,434][0m Trial 26 finished with value: 0.2 and parameters: {'n_estimators': 3608, 'max_depth': 78, 'min_samples_split': 93, 'min_samples_leaf': 98, 'criterion': 'entropy'}. Best is trial 0 with value: 0.2.[0m
[32m[I 2023-01-13 00:12:19,867][0m Trial 27 finished with value: 0.2 and parameters: {'n_estimators': 3441, 'max_depth': 35, 'min_samples_split': 66, 'min_samples_leaf': 64, 'criterion': 'entropy'}. Best is trial 0 with value: 0.2.[0m
[32m[I 2023-01-13 00:12:31,123][0m Trial 28 finished with value: 0.2 and parameters: {'n_estimators': 4964, 'max_depth': 34, 'min_samples_split': 48, 'min_samples_leaf': 114, 'criterion': 'entropy'}. Best is trial 0 with value: 0.2.[0m
[32m[I 2023-01-13 00:12:39,501][0m Trial 29 finished with value: 0.2 and parameters: {'n_estimators': 3751, 'max_depth': 76, 'min_samples_split': 112, 'min_samples_leaf': 96, 'criterion': 'entropy'}. Best is trial 0 with value: 0.2.[0m
[32m[I 2023-01-13 00:12:45,519][0m Trial 30 finished with value: 0.2 and parameters: {'n_estimators': 2719, 'max_depth': 22, 'min_samples_split': 80, 'min_samples_leaf': 56, 'criterion': 'entropy'}. Best is trial 0 with value: 0.2.[0m
[32m[I 2023-01-13 00:12:53,014][0m Trial 31 finished with value: 0.2 and parameters: {'n_estimators': 3360, 'max_depth': 38, 'min_samples_split': 67, 'min_samples_leaf': 114, 'criterion': 'entropy'}. Best is trial 0 with value: 0.2.[0m
[32m[I 2023-01-13 00:13:01,675][0m Trial 32 finished with value: 0.2 and parameters: {'n_estimators': 3875, 'max_depth': 10, 'min_samples_split': 113, 'min_samples_leaf': 97, 'criterion': 'entropy'}. Best is trial 0 with value: 0.2.[0m
[32m[I 2023-01-13 00:13:07,514][0m Trial 33 finished with value: 0.2 and parameters: {'n_estimators': 2653, 'max_depth': 18, 'min_samples_split': 80, 'min_samples_leaf': 62, 'criterion': 'entropy'}. Best is trial 0 with value: 0.2.[0m
[32m[I 2023-01-13 00:13:14,077][0m Trial 34 finished with value: 0.2 and parameters: {'n_estimators': 2980, 'max_depth': 4, 'min_samples_split': 113, 'min_samples_leaf': 93, 'criterion': 'entropy'}. Best is trial 0 with value: 0.2.[0m
[32m[I 2023-01-13 00:13:17,799][0m Trial 35 finished with value: 0.2 and parameters: {'n_estimators': 1673, 'max_depth': 114, 'min_samples_split': 72, 'min_samples_leaf': 40, 'criterion': 'entropy'}. Best is trial 0 with value: 0.2.[0m
[32m[I 2023-01-13 00:13:27,203][0m Trial 36 finished with value: 0.2 and parameters: {'n_estimators': 4274, 'max_depth': 60, 'min_samples_split': 11, 'min_samples_leaf': 128, 'criterion': 'entropy'}. Best is trial 0 with value: 0.2.[0m
[32m[I 2023-01-13 00:13:36,606][0m Trial 37 finished with value: 0.2 and parameters: {'n_estimators': 4199, 'max_depth': 91, 'min_samples_split': 25, 'min_samples_leaf': 120, 'criterion': 'entropy'}. Best is trial 0 with value: 0.2.[0m
[32m[I 2023-01-13 00:13:46,950][0m Trial 38 finished with value: 0.2 and parameters: {'n_estimators': 4629, 'max_depth': 56, 'min_samples_split': 57, 'min_samples_leaf': 73, 'criterion': 'entropy'}. Best is trial 0 with value: 0.2.[0m
[32m[I 2023-01-13 00:13:56,097][0m Trial 39 finished with value: 0.2 and parameters: {'n_estimators': 4072, 'max_depth': 43, 'min_samples_split': 37, 'min_samples_leaf': 106, 'criterion': 'entropy'}. Best is trial 0 with value: 0.2.[0m
[32m[I 2023-01-13 00:14:03,124][0m Trial 40 finished with value: 0.2 and parameters: {'n_estimators': 3190, 'max_depth': 86, 'min_samples_split': 62, 'min_samples_leaf': 80, 'criterion': 'entropy'}. Best is trial 0 with value: 0.2.[0m
[32m[I 2023-01-13 00:14:13,010][0m Trial 41 finished with value: 0.2 and parameters: {'n_estimators': 4361, 'max_depth': 55, 'min_samples_split': 48, 'min_samples_leaf': 113, 'criterion': 'entropy'}. Best is trial 0 with value: 0.2.[0m
[32m[I 2023-01-13 00:14:21,343][0m Trial 42 finished with value: 0.2 and parameters: {'n_estimators': 3730, 'max_depth': 80, 'min_samples_split': 95, 'min_samples_leaf': 90, 'criterion': 'entropy'}. Best is trial 0 with value: 0.2.[0m
[32m[I 2023-01-13 00:14:32,349][0m Trial 43 finished with value: 0.2 and parameters: {'n_estimators': 4997, 'max_depth': 109, 'min_samples_split': 93, 'min_samples_leaf': 69, 'criterion': 'entropy'}. Best is trial 0 with value: 0.2.[0m
