[32m[I 2023-01-13 01:12:11,906][0m Trial 6 finished with value: 0.2 and parameters: {'n_estimators': 3062, 'max_depth': 81, 'min_samples_split': 121, 'min_samples_leaf': 88, 'criterion': 'entropy'}. Best is trial 0 with value: 0.2.[0m
[32m[I 2023-01-13 01:12:19,418][0m Trial 7 finished with value: 0.2 and parameters: {'n_estimators': 3490, 'max_depth': 11, 'min_samples_split': 86, 'min_samples_leaf': 86, 'criterion': 'gini'}. Best is trial 0 with value: 0.2.[0m
[32m[I 2023-01-13 01:12:22,771][0m Trial 8 finished with value: 0.2 and parameters: {'n_estimators': 1580, 'max_depth': 49, 'min_samples_split': 74, 'min_samples_leaf': 57, 'criterion': 'gini'}. Best is trial 0 with value: 0.2.[0m
[32m[I 2023-01-13 01:12:24,992][0m Trial 9 finished with value: 0.2 and parameters: {'n_estimators': 1047, 'max_depth': 24, 'min_samples_split': 84, 'min_samples_leaf': 33, 'criterion': 'gini'}. Best is trial 0 with value: 0.2.[0m
[32m[I 2023-01-13 01:12:35,094][0m Trial 10 finished with value: 0.2 and parameters: {'n_estimators': 4704, 'max_depth': 52, 'min_samples_split': 41, 'min_samples_leaf': 3, 'criterion': 'entropy'}. Best is trial 0 with value: 0.2.[0m
[32m[I 2023-01-13 01:12:39,751][0m Trial 11 finished with value: 0.2 and parameters: {'n_estimators': 2191, 'max_depth': 92, 'min_samples_split': 99, 'min_samples_leaf': 48, 'criterion': 'gini'}. Best is trial 0 with value: 0.2.[0m
[32m[I 2023-01-13 01:12:44,431][0m Trial 12 finished with value: 0.2 and parameters: {'n_estimators': 2200, 'max_depth': 126, 'min_samples_split': 106, 'min_samples_leaf': 36, 'criterion': 'entropy'}. Best is trial 0 with value: 0.2.[0m
[32m[I 2023-01-13 01:12:44,541][0m Trial 13 finished with value: 0.2 and parameters: {'n_estimators': 48, 'max_depth': 68, 'min_samples_split': 51, 'min_samples_leaf': 69, 'criterion': 'gini'}. Best is trial 0 with value: 0.2.[0m
[32m[I 2023-01-13 01:12:49,398][0m Trial 14 finished with value: 0.2 and parameters: {'n_estimators': 2211, 'max_depth': 103, 'min_samples_split': 104, 'min_samples_leaf': 30, 'criterion': 'entropy'}. Best is trial 0 with value: 0.2.[0m
[32m[I 2023-01-13 01:12:57,844][0m Trial 15 finished with value: 0.2 and parameters: {'n_estimators': 3989, 'max_depth': 73, 'min_samples_split': 33, 'min_samples_leaf': 51, 'criterion': 'gini'}. Best is trial 0 with value: 0.2.[0m
[32m[I 2023-01-13 01:13:01,410][0m Trial 16 finished with value: 0.2 and parameters: {'n_estimators': 1685, 'max_depth': 128, 'min_samples_split': 74, 'min_samples_leaf': 83, 'criterion': 'entropy'}. Best is trial 0 with value: 0.2.[0m
[32m[I 2023-01-13 01:13:06,955][0m Trial 17 finished with value: 0.2 and parameters: {'n_estimators': 2576, 'max_depth': 102, 'min_samples_split': 104, 'min_samples_leaf': 26, 'criterion': 'entropy'}. Best is trial 0 with value: 0.2.[0m
[32m[I 2023-01-13 01:13:16,397][0m Trial 18 finished with value: 0.2 and parameters: {'n_estimators': 4363, 'max_depth': 63, 'min_samples_split': 33, 'min_samples_leaf': 108, 'criterion': 'gini'}. Best is trial 0 with value: 0.2.[0m
[32m[I 2023-01-13 01:13:20,053][0m Trial 19 finished with value: 0.2 and parameters: {'n_estimators': 1722, 'max_depth': 128, 'min_samples_split': 72, 'min_samples_leaf': 79, 'criterion': 'entropy'}. Best is trial 0 with value: 0.2.[0m
[32m[I 2023-01-13 01:13:26,813][0m Trial 20 finished with value: 0.2 and parameters: {'n_estimators': 3188, 'max_depth': 92, 'min_samples_split': 88, 'min_samples_leaf': 19, 'criterion': 'entropy'}. Best is trial 0 with value: 0.2.[0m
[32m[I 2023-01-13 01:13:37,081][0m Trial 21 finished with value: 0.2 and parameters: {'n_estimators': 4773, 'max_depth': 46, 'min_samples_split': 57, 'min_samples_leaf': 127, 'criterion': 'entropy'}. Best is trial 0 with value: 0.2.[0m
[32m[I 2023-01-13 01:13:46,314][0m Trial 22 finished with value: 0.2 and parameters: {'n_estimators': 4251, 'max_depth': 61, 'min_samples_split': 42, 'min_samples_leaf': 105, 'criterion': 'entropy'}. Best is trial 0 with value: 0.2.[0m
[32m[I 2023-01-13 01:13:53,833][0m Trial 23 finished with value: 0.2 and parameters: {'n_estimators': 3496, 'max_depth': 90, 'min_samples_split': 92, 'min_samples_leaf': 77, 'criterion': 'entropy'}. Best is trial 0 with value: 0.2.[0m
[32m[I 2023-01-13 01:14:04,439][0m Trial 24 finished with value: 0.2 and parameters: {'n_estimators': 4947, 'max_depth': 35, 'min_samples_split': 62, 'min_samples_leaf': 17, 'criterion': 'entropy'}. Best is trial 0 with value: 0.2.[0m
[32m[I 2023-01-13 01:14:13,995][0m Trial 25 finished with value: 0.2 and parameters: {'n_estimators': 4485, 'max_depth': 52, 'min_samples_split': 49, 'min_samples_leaf': 127, 'criterion': 'entropy'}. Best is trial 0 with value: 0.2.[0m
[32m[I 2023-01-13 01:14:21,751][0m Trial 26 finished with value: 0.2 and parameters: {'n_estimators': 3608, 'max_depth': 78, 'min_samples_split': 93, 'min_samples_leaf': 98, 'criterion': 'entropy'}. Best is trial 0 with value: 0.2.[0m
[32m[I 2023-01-13 01:14:29,069][0m Trial 27 finished with value: 0.2 and parameters: {'n_estimators': 3441, 'max_depth': 35, 'min_samples_split': 66, 'min_samples_leaf': 64, 'criterion': 'entropy'}. Best is trial 0 with value: 0.2.[0m
[32m[I 2023-01-13 01:14:39,733][0m Trial 28 finished with value: 0.2 and parameters: {'n_estimators': 4964, 'max_depth': 34, 'min_samples_split': 48, 'min_samples_leaf': 114, 'criterion': 'entropy'}. Best is trial 0 with value: 0.2.[0m
[32m[I 2023-01-13 01:14:47,838][0m Trial 29 finished with value: 0.2 and parameters: {'n_estimators': 3751, 'max_depth': 76, 'min_samples_split': 112, 'min_samples_leaf': 96, 'criterion': 'entropy'}. Best is trial 0 with value: 0.2.[0m
[32m[I 2023-01-13 01:14:53,725][0m Trial 30 finished with value: 0.2 and parameters: {'n_estimators': 2719, 'max_depth': 22, 'min_samples_split': 80, 'min_samples_leaf': 56, 'criterion': 'entropy'}. Best is trial 0 with value: 0.2.[0m
[32m[I 2023-01-13 01:15:00,859][0m Trial 31 finished with value: 0.2 and parameters: {'n_estimators': 3360, 'max_depth': 38, 'min_samples_split': 67, 'min_samples_leaf': 114, 'criterion': 'entropy'}. Best is trial 0 with value: 0.2.[0m
[32m[I 2023-01-13 01:15:09,154][0m Trial 32 finished with value: 0.2 and parameters: {'n_estimators': 3875, 'max_depth': 10, 'min_samples_split': 113, 'min_samples_leaf': 97, 'criterion': 'entropy'}. Best is trial 0 with value: 0.2.[0m
[32m[I 2023-01-13 01:15:14,778][0m Trial 33 finished with value: 0.2 and parameters: {'n_estimators': 2653, 'max_depth': 18, 'min_samples_split': 80, 'min_samples_leaf': 62, 'criterion': 'entropy'}. Best is trial 0 with value: 0.2.[0m
[32m[I 2023-01-13 01:15:21,191][0m Trial 34 finished with value: 0.2 and parameters: {'n_estimators': 2980, 'max_depth': 4, 'min_samples_split': 113, 'min_samples_leaf': 93, 'criterion': 'entropy'}. Best is trial 0 with value: 0.2.[0m
[32m[I 2023-01-13 01:15:24,752][0m Trial 35 finished with value: 0.2 and parameters: {'n_estimators': 1673, 'max_depth': 114, 'min_samples_split': 72, 'min_samples_leaf': 40, 'criterion': 'entropy'}. Best is trial 0 with value: 0.2.[0m
[32m[I 2023-01-13 01:15:33,941][0m Trial 36 finished with value: 0.2 and parameters: {'n_estimators': 4274, 'max_depth': 60, 'min_samples_split': 11, 'min_samples_leaf': 128, 'criterion': 'entropy'}. Best is trial 0 with value: 0.2.[0m
[32m[I 2023-01-13 01:15:42,863][0m Trial 37 finished with value: 0.2 and parameters: {'n_estimators': 4199, 'max_depth': 91, 'min_samples_split': 25, 'min_samples_leaf': 120, 'criterion': 'entropy'}. Best is trial 0 with value: 0.2.[0m
[32m[I 2023-01-13 01:15:52,773][0m Trial 38 finished with value: 0.2 and parameters: {'n_estimators': 4629, 'max_depth': 56, 'min_samples_split': 57, 'min_samples_leaf': 73, 'criterion': 'entropy'}. Best is trial 0 with value: 0.2.[0m
[32m[I 2023-01-13 01:16:01,484][0m Trial 39 finished with value: 0.2 and parameters: {'n_estimators': 4072, 'max_depth': 43, 'min_samples_split': 37, 'min_samples_leaf': 106, 'criterion': 'entropy'}. Best is trial 0 with value: 0.2.[0m
[32m[I 2023-01-13 01:16:08,234][0m Trial 40 finished with value: 0.2 and parameters: {'n_estimators': 3190, 'max_depth': 86, 'min_samples_split': 62, 'min_samples_leaf': 80, 'criterion': 'entropy'}. Best is trial 0 with value: 0.2.[0m
[32m[I 2023-01-13 01:16:17,592][0m Trial 41 finished with value: 0.2 and parameters: {'n_estimators': 4361, 'max_depth': 55, 'min_samples_split': 48, 'min_samples_leaf': 113, 'criterion': 'entropy'}. Best is trial 0 with value: 0.2.[0m
[32m[I 2023-01-13 01:16:25,637][0m Trial 42 finished with value: 0.2 and parameters: {'n_estimators': 3730, 'max_depth': 80, 'min_samples_split': 95, 'min_samples_leaf': 90, 'criterion': 'entropy'}. Best is trial 0 with value: 0.2.[0m
[32m[I 2023-01-13 01:16:36,367][0m Trial 43 finished with value: 0.2 and parameters: {'n_estimators': 4997, 'max_depth': 109, 'min_samples_split': 93, 'min_samples_leaf': 69, 'criterion': 'entropy'}. Best is trial 0 with value: 0.2.[0m
[32m[I 2023-01-13 01:16:46,049][0m Trial 44 finished with value: 0.2 and parameters: {'n_estimators': 4543, 'max_depth': 30, 'min_samples_split': 67, 'min_samples_leaf': 8, 'criterion': 'entropy'}. Best is trial 0 with value: 0.2.[0m
[32m[I 2023-01-13 01:16:53,604][0m Trial 45 finished with value: 0.2 and parameters: {'n_estimators': 3516, 'max_depth': 41, 'min_samples_split': 81, 'min_samples_leaf': 42, 'criterion': 'entropy'}. Best is trial 0 with value: 0.2.[0m
[32m[I 2023-01-13 01:16:59,794][0m Trial 46 finished with value: 0.2 and parameters: {'n_estimators': 2917, 'max_depth': 70, 'min_samples_split': 44, 'min_samples_leaf': 119, 'criterion': 'gini'}. Best is trial 0 with value: 0.2.[0m
[32m[I 2023-01-13 01:17:07,708][0m Trial 47 finished with value: 0.2 and parameters: {'n_estimators': 3681, 'max_depth': 31, 'min_samples_split': 53, 'min_samples_leaf': 99, 'criterion': 'entropy'}. Best is trial 0 with value: 0.2.[0m
[32m[I 2023-01-13 01:17:12,904][0m Trial 48 finished with value: 0.2 and parameters: {'n_estimators': 2423, 'max_depth': 75, 'min_samples_split': 128, 'min_samples_leaf': 97, 'criterion': 'entropy'}. Best is trial 0 with value: 0.2.[0m
[32m[I 2023-01-13 01:17:19,938][0m Trial 49 finished with value: 0.2 and parameters: {'n_estimators': 3279, 'max_depth': 79, 'min_samples_split': 121, 'min_samples_leaf': 64, 'criterion': 'gini'}. Best is trial 0 with value: 0.2.[0m
[32m[I 2023-01-13 01:17:24,129][0m Trial 50 finished with value: 0.2 and parameters: {'n_estimators': 1979, 'max_depth': 25, 'min_samples_split': 76, 'min_samples_leaf': 53, 'criterion': 'entropy'}. Best is trial 0 with value: 0.2.[0m
[32m[I 2023-01-13 01:17:29,973][0m Trial 51 finished with value: 0.2 and parameters: {'n_estimators': 2758, 'max_depth': 20, 'min_samples_split': 3, 'min_samples_leaf': 57, 'criterion': 'entropy'}. Best is trial 0 with value: 0.2.[0m
[32m[I 2023-01-13 01:17:38,231][0m Trial 52 finished with value: 0.2 and parameters: {'n_estimators': 3840, 'max_depth': 13, 'min_samples_split': 115, 'min_samples_leaf': 115, 'criterion': 'entropy'}. Best is trial 0 with value: 0.2.[0m
[32m[I 2023-01-13 01:17:46,754][0m Trial 53 finished with value: 0.2 and parameters: {'n_estimators': 3955, 'max_depth': 13, 'min_samples_split': 111, 'min_samples_leaf': 111, 'criterion': 'entropy'}. Best is trial 0 with value: 0.2.[0m
[32m[I 2023-01-13 01:17:52,758][0m Trial 54 finished with value: 0.2 and parameters: {'n_estimators': 2833, 'max_depth': 4, 'min_samples_split': 80, 'min_samples_leaf': 60, 'criterion': 'entropy'}. Best is trial 0 with value: 0.2.[0m
[32m[I 2023-01-13 01:17:58,101][0m Trial 55 finished with value: 0.2 and parameters: {'n_estimators': 2465, 'max_depth': 17, 'min_samples_split': 101, 'min_samples_leaf': 46, 'criterion': 'entropy'}. Best is trial 0 with value: 0.2.[0m
[32m[I 2023-01-13 01:18:03,731][0m Trial 56 finished with value: 0.2 and parameters: {'n_estimators': 2650, 'max_depth': 5, 'min_samples_split': 87, 'min_samples_leaf': 84, 'criterion': 'gini'}. Best is trial 0 with value: 0.2.[0m
[32m[I 2023-01-13 01:18:07,995][0m Trial 57 finished with value: 0.2 and parameters: {'n_estimators': 2007, 'max_depth': 9, 'min_samples_split': 121, 'min_samples_leaf': 93, 'criterion': 'entropy'}. Best is trial 0 with value: 0.2.[0m
[32m[I 2023-01-13 01:18:10,292][0m Trial 58 finished with value: 0.2 and parameters: {'n_estimators': 1074, 'max_depth': 108, 'min_samples_split': 73, 'min_samples_leaf': 87, 'criterion': 'entropy'}. Best is trial 0 with value: 0.2.[0m
[32m[I 2023-01-13 01:18:16,700][0m Trial 59 finished with value: 0.2 and parameters: {'n_estimators': 2974, 'max_depth': 119, 'min_samples_split': 68, 'min_samples_leaf': 36, 'criterion': 'entropy'}. Best is trial 0 with value: 0.2.[0m
[32m[I 2023-01-13 01:18:17,867][0m Trial 60 finished with value: 0.2 and parameters: {'n_estimators': 548, 'max_depth': 96, 'min_samples_split': 109, 'min_samples_leaf': 43, 'criterion': 'entropy'}. Best is trial 0 with value: 0.2.[0m
[32m[I 2023-01-13 01:18:26,603][0m Trial 61 finished with value: 0.2 and parameters: {'n_estimators': 4107, 'max_depth': 118, 'min_samples_split': 18, 'min_samples_leaf': 121, 'criterion': 'entropy'}. Best is trial 0 with value: 0.2.[0m
[32m[I 2023-01-13 01:18:36,513][0m Trial 62 finished with value: 0.2 and parameters: {'n_estimators': 4619, 'max_depth': 58, 'min_samples_split': 23, 'min_samples_leaf': 73, 'criterion': 'entropy'}. Best is trial 0 with value: 0.2.[0m
[32m[I 2023-01-13 01:18:39,512][0m Trial 63 finished with value: 0.2 and parameters: {'n_estimators': 1410, 'max_depth': 96, 'min_samples_split': 9, 'min_samples_leaf': 72, 'criterion': 'entropy'}. Best is trial 0 with value: 0.2.[0m
[32m[I 2023-01-13 01:18:49,829][0m Trial 64 finished with value: 0.2 and parameters: {'n_estimators': 4807, 'max_depth': 85, 'min_samples_split': 33, 'min_samples_leaf': 122, 'criterion': 'entropy'}. Best is trial 0 with value: 0.2.[0m
[32m[I 2023-01-13 01:18:58,970][0m Trial 65 finished with value: 0.2 and parameters: {'n_estimators': 4201, 'max_depth': 45, 'min_samples_split': 29, 'min_samples_leaf': 104, 'criterion': 'entropy'}. Best is trial 0 with value: 0.2.[0m
[32m[I 2023-01-13 01:19:07,720][0m Trial 66 finished with value: 0.2 and parameters: {'n_estimators': 4079, 'max_depth': 85, 'min_samples_split': 16, 'min_samples_leaf': 78, 'criterion': 'gini'}. Best is trial 0 with value: 0.2.[0m
[32m[I 2023-01-13 01:19:17,143][0m Trial 67 finished with value: 0.2 and parameters: {'n_estimators': 4395, 'max_depth': 64, 'min_samples_split': 59, 'min_samples_leaf': 125, 'criterion': 'entropy'}. Best is trial 0 with value: 0.2.[0m
[32m[I 2023-01-13 01:19:26,297][0m Trial 68 finished with value: 0.2 and parameters: {'n_estimators': 4317, 'max_depth': 57, 'min_samples_split': 37, 'min_samples_leaf': 109, 'criterion': 'entropy'}. Best is trial 0 with value: 0.2.[0m
[32m[I 2023-01-13 01:19:36,359][0m Trial 69 finished with value: 0.2 and parameters: {'n_estimators': 4701, 'max_depth': 68, 'min_samples_split': 28, 'min_samples_leaf': 116, 'criterion': 'entropy'}. Best is trial 0 with value: 0.2.[0m
[32m[I 2023-01-13 01:19:43,207][0m Trial 70 finished with value: 0.2 and parameters: {'n_estimators': 3169, 'max_depth': 89, 'min_samples_split': 55, 'min_samples_leaf': 91, 'criterion': 'entropy'}. Best is trial 0 with value: 0.2.[0m
[32m[I 2023-01-13 01:19:48,220][0m Trial 71 finished with value: 0.2 and parameters: {'n_estimators': 2360, 'max_depth': 71, 'min_samples_split': 127, 'min_samples_leaf': 56, 'criterion': 'gini'}. Best is trial 0 with value: 0.2.[0m
[32m[I 2023-01-13 01:19:52,497][0m Trial 72 finished with value: 0.2 and parameters: {'n_estimators': 1986, 'max_depth': 27, 'min_samples_split': 119, 'min_samples_leaf': 50, 'criterion': 'gini'}. Best is trial 0 with value: 0.2.[0m
[32m[I 2023-01-13 01:19:57,684][0m Trial 73 finished with value: 0.2 and parameters: {'n_estimators': 2401, 'max_depth': 21, 'min_samples_split': 117, 'min_samples_leaf': 100, 'criterion': 'gini'}. Best is trial 0 with value: 0.2.[0m
[32m[I 2023-01-13 01:20:01,907][0m Trial 74 finished with value: 0.2 and parameters: {'n_estimators': 1995, 'max_depth': 11, 'min_samples_split': 123, 'min_samples_leaf': 53, 'criterion': 'gini'}. Best is trial 0 with value: 0.2.[0m
[32m[I 2023-01-13 01:20:09,100][0m Trial 75 finished with value: 0.2 and parameters: {'n_estimators': 3312, 'max_depth': 29, 'min_samples_split': 125, 'min_samples_leaf': 109, 'criterion': 'gini'}. Best is trial 0 with value: 0.2.[0m
[32m[I 2023-01-13 01:20:14,972][0m Trial 76 finished with value: 0.2 and parameters: {'n_estimators': 2771, 'max_depth': 15, 'min_samples_split': 4, 'min_samples_leaf': 61, 'criterion': 'gini'}. Best is trial 0 with value: 0.2.[0m
[32m[I 2023-01-13 01:20:20,986][0m Trial 77 finished with value: 0.2 and parameters: {'n_estimators': 2849, 'max_depth': 14, 'min_samples_split': 115, 'min_samples_leaf': 68, 'criterion': 'entropy'}. Best is trial 0 with value: 0.2.[0m
[32m[I 2023-01-13 01:20:29,276][0m Trial 78 finished with value: 0.2 and parameters: {'n_estimators': 3887, 'max_depth': 17, 'min_samples_split': 106, 'min_samples_leaf': 47, 'criterion': 'entropy'}. Best is trial 0 with value: 0.2.[0m
[32m[I 2023-01-13 01:20:34,651][0m Trial 79 finished with value: 0.2 and parameters: {'n_estimators': 2528, 'max_depth': 6, 'min_samples_split': 99, 'min_samples_leaf': 59, 'criterion': 'entropy'}. Best is trial 0 with value: 0.2.[0m
[32m[I 2023-01-13 01:20:39,417][0m Trial 80 finished with value: 0.2 and parameters: {'n_estimators': 2219, 'max_depth': 8, 'min_samples_split': 88, 'min_samples_leaf': 83, 'criterion': 'entropy'}. Best is trial 0 with value: 0.2.[0m
[32m[I 2023-01-13 01:20:42,043][0m Trial 81 finished with value: 0.2 and parameters: {'n_estimators': 1230, 'max_depth': 12, 'min_samples_split': 99, 'min_samples_leaf': 86, 'criterion': 'entropy'}. Best is trial 0 with value: 0.2.[0m
[32m[I 2023-01-13 01:20:43,591][0m Trial 82 finished with value: 0.2 and parameters: {'n_estimators': 729, 'max_depth': 4, 'min_samples_split': 70, 'min_samples_leaf': 33, 'criterion': 'entropy'}. Best is trial 0 with value: 0.2.[0m
[32m[I 2023-01-13 01:20:49,973][0m Trial 83 finished with value: 0.2 and parameters: {'n_estimators': 3015, 'max_depth': 108, 'min_samples_split': 84, 'min_samples_leaf': 25, 'criterion': 'entropy'}. Best is trial 0 with value: 0.2.[0m
[32m[I 2023-01-13 01:20:50,427][0m Trial 84 finished with value: 0.2 and parameters: {'n_estimators': 211, 'max_depth': 121, 'min_samples_split': 110, 'min_samples_leaf': 44, 'criterion': 'entropy'}. Best is trial 0 with value: 0.2.[0m
[32m[I 2023-01-13 01:20:51,924][0m Trial 85 finished with value: 0.2 and parameters: {'n_estimators': 702, 'max_depth': 104, 'min_samples_split': 76, 'min_samples_leaf': 33, 'criterion': 'entropy'}. Best is trial 0 with value: 0.2.[0m
[32m[I 2023-01-13 01:20:52,834][0m Trial 86 finished with value: 0.2 and parameters: {'n_estimators': 431, 'max_depth': 118, 'min_samples_split': 89, 'min_samples_leaf': 39, 'criterion': 'entropy'}. Best is trial 0 with value: 0.2.[0m
[32m[I 2023-01-13 01:20:55,134][0m Trial 87 finished with value: 0.2 and parameters: {'n_estimators': 1087, 'max_depth': 124, 'min_samples_split': 20, 'min_samples_leaf': 73, 'criterion': 'entropy'}. Best is trial 0 with value: 0.2.[0m
[32m[I 2023-01-13 01:20:57,894][0m Trial 88 finished with value: 0.2 and parameters: {'n_estimators': 1263, 'max_depth': 98, 'min_samples_split': 14, 'min_samples_leaf': 76, 'criterion': 'entropy'}. Best is trial 0 with value: 0.2.[0m
[32m[I 2023-01-13 01:20:59,702][0m Trial 89 finished with value: 0.2 and parameters: {'n_estimators': 863, 'max_depth': 96, 'min_samples_split': 10, 'min_samples_leaf': 85, 'criterion': 'gini'}. Best is trial 0 with value: 0.2.[0m
[32m[I 2023-01-13 01:21:09,898][0m Trial 90 finished with value: 0.2 and parameters: {'n_estimators': 4774, 'max_depth': 95, 'min_samples_split': 18, 'min_samples_leaf': 72, 'criterion': 'entropy'}. Best is trial 0 with value: 0.2.[0m
[32m[I 2023-01-13 01:21:13,024][0m Trial 91 finished with value: 0.2 and parameters: {'n_estimators': 1476, 'max_depth': 106, 'min_samples_split': 25, 'min_samples_leaf': 94, 'criterion': 'entropy'}. Best is trial 0 with value: 0.2.[0m
[32m[I 2023-01-13 01:21:21,563][0m Trial 92 finished with value: 0.2 and parameters: {'n_estimators': 4069, 'max_depth': 84, 'min_samples_split': 16, 'min_samples_leaf': 68, 'criterion': 'entropy'}. Best is trial 0 with value: 0.2.[0m
[32m[I 2023-01-13 01:21:30,570][0m Trial 93 finished with value: 0.2 and parameters: {'n_estimators': 4145, 'max_depth': 113, 'min_samples_split': 22, 'min_samples_leaf': 78, 'criterion': 'entropy'}. Best is trial 0 with value: 0.2.[0m
[32m[I 2023-01-13 01:21:39,963][0m Trial 94 finished with value: 0.2 and parameters: {'n_estimators': 4434, 'max_depth': 64, 'min_samples_split': 7, 'min_samples_leaf': 123, 'criterion': 'entropy'}. Best is trial 0 with value: 0.2.[0m
[32m[I 2023-01-13 01:21:50,174][0m Trial 95 finished with value: 0.2 and parameters: {'n_estimators': 4802, 'max_depth': 57, 'min_samples_split': 31, 'min_samples_leaf': 125, 'criterion': 'entropy'}. Best is trial 0 with value: 0.2.[0m
[32m[I 2023-01-13 01:22:00,009][0m Trial 96 finished with value: 0.2 and parameters: {'n_estimators': 4640, 'max_depth': 48, 'min_samples_split': 29, 'min_samples_leaf': 103, 'criterion': 'entropy'}. Best is trial 0 with value: 0.2.[0m
[32m[I 2023-01-13 01:22:09,100][0m Trial 97 finished with value: 0.2 and parameters: {'n_estimators': 4334, 'max_depth': 68, 'min_samples_split': 36, 'min_samples_leaf': 119, 'criterion': 'entropy'}. Best is trial 0 with value: 0.2.[0m
