[32m[I 2023-01-13 02:32:58,578][0m Trial 47 finished with value: 0.3232600732600733 and parameters: {'n_estimators': 3597, 'max_depth': 98, 'min_samples_split': 12, 'min_samples_leaf': 9, 'criterion': 'gini'}. Best is trial 11 with value: 0.5228710178710179.[0m
[32m[I 2023-01-13 02:32:59,232][0m Trial 48 finished with value: 0.2732600732600733 and parameters: {'n_estimators': 310, 'max_depth': 4, 'min_samples_split': 19, 'min_samples_leaf': 15, 'criterion': 'entropy'}. Best is trial 11 with value: 0.5228710178710179.[0m
[32m[I 2023-01-13 02:33:02,387][0m Trial 49 finished with value: 0.4317399267399267 and parameters: {'n_estimators': 1482, 'max_depth': 103, 'min_samples_split': 24, 'min_samples_leaf': 1, 'criterion': 'entropy'}. Best is trial 11 with value: 0.5228710178710179.[0m
[32m[I 2023-01-13 02:33:05,251][0m Trial 50 finished with value: 0.2732600732600733 and parameters: {'n_estimators': 1365, 'max_depth': 59, 'min_samples_split': 42, 'min_samples_leaf': 113, 'criterion': 'entropy'}. Best is trial 11 with value: 0.5228710178710179.[0m
[32m[I 2023-01-13 02:33:09,698][0m Trial 51 finished with value: 0.5612043512043512 and parameters: {'n_estimators': 2002, 'max_depth': 103, 'min_samples_split': 8, 'min_samples_leaf': 1, 'criterion': 'entropy'}. Best is trial 51 with value: 0.5612043512043512.[0m
[32m[I 2023-01-13 02:33:14,149][0m Trial 52 finished with value: 0.534040404040404 and parameters: {'n_estimators': 2018, 'max_depth': 114, 'min_samples_split': 7, 'min_samples_leaf': 2, 'criterion': 'entropy'}. Best is trial 51 with value: 0.5612043512043512.[0m
[32m[I 2023-01-13 02:33:18,877][0m Trial 53 finished with value: 0.5786036186036186 and parameters: {'n_estimators': 2052, 'max_depth': 116, 'min_samples_split': 6, 'min_samples_leaf': 1, 'criterion': 'entropy'}. Best is trial 53 with value: 0.5786036186036186.[0m
[32m[I 2023-01-13 02:33:22,524][0m Trial 54 finished with value: 0.5125757575757575 and parameters: {'n_estimators': 1690, 'max_depth': 123, 'min_samples_split': 8, 'min_samples_leaf': 3, 'criterion': 'entropy'}. Best is trial 53 with value: 0.5786036186036186.[0m
[32m[I 2023-01-13 02:33:27,097][0m Trial 55 finished with value: 0.5612043512043512 and parameters: {'n_estimators': 2070, 'max_depth': 122, 'min_samples_split': 8, 'min_samples_leaf': 1, 'criterion': 'entropy'}. Best is trial 53 with value: 0.5786036186036186.[0m
[32m[I 2023-01-13 02:33:31,769][0m Trial 56 finished with value: 0.5645376845376846 and parameters: {'n_estimators': 2127, 'max_depth': 116, 'min_samples_split': 12, 'min_samples_leaf': 1, 'criterion': 'entropy'}. Best is trial 53 with value: 0.5786036186036186.[0m
[32m[I 2023-01-13 02:33:36,074][0m Trial 57 finished with value: 0.2732600732600733 and parameters: {'n_estimators': 2001, 'max_depth': 116, 'min_samples_split': 12, 'min_samples_leaf': 16, 'criterion': 'entropy'}. Best is trial 53 with value: 0.5786036186036186.[0m
[32m[I 2023-01-13 02:33:40,635][0m Trial 58 finished with value: 0.2732600732600733 and parameters: {'n_estimators': 2166, 'max_depth': 112, 'min_samples_split': 33, 'min_samples_leaf': 27, 'criterion': 'entropy'}. Best is trial 53 with value: 0.5786036186036186.[0m
[32m[I 2023-01-13 02:33:43,185][0m Trial 59 finished with value: 0.5962803862803863 and parameters: {'n_estimators': 1148, 'max_depth': 123, 'min_samples_split': 8, 'min_samples_leaf': 1, 'criterion': 'entropy'}. Best is trial 59 with value: 0.5962803862803863.[0m
[32m[I 2023-01-13 02:33:45,419][0m Trial 60 finished with value: 0.2732600732600733 and parameters: {'n_estimators': 1072, 'max_depth': 119, 'min_samples_split': 7, 'min_samples_leaf': 19, 'criterion': 'entropy'}. Best is trial 59 with value: 0.5962803862803863.[0m
[32m[I 2023-01-13 02:33:50,494][0m Trial 61 finished with value: 0.507979797979798 and parameters: {'n_estimators': 2300, 'max_depth': 123, 'min_samples_split': 14, 'min_samples_leaf': 1, 'criterion': 'entropy'}. Best is trial 59 with value: 0.5962803862803863.[0m
[32m[I 2023-01-13 02:33:55,085][0m Trial 62 finished with value: 0.4808003108003107 and parameters: {'n_estimators': 2088, 'max_depth': 124, 'min_samples_split': 6, 'min_samples_leaf': 5, 'criterion': 'entropy'}. Best is trial 59 with value: 0.5962803862803863.[0m
[32m[I 2023-01-13 02:34:00,237][0m Trial 63 finished with value: 0.3232600732600733 and parameters: {'n_estimators': 2443, 'max_depth': 45, 'min_samples_split': 10, 'min_samples_leaf': 12, 'criterion': 'entropy'}. Best is trial 59 with value: 0.5962803862803863.[0m
[32m[I 2023-01-13 02:34:06,496][0m Trial 64 finished with value: 0.5596137196137196 and parameters: {'n_estimators': 2791, 'max_depth': 112, 'min_samples_split': 2, 'min_samples_leaf': 1, 'criterion': 'entropy'}. Best is trial 59 with value: 0.5962803862803863.[0m
[32m[I 2023-01-13 02:34:12,600][0m Trial 65 finished with value: 0.2732600732600733 and parameters: {'n_estimators': 2866, 'max_depth': 112, 'min_samples_split': 86, 'min_samples_leaf': 5, 'criterion': 'entropy'}. Best is trial 59 with value: 0.5962803862803863.[0m
[32m[I 2023-01-13 02:34:18,329][0m Trial 66 finished with value: 0.3232600732600733 and parameters: {'n_estimators': 2715, 'max_depth': 117, 'min_samples_split': 20, 'min_samples_leaf': 13, 'criterion': 'entropy'}. Best is trial 59 with value: 0.5962803862803863.[0m
[32m[I 2023-01-13 02:34:22,623][0m Trial 67 finished with value: 0.5402197802197802 and parameters: {'n_estimators': 1907, 'max_depth': 109, 'min_samples_split': 2, 'min_samples_leaf': 1, 'criterion': 'entropy'}. Best is trial 59 with value: 0.5962803862803863.[0m
[32m[I 2023-01-13 02:34:26,668][0m Trial 68 finished with value: 0.2732600732600733 and parameters: {'n_estimators': 1877, 'max_depth': 109, 'min_samples_split': 2, 'min_samples_leaf': 22, 'criterion': 'entropy'}. Best is trial 59 with value: 0.5962803862803863.[0m
[32m[I 2023-01-13 02:34:29,227][0m Trial 69 finished with value: 0.36796536796536794 and parameters: {'n_estimators': 1205, 'max_depth': 99, 'min_samples_split': 5, 'min_samples_leaf': 6, 'criterion': 'entropy'}. Best is trial 59 with value: 0.5962803862803863.[0m
[32m[I 2023-01-13 02:34:30,860][0m Trial 70 finished with value: 0.32659340659340663 and parameters: {'n_estimators': 758, 'max_depth': 126, 'min_samples_split': 12, 'min_samples_leaf': 11, 'criterion': 'entropy'}. Best is trial 59 with value: 0.5962803862803863.[0m
[32m[I 2023-01-13 02:34:34,368][0m Trial 71 finished with value: 0.5786036186036186 and parameters: {'n_estimators': 1569, 'max_depth': 121, 'min_samples_split': 8, 'min_samples_leaf': 1, 'criterion': 'entropy'}. Best is trial 59 with value: 0.5962803862803863.[0m
[32m[I 2023-01-13 02:34:38,055][0m Trial 72 finished with value: 0.5822144522144523 and parameters: {'n_estimators': 1649, 'max_depth': 120, 'min_samples_split': 5, 'min_samples_leaf': 1, 'criterion': 'entropy'}. Best is trial 59 with value: 0.5962803862803863.[0m
[32m[I 2023-01-13 02:34:41,523][0m Trial 73 finished with value: 0.2732600732600733 and parameters: {'n_estimators': 1635, 'max_depth': 121, 'min_samples_split': 10, 'min_samples_leaf': 16, 'criterion': 'entropy'}. Best is trial 59 with value: 0.5962803862803863.[0m
[32m[I 2023-01-13 02:34:44,620][0m Trial 74 finished with value: 0.2732600732600733 and parameters: {'n_estimators': 1465, 'max_depth': 117, 'min_samples_split': 78, 'min_samples_leaf': 6, 'criterion': 'entropy'}. Best is trial 59 with value: 0.5962803862803863.[0m
[32m[I 2023-01-13 02:34:47,993][0m Trial 75 finished with value: 0.3232600732600733 and parameters: {'n_estimators': 1554, 'max_depth': 128, 'min_samples_split': 19, 'min_samples_leaf': 9, 'criterion': 'entropy'}. Best is trial 59 with value: 0.5962803862803863.[0m
[32m[I 2023-01-13 02:34:53,120][0m Trial 76 finished with value: 0.2732600732600733 and parameters: {'n_estimators': 2433, 'max_depth': 120, 'min_samples_split': 14, 'min_samples_leaf': 57, 'criterion': 'entropy'}. Best is trial 59 with value: 0.5962803862803863.[0m
[32m[I 2023-01-13 02:34:55,644][0m Trial 77 finished with value: 0.2732600732600733 and parameters: {'n_estimators': 1195, 'max_depth': 125, 'min_samples_split': 117, 'min_samples_leaf': 4, 'criterion': 'entropy'}. Best is trial 59 with value: 0.5962803862803863.[0m
[32m[I 2023-01-13 02:34:59,324][0m Trial 78 finished with value: 0.2732600732600733 and parameters: {'n_estimators': 1749, 'max_depth': 112, 'min_samples_split': 25, 'min_samples_leaf': 97, 'criterion': 'entropy'}. Best is trial 59 with value: 0.5962803862803863.[0m
[32m[I 2023-01-13 02:35:04,047][0m Trial 79 finished with value: 0.2732600732600733 and parameters: {'n_estimators': 2252, 'max_depth': 119, 'min_samples_split': 92, 'min_samples_leaf': 13, 'criterion': 'entropy'}. Best is trial 59 with value: 0.5962803862803863.[0m
[32m[I 2023-01-13 02:35:08,664][0m Trial 80 finished with value: 0.3232600732600733 and parameters: {'n_estimators': 2140, 'max_depth': 23, 'min_samples_split': 5, 'min_samples_leaf': 9, 'criterion': 'entropy'}. Best is trial 59 with value: 0.5962803862803863.[0m
[32m[I 2023-01-13 02:35:12,772][0m Trial 81 finished with value: 0.5402197802197802 and parameters: {'n_estimators': 1818, 'max_depth': 106, 'min_samples_split': 2, 'min_samples_leaf': 1, 'criterion': 'entropy'}. Best is trial 59 with value: 0.5962803862803863.[0m
[32m[I 2023-01-13 02:35:16,754][0m Trial 82 finished with value: 0.5612043512043512 and parameters: {'n_estimators': 1787, 'max_depth': 106, 'min_samples_split': 9, 'min_samples_leaf': 1, 'criterion': 'entropy'}. Best is trial 59 with value: 0.5962803862803863.[0m
[32m[I 2023-01-13 02:35:19,390][0m Trial 83 finished with value: 0.4762043512043512 and parameters: {'n_estimators': 1227, 'max_depth': 115, 'min_samples_split': 15, 'min_samples_leaf': 5, 'criterion': 'entropy'}. Best is trial 59 with value: 0.5962803862803863.[0m
[32m[I 2023-01-13 02:35:25,204][0m Trial 84 finished with value: 0.3562271062271062 and parameters: {'n_estimators': 2584, 'max_depth': 122, 'min_samples_split': 9, 'min_samples_leaf': 8, 'criterion': 'entropy'}. Best is trial 59 with value: 0.5962803862803863.[0m
[32m[I 2023-01-13 02:35:28,654][0m Trial 85 finished with value: 0.4886363636363636 and parameters: {'n_estimators': 1585, 'max_depth': 96, 'min_samples_split': 5, 'min_samples_leaf': 4, 'criterion': 'entropy'}. Best is trial 59 with value: 0.5962803862803863.[0m
[32m[I 2023-01-13 02:35:32,894][0m Trial 86 finished with value: 0.3232600732600733 and parameters: {'n_estimators': 2014, 'max_depth': 103, 'min_samples_split': 18, 'min_samples_leaf': 12, 'criterion': 'entropy'}. Best is trial 59 with value: 0.5962803862803863.[0m
[32m[I 2023-01-13 02:35:34,658][0m Trial 87 finished with value: 0.2732600732600733 and parameters: {'n_estimators': 831, 'max_depth': 110, 'min_samples_split': 10, 'min_samples_leaf': 128, 'criterion': 'entropy'}. Best is trial 59 with value: 0.5962803862803863.[0m
[32m[I 2023-01-13 02:35:37,805][0m Trial 88 finished with value: 0.2732600732600733 and parameters: {'n_estimators': 1491, 'max_depth': 118, 'min_samples_split': 23, 'min_samples_leaf': 17, 'criterion': 'entropy'}. Best is trial 59 with value: 0.5962803862803863.[0m
[32m[I 2023-01-13 02:35:43,054][0m Trial 89 finished with value: 0.3562271062271062 and parameters: {'n_estimators': 2421, 'max_depth': 107, 'min_samples_split': 14, 'min_samples_leaf': 8, 'criterion': 'entropy'}. Best is trial 59 with value: 0.5962803862803863.[0m
[32m[I 2023-01-13 02:35:49,265][0m Trial 90 finished with value: 0.2732600732600733 and parameters: {'n_estimators': 2959, 'max_depth': 125, 'min_samples_split': 28, 'min_samples_leaf': 72, 'criterion': 'entropy'}. Best is trial 59 with value: 0.5962803862803863.[0m
[32m[I 2023-01-13 02:35:53,581][0m Trial 91 finished with value: 0.5822144522144523 and parameters: {'n_estimators': 1916, 'max_depth': 109, 'min_samples_split': 4, 'min_samples_leaf': 1, 'criterion': 'entropy'}. Best is trial 59 with value: 0.5962803862803863.[0m
[32m[I 2023-01-13 02:35:57,557][0m Trial 92 finished with value: 0.5612043512043512 and parameters: {'n_estimators': 1758, 'max_depth': 113, 'min_samples_split': 5, 'min_samples_leaf': 1, 'criterion': 'entropy'}. Best is trial 59 with value: 0.5962803862803863.[0m
[32m[I 2023-01-13 02:36:01,850][0m Trial 93 finished with value: 0.45979020979020974 and parameters: {'n_estimators': 1963, 'max_depth': 115, 'min_samples_split': 9, 'min_samples_leaf': 4, 'criterion': 'entropy'}. Best is trial 59 with value: 0.5962803862803863.[0m
[32m[I 2023-01-13 02:36:05,482][0m Trial 94 finished with value: 0.34523809523809523 and parameters: {'n_estimators': 1718, 'max_depth': 121, 'min_samples_split': 5, 'min_samples_leaf': 7, 'criterion': 'entropy'}. Best is trial 59 with value: 0.5962803862803863.[0m
[32m[I 2023-01-13 02:36:09,222][0m Trial 95 finished with value: 0.3232600732600733 and parameters: {'n_estimators': 1764, 'max_depth': 117, 'min_samples_split': 13, 'min_samples_leaf': 10, 'criterion': 'entropy'}. Best is trial 59 with value: 0.5962803862803863.[0m
[32m[I 2023-01-13 02:36:13,801][0m Trial 96 finished with value: 0.505050505050505 and parameters: {'n_estimators': 2133, 'max_depth': 105, 'min_samples_split': 18, 'min_samples_leaf': 3, 'criterion': 'entropy'}. Best is trial 59 with value: 0.5962803862803863.[0m
[32m[I 2023-01-13 02:36:16,767][0m Trial 97 finished with value: 0.2732600732600733 and parameters: {'n_estimators': 1420, 'max_depth': 74, 'min_samples_split': 57, 'min_samples_leaf': 6, 'criterion': 'entropy'}. Best is trial 59 with value: 0.5962803862803863.[0m
[32m[I 2023-01-13 02:36:19,603][0m Trial 98 finished with value: 0.29670329670329676 and parameters: {'n_estimators': 1310, 'max_depth': 100, 'min_samples_split': 7, 'min_samples_leaf': 14, 'criterion': 'entropy'}. Best is trial 59 with value: 0.5962803862803863.[0m
[32m[I 2023-01-13 02:36:23,232][0m Trial 99 finished with value: 0.5822144522144523 and parameters: {'n_estimators': 1639, 'max_depth': 128, 'min_samples_split': 11, 'min_samples_leaf': 1, 'criterion': 'entropy'}. Best is trial 59 with value: 0.5962803862803863.[0m
Uploaded file from /Users/kevinmaikjablonka/git/kjappelbaum/gptchem/experiments/03_classification/opv/out/20230113_020122/train.jsonl: file-gxv353q8UL7K0VX36KOjE2z2
Ran train size 50 and got accuracy 0.54, XGB baseline 0.568, and TabPFN baseline 0.576
Computing morgan fingerprints...
Loading model that can be used for inference only
Using a Transformer with 25.82 M parameters
╒═════════════════════════╤═══════════╤══════════════════╤═════════╤═════════════╤═════════╤═════════╤═════════╕
│ name                    │ class     │ transform        │ prior   │ trainable   │ shape   │ dtype   │   value │
╞═════════════════════════╪═══════════╪══════════════════╪═════════╪═════════════╪═════════╪═════════╪═════════╡
│ GPR.mean_function.c     │ Parameter │ Identity         │         │ True        │ ()      │ float64 │       0 │
├─────────────────────────┼───────────┼──────────────────┼─────────┼─────────────┼─────────┼─────────┼─────────┤
│ GPR.kernel.variance     │ Parameter │ Softplus         │         │ True        │ ()      │ float64 │       0 │
├─────────────────────────┼───────────┼──────────────────┼─────────┼─────────────┼─────────┼─────────┼─────────┤
│ GPR.likelihood.variance │ Parameter │ Softplus + Shift │         │ True        │ ()      │ float64 │       1 │
╘═════════════════════════╧═══════════╧══════════════════╧═════════╧═════════════╧═════════╧═════════╧═════════╛
Upload progress:   0%|          | 0.00/65.2k [00:00<?, ?it/s]Upload progress: 100%|██████████| 65.2k/65.2k [00:00<00:00, 21.4Mit/s]
[32m[I 2023-01-13 02:44:38,099][0m A new study created in memory with name: no-name-6d74a5ca-b421-4b64-bfe2-9d08c4b51e6a[0m
/Users/kevinmaikjablonka/git/kjappelbaum/gptchem/src/gptchem/baselines/xgboost.py:38: FutureWarning: suggest_loguniform has been deprecated in v3.0.0. This feature will be removed in v6.0.0. See https://github.com/optuna/optuna/releases/tag/v3.0.0. Use :func:`~optuna.trial.Trial.suggest_float` instead.
  "learning_rate": trial.suggest_loguniform("learning_rate", 0.001, 0.05),
/Users/kevinmaikjablonka/git/kjappelbaum/gptchem/src/gptchem/baselines/xgboost.py:39: FutureWarning: suggest_loguniform has been deprecated in v3.0.0. This feature will be removed in v6.0.0. See https://github.com/optuna/optuna/releases/tag/v3.0.0. Use :func:`~optuna.trial.Trial.suggest_float` instead.
  "colsample_bytree": trial.suggest_loguniform(
/Users/kevinmaikjablonka/git/kjappelbaum/gptchem/src/gptchem/baselines/xgboost.py:42: FutureWarning: suggest_loguniform has been deprecated in v3.0.0. This feature will be removed in v6.0.0. See https://github.com/optuna/optuna/releases/tag/v3.0.0. Use :func:`~optuna.trial.Trial.suggest_float` instead.
  "subsample": trial.suggest_loguniform("subsample", 0.00001, 1),
/Users/kevinmaikjablonka/git/kjappelbaum/gptchem/src/gptchem/baselines/xgboost.py:43: FutureWarning: suggest_loguniform has been deprecated in v3.0.0. This feature will be removed in v6.0.0. See https://github.com/optuna/optuna/releases/tag/v3.0.0. Use :func:`~optuna.trial.Trial.suggest_float` instead.
  "alpha": trial.suggest_loguniform("alpha", 1e-8, 10.0),
/Users/kevinmaikjablonka/git/kjappelbaum/gptchem/src/gptchem/baselines/xgboost.py:44: FutureWarning: suggest_loguniform has been deprecated in v3.0.0. This feature will be removed in v6.0.0. See https://github.com/optuna/optuna/releases/tag/v3.0.0. Use :func:`~optuna.trial.Trial.suggest_float` instead.
  "lambda": trial.suggest_loguniform("lambda", 1e-8, 10.0),
[32m[I 2023-01-13 02:44:42,595][0m Trial 0 finished with value: 0.32731631113984055 and parameters: {'n_estimators': 5490, 'max_depth': 37, 'learning_rate': 0.010570046446158271, 'colsample_bytree': 0.48071425018349023, 'subsample': 0.0013130280280658588, 'alpha': 0.006502000785097662, 'lambda': 8.675307976899775e-05}. Best is trial 0 with value: 0.32731631113984055.[0m
/Users/kevinmaikjablonka/git/kjappelbaum/gptchem/src/gptchem/baselines/xgboost.py:38: FutureWarning: suggest_loguniform has been deprecated in v3.0.0. This feature will be removed in v6.0.0. See https://github.com/optuna/optuna/releases/tag/v3.0.0. Use :func:`~optuna.trial.Trial.suggest_float` instead.
  "learning_rate": trial.suggest_loguniform("learning_rate", 0.001, 0.05),
/Users/kevinmaikjablonka/git/kjappelbaum/gptchem/src/gptchem/baselines/xgboost.py:39: FutureWarning: suggest_loguniform has been deprecated in v3.0.0. This feature will be removed in v6.0.0. See https://github.com/optuna/optuna/releases/tag/v3.0.0. Use :func:`~optuna.trial.Trial.suggest_float` instead.
  "colsample_bytree": trial.suggest_loguniform(
/Users/kevinmaikjablonka/git/kjappelbaum/gptchem/src/gptchem/baselines/xgboost.py:42: FutureWarning: suggest_loguniform has been deprecated in v3.0.0. This feature will be removed in v6.0.0. See https://github.com/optuna/optuna/releases/tag/v3.0.0. Use :func:`~optuna.trial.Trial.suggest_float` instead.
  "subsample": trial.suggest_loguniform("subsample", 0.00001, 1),
/Users/kevinmaikjablonka/git/kjappelbaum/gptchem/src/gptchem/baselines/xgboost.py:43: FutureWarning: suggest_loguniform has been deprecated in v3.0.0. This feature will be removed in v6.0.0. See https://github.com/optuna/optuna/releases/tag/v3.0.0. Use :func:`~optuna.trial.Trial.suggest_float` instead.
  "alpha": trial.suggest_loguniform("alpha", 1e-8, 10.0),
/Users/kevinmaikjablonka/git/kjappelbaum/gptchem/src/gptchem/baselines/xgboost.py:44: FutureWarning: suggest_loguniform has been deprecated in v3.0.0. This feature will be removed in v6.0.0. See https://github.com/optuna/optuna/releases/tag/v3.0.0. Use :func:`~optuna.trial.Trial.suggest_float` instead.
  "lambda": trial.suggest_loguniform("lambda", 1e-8, 10.0),
