[32m[I 2023-01-13 02:47:03,737][0m Trial 21 finished with value: 0.4683838383838384 and parameters: {'n_estimators': 9175, 'max_depth': 45, 'learning_rate': 0.03534089848510369, 'colsample_bytree': 0.2839497621115667, 'subsample': 0.2791696533990062, 'alpha': 0.0005677762656418596, 'lambda': 0.006470110540109253}. Best is trial 20 with value: 0.564116439116439.[0m
/Users/kevinmaikjablonka/git/kjappelbaum/gptchem/src/gptchem/baselines/xgboost.py:38: FutureWarning: suggest_loguniform has been deprecated in v3.0.0. This feature will be removed in v6.0.0. See https://github.com/optuna/optuna/releases/tag/v3.0.0. Use :func:`~optuna.trial.Trial.suggest_float` instead.
  "learning_rate": trial.suggest_loguniform("learning_rate", 0.001, 0.05),
/Users/kevinmaikjablonka/git/kjappelbaum/gptchem/src/gptchem/baselines/xgboost.py:39: FutureWarning: suggest_loguniform has been deprecated in v3.0.0. This feature will be removed in v6.0.0. See https://github.com/optuna/optuna/releases/tag/v3.0.0. Use :func:`~optuna.trial.Trial.suggest_float` instead.
  "colsample_bytree": trial.suggest_loguniform(
/Users/kevinmaikjablonka/git/kjappelbaum/gptchem/src/gptchem/baselines/xgboost.py:42: FutureWarning: suggest_loguniform has been deprecated in v3.0.0. This feature will be removed in v6.0.0. See https://github.com/optuna/optuna/releases/tag/v3.0.0. Use :func:`~optuna.trial.Trial.suggest_float` instead.
  "subsample": trial.suggest_loguniform("subsample", 0.00001, 1),
/Users/kevinmaikjablonka/git/kjappelbaum/gptchem/src/gptchem/baselines/xgboost.py:43: FutureWarning: suggest_loguniform has been deprecated in v3.0.0. This feature will be removed in v6.0.0. See https://github.com/optuna/optuna/releases/tag/v3.0.0. Use :func:`~optuna.trial.Trial.suggest_float` instead.
  "alpha": trial.suggest_loguniform("alpha", 1e-8, 10.0),
/Users/kevinmaikjablonka/git/kjappelbaum/gptchem/src/gptchem/baselines/xgboost.py:44: FutureWarning: suggest_loguniform has been deprecated in v3.0.0. This feature will be removed in v6.0.0. See https://github.com/optuna/optuna/releases/tag/v3.0.0. Use :func:`~optuna.trial.Trial.suggest_float` instead.
  "lambda": trial.suggest_loguniform("lambda", 1e-8, 10.0),
[32m[I 2023-01-13 02:47:18,195][0m Trial 22 finished with value: 0.5618270618270618 and parameters: {'n_estimators': 9897, 'max_depth': 46, 'learning_rate': 0.020952301394668617, 'colsample_bytree': 0.3816182177909761, 'subsample': 0.9196608324364225, 'alpha': 0.00016925063847598394, 'lambda': 0.06434917528444956}. Best is trial 20 with value: 0.564116439116439.[0m
/Users/kevinmaikjablonka/git/kjappelbaum/gptchem/src/gptchem/baselines/xgboost.py:38: FutureWarning: suggest_loguniform has been deprecated in v3.0.0. This feature will be removed in v6.0.0. See https://github.com/optuna/optuna/releases/tag/v3.0.0. Use :func:`~optuna.trial.Trial.suggest_float` instead.
  "learning_rate": trial.suggest_loguniform("learning_rate", 0.001, 0.05),
/Users/kevinmaikjablonka/git/kjappelbaum/gptchem/src/gptchem/baselines/xgboost.py:39: FutureWarning: suggest_loguniform has been deprecated in v3.0.0. This feature will be removed in v6.0.0. See https://github.com/optuna/optuna/releases/tag/v3.0.0. Use :func:`~optuna.trial.Trial.suggest_float` instead.
  "colsample_bytree": trial.suggest_loguniform(
/Users/kevinmaikjablonka/git/kjappelbaum/gptchem/src/gptchem/baselines/xgboost.py:42: FutureWarning: suggest_loguniform has been deprecated in v3.0.0. This feature will be removed in v6.0.0. See https://github.com/optuna/optuna/releases/tag/v3.0.0. Use :func:`~optuna.trial.Trial.suggest_float` instead.
  "subsample": trial.suggest_loguniform("subsample", 0.00001, 1),
/Users/kevinmaikjablonka/git/kjappelbaum/gptchem/src/gptchem/baselines/xgboost.py:43: FutureWarning: suggest_loguniform has been deprecated in v3.0.0. This feature will be removed in v6.0.0. See https://github.com/optuna/optuna/releases/tag/v3.0.0. Use :func:`~optuna.trial.Trial.suggest_float` instead.
  "alpha": trial.suggest_loguniform("alpha", 1e-8, 10.0),
/Users/kevinmaikjablonka/git/kjappelbaum/gptchem/src/gptchem/baselines/xgboost.py:44: FutureWarning: suggest_loguniform has been deprecated in v3.0.0. This feature will be removed in v6.0.0. See https://github.com/optuna/optuna/releases/tag/v3.0.0. Use :func:`~optuna.trial.Trial.suggest_float` instead.
  "lambda": trial.suggest_loguniform("lambda", 1e-8, 10.0),
[32m[I 2023-01-13 02:47:24,774][0m Trial 23 finished with value: 0.2732600732600733 and parameters: {'n_estimators': 8595, 'max_depth': 46, 'learning_rate': 0.021321506233806214, 'colsample_bytree': 0.29278135591068244, 'subsample': 0.0686700900622016, 'alpha': 0.017748954902087197, 'lambda': 0.6348098896687479}. Best is trial 20 with value: 0.564116439116439.[0m
/Users/kevinmaikjablonka/git/kjappelbaum/gptchem/src/gptchem/baselines/xgboost.py:38: FutureWarning: suggest_loguniform has been deprecated in v3.0.0. This feature will be removed in v6.0.0. See https://github.com/optuna/optuna/releases/tag/v3.0.0. Use :func:`~optuna.trial.Trial.suggest_float` instead.
  "learning_rate": trial.suggest_loguniform("learning_rate", 0.001, 0.05),
/Users/kevinmaikjablonka/git/kjappelbaum/gptchem/src/gptchem/baselines/xgboost.py:39: FutureWarning: suggest_loguniform has been deprecated in v3.0.0. This feature will be removed in v6.0.0. See https://github.com/optuna/optuna/releases/tag/v3.0.0. Use :func:`~optuna.trial.Trial.suggest_float` instead.
  "colsample_bytree": trial.suggest_loguniform(
/Users/kevinmaikjablonka/git/kjappelbaum/gptchem/src/gptchem/baselines/xgboost.py:42: FutureWarning: suggest_loguniform has been deprecated in v3.0.0. This feature will be removed in v6.0.0. See https://github.com/optuna/optuna/releases/tag/v3.0.0. Use :func:`~optuna.trial.Trial.suggest_float` instead.
  "subsample": trial.suggest_loguniform("subsample", 0.00001, 1),
/Users/kevinmaikjablonka/git/kjappelbaum/gptchem/src/gptchem/baselines/xgboost.py:43: FutureWarning: suggest_loguniform has been deprecated in v3.0.0. This feature will be removed in v6.0.0. See https://github.com/optuna/optuna/releases/tag/v3.0.0. Use :func:`~optuna.trial.Trial.suggest_float` instead.
  "alpha": trial.suggest_loguniform("alpha", 1e-8, 10.0),
/Users/kevinmaikjablonka/git/kjappelbaum/gptchem/src/gptchem/baselines/xgboost.py:44: FutureWarning: suggest_loguniform has been deprecated in v3.0.0. This feature will be removed in v6.0.0. See https://github.com/optuna/optuna/releases/tag/v3.0.0. Use :func:`~optuna.trial.Trial.suggest_float` instead.
  "lambda": trial.suggest_loguniform("lambda", 1e-8, 10.0),
[32m[I 2023-01-13 02:47:36,823][0m Trial 24 finished with value: 0.48858585858585846 and parameters: {'n_estimators': 9597, 'max_depth': 21, 'learning_rate': 0.008612122974264653, 'colsample_bytree': 0.2538144432666992, 'subsample': 0.8939563021056767, 'alpha': 0.00024232349183653658, 'lambda': 0.06782827540640571}. Best is trial 20 with value: 0.564116439116439.[0m
/Users/kevinmaikjablonka/git/kjappelbaum/gptchem/src/gptchem/baselines/xgboost.py:38: FutureWarning: suggest_loguniform has been deprecated in v3.0.0. This feature will be removed in v6.0.0. See https://github.com/optuna/optuna/releases/tag/v3.0.0. Use :func:`~optuna.trial.Trial.suggest_float` instead.
  "learning_rate": trial.suggest_loguniform("learning_rate", 0.001, 0.05),
/Users/kevinmaikjablonka/git/kjappelbaum/gptchem/src/gptchem/baselines/xgboost.py:39: FutureWarning: suggest_loguniform has been deprecated in v3.0.0. This feature will be removed in v6.0.0. See https://github.com/optuna/optuna/releases/tag/v3.0.0. Use :func:`~optuna.trial.Trial.suggest_float` instead.
  "colsample_bytree": trial.suggest_loguniform(
/Users/kevinmaikjablonka/git/kjappelbaum/gptchem/src/gptchem/baselines/xgboost.py:42: FutureWarning: suggest_loguniform has been deprecated in v3.0.0. This feature will be removed in v6.0.0. See https://github.com/optuna/optuna/releases/tag/v3.0.0. Use :func:`~optuna.trial.Trial.suggest_float` instead.
  "subsample": trial.suggest_loguniform("subsample", 0.00001, 1),
/Users/kevinmaikjablonka/git/kjappelbaum/gptchem/src/gptchem/baselines/xgboost.py:43: FutureWarning: suggest_loguniform has been deprecated in v3.0.0. This feature will be removed in v6.0.0. See https://github.com/optuna/optuna/releases/tag/v3.0.0. Use :func:`~optuna.trial.Trial.suggest_float` instead.
  "alpha": trial.suggest_loguniform("alpha", 1e-8, 10.0),
/Users/kevinmaikjablonka/git/kjappelbaum/gptchem/src/gptchem/baselines/xgboost.py:44: FutureWarning: suggest_loguniform has been deprecated in v3.0.0. This feature will be removed in v6.0.0. See https://github.com/optuna/optuna/releases/tag/v3.0.0. Use :func:`~optuna.trial.Trial.suggest_float` instead.
  "lambda": trial.suggest_loguniform("lambda", 1e-8, 10.0),
[32m[I 2023-01-13 02:47:46,448][0m Trial 25 finished with value: 0.47222222222222215 and parameters: {'n_estimators': 10000, 'max_depth': 38, 'learning_rate': 0.015719242899173716, 'colsample_bytree': 0.394927539398407, 'subsample': 0.24048378570598294, 'alpha': 0.004409837523719677, 'lambda': 0.004036522949120739}. Best is trial 20 with value: 0.564116439116439.[0m
/Users/kevinmaikjablonka/git/kjappelbaum/gptchem/src/gptchem/baselines/xgboost.py:38: FutureWarning: suggest_loguniform has been deprecated in v3.0.0. This feature will be removed in v6.0.0. See https://github.com/optuna/optuna/releases/tag/v3.0.0. Use :func:`~optuna.trial.Trial.suggest_float` instead.
  "learning_rate": trial.suggest_loguniform("learning_rate", 0.001, 0.05),
/Users/kevinmaikjablonka/git/kjappelbaum/gptchem/src/gptchem/baselines/xgboost.py:39: FutureWarning: suggest_loguniform has been deprecated in v3.0.0. This feature will be removed in v6.0.0. See https://github.com/optuna/optuna/releases/tag/v3.0.0. Use :func:`~optuna.trial.Trial.suggest_float` instead.
  "colsample_bytree": trial.suggest_loguniform(
/Users/kevinmaikjablonka/git/kjappelbaum/gptchem/src/gptchem/baselines/xgboost.py:42: FutureWarning: suggest_loguniform has been deprecated in v3.0.0. This feature will be removed in v6.0.0. See https://github.com/optuna/optuna/releases/tag/v3.0.0. Use :func:`~optuna.trial.Trial.suggest_float` instead.
  "subsample": trial.suggest_loguniform("subsample", 0.00001, 1),
/Users/kevinmaikjablonka/git/kjappelbaum/gptchem/src/gptchem/baselines/xgboost.py:43: FutureWarning: suggest_loguniform has been deprecated in v3.0.0. This feature will be removed in v6.0.0. See https://github.com/optuna/optuna/releases/tag/v3.0.0. Use :func:`~optuna.trial.Trial.suggest_float` instead.
  "alpha": trial.suggest_loguniform("alpha", 1e-8, 10.0),
/Users/kevinmaikjablonka/git/kjappelbaum/gptchem/src/gptchem/baselines/xgboost.py:44: FutureWarning: suggest_loguniform has been deprecated in v3.0.0. This feature will be removed in v6.0.0. See https://github.com/optuna/optuna/releases/tag/v3.0.0. Use :func:`~optuna.trial.Trial.suggest_float` instead.
  "lambda": trial.suggest_loguniform("lambda", 1e-8, 10.0),
[32m[I 2023-01-13 02:47:52,780][0m Trial 26 finished with value: 0.29670329670329676 and parameters: {'n_estimators': 7409, 'max_depth': 32, 'learning_rate': 0.02736750576526617, 'colsample_bytree': 0.523538779871019, 'subsample': 0.04055066321837363, 'alpha': 0.11384730577853971, 'lambda': 9.516704768058608e-06}. Best is trial 20 with value: 0.564116439116439.[0m
/Users/kevinmaikjablonka/git/kjappelbaum/gptchem/src/gptchem/baselines/xgboost.py:38: FutureWarning: suggest_loguniform has been deprecated in v3.0.0. This feature will be removed in v6.0.0. See https://github.com/optuna/optuna/releases/tag/v3.0.0. Use :func:`~optuna.trial.Trial.suggest_float` instead.
  "learning_rate": trial.suggest_loguniform("learning_rate", 0.001, 0.05),
/Users/kevinmaikjablonka/git/kjappelbaum/gptchem/src/gptchem/baselines/xgboost.py:39: FutureWarning: suggest_loguniform has been deprecated in v3.0.0. This feature will be removed in v6.0.0. See https://github.com/optuna/optuna/releases/tag/v3.0.0. Use :func:`~optuna.trial.Trial.suggest_float` instead.
  "colsample_bytree": trial.suggest_loguniform(
/Users/kevinmaikjablonka/git/kjappelbaum/gptchem/src/gptchem/baselines/xgboost.py:42: FutureWarning: suggest_loguniform has been deprecated in v3.0.0. This feature will be removed in v6.0.0. See https://github.com/optuna/optuna/releases/tag/v3.0.0. Use :func:`~optuna.trial.Trial.suggest_float` instead.
  "subsample": trial.suggest_loguniform("subsample", 0.00001, 1),
/Users/kevinmaikjablonka/git/kjappelbaum/gptchem/src/gptchem/baselines/xgboost.py:43: FutureWarning: suggest_loguniform has been deprecated in v3.0.0. This feature will be removed in v6.0.0. See https://github.com/optuna/optuna/releases/tag/v3.0.0. Use :func:`~optuna.trial.Trial.suggest_float` instead.
  "alpha": trial.suggest_loguniform("alpha", 1e-8, 10.0),
/Users/kevinmaikjablonka/git/kjappelbaum/gptchem/src/gptchem/baselines/xgboost.py:44: FutureWarning: suggest_loguniform has been deprecated in v3.0.0. This feature will be removed in v6.0.0. See https://github.com/optuna/optuna/releases/tag/v3.0.0. Use :func:`~optuna.trial.Trial.suggest_float` instead.
  "lambda": trial.suggest_loguniform("lambda", 1e-8, 10.0),
[32m[I 2023-01-13 02:47:54,659][0m Trial 27 finished with value: 0.32731631113984055 and parameters: {'n_estimators': 2559, 'max_depth': 47, 'learning_rate': 0.018932617588572592, 'colsample_bytree': 0.20992663878812298, 'subsample': 0.006881609215706596, 'alpha': 0.0002326727988236504, 'lambda': 0.000527270487908222}. Best is trial 20 with value: 0.564116439116439.[0m
/Users/kevinmaikjablonka/git/kjappelbaum/gptchem/src/gptchem/baselines/xgboost.py:38: FutureWarning: suggest_loguniform has been deprecated in v3.0.0. This feature will be removed in v6.0.0. See https://github.com/optuna/optuna/releases/tag/v3.0.0. Use :func:`~optuna.trial.Trial.suggest_float` instead.
  "learning_rate": trial.suggest_loguniform("learning_rate", 0.001, 0.05),
/Users/kevinmaikjablonka/git/kjappelbaum/gptchem/src/gptchem/baselines/xgboost.py:39: FutureWarning: suggest_loguniform has been deprecated in v3.0.0. This feature will be removed in v6.0.0. See https://github.com/optuna/optuna/releases/tag/v3.0.0. Use :func:`~optuna.trial.Trial.suggest_float` instead.
  "colsample_bytree": trial.suggest_loguniform(
/Users/kevinmaikjablonka/git/kjappelbaum/gptchem/src/gptchem/baselines/xgboost.py:42: FutureWarning: suggest_loguniform has been deprecated in v3.0.0. This feature will be removed in v6.0.0. See https://github.com/optuna/optuna/releases/tag/v3.0.0. Use :func:`~optuna.trial.Trial.suggest_float` instead.
  "subsample": trial.suggest_loguniform("subsample", 0.00001, 1),
/Users/kevinmaikjablonka/git/kjappelbaum/gptchem/src/gptchem/baselines/xgboost.py:43: FutureWarning: suggest_loguniform has been deprecated in v3.0.0. This feature will be removed in v6.0.0. See https://github.com/optuna/optuna/releases/tag/v3.0.0. Use :func:`~optuna.trial.Trial.suggest_float` instead.
  "alpha": trial.suggest_loguniform("alpha", 1e-8, 10.0),
/Users/kevinmaikjablonka/git/kjappelbaum/gptchem/src/gptchem/baselines/xgboost.py:44: FutureWarning: suggest_loguniform has been deprecated in v3.0.0. This feature will be removed in v6.0.0. See https://github.com/optuna/optuna/releases/tag/v3.0.0. Use :func:`~optuna.trial.Trial.suggest_float` instead.
  "lambda": trial.suggest_loguniform("lambda", 1e-8, 10.0),
[32m[I 2023-01-13 02:48:02,141][0m Trial 28 finished with value: 0.4683838383838384 and parameters: {'n_estimators': 8445, 'max_depth': 39, 'learning_rate': 0.03542001708544566, 'colsample_bytree': 0.3073921243497678, 'subsample': 0.2484450838316159, 'alpha': 3.7951796103932325e-06, 'lambda': 0.5804184093041443}. Best is trial 20 with value: 0.564116439116439.[0m
/Users/kevinmaikjablonka/git/kjappelbaum/gptchem/src/gptchem/baselines/xgboost.py:38: FutureWarning: suggest_loguniform has been deprecated in v3.0.0. This feature will be removed in v6.0.0. See https://github.com/optuna/optuna/releases/tag/v3.0.0. Use :func:`~optuna.trial.Trial.suggest_float` instead.
  "learning_rate": trial.suggest_loguniform("learning_rate", 0.001, 0.05),
/Users/kevinmaikjablonka/git/kjappelbaum/gptchem/src/gptchem/baselines/xgboost.py:39: FutureWarning: suggest_loguniform has been deprecated in v3.0.0. This feature will be removed in v6.0.0. See https://github.com/optuna/optuna/releases/tag/v3.0.0. Use :func:`~optuna.trial.Trial.suggest_float` instead.
  "colsample_bytree": trial.suggest_loguniform(
/Users/kevinmaikjablonka/git/kjappelbaum/gptchem/src/gptchem/baselines/xgboost.py:42: FutureWarning: suggest_loguniform has been deprecated in v3.0.0. This feature will be removed in v6.0.0. See https://github.com/optuna/optuna/releases/tag/v3.0.0. Use :func:`~optuna.trial.Trial.suggest_float` instead.
  "subsample": trial.suggest_loguniform("subsample", 0.00001, 1),
/Users/kevinmaikjablonka/git/kjappelbaum/gptchem/src/gptchem/baselines/xgboost.py:43: FutureWarning: suggest_loguniform has been deprecated in v3.0.0. This feature will be removed in v6.0.0. See https://github.com/optuna/optuna/releases/tag/v3.0.0. Use :func:`~optuna.trial.Trial.suggest_float` instead.
  "alpha": trial.suggest_loguniform("alpha", 1e-8, 10.0),
/Users/kevinmaikjablonka/git/kjappelbaum/gptchem/src/gptchem/baselines/xgboost.py:44: FutureWarning: suggest_loguniform has been deprecated in v3.0.0. This feature will be removed in v6.0.0. See https://github.com/optuna/optuna/releases/tag/v3.0.0. Use :func:`~optuna.trial.Trial.suggest_float` instead.
  "lambda": trial.suggest_loguniform("lambda", 1e-8, 10.0),
[32m[I 2023-01-13 02:48:05,815][0m Trial 29 finished with value: 0.3273163111398406 and parameters: {'n_estimators': 4455, 'max_depth': 35, 'learning_rate': 0.013032815572064253, 'colsample_bytree': 0.47704244265046636, 'subsample': 0.008899994978606605, 'alpha': 0.004654546809813438, 'lambda': 0.00011286421645191155}. Best is trial 20 with value: 0.564116439116439.[0m
/Users/kevinmaikjablonka/git/kjappelbaum/gptchem/src/gptchem/baselines/xgboost.py:38: FutureWarning: suggest_loguniform has been deprecated in v3.0.0. This feature will be removed in v6.0.0. See https://github.com/optuna/optuna/releases/tag/v3.0.0. Use :func:`~optuna.trial.Trial.suggest_float` instead.
  "learning_rate": trial.suggest_loguniform("learning_rate", 0.001, 0.05),
/Users/kevinmaikjablonka/git/kjappelbaum/gptchem/src/gptchem/baselines/xgboost.py:39: FutureWarning: suggest_loguniform has been deprecated in v3.0.0. This feature will be removed in v6.0.0. See https://github.com/optuna/optuna/releases/tag/v3.0.0. Use :func:`~optuna.trial.Trial.suggest_float` instead.
  "colsample_bytree": trial.suggest_loguniform(
/Users/kevinmaikjablonka/git/kjappelbaum/gptchem/src/gptchem/baselines/xgboost.py:42: FutureWarning: suggest_loguniform has been deprecated in v3.0.0. This feature will be removed in v6.0.0. See https://github.com/optuna/optuna/releases/tag/v3.0.0. Use :func:`~optuna.trial.Trial.suggest_float` instead.
  "subsample": trial.suggest_loguniform("subsample", 0.00001, 1),
/Users/kevinmaikjablonka/git/kjappelbaum/gptchem/src/gptchem/baselines/xgboost.py:43: FutureWarning: suggest_loguniform has been deprecated in v3.0.0. This feature will be removed in v6.0.0. See https://github.com/optuna/optuna/releases/tag/v3.0.0. Use :func:`~optuna.trial.Trial.suggest_float` instead.
  "alpha": trial.suggest_loguniform("alpha", 1e-8, 10.0),
/Users/kevinmaikjablonka/git/kjappelbaum/gptchem/src/gptchem/baselines/xgboost.py:44: FutureWarning: suggest_loguniform has been deprecated in v3.0.0. This feature will be removed in v6.0.0. See https://github.com/optuna/optuna/releases/tag/v3.0.0. Use :func:`~optuna.trial.Trial.suggest_float` instead.
  "lambda": trial.suggest_loguniform("lambda", 1e-8, 10.0),
[32m[I 2023-01-13 02:48:11,568][0m Trial 30 finished with value: 0.2732600732600733 and parameters: {'n_estimators': 6500, 'max_depth': 47, 'learning_rate': 0.009358978349543167, 'colsample_bytree': 0.5813556002177173, 'subsample': 0.0531295720244386, 'alpha': 5.4470570189340945e-05, 'lambda': 2.73070271611015e-05}. Best is trial 20 with value: 0.564116439116439.[0m
/Users/kevinmaikjablonka/git/kjappelbaum/gptchem/src/gptchem/baselines/xgboost.py:38: FutureWarning: suggest_loguniform has been deprecated in v3.0.0. This feature will be removed in v6.0.0. See https://github.com/optuna/optuna/releases/tag/v3.0.0. Use :func:`~optuna.trial.Trial.suggest_float` instead.
  "learning_rate": trial.suggest_loguniform("learning_rate", 0.001, 0.05),
/Users/kevinmaikjablonka/git/kjappelbaum/gptchem/src/gptchem/baselines/xgboost.py:39: FutureWarning: suggest_loguniform has been deprecated in v3.0.0. This feature will be removed in v6.0.0. See https://github.com/optuna/optuna/releases/tag/v3.0.0. Use :func:`~optuna.trial.Trial.suggest_float` instead.
  "colsample_bytree": trial.suggest_loguniform(
/Users/kevinmaikjablonka/git/kjappelbaum/gptchem/src/gptchem/baselines/xgboost.py:42: FutureWarning: suggest_loguniform has been deprecated in v3.0.0. This feature will be removed in v6.0.0. See https://github.com/optuna/optuna/releases/tag/v3.0.0. Use :func:`~optuna.trial.Trial.suggest_float` instead.
  "subsample": trial.suggest_loguniform("subsample", 0.00001, 1),
/Users/kevinmaikjablonka/git/kjappelbaum/gptchem/src/gptchem/baselines/xgboost.py:43: FutureWarning: suggest_loguniform has been deprecated in v3.0.0. This feature will be removed in v6.0.0. See https://github.com/optuna/optuna/releases/tag/v3.0.0. Use :func:`~optuna.trial.Trial.suggest_float` instead.
  "alpha": trial.suggest_loguniform("alpha", 1e-8, 10.0),
/Users/kevinmaikjablonka/git/kjappelbaum/gptchem/src/gptchem/baselines/xgboost.py:44: FutureWarning: suggest_loguniform has been deprecated in v3.0.0. This feature will be removed in v6.0.0. See https://github.com/optuna/optuna/releases/tag/v3.0.0. Use :func:`~optuna.trial.Trial.suggest_float` instead.
  "lambda": trial.suggest_loguniform("lambda", 1e-8, 10.0),
