[32m[I 2023-01-13 04:54:07,770][0m Trial 91 finished with value: 0.5342412136479305 and parameters: {'n_estimators': 8358, 'max_depth': 48, 'learning_rate': 0.042613943505999397, 'colsample_bytree': 0.4036132911895266, 'subsample': 0.541937677186372, 'alpha': 3.6217969777533813e-06, 'lambda': 0.12303805743966653}. Best is trial 86 with value: 0.5763263657865891.[0m
/Users/kevinmaikjablonka/git/kjappelbaum/gptchem/src/gptchem/baselines/xgboost.py:38: FutureWarning: suggest_loguniform has been deprecated in v3.0.0. This feature will be removed in v6.0.0. See https://github.com/optuna/optuna/releases/tag/v3.0.0. Use :func:`~optuna.trial.Trial.suggest_float` instead.
  "learning_rate": trial.suggest_loguniform("learning_rate", 0.001, 0.05),
/Users/kevinmaikjablonka/git/kjappelbaum/gptchem/src/gptchem/baselines/xgboost.py:39: FutureWarning: suggest_loguniform has been deprecated in v3.0.0. This feature will be removed in v6.0.0. See https://github.com/optuna/optuna/releases/tag/v3.0.0. Use :func:`~optuna.trial.Trial.suggest_float` instead.
  "colsample_bytree": trial.suggest_loguniform(
/Users/kevinmaikjablonka/git/kjappelbaum/gptchem/src/gptchem/baselines/xgboost.py:42: FutureWarning: suggest_loguniform has been deprecated in v3.0.0. This feature will be removed in v6.0.0. See https://github.com/optuna/optuna/releases/tag/v3.0.0. Use :func:`~optuna.trial.Trial.suggest_float` instead.
  "subsample": trial.suggest_loguniform("subsample", 0.00001, 1),
/Users/kevinmaikjablonka/git/kjappelbaum/gptchem/src/gptchem/baselines/xgboost.py:43: FutureWarning: suggest_loguniform has been deprecated in v3.0.0. This feature will be removed in v6.0.0. See https://github.com/optuna/optuna/releases/tag/v3.0.0. Use :func:`~optuna.trial.Trial.suggest_float` instead.
  "alpha": trial.suggest_loguniform("alpha", 1e-8, 10.0),
/Users/kevinmaikjablonka/git/kjappelbaum/gptchem/src/gptchem/baselines/xgboost.py:44: FutureWarning: suggest_loguniform has been deprecated in v3.0.0. This feature will be removed in v6.0.0. See https://github.com/optuna/optuna/releases/tag/v3.0.0. Use :func:`~optuna.trial.Trial.suggest_float` instead.
  "lambda": trial.suggest_loguniform("lambda", 1e-8, 10.0),
[32m[I 2023-01-13 04:54:29,539][0m Trial 92 finished with value: 0.5242984354826461 and parameters: {'n_estimators': 8519, 'max_depth': 46, 'learning_rate': 0.04733830351760155, 'colsample_bytree': 0.32213516160982775, 'subsample': 0.8161731649026952, 'alpha': 1.1156673870783994e-05, 'lambda': 4.200005655868465}. Best is trial 86 with value: 0.5763263657865891.[0m
/Users/kevinmaikjablonka/git/kjappelbaum/gptchem/src/gptchem/baselines/xgboost.py:38: FutureWarning: suggest_loguniform has been deprecated in v3.0.0. This feature will be removed in v6.0.0. See https://github.com/optuna/optuna/releases/tag/v3.0.0. Use :func:`~optuna.trial.Trial.suggest_float` instead.
  "learning_rate": trial.suggest_loguniform("learning_rate", 0.001, 0.05),
/Users/kevinmaikjablonka/git/kjappelbaum/gptchem/src/gptchem/baselines/xgboost.py:39: FutureWarning: suggest_loguniform has been deprecated in v3.0.0. This feature will be removed in v6.0.0. See https://github.com/optuna/optuna/releases/tag/v3.0.0. Use :func:`~optuna.trial.Trial.suggest_float` instead.
  "colsample_bytree": trial.suggest_loguniform(
/Users/kevinmaikjablonka/git/kjappelbaum/gptchem/src/gptchem/baselines/xgboost.py:42: FutureWarning: suggest_loguniform has been deprecated in v3.0.0. This feature will be removed in v6.0.0. See https://github.com/optuna/optuna/releases/tag/v3.0.0. Use :func:`~optuna.trial.Trial.suggest_float` instead.
  "subsample": trial.suggest_loguniform("subsample", 0.00001, 1),
/Users/kevinmaikjablonka/git/kjappelbaum/gptchem/src/gptchem/baselines/xgboost.py:43: FutureWarning: suggest_loguniform has been deprecated in v3.0.0. This feature will be removed in v6.0.0. See https://github.com/optuna/optuna/releases/tag/v3.0.0. Use :func:`~optuna.trial.Trial.suggest_float` instead.
  "alpha": trial.suggest_loguniform("alpha", 1e-8, 10.0),
/Users/kevinmaikjablonka/git/kjappelbaum/gptchem/src/gptchem/baselines/xgboost.py:44: FutureWarning: suggest_loguniform has been deprecated in v3.0.0. This feature will be removed in v6.0.0. See https://github.com/optuna/optuna/releases/tag/v3.0.0. Use :func:`~optuna.trial.Trial.suggest_float` instead.
  "lambda": trial.suggest_loguniform("lambda", 1e-8, 10.0),
[32m[I 2023-01-13 04:54:46,165][0m Trial 93 finished with value: 0.4873547505126453 and parameters: {'n_estimators': 9476, 'max_depth': 49, 'learning_rate': 0.044273915604333566, 'colsample_bytree': 0.33829919926511687, 'subsample': 0.31955221836615255, 'alpha': 5.71614344278386e-05, 'lambda': 0.06277685560454196}. Best is trial 86 with value: 0.5763263657865891.[0m
/Users/kevinmaikjablonka/git/kjappelbaum/gptchem/src/gptchem/baselines/xgboost.py:38: FutureWarning: suggest_loguniform has been deprecated in v3.0.0. This feature will be removed in v6.0.0. See https://github.com/optuna/optuna/releases/tag/v3.0.0. Use :func:`~optuna.trial.Trial.suggest_float` instead.
  "learning_rate": trial.suggest_loguniform("learning_rate", 0.001, 0.05),
/Users/kevinmaikjablonka/git/kjappelbaum/gptchem/src/gptchem/baselines/xgboost.py:39: FutureWarning: suggest_loguniform has been deprecated in v3.0.0. This feature will be removed in v6.0.0. See https://github.com/optuna/optuna/releases/tag/v3.0.0. Use :func:`~optuna.trial.Trial.suggest_float` instead.
  "colsample_bytree": trial.suggest_loguniform(
/Users/kevinmaikjablonka/git/kjappelbaum/gptchem/src/gptchem/baselines/xgboost.py:42: FutureWarning: suggest_loguniform has been deprecated in v3.0.0. This feature will be removed in v6.0.0. See https://github.com/optuna/optuna/releases/tag/v3.0.0. Use :func:`~optuna.trial.Trial.suggest_float` instead.
  "subsample": trial.suggest_loguniform("subsample", 0.00001, 1),
/Users/kevinmaikjablonka/git/kjappelbaum/gptchem/src/gptchem/baselines/xgboost.py:43: FutureWarning: suggest_loguniform has been deprecated in v3.0.0. This feature will be removed in v6.0.0. See https://github.com/optuna/optuna/releases/tag/v3.0.0. Use :func:`~optuna.trial.Trial.suggest_float` instead.
  "alpha": trial.suggest_loguniform("alpha", 1e-8, 10.0),
/Users/kevinmaikjablonka/git/kjappelbaum/gptchem/src/gptchem/baselines/xgboost.py:44: FutureWarning: suggest_loguniform has been deprecated in v3.0.0. This feature will be removed in v6.0.0. See https://github.com/optuna/optuna/releases/tag/v3.0.0. Use :func:`~optuna.trial.Trial.suggest_float` instead.
  "lambda": trial.suggest_loguniform("lambda", 1e-8, 10.0),
[32m[I 2023-01-13 04:55:02,369][0m Trial 94 finished with value: 0.5268210750079104 and parameters: {'n_estimators': 7042, 'max_depth': 43, 'learning_rate': 0.03207579711582579, 'colsample_bytree': 0.3651084240611605, 'subsample': 0.4691941394439936, 'alpha': 4.1549803258116406e-05, 'lambda': 1.5896422194557458}. Best is trial 86 with value: 0.5763263657865891.[0m
/Users/kevinmaikjablonka/git/kjappelbaum/gptchem/src/gptchem/baselines/xgboost.py:38: FutureWarning: suggest_loguniform has been deprecated in v3.0.0. This feature will be removed in v6.0.0. See https://github.com/optuna/optuna/releases/tag/v3.0.0. Use :func:`~optuna.trial.Trial.suggest_float` instead.
  "learning_rate": trial.suggest_loguniform("learning_rate", 0.001, 0.05),
/Users/kevinmaikjablonka/git/kjappelbaum/gptchem/src/gptchem/baselines/xgboost.py:39: FutureWarning: suggest_loguniform has been deprecated in v3.0.0. This feature will be removed in v6.0.0. See https://github.com/optuna/optuna/releases/tag/v3.0.0. Use :func:`~optuna.trial.Trial.suggest_float` instead.
  "colsample_bytree": trial.suggest_loguniform(
/Users/kevinmaikjablonka/git/kjappelbaum/gptchem/src/gptchem/baselines/xgboost.py:42: FutureWarning: suggest_loguniform has been deprecated in v3.0.0. This feature will be removed in v6.0.0. See https://github.com/optuna/optuna/releases/tag/v3.0.0. Use :func:`~optuna.trial.Trial.suggest_float` instead.
  "subsample": trial.suggest_loguniform("subsample", 0.00001, 1),
/Users/kevinmaikjablonka/git/kjappelbaum/gptchem/src/gptchem/baselines/xgboost.py:43: FutureWarning: suggest_loguniform has been deprecated in v3.0.0. This feature will be removed in v6.0.0. See https://github.com/optuna/optuna/releases/tag/v3.0.0. Use :func:`~optuna.trial.Trial.suggest_float` instead.
  "alpha": trial.suggest_loguniform("alpha", 1e-8, 10.0),
/Users/kevinmaikjablonka/git/kjappelbaum/gptchem/src/gptchem/baselines/xgboost.py:44: FutureWarning: suggest_loguniform has been deprecated in v3.0.0. This feature will be removed in v6.0.0. See https://github.com/optuna/optuna/releases/tag/v3.0.0. Use :func:`~optuna.trial.Trial.suggest_float` instead.
  "lambda": trial.suggest_loguniform("lambda", 1e-8, 10.0),
[32m[I 2023-01-13 04:55:27,504][0m Trial 95 finished with value: 0.5528822055137844 and parameters: {'n_estimators': 8930, 'max_depth': 47, 'learning_rate': 0.04961312709233445, 'colsample_bytree': 0.5014614296161243, 'subsample': 0.7200833597607685, 'alpha': 2.495774999533197e-07, 'lambda': 0.020491750144458462}. Best is trial 86 with value: 0.5763263657865891.[0m
/Users/kevinmaikjablonka/git/kjappelbaum/gptchem/src/gptchem/baselines/xgboost.py:38: FutureWarning: suggest_loguniform has been deprecated in v3.0.0. This feature will be removed in v6.0.0. See https://github.com/optuna/optuna/releases/tag/v3.0.0. Use :func:`~optuna.trial.Trial.suggest_float` instead.
  "learning_rate": trial.suggest_loguniform("learning_rate", 0.001, 0.05),
/Users/kevinmaikjablonka/git/kjappelbaum/gptchem/src/gptchem/baselines/xgboost.py:39: FutureWarning: suggest_loguniform has been deprecated in v3.0.0. This feature will be removed in v6.0.0. See https://github.com/optuna/optuna/releases/tag/v3.0.0. Use :func:`~optuna.trial.Trial.suggest_float` instead.
  "colsample_bytree": trial.suggest_loguniform(
/Users/kevinmaikjablonka/git/kjappelbaum/gptchem/src/gptchem/baselines/xgboost.py:42: FutureWarning: suggest_loguniform has been deprecated in v3.0.0. This feature will be removed in v6.0.0. See https://github.com/optuna/optuna/releases/tag/v3.0.0. Use :func:`~optuna.trial.Trial.suggest_float` instead.
  "subsample": trial.suggest_loguniform("subsample", 0.00001, 1),
/Users/kevinmaikjablonka/git/kjappelbaum/gptchem/src/gptchem/baselines/xgboost.py:43: FutureWarning: suggest_loguniform has been deprecated in v3.0.0. This feature will be removed in v6.0.0. See https://github.com/optuna/optuna/releases/tag/v3.0.0. Use :func:`~optuna.trial.Trial.suggest_float` instead.
  "alpha": trial.suggest_loguniform("alpha", 1e-8, 10.0),
/Users/kevinmaikjablonka/git/kjappelbaum/gptchem/src/gptchem/baselines/xgboost.py:44: FutureWarning: suggest_loguniform has been deprecated in v3.0.0. This feature will be removed in v6.0.0. See https://github.com/optuna/optuna/releases/tag/v3.0.0. Use :func:`~optuna.trial.Trial.suggest_float` instead.
  "lambda": trial.suggest_loguniform("lambda", 1e-8, 10.0),
[32m[I 2023-01-13 04:55:51,391][0m Trial 96 finished with value: 0.5539965162266279 and parameters: {'n_estimators': 8897, 'max_depth': 41, 'learning_rate': 0.0493453526194537, 'colsample_bytree': 0.4980841095474129, 'subsample': 0.6290055770568674, 'alpha': 5.751694470452551e-06, 'lambda': 0.006726977075617815}. Best is trial 86 with value: 0.5763263657865891.[0m
/Users/kevinmaikjablonka/git/kjappelbaum/gptchem/src/gptchem/baselines/xgboost.py:38: FutureWarning: suggest_loguniform has been deprecated in v3.0.0. This feature will be removed in v6.0.0. See https://github.com/optuna/optuna/releases/tag/v3.0.0. Use :func:`~optuna.trial.Trial.suggest_float` instead.
  "learning_rate": trial.suggest_loguniform("learning_rate", 0.001, 0.05),
/Users/kevinmaikjablonka/git/kjappelbaum/gptchem/src/gptchem/baselines/xgboost.py:39: FutureWarning: suggest_loguniform has been deprecated in v3.0.0. This feature will be removed in v6.0.0. See https://github.com/optuna/optuna/releases/tag/v3.0.0. Use :func:`~optuna.trial.Trial.suggest_float` instead.
  "colsample_bytree": trial.suggest_loguniform(
/Users/kevinmaikjablonka/git/kjappelbaum/gptchem/src/gptchem/baselines/xgboost.py:42: FutureWarning: suggest_loguniform has been deprecated in v3.0.0. This feature will be removed in v6.0.0. See https://github.com/optuna/optuna/releases/tag/v3.0.0. Use :func:`~optuna.trial.Trial.suggest_float` instead.
  "subsample": trial.suggest_loguniform("subsample", 0.00001, 1),
/Users/kevinmaikjablonka/git/kjappelbaum/gptchem/src/gptchem/baselines/xgboost.py:43: FutureWarning: suggest_loguniform has been deprecated in v3.0.0. This feature will be removed in v6.0.0. See https://github.com/optuna/optuna/releases/tag/v3.0.0. Use :func:`~optuna.trial.Trial.suggest_float` instead.
  "alpha": trial.suggest_loguniform("alpha", 1e-8, 10.0),
/Users/kevinmaikjablonka/git/kjappelbaum/gptchem/src/gptchem/baselines/xgboost.py:44: FutureWarning: suggest_loguniform has been deprecated in v3.0.0. This feature will be removed in v6.0.0. See https://github.com/optuna/optuna/releases/tag/v3.0.0. Use :func:`~optuna.trial.Trial.suggest_float` instead.
  "lambda": trial.suggest_loguniform("lambda", 1e-8, 10.0),
[32m[I 2023-01-13 04:56:15,048][0m Trial 97 finished with value: 0.5455903185072657 and parameters: {'n_estimators': 8817, 'max_depth': 35, 'learning_rate': 0.04997946553588456, 'colsample_bytree': 0.5030998654835582, 'subsample': 0.6074052363258363, 'alpha': 2.3733633891116698e-07, 'lambda': 0.006297383673759217}. Best is trial 86 with value: 0.5763263657865891.[0m
/Users/kevinmaikjablonka/git/kjappelbaum/gptchem/src/gptchem/baselines/xgboost.py:38: FutureWarning: suggest_loguniform has been deprecated in v3.0.0. This feature will be removed in v6.0.0. See https://github.com/optuna/optuna/releases/tag/v3.0.0. Use :func:`~optuna.trial.Trial.suggest_float` instead.
  "learning_rate": trial.suggest_loguniform("learning_rate", 0.001, 0.05),
/Users/kevinmaikjablonka/git/kjappelbaum/gptchem/src/gptchem/baselines/xgboost.py:39: FutureWarning: suggest_loguniform has been deprecated in v3.0.0. This feature will be removed in v6.0.0. See https://github.com/optuna/optuna/releases/tag/v3.0.0. Use :func:`~optuna.trial.Trial.suggest_float` instead.
  "colsample_bytree": trial.suggest_loguniform(
/Users/kevinmaikjablonka/git/kjappelbaum/gptchem/src/gptchem/baselines/xgboost.py:42: FutureWarning: suggest_loguniform has been deprecated in v3.0.0. This feature will be removed in v6.0.0. See https://github.com/optuna/optuna/releases/tag/v3.0.0. Use :func:`~optuna.trial.Trial.suggest_float` instead.
  "subsample": trial.suggest_loguniform("subsample", 0.00001, 1),
/Users/kevinmaikjablonka/git/kjappelbaum/gptchem/src/gptchem/baselines/xgboost.py:43: FutureWarning: suggest_loguniform has been deprecated in v3.0.0. This feature will be removed in v6.0.0. See https://github.com/optuna/optuna/releases/tag/v3.0.0. Use :func:`~optuna.trial.Trial.suggest_float` instead.
  "alpha": trial.suggest_loguniform("alpha", 1e-8, 10.0),
/Users/kevinmaikjablonka/git/kjappelbaum/gptchem/src/gptchem/baselines/xgboost.py:44: FutureWarning: suggest_loguniform has been deprecated in v3.0.0. This feature will be removed in v6.0.0. See https://github.com/optuna/optuna/releases/tag/v3.0.0. Use :func:`~optuna.trial.Trial.suggest_float` instead.
  "lambda": trial.suggest_loguniform("lambda", 1e-8, 10.0),
[32m[I 2023-01-13 04:56:30,252][0m Trial 98 finished with value: 0.5084149768360294 and parameters: {'n_estimators': 7699, 'max_depth': 39, 'learning_rate': 0.0396088850894066, 'colsample_bytree': 0.4842598827274039, 'subsample': 0.2711611769716161, 'alpha': 6.62561019264136e-07, 'lambda': 0.003958341493493583}. Best is trial 86 with value: 0.5763263657865891.[0m
/Users/kevinmaikjablonka/git/kjappelbaum/gptchem/src/gptchem/baselines/xgboost.py:38: FutureWarning: suggest_loguniform has been deprecated in v3.0.0. This feature will be removed in v6.0.0. See https://github.com/optuna/optuna/releases/tag/v3.0.0. Use :func:`~optuna.trial.Trial.suggest_float` instead.
  "learning_rate": trial.suggest_loguniform("learning_rate", 0.001, 0.05),
/Users/kevinmaikjablonka/git/kjappelbaum/gptchem/src/gptchem/baselines/xgboost.py:39: FutureWarning: suggest_loguniform has been deprecated in v3.0.0. This feature will be removed in v6.0.0. See https://github.com/optuna/optuna/releases/tag/v3.0.0. Use :func:`~optuna.trial.Trial.suggest_float` instead.
  "colsample_bytree": trial.suggest_loguniform(
/Users/kevinmaikjablonka/git/kjappelbaum/gptchem/src/gptchem/baselines/xgboost.py:42: FutureWarning: suggest_loguniform has been deprecated in v3.0.0. This feature will be removed in v6.0.0. See https://github.com/optuna/optuna/releases/tag/v3.0.0. Use :func:`~optuna.trial.Trial.suggest_float` instead.
  "subsample": trial.suggest_loguniform("subsample", 0.00001, 1),
/Users/kevinmaikjablonka/git/kjappelbaum/gptchem/src/gptchem/baselines/xgboost.py:43: FutureWarning: suggest_loguniform has been deprecated in v3.0.0. This feature will be removed in v6.0.0. See https://github.com/optuna/optuna/releases/tag/v3.0.0. Use :func:`~optuna.trial.Trial.suggest_float` instead.
  "alpha": trial.suggest_loguniform("alpha", 1e-8, 10.0),
/Users/kevinmaikjablonka/git/kjappelbaum/gptchem/src/gptchem/baselines/xgboost.py:44: FutureWarning: suggest_loguniform has been deprecated in v3.0.0. This feature will be removed in v6.0.0. See https://github.com/optuna/optuna/releases/tag/v3.0.0. Use :func:`~optuna.trial.Trial.suggest_float` instead.
  "lambda": trial.suggest_loguniform("lambda", 1e-8, 10.0),
[32m[I 2023-01-13 04:56:45,667][0m Trial 99 finished with value: 0.5070169028709882 and parameters: {'n_estimators': 9063, 'max_depth': 41, 'learning_rate': 0.002481710175672689, 'colsample_bytree': 0.5353502755872296, 'subsample': 0.13111489272567264, 'alpha': 5.817896019093474e-06, 'lambda': 0.012238238277650365}. Best is trial 86 with value: 0.5763263657865891.[0m
[32m[I 2023-01-13 04:57:11,016][0m A new study created in memory with name: no-name-196e6889-85f6-42a5-9cb8-0207b2cd4317[0m
[32m[I 2023-01-13 04:57:17,023][0m Trial 0 finished with value: 0.2747673782156541 and parameters: {'n_estimators': 2746, 'max_depth': 93, 'min_samples_split': 78, 'min_samples_leaf': 70, 'criterion': 'entropy'}. Best is trial 0 with value: 0.2747673782156541.[0m
[32m[I 2023-01-13 04:57:21,680][0m Trial 1 finished with value: 0.2747673782156541 and parameters: {'n_estimators': 2190, 'max_depth': 115, 'min_samples_split': 124, 'min_samples_leaf': 50, 'criterion': 'gini'}. Best is trial 0 with value: 0.2747673782156541.[0m
[32m[I 2023-01-13 04:57:27,875][0m Trial 2 finished with value: 0.3420134852359916 and parameters: {'n_estimators': 2842, 'max_depth': 119, 'min_samples_split': 11, 'min_samples_leaf': 12, 'criterion': 'entropy'}. Best is trial 2 with value: 0.3420134852359916.[0m
[32m[I 2023-01-13 04:57:36,274][0m Trial 3 finished with value: 0.2747673782156541 and parameters: {'n_estimators': 3892, 'max_depth': 112, 'min_samples_split': 126, 'min_samples_leaf': 103, 'criterion': 'entropy'}. Best is trial 2 with value: 0.3420134852359916.[0m
[32m[I 2023-01-13 04:57:37,547][0m Trial 4 finished with value: 0.2747673782156541 and parameters: {'n_estimators': 595, 'max_depth': 83, 'min_samples_split': 20, 'min_samples_leaf': 121, 'criterion': 'gini'}. Best is trial 2 with value: 0.3420134852359916.[0m
[32m[I 2023-01-13 04:57:40,375][0m Trial 5 finished with value: 0.2747673782156541 and parameters: {'n_estimators': 1325, 'max_depth': 100, 'min_samples_split': 59, 'min_samples_leaf': 73, 'criterion': 'entropy'}. Best is trial 2 with value: 0.3420134852359916.[0m
[32m[I 2023-01-13 04:57:46,962][0m Trial 6 finished with value: 0.2747673782156541 and parameters: {'n_estimators': 3062, 'max_depth': 81, 'min_samples_split': 121, 'min_samples_leaf': 88, 'criterion': 'entropy'}. Best is trial 2 with value: 0.3420134852359916.[0m
[32m[I 2023-01-13 04:57:54,317][0m Trial 7 finished with value: 0.2747673782156541 and parameters: {'n_estimators': 3490, 'max_depth': 11, 'min_samples_split': 86, 'min_samples_leaf': 86, 'criterion': 'gini'}. Best is trial 2 with value: 0.3420134852359916.[0m
[32m[I 2023-01-13 04:57:57,826][0m Trial 8 finished with value: 0.2747673782156541 and parameters: {'n_estimators': 1580, 'max_depth': 49, 'min_samples_split': 74, 'min_samples_leaf': 57, 'criterion': 'gini'}. Best is trial 2 with value: 0.3420134852359916.[0m
[32m[I 2023-01-13 04:58:00,039][0m Trial 9 finished with value: 0.2747673782156541 and parameters: {'n_estimators': 1047, 'max_depth': 24, 'min_samples_split': 84, 'min_samples_leaf': 33, 'criterion': 'gini'}. Best is trial 2 with value: 0.3420134852359916.[0m
[32m[I 2023-01-13 04:58:10,932][0m Trial 10 finished with value: 0.4877542340700235 and parameters: {'n_estimators': 4704, 'max_depth': 127, 'min_samples_split': 4, 'min_samples_leaf': 3, 'criterion': 'entropy'}. Best is trial 10 with value: 0.4877542340700235.[0m
[32m[I 2023-01-13 04:58:22,469][0m Trial 11 finished with value: 0.5456077694235588 and parameters: {'n_estimators': 4941, 'max_depth': 123, 'min_samples_split': 12, 'min_samples_leaf': 2, 'criterion': 'entropy'}. Best is trial 11 with value: 0.5456077694235588.[0m
[32m[I 2023-01-13 04:58:33,016][0m Trial 12 finished with value: 0.5068960279486595 and parameters: {'n_estimators': 4775, 'max_depth': 127, 'min_samples_split': 30, 'min_samples_leaf': 5, 'criterion': 'entropy'}. Best is trial 11 with value: 0.5456077694235588.[0m
[32m[I 2023-01-13 04:58:43,737][0m Trial 13 finished with value: 0.2747673782156541 and parameters: {'n_estimators': 4987, 'max_depth': 58, 'min_samples_split': 37, 'min_samples_leaf': 24, 'criterion': 'entropy'}. Best is trial 11 with value: 0.5456077694235588.[0m
