[32m[I 2023-01-13 04:10:47,661][0m Trial 97 finished with value: 0.5455903185072657 and parameters: {'n_estimators': 8817, 'max_depth': 35, 'learning_rate': 0.04997946553588456, 'colsample_bytree': 0.5030998654835582, 'subsample': 0.6074052363258363, 'alpha': 2.3733633891116698e-07, 'lambda': 0.006297383673759217}. Best is trial 86 with value: 0.5763263657865891.[0m
/Users/kevinmaikjablonka/git/kjappelbaum/gptchem/src/gptchem/baselines/xgboost.py:38: FutureWarning: suggest_loguniform has been deprecated in v3.0.0. This feature will be removed in v6.0.0. See https://github.com/optuna/optuna/releases/tag/v3.0.0. Use :func:`~optuna.trial.Trial.suggest_float` instead.
  "learning_rate": trial.suggest_loguniform("learning_rate", 0.001, 0.05),
/Users/kevinmaikjablonka/git/kjappelbaum/gptchem/src/gptchem/baselines/xgboost.py:39: FutureWarning: suggest_loguniform has been deprecated in v3.0.0. This feature will be removed in v6.0.0. See https://github.com/optuna/optuna/releases/tag/v3.0.0. Use :func:`~optuna.trial.Trial.suggest_float` instead.
  "colsample_bytree": trial.suggest_loguniform(
/Users/kevinmaikjablonka/git/kjappelbaum/gptchem/src/gptchem/baselines/xgboost.py:42: FutureWarning: suggest_loguniform has been deprecated in v3.0.0. This feature will be removed in v6.0.0. See https://github.com/optuna/optuna/releases/tag/v3.0.0. Use :func:`~optuna.trial.Trial.suggest_float` instead.
  "subsample": trial.suggest_loguniform("subsample", 0.00001, 1),
/Users/kevinmaikjablonka/git/kjappelbaum/gptchem/src/gptchem/baselines/xgboost.py:43: FutureWarning: suggest_loguniform has been deprecated in v3.0.0. This feature will be removed in v6.0.0. See https://github.com/optuna/optuna/releases/tag/v3.0.0. Use :func:`~optuna.trial.Trial.suggest_float` instead.
  "alpha": trial.suggest_loguniform("alpha", 1e-8, 10.0),
/Users/kevinmaikjablonka/git/kjappelbaum/gptchem/src/gptchem/baselines/xgboost.py:44: FutureWarning: suggest_loguniform has been deprecated in v3.0.0. This feature will be removed in v6.0.0. See https://github.com/optuna/optuna/releases/tag/v3.0.0. Use :func:`~optuna.trial.Trial.suggest_float` instead.
  "lambda": trial.suggest_loguniform("lambda", 1e-8, 10.0),
[32m[I 2023-01-13 04:11:03,205][0m Trial 98 finished with value: 0.5084149768360294 and parameters: {'n_estimators': 7699, 'max_depth': 39, 'learning_rate': 0.0396088850894066, 'colsample_bytree': 0.4842598827274039, 'subsample': 0.2711611769716161, 'alpha': 6.62561019264136e-07, 'lambda': 0.003958341493493583}. Best is trial 86 with value: 0.5763263657865891.[0m
/Users/kevinmaikjablonka/git/kjappelbaum/gptchem/src/gptchem/baselines/xgboost.py:38: FutureWarning: suggest_loguniform has been deprecated in v3.0.0. This feature will be removed in v6.0.0. See https://github.com/optuna/optuna/releases/tag/v3.0.0. Use :func:`~optuna.trial.Trial.suggest_float` instead.
  "learning_rate": trial.suggest_loguniform("learning_rate", 0.001, 0.05),
/Users/kevinmaikjablonka/git/kjappelbaum/gptchem/src/gptchem/baselines/xgboost.py:39: FutureWarning: suggest_loguniform has been deprecated in v3.0.0. This feature will be removed in v6.0.0. See https://github.com/optuna/optuna/releases/tag/v3.0.0. Use :func:`~optuna.trial.Trial.suggest_float` instead.
  "colsample_bytree": trial.suggest_loguniform(
/Users/kevinmaikjablonka/git/kjappelbaum/gptchem/src/gptchem/baselines/xgboost.py:42: FutureWarning: suggest_loguniform has been deprecated in v3.0.0. This feature will be removed in v6.0.0. See https://github.com/optuna/optuna/releases/tag/v3.0.0. Use :func:`~optuna.trial.Trial.suggest_float` instead.
  "subsample": trial.suggest_loguniform("subsample", 0.00001, 1),
/Users/kevinmaikjablonka/git/kjappelbaum/gptchem/src/gptchem/baselines/xgboost.py:43: FutureWarning: suggest_loguniform has been deprecated in v3.0.0. This feature will be removed in v6.0.0. See https://github.com/optuna/optuna/releases/tag/v3.0.0. Use :func:`~optuna.trial.Trial.suggest_float` instead.
  "alpha": trial.suggest_loguniform("alpha", 1e-8, 10.0),
/Users/kevinmaikjablonka/git/kjappelbaum/gptchem/src/gptchem/baselines/xgboost.py:44: FutureWarning: suggest_loguniform has been deprecated in v3.0.0. This feature will be removed in v6.0.0. See https://github.com/optuna/optuna/releases/tag/v3.0.0. Use :func:`~optuna.trial.Trial.suggest_float` instead.
  "lambda": trial.suggest_loguniform("lambda", 1e-8, 10.0),
[32m[I 2023-01-13 04:11:18,924][0m Trial 99 finished with value: 0.5070169028709882 and parameters: {'n_estimators': 9063, 'max_depth': 41, 'learning_rate': 0.002481710175672689, 'colsample_bytree': 0.5353502755872296, 'subsample': 0.13111489272567264, 'alpha': 5.817896019093474e-06, 'lambda': 0.012238238277650365}. Best is trial 86 with value: 0.5763263657865891.[0m
[32m[I 2023-01-13 04:14:38,398][0m A new study created in memory with name: no-name-62a44e18-e721-4b81-b70e-dc22b51d7b28[0m
[32m[I 2023-01-13 04:14:44,750][0m Trial 0 finished with value: 0.2747673782156541 and parameters: {'n_estimators': 2746, 'max_depth': 93, 'min_samples_split': 78, 'min_samples_leaf': 70, 'criterion': 'entropy'}. Best is trial 0 with value: 0.2747673782156541.[0m
[32m[I 2023-01-13 04:14:49,687][0m Trial 1 finished with value: 0.2747673782156541 and parameters: {'n_estimators': 2190, 'max_depth': 115, 'min_samples_split': 124, 'min_samples_leaf': 50, 'criterion': 'gini'}. Best is trial 0 with value: 0.2747673782156541.[0m
[32m[I 2023-01-13 04:14:56,009][0m Trial 2 finished with value: 0.3420134852359916 and parameters: {'n_estimators': 2842, 'max_depth': 119, 'min_samples_split': 11, 'min_samples_leaf': 12, 'criterion': 'entropy'}. Best is trial 2 with value: 0.3420134852359916.[0m
[32m[I 2023-01-13 04:15:04,557][0m Trial 3 finished with value: 0.2747673782156541 and parameters: {'n_estimators': 3892, 'max_depth': 112, 'min_samples_split': 126, 'min_samples_leaf': 103, 'criterion': 'entropy'}. Best is trial 2 with value: 0.3420134852359916.[0m
[32m[I 2023-01-13 04:15:05,844][0m Trial 4 finished with value: 0.2747673782156541 and parameters: {'n_estimators': 595, 'max_depth': 83, 'min_samples_split': 20, 'min_samples_leaf': 121, 'criterion': 'gini'}. Best is trial 2 with value: 0.3420134852359916.[0m
[32m[I 2023-01-13 04:15:08,727][0m Trial 5 finished with value: 0.2747673782156541 and parameters: {'n_estimators': 1325, 'max_depth': 100, 'min_samples_split': 59, 'min_samples_leaf': 73, 'criterion': 'entropy'}. Best is trial 2 with value: 0.3420134852359916.[0m
[32m[I 2023-01-13 04:15:15,409][0m Trial 6 finished with value: 0.2747673782156541 and parameters: {'n_estimators': 3062, 'max_depth': 81, 'min_samples_split': 121, 'min_samples_leaf': 88, 'criterion': 'entropy'}. Best is trial 2 with value: 0.3420134852359916.[0m
[32m[I 2023-01-13 04:15:23,090][0m Trial 7 finished with value: 0.2747673782156541 and parameters: {'n_estimators': 3490, 'max_depth': 11, 'min_samples_split': 86, 'min_samples_leaf': 86, 'criterion': 'gini'}. Best is trial 2 with value: 0.3420134852359916.[0m
[32m[I 2023-01-13 04:15:26,461][0m Trial 8 finished with value: 0.2747673782156541 and parameters: {'n_estimators': 1580, 'max_depth': 49, 'min_samples_split': 74, 'min_samples_leaf': 57, 'criterion': 'gini'}. Best is trial 2 with value: 0.3420134852359916.[0m
[32m[I 2023-01-13 04:15:28,732][0m Trial 9 finished with value: 0.2747673782156541 and parameters: {'n_estimators': 1047, 'max_depth': 24, 'min_samples_split': 84, 'min_samples_leaf': 33, 'criterion': 'gini'}. Best is trial 2 with value: 0.3420134852359916.[0m
[32m[I 2023-01-13 04:15:39,784][0m Trial 10 finished with value: 0.4877542340700235 and parameters: {'n_estimators': 4704, 'max_depth': 127, 'min_samples_split': 4, 'min_samples_leaf': 3, 'criterion': 'entropy'}. Best is trial 10 with value: 0.4877542340700235.[0m
[32m[I 2023-01-13 04:15:51,558][0m Trial 11 finished with value: 0.5456077694235588 and parameters: {'n_estimators': 4941, 'max_depth': 123, 'min_samples_split': 12, 'min_samples_leaf': 2, 'criterion': 'entropy'}. Best is trial 11 with value: 0.5456077694235588.[0m
[32m[I 2023-01-13 04:16:02,186][0m Trial 12 finished with value: 0.5068960279486595 and parameters: {'n_estimators': 4775, 'max_depth': 127, 'min_samples_split': 30, 'min_samples_leaf': 5, 'criterion': 'entropy'}. Best is trial 11 with value: 0.5456077694235588.[0m
[32m[I 2023-01-13 04:16:13,199][0m Trial 13 finished with value: 0.2747673782156541 and parameters: {'n_estimators': 4987, 'max_depth': 58, 'min_samples_split': 37, 'min_samples_leaf': 24, 'criterion': 'entropy'}. Best is trial 11 with value: 0.5456077694235588.[0m
[32m[I 2023-01-13 04:16:21,965][0m Trial 14 finished with value: 0.2747673782156541 and parameters: {'n_estimators': 4126, 'max_depth': 103, 'min_samples_split': 40, 'min_samples_leaf': 36, 'criterion': 'entropy'}. Best is trial 11 with value: 0.5456077694235588.[0m
[32m[I 2023-01-13 04:16:31,346][0m Trial 15 finished with value: 0.5394987468671679 and parameters: {'n_estimators': 4159, 'max_depth': 126, 'min_samples_split': 29, 'min_samples_leaf': 3, 'criterion': 'entropy'}. Best is trial 11 with value: 0.5456077694235588.[0m
[32m[I 2023-01-13 04:16:40,533][0m Trial 16 finished with value: 0.2747673782156541 and parameters: {'n_estimators': 4306, 'max_depth': 71, 'min_samples_split': 57, 'min_samples_leaf': 19, 'criterion': 'entropy'}. Best is trial 11 with value: 0.5456077694235588.[0m
[32m[I 2023-01-13 04:16:48,283][0m Trial 17 finished with value: 0.2747673782156541 and parameters: {'n_estimators': 3661, 'max_depth': 49, 'min_samples_split': 22, 'min_samples_leaf': 46, 'criterion': 'entropy'}. Best is trial 11 with value: 0.5456077694235588.[0m
[32m[I 2023-01-13 04:16:52,828][0m Trial 18 finished with value: 0.2747673782156541 and parameters: {'n_estimators': 2088, 'max_depth': 107, 'min_samples_split': 47, 'min_samples_leaf': 29, 'criterion': 'entropy'}. Best is trial 11 with value: 0.5456077694235588.[0m
[32m[I 2023-01-13 04:17:02,116][0m Trial 19 finished with value: 0.2747673782156541 and parameters: {'n_estimators': 4408, 'max_depth': 93, 'min_samples_split': 102, 'min_samples_leaf': 1, 'criterion': 'entropy'}. Best is trial 11 with value: 0.5456077694235588.[0m
[32m[I 2023-01-13 04:17:09,539][0m Trial 20 finished with value: 0.3256902529127593 and parameters: {'n_estimators': 3405, 'max_depth': 38, 'min_samples_split': 4, 'min_samples_leaf': 15, 'criterion': 'entropy'}. Best is trial 11 with value: 0.5456077694235588.[0m
[32m[I 2023-01-13 04:17:20,715][0m Trial 21 finished with value: 0.5297744360902257 and parameters: {'n_estimators': 4950, 'max_depth': 127, 'min_samples_split': 27, 'min_samples_leaf': 3, 'criterion': 'entropy'}. Best is trial 11 with value: 0.5456077694235588.[0m
[32m[I 2023-01-13 04:17:30,487][0m Trial 22 finished with value: 0.33405555555555555 and parameters: {'n_estimators': 4486, 'max_depth': 125, 'min_samples_split': 28, 'min_samples_leaf': 14, 'criterion': 'entropy'}. Best is trial 11 with value: 0.5456077694235588.[0m
[32m[I 2023-01-13 04:17:40,992][0m Trial 23 finished with value: 0.2747673782156541 and parameters: {'n_estimators': 4861, 'max_depth': 114, 'min_samples_split': 14, 'min_samples_leaf': 41, 'criterion': 'entropy'}. Best is trial 11 with value: 0.5456077694235588.[0m
[32m[I 2023-01-13 04:17:49,370][0m Trial 24 finished with value: 0.2747673782156541 and parameters: {'n_estimators': 3945, 'max_depth': 95, 'min_samples_split': 50, 'min_samples_leaf': 25, 'criterion': 'entropy'}. Best is trial 11 with value: 0.5456077694235588.[0m
[32m[I 2023-01-13 04:17:49,482][0m Trial 25 finished with value: 0.4176306149990361 and parameters: {'n_estimators': 48, 'max_depth': 128, 'min_samples_split': 32, 'min_samples_leaf': 8, 'criterion': 'entropy'}. Best is trial 11 with value: 0.5456077694235588.[0m
[32m[I 2023-01-13 04:17:59,091][0m Trial 26 finished with value: 0.3001664433889498 and parameters: {'n_estimators': 4470, 'max_depth': 82, 'min_samples_split': 17, 'min_samples_leaf': 19, 'criterion': 'entropy'}. Best is trial 11 with value: 0.5456077694235588.[0m
[32m[I 2023-01-13 04:18:10,293][0m Trial 27 finished with value: 0.5161822404573784 and parameters: {'n_estimators': 4966, 'max_depth': 117, 'min_samples_split': 38, 'min_samples_leaf': 2, 'criterion': 'gini'}. Best is trial 11 with value: 0.5456077694235588.[0m
[32m[I 2023-01-13 04:18:17,412][0m Trial 28 finished with value: 0.2747673782156541 and parameters: {'n_estimators': 3223, 'max_depth': 108, 'min_samples_split': 46, 'min_samples_leaf': 56, 'criterion': 'entropy'}. Best is trial 11 with value: 0.5456077694235588.[0m
[32m[I 2023-01-13 04:18:25,405][0m Trial 29 finished with value: 0.2747673782156541 and parameters: {'n_estimators': 3784, 'max_depth': 92, 'min_samples_split': 24, 'min_samples_leaf': 27, 'criterion': 'entropy'}. Best is trial 11 with value: 0.5456077694235588.[0m
[32m[I 2023-01-13 04:18:31,055][0m Trial 30 finished with value: 0.3737076682459642 and parameters: {'n_estimators': 2562, 'max_depth': 120, 'min_samples_split': 9, 'min_samples_leaf': 10, 'criterion': 'entropy'}. Best is trial 11 with value: 0.5456077694235588.[0m
[32m[I 2023-01-13 04:18:42,104][0m Trial 31 finished with value: 0.511332616397228 and parameters: {'n_estimators': 5000, 'max_depth': 118, 'min_samples_split': 40, 'min_samples_leaf': 1, 'criterion': 'gini'}. Best is trial 11 with value: 0.5456077694235588.[0m
[32m[I 2023-01-13 04:18:52,136][0m Trial 32 finished with value: 0.3751123308348373 and parameters: {'n_estimators': 4592, 'max_depth': 112, 'min_samples_split': 35, 'min_samples_leaf': 10, 'criterion': 'gini'}. Best is trial 11 with value: 0.5456077694235588.[0m
[32m[I 2023-01-13 04:19:01,197][0m Trial 33 finished with value: 0.31013431013431014 and parameters: {'n_estimators': 4102, 'max_depth': 120, 'min_samples_split': 25, 'min_samples_leaf': 21, 'criterion': 'gini'}. Best is trial 11 with value: 0.5456077694235588.[0m
[32m[I 2023-01-13 04:19:11,503][0m Trial 34 finished with value: 0.5285623148781043 and parameters: {'n_estimators': 4209, 'max_depth': 102, 'min_samples_split': 12, 'min_samples_leaf': 1, 'criterion': 'gini'}. Best is trial 11 with value: 0.5456077694235588.[0m
[32m[I 2023-01-13 04:19:20,996][0m Trial 35 finished with value: 0.3372121212121212 and parameters: {'n_estimators': 4207, 'max_depth': 100, 'min_samples_split': 13, 'min_samples_leaf': 13, 'criterion': 'gini'}. Best is trial 11 with value: 0.5456077694235588.[0m
[32m[I 2023-01-13 04:19:29,487][0m Trial 36 finished with value: 0.2747673782156541 and parameters: {'n_estimators': 3896, 'max_depth': 108, 'min_samples_split': 3, 'min_samples_leaf': 39, 'criterion': 'gini'}. Best is trial 11 with value: 0.5456077694235588.[0m
[32m[I 2023-01-13 04:19:39,495][0m Trial 37 finished with value: 0.2747673782156541 and parameters: {'n_estimators': 4573, 'max_depth': 122, 'min_samples_split': 16, 'min_samples_leaf': 127, 'criterion': 'gini'}. Best is trial 11 with value: 0.5456077694235588.[0m
[32m[I 2023-01-13 04:19:44,015][0m Trial 38 finished with value: 0.2747673782156541 and parameters: {'n_estimators': 2068, 'max_depth': 73, 'min_samples_split': 70, 'min_samples_leaf': 71, 'criterion': 'entropy'}. Best is trial 11 with value: 0.5456077694235588.[0m
[32m[I 2023-01-13 04:19:50,073][0m Trial 39 finished with value: 0.2747673782156541 and parameters: {'n_estimators': 2745, 'max_depth': 87, 'min_samples_split': 9, 'min_samples_leaf': 104, 'criterion': 'gini'}. Best is trial 11 with value: 0.5456077694235588.[0m
[32m[I 2023-01-13 04:19:57,955][0m Trial 40 finished with value: 0.3737076682459642 and parameters: {'n_estimators': 3547, 'max_depth': 113, 'min_samples_split': 20, 'min_samples_leaf': 10, 'criterion': 'entropy'}. Best is trial 11 with value: 0.5456077694235588.[0m
[32m[I 2023-01-13 04:20:08,361][0m Trial 41 finished with value: 0.2747673782156541 and parameters: {'n_estimators': 4746, 'max_depth': 116, 'min_samples_split': 54, 'min_samples_leaf': 1, 'criterion': 'gini'}. Best is trial 11 with value: 0.5456077694235588.[0m
[32m[I 2023-01-13 04:20:18,007][0m Trial 42 finished with value: 0.3001664433889498 and parameters: {'n_estimators': 4339, 'max_depth': 101, 'min_samples_split': 28, 'min_samples_leaf': 17, 'criterion': 'gini'}. Best is trial 11 with value: 0.5456077694235588.[0m
[32m[I 2023-01-13 04:20:28,920][0m Trial 43 finished with value: 0.2747673782156541 and parameters: {'n_estimators': 4997, 'max_depth': 121, 'min_samples_split': 66, 'min_samples_leaf': 7, 'criterion': 'gini'}. Best is trial 11 with value: 0.5456077694235588.[0m
[32m[I 2023-01-13 04:20:39,620][0m Trial 44 finished with value: 0.4083356643356644 and parameters: {'n_estimators': 4742, 'max_depth': 106, 'min_samples_split': 43, 'min_samples_leaf': 5, 'criterion': 'gini'}. Best is trial 11 with value: 0.5456077694235588.[0m
[32m[I 2023-01-13 04:20:48,334][0m Trial 45 finished with value: 0.2747673782156541 and parameters: {'n_estimators': 4024, 'max_depth': 112, 'min_samples_split': 8, 'min_samples_leaf': 30, 'criterion': 'gini'}. Best is trial 11 with value: 0.5456077694235588.[0m
[32m[I 2023-01-13 04:20:58,603][0m Trial 46 finished with value: 0.31013431013431014 and parameters: {'n_estimators': 4621, 'max_depth': 126, 'min_samples_split': 34, 'min_samples_leaf': 21, 'criterion': 'gini'}. Best is trial 11 with value: 0.5456077694235588.[0m
[32m[I 2023-01-13 04:21:05,470][0m Trial 47 finished with value: 0.2747673782156541 and parameters: {'n_estimators': 3125, 'max_depth': 128, 'min_samples_split': 19, 'min_samples_leaf': 64, 'criterion': 'entropy'}. Best is trial 11 with value: 0.5456077694235588.[0m
[32m[I 2023-01-13 04:21:14,988][0m Trial 48 finished with value: 0.2747673782156541 and parameters: {'n_estimators': 4253, 'max_depth': 4, 'min_samples_split': 118, 'min_samples_leaf': 86, 'criterion': 'gini'}. Best is trial 11 with value: 0.5456077694235588.[0m
[32m[I 2023-01-13 04:21:25,960][0m Trial 49 finished with value: 0.3331334763559827 and parameters: {'n_estimators': 4849, 'max_depth': 97, 'min_samples_split': 25, 'min_samples_leaf': 15, 'criterion': 'entropy'}. Best is trial 11 with value: 0.5456077694235588.[0m
[32m[I 2023-01-13 04:21:34,115][0m Trial 50 finished with value: 0.2747673782156541 and parameters: {'n_estimators': 3717, 'max_depth': 117, 'min_samples_split': 37, 'min_samples_leaf': 98, 'criterion': 'entropy'}. Best is trial 11 with value: 0.5456077694235588.[0m
[32m[I 2023-01-13 04:21:45,905][0m Trial 51 finished with value: 0.52785448469659 and parameters: {'n_estimators': 4967, 'max_depth': 122, 'min_samples_split': 31, 'min_samples_leaf': 1, 'criterion': 'gini'}. Best is trial 11 with value: 0.5456077694235588.[0m
[32m[I 2023-01-13 04:21:57,001][0m Trial 52 finished with value: 0.4641591190251845 and parameters: {'n_estimators': 4830, 'max_depth': 124, 'min_samples_split': 21, 'min_samples_leaf': 6, 'criterion': 'gini'}. Best is trial 11 with value: 0.5456077694235588.[0m
[32m[I 2023-01-13 04:22:07,480][0m Trial 53 finished with value: 0.52785448469659 and parameters: {'n_estimators': 4406, 'max_depth': 110, 'min_samples_split': 30, 'min_samples_leaf': 1, 'criterion': 'gini'}. Best is trial 11 with value: 0.5456077694235588.[0m
[32m[I 2023-01-13 04:22:17,714][0m Trial 54 finished with value: 0.4377041087567403 and parameters: {'n_estimators': 4461, 'max_depth': 110, 'min_samples_split': 31, 'min_samples_leaf': 6, 'criterion': 'gini'}. Best is trial 11 with value: 0.5456077694235588.[0m
[32m[I 2023-01-13 04:22:27,209][0m Trial 55 finished with value: 0.3420134852359916 and parameters: {'n_estimators': 4226, 'max_depth': 103, 'min_samples_split': 12, 'min_samples_leaf': 12, 'criterion': 'gini'}. Best is trial 11 with value: 0.5456077694235588.[0m
[32m[I 2023-01-13 04:22:37,487][0m Trial 56 finished with value: 0.2747673782156541 and parameters: {'n_estimators': 4647, 'max_depth': 123, 'min_samples_split': 89, 'min_samples_leaf': 79, 'criterion': 'entropy'}. Best is trial 11 with value: 0.5456077694235588.[0m
[32m[I 2023-01-13 04:22:42,495][0m Trial 57 finished with value: 0.5396491228070175 and parameters: {'n_estimators': 1782, 'max_depth': 88, 'min_samples_split': 2, 'min_samples_leaf': 1, 'criterion': 'entropy'}. Best is trial 11 with value: 0.5456077694235588.[0m
[32m[I 2023-01-13 04:22:46,688][0m Trial 58 finished with value: 0.2747673782156541 and parameters: {'n_estimators': 1832, 'max_depth': 89, 'min_samples_split': 2, 'min_samples_leaf': 22, 'criterion': 'entropy'}. Best is trial 11 with value: 0.5456077694235588.[0m
[32m[I 2023-01-13 04:22:49,505][0m Trial 59 finished with value: 0.3256902529127593 and parameters: {'n_estimators': 1252, 'max_depth': 75, 'min_samples_split': 8, 'min_samples_leaf': 15, 'criterion': 'entropy'}. Best is trial 11 with value: 0.5456077694235588.[0m
[32m[I 2023-01-13 04:22:51,703][0m Trial 60 finished with value: 0.4282866256550467 and parameters: {'n_estimators': 960, 'max_depth': 62, 'min_samples_split': 15, 'min_samples_leaf': 7, 'criterion': 'entropy'}. Best is trial 11 with value: 0.5456077694235588.[0m
[32m[I 2023-01-13 04:22:55,406][0m Trial 61 finished with value: 0.5497744360902255 and parameters: {'n_estimators': 1460, 'max_depth': 106, 'min_samples_split': 6, 'min_samples_leaf': 1, 'criterion': 'entropy'}. Best is trial 61 with value: 0.5497744360902255.[0m
[32m[I 2023-01-13 04:22:59,273][0m Trial 62 finished with value: 0.5084149768360294 and parameters: {'n_estimators': 1670, 'max_depth': 104, 'min_samples_split': 4, 'min_samples_leaf': 5, 'criterion': 'entropy'}. Best is trial 61 with value: 0.5497744360902255.[0m
