[32m[I 2023-01-13 00:40:49,082][0m Trial 62 finished with value: 0.2 and parameters: {'n_estimators': 4619, 'max_depth': 58, 'min_samples_split': 23, 'min_samples_leaf': 73, 'criterion': 'entropy'}. Best is trial 0 with value: 0.2.[0m
[32m[I 2023-01-13 00:40:52,120][0m Trial 63 finished with value: 0.2 and parameters: {'n_estimators': 1410, 'max_depth': 96, 'min_samples_split': 9, 'min_samples_leaf': 72, 'criterion': 'entropy'}. Best is trial 0 with value: 0.2.[0m
[32m[I 2023-01-13 00:41:02,805][0m Trial 64 finished with value: 0.2 and parameters: {'n_estimators': 4807, 'max_depth': 85, 'min_samples_split': 33, 'min_samples_leaf': 122, 'criterion': 'entropy'}. Best is trial 0 with value: 0.2.[0m
[32m[I 2023-01-13 00:41:12,154][0m Trial 65 finished with value: 0.2 and parameters: {'n_estimators': 4201, 'max_depth': 45, 'min_samples_split': 29, 'min_samples_leaf': 104, 'criterion': 'entropy'}. Best is trial 0 with value: 0.2.[0m
[32m[I 2023-01-13 00:41:21,123][0m Trial 66 finished with value: 0.2 and parameters: {'n_estimators': 4079, 'max_depth': 85, 'min_samples_split': 16, 'min_samples_leaf': 78, 'criterion': 'gini'}. Best is trial 0 with value: 0.2.[0m
[32m[I 2023-01-13 00:41:30,891][0m Trial 67 finished with value: 0.2 and parameters: {'n_estimators': 4395, 'max_depth': 64, 'min_samples_split': 59, 'min_samples_leaf': 125, 'criterion': 'entropy'}. Best is trial 0 with value: 0.2.[0m
[32m[I 2023-01-13 00:41:40,482][0m Trial 68 finished with value: 0.2 and parameters: {'n_estimators': 4317, 'max_depth': 57, 'min_samples_split': 37, 'min_samples_leaf': 109, 'criterion': 'entropy'}. Best is trial 0 with value: 0.2.[0m
[32m[I 2023-01-13 00:41:50,957][0m Trial 69 finished with value: 0.2 and parameters: {'n_estimators': 4701, 'max_depth': 68, 'min_samples_split': 28, 'min_samples_leaf': 116, 'criterion': 'entropy'}. Best is trial 0 with value: 0.2.[0m
[32m[I 2023-01-13 00:41:57,915][0m Trial 70 finished with value: 0.2 and parameters: {'n_estimators': 3169, 'max_depth': 89, 'min_samples_split': 55, 'min_samples_leaf': 91, 'criterion': 'entropy'}. Best is trial 0 with value: 0.2.[0m
[32m[I 2023-01-13 00:42:03,231][0m Trial 71 finished with value: 0.2 and parameters: {'n_estimators': 2360, 'max_depth': 71, 'min_samples_split': 127, 'min_samples_leaf': 56, 'criterion': 'gini'}. Best is trial 0 with value: 0.2.[0m
[32m[I 2023-01-13 00:42:07,571][0m Trial 72 finished with value: 0.2 and parameters: {'n_estimators': 1986, 'max_depth': 27, 'min_samples_split': 119, 'min_samples_leaf': 50, 'criterion': 'gini'}. Best is trial 0 with value: 0.2.[0m
[32m[I 2023-01-13 00:42:12,860][0m Trial 73 finished with value: 0.2 and parameters: {'n_estimators': 2401, 'max_depth': 21, 'min_samples_split': 117, 'min_samples_leaf': 100, 'criterion': 'gini'}. Best is trial 0 with value: 0.2.[0m
[32m[I 2023-01-13 00:42:17,334][0m Trial 74 finished with value: 0.2 and parameters: {'n_estimators': 1995, 'max_depth': 11, 'min_samples_split': 123, 'min_samples_leaf': 53, 'criterion': 'gini'}. Best is trial 0 with value: 0.2.[0m
[32m[I 2023-01-13 00:42:24,588][0m Trial 75 finished with value: 0.2 and parameters: {'n_estimators': 3312, 'max_depth': 29, 'min_samples_split': 125, 'min_samples_leaf': 109, 'criterion': 'gini'}. Best is trial 0 with value: 0.2.[0m
[32m[I 2023-01-13 00:42:30,670][0m Trial 76 finished with value: 0.2 and parameters: {'n_estimators': 2771, 'max_depth': 15, 'min_samples_split': 4, 'min_samples_leaf': 61, 'criterion': 'gini'}. Best is trial 0 with value: 0.2.[0m
[32m[I 2023-01-13 00:42:37,057][0m Trial 77 finished with value: 0.2 and parameters: {'n_estimators': 2849, 'max_depth': 14, 'min_samples_split': 115, 'min_samples_leaf': 68, 'criterion': 'entropy'}. Best is trial 0 with value: 0.2.[0m
[32m[I 2023-01-13 00:42:45,738][0m Trial 78 finished with value: 0.2 and parameters: {'n_estimators': 3887, 'max_depth': 17, 'min_samples_split': 106, 'min_samples_leaf': 47, 'criterion': 'entropy'}. Best is trial 0 with value: 0.2.[0m
[32m[I 2023-01-13 00:42:51,643][0m Trial 79 finished with value: 0.2 and parameters: {'n_estimators': 2528, 'max_depth': 6, 'min_samples_split': 99, 'min_samples_leaf': 59, 'criterion': 'entropy'}. Best is trial 0 with value: 0.2.[0m
[32m[I 2023-01-13 00:42:56,730][0m Trial 80 finished with value: 0.2 and parameters: {'n_estimators': 2219, 'max_depth': 8, 'min_samples_split': 88, 'min_samples_leaf': 83, 'criterion': 'entropy'}. Best is trial 0 with value: 0.2.[0m
[32m[I 2023-01-13 00:42:59,482][0m Trial 81 finished with value: 0.2 and parameters: {'n_estimators': 1230, 'max_depth': 12, 'min_samples_split': 99, 'min_samples_leaf': 86, 'criterion': 'entropy'}. Best is trial 0 with value: 0.2.[0m
[32m[I 2023-01-13 00:43:01,099][0m Trial 82 finished with value: 0.2 and parameters: {'n_estimators': 729, 'max_depth': 4, 'min_samples_split': 70, 'min_samples_leaf': 33, 'criterion': 'entropy'}. Best is trial 0 with value: 0.2.[0m
[32m[I 2023-01-13 00:43:07,821][0m Trial 83 finished with value: 0.2 and parameters: {'n_estimators': 3015, 'max_depth': 108, 'min_samples_split': 84, 'min_samples_leaf': 25, 'criterion': 'entropy'}. Best is trial 0 with value: 0.2.[0m
[32m[I 2023-01-13 00:43:08,292][0m Trial 84 finished with value: 0.2 and parameters: {'n_estimators': 211, 'max_depth': 121, 'min_samples_split': 110, 'min_samples_leaf': 44, 'criterion': 'entropy'}. Best is trial 0 with value: 0.2.[0m
[32m[I 2023-01-13 00:43:09,848][0m Trial 85 finished with value: 0.2 and parameters: {'n_estimators': 702, 'max_depth': 104, 'min_samples_split': 76, 'min_samples_leaf': 33, 'criterion': 'entropy'}. Best is trial 0 with value: 0.2.[0m
[32m[I 2023-01-13 00:43:10,811][0m Trial 86 finished with value: 0.2 and parameters: {'n_estimators': 431, 'max_depth': 118, 'min_samples_split': 89, 'min_samples_leaf': 39, 'criterion': 'entropy'}. Best is trial 0 with value: 0.2.[0m
[32m[I 2023-01-13 00:43:13,200][0m Trial 87 finished with value: 0.2 and parameters: {'n_estimators': 1087, 'max_depth': 124, 'min_samples_split': 20, 'min_samples_leaf': 73, 'criterion': 'entropy'}. Best is trial 0 with value: 0.2.[0m
[32m[I 2023-01-13 00:43:15,992][0m Trial 88 finished with value: 0.2 and parameters: {'n_estimators': 1263, 'max_depth': 98, 'min_samples_split': 14, 'min_samples_leaf': 76, 'criterion': 'entropy'}. Best is trial 0 with value: 0.2.[0m
[32m[I 2023-01-13 00:43:17,894][0m Trial 89 finished with value: 0.2 and parameters: {'n_estimators': 863, 'max_depth': 96, 'min_samples_split': 10, 'min_samples_leaf': 85, 'criterion': 'gini'}. Best is trial 0 with value: 0.2.[0m
[32m[I 2023-01-13 00:43:28,465][0m Trial 90 finished with value: 0.2 and parameters: {'n_estimators': 4774, 'max_depth': 95, 'min_samples_split': 18, 'min_samples_leaf': 72, 'criterion': 'entropy'}. Best is trial 0 with value: 0.2.[0m
[32m[I 2023-01-13 00:43:31,716][0m Trial 91 finished with value: 0.2 and parameters: {'n_estimators': 1476, 'max_depth': 106, 'min_samples_split': 25, 'min_samples_leaf': 94, 'criterion': 'entropy'}. Best is trial 0 with value: 0.2.[0m
[32m[I 2023-01-13 00:43:40,797][0m Trial 92 finished with value: 0.2 and parameters: {'n_estimators': 4069, 'max_depth': 84, 'min_samples_split': 16, 'min_samples_leaf': 68, 'criterion': 'entropy'}. Best is trial 0 with value: 0.2.[0m
[32m[I 2023-01-13 00:43:50,007][0m Trial 93 finished with value: 0.2 and parameters: {'n_estimators': 4145, 'max_depth': 113, 'min_samples_split': 22, 'min_samples_leaf': 78, 'criterion': 'entropy'}. Best is trial 0 with value: 0.2.[0m
[32m[I 2023-01-13 00:43:59,793][0m Trial 94 finished with value: 0.2 and parameters: {'n_estimators': 4434, 'max_depth': 64, 'min_samples_split': 7, 'min_samples_leaf': 123, 'criterion': 'entropy'}. Best is trial 0 with value: 0.2.[0m
[32m[I 2023-01-13 00:44:10,619][0m Trial 95 finished with value: 0.2 and parameters: {'n_estimators': 4802, 'max_depth': 57, 'min_samples_split': 31, 'min_samples_leaf': 125, 'criterion': 'entropy'}. Best is trial 0 with value: 0.2.[0m
[32m[I 2023-01-13 00:44:20,937][0m Trial 96 finished with value: 0.2 and parameters: {'n_estimators': 4640, 'max_depth': 48, 'min_samples_split': 29, 'min_samples_leaf': 103, 'criterion': 'entropy'}. Best is trial 0 with value: 0.2.[0m
[32m[I 2023-01-13 00:44:30,538][0m Trial 97 finished with value: 0.2 and parameters: {'n_estimators': 4334, 'max_depth': 68, 'min_samples_split': 36, 'min_samples_leaf': 119, 'criterion': 'entropy'}. Best is trial 0 with value: 0.2.[0m
[32m[I 2023-01-13 00:44:41,347][0m Trial 98 finished with value: 0.2 and parameters: {'n_estimators': 4872, 'max_depth': 88, 'min_samples_split': 27, 'min_samples_leaf': 116, 'criterion': 'entropy'}. Best is trial 0 with value: 0.2.[0m
[32m[I 2023-01-13 00:44:51,420][0m Trial 99 finished with value: 0.2 and parameters: {'n_estimators': 4549, 'max_depth': 71, 'min_samples_split': 39, 'min_samples_leaf': 103, 'criterion': 'gini'}. Best is trial 0 with value: 0.2.[0m
Uploaded file from /Users/kevinmaikjablonka/git/kjappelbaum/gptchem/experiments/03_classification/opv/out/20230113_002033/train.jsonl: file-BNMRJT6w6uQ8p5aGr87wxo9Q
Ran train size 10 and got accuracy 0.504, XGB baseline 0.5, and TabPFN baseline 0.548
Computing morgan fingerprints...
Loading model that can be used for inference only
Using a Transformer with 25.82 M parameters
╒═════════════════════════╤═══════════╤══════════════════╤═════════╤═════════════╤═════════╤═════════╤═════════╕
│ name                    │ class     │ transform        │ prior   │ trainable   │ shape   │ dtype   │   value │
╞═════════════════════════╪═══════════╪══════════════════╪═════════╪═════════════╪═════════╪═════════╪═════════╡
│ GPR.mean_function.c     │ Parameter │ Identity         │         │ True        │ ()      │ float64 │       0 │
├─────────────────────────┼───────────┼──────────────────┼─────────┼─────────────┼─────────┼─────────┼─────────┤
│ GPR.kernel.variance     │ Parameter │ Softplus         │         │ True        │ ()      │ float64 │       0 │
├─────────────────────────┼───────────┼──────────────────┼─────────┼─────────────┼─────────┼─────────┼─────────┤
│ GPR.likelihood.variance │ Parameter │ Softplus + Shift │         │ True        │ ()      │ float64 │       1 │
╘═════════════════════════╧═══════════╧══════════════════╧═════════╧═════════════╧═════════╧═════════╧═════════╛
Upload progress:   0%|          | 0.00/13.7k [00:00<?, ?it/s]Upload progress: 100%|██████████| 13.7k/13.7k [00:00<00:00, 11.1Mit/s]
[32m[I 2023-01-13 01:05:10,102][0m A new study created in memory with name: no-name-f2362468-a523-43ef-83fb-6b1817bc24a5[0m
/Users/kevinmaikjablonka/git/kjappelbaum/gptchem/src/gptchem/baselines/xgboost.py:38: FutureWarning: suggest_loguniform has been deprecated in v3.0.0. This feature will be removed in v6.0.0. See https://github.com/optuna/optuna/releases/tag/v3.0.0. Use :func:`~optuna.trial.Trial.suggest_float` instead.
  "learning_rate": trial.suggest_loguniform("learning_rate", 0.001, 0.05),
/Users/kevinmaikjablonka/git/kjappelbaum/gptchem/src/gptchem/baselines/xgboost.py:39: FutureWarning: suggest_loguniform has been deprecated in v3.0.0. This feature will be removed in v6.0.0. See https://github.com/optuna/optuna/releases/tag/v3.0.0. Use :func:`~optuna.trial.Trial.suggest_float` instead.
  "colsample_bytree": trial.suggest_loguniform(
/Users/kevinmaikjablonka/git/kjappelbaum/gptchem/src/gptchem/baselines/xgboost.py:42: FutureWarning: suggest_loguniform has been deprecated in v3.0.0. This feature will be removed in v6.0.0. See https://github.com/optuna/optuna/releases/tag/v3.0.0. Use :func:`~optuna.trial.Trial.suggest_float` instead.
  "subsample": trial.suggest_loguniform("subsample", 0.00001, 1),
/Users/kevinmaikjablonka/git/kjappelbaum/gptchem/src/gptchem/baselines/xgboost.py:43: FutureWarning: suggest_loguniform has been deprecated in v3.0.0. This feature will be removed in v6.0.0. See https://github.com/optuna/optuna/releases/tag/v3.0.0. Use :func:`~optuna.trial.Trial.suggest_float` instead.
  "alpha": trial.suggest_loguniform("alpha", 1e-8, 10.0),
/Users/kevinmaikjablonka/git/kjappelbaum/gptchem/src/gptchem/baselines/xgboost.py:44: FutureWarning: suggest_loguniform has been deprecated in v3.0.0. This feature will be removed in v6.0.0. See https://github.com/optuna/optuna/releases/tag/v3.0.0. Use :func:`~optuna.trial.Trial.suggest_float` instead.
  "lambda": trial.suggest_loguniform("lambda", 1e-8, 10.0),
[32m[I 2023-01-13 01:05:12,730][0m Trial 0 finished with value: 0.39999999999999997 and parameters: {'n_estimators': 5490, 'max_depth': 37, 'learning_rate': 0.010570046446158271, 'colsample_bytree': 0.48071425018349023, 'subsample': 0.0013130280280658588, 'alpha': 0.006502000785097662, 'lambda': 8.675307976899775e-05}. Best is trial 0 with value: 0.39999999999999997.[0m
/Users/kevinmaikjablonka/git/kjappelbaum/gptchem/src/gptchem/baselines/xgboost.py:38: FutureWarning: suggest_loguniform has been deprecated in v3.0.0. This feature will be removed in v6.0.0. See https://github.com/optuna/optuna/releases/tag/v3.0.0. Use :func:`~optuna.trial.Trial.suggest_float` instead.
  "learning_rate": trial.suggest_loguniform("learning_rate", 0.001, 0.05),
/Users/kevinmaikjablonka/git/kjappelbaum/gptchem/src/gptchem/baselines/xgboost.py:39: FutureWarning: suggest_loguniform has been deprecated in v3.0.0. This feature will be removed in v6.0.0. See https://github.com/optuna/optuna/releases/tag/v3.0.0. Use :func:`~optuna.trial.Trial.suggest_float` instead.
  "colsample_bytree": trial.suggest_loguniform(
/Users/kevinmaikjablonka/git/kjappelbaum/gptchem/src/gptchem/baselines/xgboost.py:42: FutureWarning: suggest_loguniform has been deprecated in v3.0.0. This feature will be removed in v6.0.0. See https://github.com/optuna/optuna/releases/tag/v3.0.0. Use :func:`~optuna.trial.Trial.suggest_float` instead.
  "subsample": trial.suggest_loguniform("subsample", 0.00001, 1),
/Users/kevinmaikjablonka/git/kjappelbaum/gptchem/src/gptchem/baselines/xgboost.py:43: FutureWarning: suggest_loguniform has been deprecated in v3.0.0. This feature will be removed in v6.0.0. See https://github.com/optuna/optuna/releases/tag/v3.0.0. Use :func:`~optuna.trial.Trial.suggest_float` instead.
  "alpha": trial.suggest_loguniform("alpha", 1e-8, 10.0),
/Users/kevinmaikjablonka/git/kjappelbaum/gptchem/src/gptchem/baselines/xgboost.py:44: FutureWarning: suggest_loguniform has been deprecated in v3.0.0. This feature will be removed in v6.0.0. See https://github.com/optuna/optuna/releases/tag/v3.0.0. Use :func:`~optuna.trial.Trial.suggest_float` instead.
  "lambda": trial.suggest_loguniform("lambda", 1e-8, 10.0),
[32m[I 2023-01-13 01:05:17,526][0m Trial 1 finished with value: 0.39999999999999997 and parameters: {'n_estimators': 8919, 'max_depth': 49, 'learning_rate': 0.00448183267887628, 'colsample_bytree': 0.7151910137131439, 'subsample': 0.004410365667970984, 'alpha': 0.001295391520396607, 'lambda': 2.13978305808933}. Best is trial 0 with value: 0.39999999999999997.[0m
/Users/kevinmaikjablonka/git/kjappelbaum/gptchem/src/gptchem/baselines/xgboost.py:38: FutureWarning: suggest_loguniform has been deprecated in v3.0.0. This feature will be removed in v6.0.0. See https://github.com/optuna/optuna/releases/tag/v3.0.0. Use :func:`~optuna.trial.Trial.suggest_float` instead.
  "learning_rate": trial.suggest_loguniform("learning_rate", 0.001, 0.05),
/Users/kevinmaikjablonka/git/kjappelbaum/gptchem/src/gptchem/baselines/xgboost.py:39: FutureWarning: suggest_loguniform has been deprecated in v3.0.0. This feature will be removed in v6.0.0. See https://github.com/optuna/optuna/releases/tag/v3.0.0. Use :func:`~optuna.trial.Trial.suggest_float` instead.
  "colsample_bytree": trial.suggest_loguniform(
/Users/kevinmaikjablonka/git/kjappelbaum/gptchem/src/gptchem/baselines/xgboost.py:42: FutureWarning: suggest_loguniform has been deprecated in v3.0.0. This feature will be removed in v6.0.0. See https://github.com/optuna/optuna/releases/tag/v3.0.0. Use :func:`~optuna.trial.Trial.suggest_float` instead.
  "subsample": trial.suggest_loguniform("subsample", 0.00001, 1),
/Users/kevinmaikjablonka/git/kjappelbaum/gptchem/src/gptchem/baselines/xgboost.py:43: FutureWarning: suggest_loguniform has been deprecated in v3.0.0. This feature will be removed in v6.0.0. See https://github.com/optuna/optuna/releases/tag/v3.0.0. Use :func:`~optuna.trial.Trial.suggest_float` instead.
  "alpha": trial.suggest_loguniform("alpha", 1e-8, 10.0),
/Users/kevinmaikjablonka/git/kjappelbaum/gptchem/src/gptchem/baselines/xgboost.py:44: FutureWarning: suggest_loguniform has been deprecated in v3.0.0. This feature will be removed in v6.0.0. See https://github.com/optuna/optuna/releases/tag/v3.0.0. Use :func:`~optuna.trial.Trial.suggest_float` instead.
  "lambda": trial.suggest_loguniform("lambda", 1e-8, 10.0),
[32m[I 2023-01-13 01:05:17,951][0m Trial 2 finished with value: 0.39999999999999997 and parameters: {'n_estimators': 714, 'max_depth': 8, 'learning_rate': 0.0010823069587789706, 'colsample_bytree': 0.7638468512687414, 'subsample': 0.07776492451078383, 'alpha': 0.6762532016190338, 'lambda': 6.42044426233932}. Best is trial 0 with value: 0.39999999999999997.[0m
/Users/kevinmaikjablonka/git/kjappelbaum/gptchem/src/gptchem/baselines/xgboost.py:38: FutureWarning: suggest_loguniform has been deprecated in v3.0.0. This feature will be removed in v6.0.0. See https://github.com/optuna/optuna/releases/tag/v3.0.0. Use :func:`~optuna.trial.Trial.suggest_float` instead.
  "learning_rate": trial.suggest_loguniform("learning_rate", 0.001, 0.05),
/Users/kevinmaikjablonka/git/kjappelbaum/gptchem/src/gptchem/baselines/xgboost.py:39: FutureWarning: suggest_loguniform has been deprecated in v3.0.0. This feature will be removed in v6.0.0. See https://github.com/optuna/optuna/releases/tag/v3.0.0. Use :func:`~optuna.trial.Trial.suggest_float` instead.
  "colsample_bytree": trial.suggest_loguniform(
/Users/kevinmaikjablonka/git/kjappelbaum/gptchem/src/gptchem/baselines/xgboost.py:42: FutureWarning: suggest_loguniform has been deprecated in v3.0.0. This feature will be removed in v6.0.0. See https://github.com/optuna/optuna/releases/tag/v3.0.0. Use :func:`~optuna.trial.Trial.suggest_float` instead.
  "subsample": trial.suggest_loguniform("subsample", 0.00001, 1),
/Users/kevinmaikjablonka/git/kjappelbaum/gptchem/src/gptchem/baselines/xgboost.py:43: FutureWarning: suggest_loguniform has been deprecated in v3.0.0. This feature will be removed in v6.0.0. See https://github.com/optuna/optuna/releases/tag/v3.0.0. Use :func:`~optuna.trial.Trial.suggest_float` instead.
  "alpha": trial.suggest_loguniform("alpha", 1e-8, 10.0),
/Users/kevinmaikjablonka/git/kjappelbaum/gptchem/src/gptchem/baselines/xgboost.py:44: FutureWarning: suggest_loguniform has been deprecated in v3.0.0. This feature will be removed in v6.0.0. See https://github.com/optuna/optuna/releases/tag/v3.0.0. Use :func:`~optuna.trial.Trial.suggest_float` instead.
  "lambda": trial.suggest_loguniform("lambda", 1e-8, 10.0),
[32m[I 2023-01-13 01:05:21,250][0m Trial 3 finished with value: 0.39999999999999997 and parameters: {'n_estimators': 7993, 'max_depth': 25, 'learning_rate': 0.021188277784090766, 'colsample_bytree': 0.24193587497780455, 'subsample': 0.015834527427829734, 'alpha': 1.9506510537765813e-07, 'lambda': 3.177022228527139}. Best is trial 0 with value: 0.39999999999999997.[0m
/Users/kevinmaikjablonka/git/kjappelbaum/gptchem/src/gptchem/baselines/xgboost.py:38: FutureWarning: suggest_loguniform has been deprecated in v3.0.0. This feature will be removed in v6.0.0. See https://github.com/optuna/optuna/releases/tag/v3.0.0. Use :func:`~optuna.trial.Trial.suggest_float` instead.
  "learning_rate": trial.suggest_loguniform("learning_rate", 0.001, 0.05),
/Users/kevinmaikjablonka/git/kjappelbaum/gptchem/src/gptchem/baselines/xgboost.py:39: FutureWarning: suggest_loguniform has been deprecated in v3.0.0. This feature will be removed in v6.0.0. See https://github.com/optuna/optuna/releases/tag/v3.0.0. Use :func:`~optuna.trial.Trial.suggest_float` instead.
  "colsample_bytree": trial.suggest_loguniform(
/Users/kevinmaikjablonka/git/kjappelbaum/gptchem/src/gptchem/baselines/xgboost.py:42: FutureWarning: suggest_loguniform has been deprecated in v3.0.0. This feature will be removed in v6.0.0. See https://github.com/optuna/optuna/releases/tag/v3.0.0. Use :func:`~optuna.trial.Trial.suggest_float` instead.
  "subsample": trial.suggest_loguniform("subsample", 0.00001, 1),
/Users/kevinmaikjablonka/git/kjappelbaum/gptchem/src/gptchem/baselines/xgboost.py:43: FutureWarning: suggest_loguniform has been deprecated in v3.0.0. This feature will be removed in v6.0.0. See https://github.com/optuna/optuna/releases/tag/v3.0.0. Use :func:`~optuna.trial.Trial.suggest_float` instead.
  "alpha": trial.suggest_loguniform("alpha", 1e-8, 10.0),
/Users/kevinmaikjablonka/git/kjappelbaum/gptchem/src/gptchem/baselines/xgboost.py:44: FutureWarning: suggest_loguniform has been deprecated in v3.0.0. This feature will be removed in v6.0.0. See https://github.com/optuna/optuna/releases/tag/v3.0.0. Use :func:`~optuna.trial.Trial.suggest_float` instead.
  "lambda": trial.suggest_loguniform("lambda", 1e-8, 10.0),
