[32m[I 2023-01-13 04:23:00,870][0m Trial 63 finished with value: 0.3831251513476578 and parameters: {'n_estimators': 703, 'max_depth': 97, 'min_samples_split': 6, 'min_samples_leaf': 11, 'criterion': 'entropy'}. Best is trial 61 with value: 0.5497744360902255.[0m
[32m[I 2023-01-13 04:23:04,270][0m Trial 64 finished with value: 0.5674680306905371 and parameters: {'n_estimators': 1364, 'max_depth': 115, 'min_samples_split': 12, 'min_samples_leaf': 1, 'criterion': 'entropy'}. Best is trial 64 with value: 0.5674680306905371.[0m
[32m[I 2023-01-13 04:23:07,068][0m Trial 65 finished with value: 0.31669841269841276 and parameters: {'n_estimators': 1247, 'max_depth': 86, 'min_samples_split': 11, 'min_samples_leaf': 18, 'criterion': 'entropy'}. Best is trial 64 with value: 0.5674680306905371.[0m
[32m[I 2023-01-13 04:23:11,287][0m Trial 66 finished with value: 0.3946470196470197 and parameters: {'n_estimators': 1811, 'max_depth': 77, 'min_samples_split': 17, 'min_samples_leaf': 9, 'criterion': 'entropy'}. Best is trial 64 with value: 0.5674680306905371.[0m
[32m[I 2023-01-13 04:23:14,718][0m Trial 67 finished with value: 0.5261102069286213 and parameters: {'n_estimators': 1453, 'max_depth': 27, 'min_samples_split': 12, 'min_samples_leaf': 4, 'criterion': 'entropy'}. Best is trial 64 with value: 0.5674680306905371.[0m
[32m[I 2023-01-13 04:23:19,636][0m Trial 68 finished with value: 0.2747673782156541 and parameters: {'n_estimators': 2247, 'max_depth': 115, 'min_samples_split': 2, 'min_samples_leaf': 34, 'criterion': 'entropy'}. Best is trial 64 with value: 0.5674680306905371.[0m
[32m[I 2023-01-13 04:23:21,749][0m Trial 69 finished with value: 0.2747673782156541 and parameters: {'n_estimators': 983, 'max_depth': 106, 'min_samples_split': 22, 'min_samples_leaf': 26, 'criterion': 'entropy'}. Best is trial 64 with value: 0.5674680306905371.[0m
[32m[I 2023-01-13 04:23:23,476][0m Trial 70 finished with value: 0.33964311486562127 and parameters: {'n_estimators': 792, 'max_depth': 92, 'min_samples_split': 7, 'min_samples_leaf': 12, 'criterion': 'entropy'}. Best is trial 64 with value: 0.5674680306905371.[0m
[32m[I 2023-01-13 04:23:24,637][0m Trial 71 finished with value: 0.5573427174073291 and parameters: {'n_estimators': 481, 'max_depth': 120, 'min_samples_split': 15, 'min_samples_leaf': 1, 'criterion': 'entropy'}. Best is trial 64 with value: 0.5674680306905371.[0m
[32m[I 2023-01-13 04:23:25,382][0m Trial 72 finished with value: 0.5081081491607807 and parameters: {'n_estimators': 326, 'max_depth': 118, 'min_samples_split': 16, 'min_samples_leaf': 4, 'criterion': 'entropy'}. Best is trial 64 with value: 0.5674680306905371.[0m
[32m[I 2023-01-13 04:23:26,239][0m Trial 73 finished with value: 0.3744449994449995 and parameters: {'n_estimators': 389, 'max_depth': 126, 'min_samples_split': 24, 'min_samples_leaf': 8, 'criterion': 'entropy'}. Best is trial 64 with value: 0.5674680306905371.[0m
[32m[I 2023-01-13 04:23:29,643][0m Trial 74 finished with value: 0.5485623148781043 and parameters: {'n_estimators': 1395, 'max_depth': 113, 'min_samples_split': 11, 'min_samples_leaf': 1, 'criterion': 'entropy'}. Best is trial 64 with value: 0.5674680306905371.[0m
[32m[I 2023-01-13 04:23:32,897][0m Trial 75 finished with value: 0.3176674608899673 and parameters: {'n_estimators': 1483, 'max_depth': 115, 'min_samples_split': 19, 'min_samples_leaf': 16, 'criterion': 'entropy'}. Best is trial 64 with value: 0.5674680306905371.[0m
[32m[I 2023-01-13 04:23:35,525][0m Trial 76 finished with value: 0.3946470196470197 and parameters: {'n_estimators': 1105, 'max_depth': 119, 'min_samples_split': 7, 'min_samples_leaf': 9, 'criterion': 'entropy'}. Best is trial 64 with value: 0.5674680306905371.[0m
[32m[I 2023-01-13 04:23:39,360][0m Trial 77 finished with value: 0.5281081491607807 and parameters: {'n_estimators': 1700, 'max_depth': 111, 'min_samples_split': 27, 'min_samples_leaf': 4, 'criterion': 'entropy'}. Best is trial 64 with value: 0.5674680306905371.[0m
[32m[I 2023-01-13 04:23:43,674][0m Trial 78 finished with value: 0.35095197499289577 and parameters: {'n_estimators': 1941, 'max_depth': 124, 'min_samples_split': 14, 'min_samples_leaf': 12, 'criterion': 'entropy'}. Best is trial 64 with value: 0.5674680306905371.[0m
[32m[I 2023-01-13 04:23:49,466][0m Trial 79 finished with value: 0.5594486215538848 and parameters: {'n_estimators': 2309, 'max_depth': 128, 'min_samples_split': 5, 'min_samples_leaf': 1, 'criterion': 'entropy'}. Best is trial 64 with value: 0.5674680306905371.[0m
[32m[I 2023-01-13 04:23:55,346][0m Trial 80 finished with value: 0.5594486215538848 and parameters: {'n_estimators': 2320, 'max_depth': 128, 'min_samples_split': 5, 'min_samples_leaf': 1, 'criterion': 'entropy'}. Best is trial 64 with value: 0.5674680306905371.[0m
[32m[I 2023-01-13 04:24:00,414][0m Trial 81 finished with value: 0.5685623148781043 and parameters: {'n_estimators': 2062, 'max_depth': 121, 'min_samples_split': 10, 'min_samples_leaf': 1, 'criterion': 'entropy'}. Best is trial 81 with value: 0.5685623148781043.[0m
[32m[I 2023-01-13 04:24:06,294][0m Trial 82 finished with value: 0.5594486215538848 and parameters: {'n_estimators': 2335, 'max_depth': 122, 'min_samples_split': 5, 'min_samples_leaf': 1, 'criterion': 'entropy'}. Best is trial 81 with value: 0.5685623148781043.[0m
[32m[I 2023-01-13 04:24:11,756][0m Trial 83 finished with value: 0.43755221386800336 and parameters: {'n_estimators': 2426, 'max_depth': 120, 'min_samples_split': 5, 'min_samples_leaf': 7, 'criterion': 'entropy'}. Best is trial 81 with value: 0.5685623148781043.[0m
[32m[I 2023-01-13 04:24:17,143][0m Trial 84 finished with value: 0.3946470196470197 and parameters: {'n_estimators': 2374, 'max_depth': 123, 'min_samples_split': 10, 'min_samples_leaf': 9, 'criterion': 'entropy'}. Best is trial 81 with value: 0.5685623148781043.[0m
[32m[I 2023-01-13 04:24:23,484][0m Trial 85 finished with value: 0.5168446187156647 and parameters: {'n_estimators': 2748, 'max_depth': 115, 'min_samples_split': 6, 'min_samples_leaf': 4, 'criterion': 'entropy'}. Best is trial 81 with value: 0.5685623148781043.[0m
[32m[I 2023-01-13 04:24:29,118][0m Trial 86 finished with value: 0.2747673782156541 and parameters: {'n_estimators': 2545, 'max_depth': 128, 'min_samples_split': 11, 'min_samples_leaf': 49, 'criterion': 'entropy'}. Best is trial 81 with value: 0.5685623148781043.[0m
[32m[I 2023-01-13 04:24:33,926][0m Trial 87 finished with value: 0.3372121212121212 and parameters: {'n_estimators': 2158, 'max_depth': 53, 'min_samples_split': 16, 'min_samples_leaf': 13, 'criterion': 'entropy'}. Best is trial 81 with value: 0.5685623148781043.[0m
[32m[I 2023-01-13 04:24:40,358][0m Trial 88 finished with value: 0.3001664433889498 and parameters: {'n_estimators': 2885, 'max_depth': 119, 'min_samples_split': 9, 'min_samples_leaf': 18, 'criterion': 'entropy'}. Best is trial 81 with value: 0.5685623148781043.[0m
[32m[I 2023-01-13 04:24:45,752][0m Trial 89 finished with value: 0.5293734335839599 and parameters: {'n_estimators': 2302, 'max_depth': 113, 'min_samples_split': 18, 'min_samples_leaf': 3, 'criterion': 'entropy'}. Best is trial 81 with value: 0.5685623148781043.[0m
[32m[I 2023-01-13 04:24:50,264][0m Trial 90 finished with value: 0.4503932198356078 and parameters: {'n_estimators': 1960, 'max_depth': 125, 'min_samples_split': 14, 'min_samples_leaf': 7, 'criterion': 'entropy'}. Best is trial 81 with value: 0.5685623148781043.[0m
[32m[I 2023-01-13 04:24:55,473][0m Trial 91 finished with value: 0.5497744360902255 and parameters: {'n_estimators': 2061, 'max_depth': 109, 'min_samples_split': 2, 'min_samples_leaf': 1, 'criterion': 'entropy'}. Best is trial 81 with value: 0.5685623148781043.[0m
[32m[I 2023-01-13 04:25:00,758][0m Trial 92 finished with value: 0.5696741854636592 and parameters: {'n_estimators': 2111, 'max_depth': 108, 'min_samples_split': 5, 'min_samples_leaf': 1, 'criterion': 'entropy'}. Best is trial 92 with value: 0.5696741854636592.[0m
[32m[I 2023-01-13 04:25:05,834][0m Trial 93 finished with value: 0.5497744360902256 and parameters: {'n_estimators': 2033, 'max_depth': 107, 'min_samples_split': 5, 'min_samples_leaf': 1, 'criterion': 'entropy'}. Best is trial 92 with value: 0.5696741854636592.[0m
[32m[I 2023-01-13 04:25:10,624][0m Trial 94 finished with value: 0.5084149768360294 and parameters: {'n_estimators': 2046, 'max_depth': 106, 'min_samples_split': 4, 'min_samples_leaf': 5, 'criterion': 'entropy'}. Best is trial 92 with value: 0.5696741854636592.[0m
[32m[I 2023-01-13 04:25:16,088][0m Trial 95 finished with value: 0.3737076682459642 and parameters: {'n_estimators': 2461, 'max_depth': 109, 'min_samples_split': 2, 'min_samples_leaf': 10, 'criterion': 'entropy'}. Best is trial 92 with value: 0.5696741854636592.[0m
[32m[I 2023-01-13 04:25:22,079][0m Trial 96 finished with value: 0.5168446187156647 and parameters: {'n_estimators': 2606, 'max_depth': 98, 'min_samples_split': 6, 'min_samples_leaf': 4, 'criterion': 'entropy'}. Best is trial 92 with value: 0.5696741854636592.[0m
[32m[I 2023-01-13 04:25:26,481][0m Trial 97 finished with value: 0.3372121212121212 and parameters: {'n_estimators': 1954, 'max_depth': 117, 'min_samples_split': 9, 'min_samples_leaf': 13, 'criterion': 'entropy'}. Best is trial 92 with value: 0.5696741854636592.[0m
[32m[I 2023-01-13 04:25:31,460][0m Trial 98 finished with value: 0.43755221386800336 and parameters: {'n_estimators': 2218, 'max_depth': 122, 'min_samples_split': 5, 'min_samples_leaf': 7, 'criterion': 'entropy'}. Best is trial 92 with value: 0.5696741854636592.[0m
[32m[I 2023-01-13 04:25:34,852][0m Trial 99 finished with value: 0.2747673782156541 and parameters: {'n_estimators': 1566, 'max_depth': 109, 'min_samples_split': 14, 'min_samples_leaf': 117, 'criterion': 'entropy'}. Best is trial 92 with value: 0.5696741854636592.[0m
Uploaded file from /Users/kevinmaikjablonka/git/kjappelbaum/gptchem/experiments/03_classification/opv/out/20230113_030921/train.jsonl: file-LjOkwGXpdAAYor4NxQlPBhed
Ran train size 50 and got accuracy 0.476, XGB baseline 0.568, and TabPFN baseline 0.576
Computing morgan fingerprints...
Loading model that can be used for inference only
Using a Transformer with 25.82 M parameters
╒═════════════════════════╤═══════════╤══════════════════╤═════════╤═════════════╤═════════╤═════════╤══════════╕
│ name                    │ class     │ transform        │ prior   │ trainable   │ shape   │ dtype   │    value │
╞═════════════════════════╪═══════════╪══════════════════╪═════════╪═════════════╪═════════╪═════════╪══════════╡
│ GPR.mean_function.c     │ Parameter │ Identity         │         │ True        │ ()      │ float64 │ -3e-05   │
├─────────────────────────┼───────────┼──────────────────┼─────────┼─────────────┼─────────┼─────────┼──────────┤
│ GPR.kernel.variance     │ Parameter │ Softplus         │         │ True        │ ()      │ float64 │  0       │
├─────────────────────────┼───────────┼──────────────────┼─────────┼─────────────┼─────────┼─────────┼──────────┤
│ GPR.likelihood.variance │ Parameter │ Softplus + Shift │         │ True        │ ()      │ float64 │  0.99994 │
╘═════════════════════════╧═══════════╧══════════════════╧═════════╧═════════════╧═════════╧═════════╧══════════╛
Upload progress:   0%|          | 0.00/37.1k [00:00<?, ?it/s]Upload progress: 100%|██████████| 37.1k/37.1k [00:00<00:00, 34.2Mit/s]
[32m[I 2023-01-13 04:31:50,077][0m A new study created in memory with name: no-name-7e461d7f-b3f8-4b36-8070-893e62b4cde6[0m
/Users/kevinmaikjablonka/git/kjappelbaum/gptchem/src/gptchem/baselines/xgboost.py:38: FutureWarning: suggest_loguniform has been deprecated in v3.0.0. This feature will be removed in v6.0.0. See https://github.com/optuna/optuna/releases/tag/v3.0.0. Use :func:`~optuna.trial.Trial.suggest_float` instead.
  "learning_rate": trial.suggest_loguniform("learning_rate", 0.001, 0.05),
/Users/kevinmaikjablonka/git/kjappelbaum/gptchem/src/gptchem/baselines/xgboost.py:39: FutureWarning: suggest_loguniform has been deprecated in v3.0.0. This feature will be removed in v6.0.0. See https://github.com/optuna/optuna/releases/tag/v3.0.0. Use :func:`~optuna.trial.Trial.suggest_float` instead.
  "colsample_bytree": trial.suggest_loguniform(
/Users/kevinmaikjablonka/git/kjappelbaum/gptchem/src/gptchem/baselines/xgboost.py:42: FutureWarning: suggest_loguniform has been deprecated in v3.0.0. This feature will be removed in v6.0.0. See https://github.com/optuna/optuna/releases/tag/v3.0.0. Use :func:`~optuna.trial.Trial.suggest_float` instead.
  "subsample": trial.suggest_loguniform("subsample", 0.00001, 1),
/Users/kevinmaikjablonka/git/kjappelbaum/gptchem/src/gptchem/baselines/xgboost.py:43: FutureWarning: suggest_loguniform has been deprecated in v3.0.0. This feature will be removed in v6.0.0. See https://github.com/optuna/optuna/releases/tag/v3.0.0. Use :func:`~optuna.trial.Trial.suggest_float` instead.
  "alpha": trial.suggest_loguniform("alpha", 1e-8, 10.0),
/Users/kevinmaikjablonka/git/kjappelbaum/gptchem/src/gptchem/baselines/xgboost.py:44: FutureWarning: suggest_loguniform has been deprecated in v3.0.0. This feature will be removed in v6.0.0. See https://github.com/optuna/optuna/releases/tag/v3.0.0. Use :func:`~optuna.trial.Trial.suggest_float` instead.
  "lambda": trial.suggest_loguniform("lambda", 1e-8, 10.0),
[32m[I 2023-01-13 04:31:56,954][0m Trial 0 finished with value: 0.328639432087708 and parameters: {'n_estimators': 5490, 'max_depth': 37, 'learning_rate': 0.010570046446158271, 'colsample_bytree': 0.48071425018349023, 'subsample': 0.0013130280280658588, 'alpha': 0.006502000785097662, 'lambda': 8.675307976899775e-05}. Best is trial 0 with value: 0.328639432087708.[0m
/Users/kevinmaikjablonka/git/kjappelbaum/gptchem/src/gptchem/baselines/xgboost.py:38: FutureWarning: suggest_loguniform has been deprecated in v3.0.0. This feature will be removed in v6.0.0. See https://github.com/optuna/optuna/releases/tag/v3.0.0. Use :func:`~optuna.trial.Trial.suggest_float` instead.
  "learning_rate": trial.suggest_loguniform("learning_rate", 0.001, 0.05),
/Users/kevinmaikjablonka/git/kjappelbaum/gptchem/src/gptchem/baselines/xgboost.py:39: FutureWarning: suggest_loguniform has been deprecated in v3.0.0. This feature will be removed in v6.0.0. See https://github.com/optuna/optuna/releases/tag/v3.0.0. Use :func:`~optuna.trial.Trial.suggest_float` instead.
  "colsample_bytree": trial.suggest_loguniform(
/Users/kevinmaikjablonka/git/kjappelbaum/gptchem/src/gptchem/baselines/xgboost.py:42: FutureWarning: suggest_loguniform has been deprecated in v3.0.0. This feature will be removed in v6.0.0. See https://github.com/optuna/optuna/releases/tag/v3.0.0. Use :func:`~optuna.trial.Trial.suggest_float` instead.
  "subsample": trial.suggest_loguniform("subsample", 0.00001, 1),
/Users/kevinmaikjablonka/git/kjappelbaum/gptchem/src/gptchem/baselines/xgboost.py:43: FutureWarning: suggest_loguniform has been deprecated in v3.0.0. This feature will be removed in v6.0.0. See https://github.com/optuna/optuna/releases/tag/v3.0.0. Use :func:`~optuna.trial.Trial.suggest_float` instead.
  "alpha": trial.suggest_loguniform("alpha", 1e-8, 10.0),
/Users/kevinmaikjablonka/git/kjappelbaum/gptchem/src/gptchem/baselines/xgboost.py:44: FutureWarning: suggest_loguniform has been deprecated in v3.0.0. This feature will be removed in v6.0.0. See https://github.com/optuna/optuna/releases/tag/v3.0.0. Use :func:`~optuna.trial.Trial.suggest_float` instead.
  "lambda": trial.suggest_loguniform("lambda", 1e-8, 10.0),
[32m[I 2023-01-13 04:32:09,104][0m Trial 1 finished with value: 0.34649657494485087 and parameters: {'n_estimators': 8919, 'max_depth': 49, 'learning_rate': 0.00448183267887628, 'colsample_bytree': 0.7151910137131439, 'subsample': 0.004410365667970984, 'alpha': 0.001295391520396607, 'lambda': 2.13978305808933}. Best is trial 1 with value: 0.34649657494485087.[0m
/Users/kevinmaikjablonka/git/kjappelbaum/gptchem/src/gptchem/baselines/xgboost.py:38: FutureWarning: suggest_loguniform has been deprecated in v3.0.0. This feature will be removed in v6.0.0. See https://github.com/optuna/optuna/releases/tag/v3.0.0. Use :func:`~optuna.trial.Trial.suggest_float` instead.
  "learning_rate": trial.suggest_loguniform("learning_rate", 0.001, 0.05),
/Users/kevinmaikjablonka/git/kjappelbaum/gptchem/src/gptchem/baselines/xgboost.py:39: FutureWarning: suggest_loguniform has been deprecated in v3.0.0. This feature will be removed in v6.0.0. See https://github.com/optuna/optuna/releases/tag/v3.0.0. Use :func:`~optuna.trial.Trial.suggest_float` instead.
  "colsample_bytree": trial.suggest_loguniform(
/Users/kevinmaikjablonka/git/kjappelbaum/gptchem/src/gptchem/baselines/xgboost.py:42: FutureWarning: suggest_loguniform has been deprecated in v3.0.0. This feature will be removed in v6.0.0. See https://github.com/optuna/optuna/releases/tag/v3.0.0. Use :func:`~optuna.trial.Trial.suggest_float` instead.
  "subsample": trial.suggest_loguniform("subsample", 0.00001, 1),
/Users/kevinmaikjablonka/git/kjappelbaum/gptchem/src/gptchem/baselines/xgboost.py:43: FutureWarning: suggest_loguniform has been deprecated in v3.0.0. This feature will be removed in v6.0.0. See https://github.com/optuna/optuna/releases/tag/v3.0.0. Use :func:`~optuna.trial.Trial.suggest_float` instead.
  "alpha": trial.suggest_loguniform("alpha", 1e-8, 10.0),
/Users/kevinmaikjablonka/git/kjappelbaum/gptchem/src/gptchem/baselines/xgboost.py:44: FutureWarning: suggest_loguniform has been deprecated in v3.0.0. This feature will be removed in v6.0.0. See https://github.com/optuna/optuna/releases/tag/v3.0.0. Use :func:`~optuna.trial.Trial.suggest_float` instead.
  "lambda": trial.suggest_loguniform("lambda", 1e-8, 10.0),
[32m[I 2023-01-13 04:32:10,268][0m Trial 2 finished with value: 0.2747673782156541 and parameters: {'n_estimators': 714, 'max_depth': 8, 'learning_rate': 0.0010823069587789706, 'colsample_bytree': 0.7638468512687414, 'subsample': 0.07776492451078383, 'alpha': 0.6762532016190338, 'lambda': 6.42044426233932}. Best is trial 1 with value: 0.34649657494485087.[0m
/Users/kevinmaikjablonka/git/kjappelbaum/gptchem/src/gptchem/baselines/xgboost.py:38: FutureWarning: suggest_loguniform has been deprecated in v3.0.0. This feature will be removed in v6.0.0. See https://github.com/optuna/optuna/releases/tag/v3.0.0. Use :func:`~optuna.trial.Trial.suggest_float` instead.
  "learning_rate": trial.suggest_loguniform("learning_rate", 0.001, 0.05),
/Users/kevinmaikjablonka/git/kjappelbaum/gptchem/src/gptchem/baselines/xgboost.py:39: FutureWarning: suggest_loguniform has been deprecated in v3.0.0. This feature will be removed in v6.0.0. See https://github.com/optuna/optuna/releases/tag/v3.0.0. Use :func:`~optuna.trial.Trial.suggest_float` instead.
  "colsample_bytree": trial.suggest_loguniform(
/Users/kevinmaikjablonka/git/kjappelbaum/gptchem/src/gptchem/baselines/xgboost.py:42: FutureWarning: suggest_loguniform has been deprecated in v3.0.0. This feature will be removed in v6.0.0. See https://github.com/optuna/optuna/releases/tag/v3.0.0. Use :func:`~optuna.trial.Trial.suggest_float` instead.
  "subsample": trial.suggest_loguniform("subsample", 0.00001, 1),
/Users/kevinmaikjablonka/git/kjappelbaum/gptchem/src/gptchem/baselines/xgboost.py:43: FutureWarning: suggest_loguniform has been deprecated in v3.0.0. This feature will be removed in v6.0.0. See https://github.com/optuna/optuna/releases/tag/v3.0.0. Use :func:`~optuna.trial.Trial.suggest_float` instead.
  "alpha": trial.suggest_loguniform("alpha", 1e-8, 10.0),
/Users/kevinmaikjablonka/git/kjappelbaum/gptchem/src/gptchem/baselines/xgboost.py:44: FutureWarning: suggest_loguniform has been deprecated in v3.0.0. This feature will be removed in v6.0.0. See https://github.com/optuna/optuna/releases/tag/v3.0.0. Use :func:`~optuna.trial.Trial.suggest_float` instead.
  "lambda": trial.suggest_loguniform("lambda", 1e-8, 10.0),
