[32m[I 2023-01-13 00:14:42,454][0m Trial 44 finished with value: 0.2 and parameters: {'n_estimators': 4543, 'max_depth': 30, 'min_samples_split': 67, 'min_samples_leaf': 8, 'criterion': 'entropy'}. Best is trial 0 with value: 0.2.[0m
[32m[I 2023-01-13 00:14:50,201][0m Trial 45 finished with value: 0.2 and parameters: {'n_estimators': 3516, 'max_depth': 41, 'min_samples_split': 81, 'min_samples_leaf': 42, 'criterion': 'entropy'}. Best is trial 0 with value: 0.2.[0m
[32m[I 2023-01-13 00:14:56,628][0m Trial 46 finished with value: 0.2 and parameters: {'n_estimators': 2917, 'max_depth': 70, 'min_samples_split': 44, 'min_samples_leaf': 119, 'criterion': 'gini'}. Best is trial 0 with value: 0.2.[0m
[32m[I 2023-01-13 00:15:04,847][0m Trial 47 finished with value: 0.2 and parameters: {'n_estimators': 3681, 'max_depth': 31, 'min_samples_split': 53, 'min_samples_leaf': 99, 'criterion': 'entropy'}. Best is trial 0 with value: 0.2.[0m
[32m[I 2023-01-13 00:15:10,270][0m Trial 48 finished with value: 0.2 and parameters: {'n_estimators': 2423, 'max_depth': 75, 'min_samples_split': 128, 'min_samples_leaf': 97, 'criterion': 'entropy'}. Best is trial 0 with value: 0.2.[0m
[32m[I 2023-01-13 00:15:17,602][0m Trial 49 finished with value: 0.2 and parameters: {'n_estimators': 3279, 'max_depth': 79, 'min_samples_split': 121, 'min_samples_leaf': 64, 'criterion': 'gini'}. Best is trial 0 with value: 0.2.[0m
[32m[I 2023-01-13 00:15:21,941][0m Trial 50 finished with value: 0.2 and parameters: {'n_estimators': 1979, 'max_depth': 25, 'min_samples_split': 76, 'min_samples_leaf': 53, 'criterion': 'entropy'}. Best is trial 0 with value: 0.2.[0m
[32m[I 2023-01-13 00:15:28,209][0m Trial 51 finished with value: 0.2 and parameters: {'n_estimators': 2758, 'max_depth': 20, 'min_samples_split': 3, 'min_samples_leaf': 57, 'criterion': 'entropy'}. Best is trial 0 with value: 0.2.[0m
[32m[I 2023-01-13 00:15:36,531][0m Trial 52 finished with value: 0.2 and parameters: {'n_estimators': 3840, 'max_depth': 13, 'min_samples_split': 115, 'min_samples_leaf': 115, 'criterion': 'entropy'}. Best is trial 0 with value: 0.2.[0m
[32m[I 2023-01-13 00:15:45,323][0m Trial 53 finished with value: 0.2 and parameters: {'n_estimators': 3955, 'max_depth': 13, 'min_samples_split': 111, 'min_samples_leaf': 111, 'criterion': 'entropy'}. Best is trial 0 with value: 0.2.[0m
[32m[I 2023-01-13 00:15:51,566][0m Trial 54 finished with value: 0.2 and parameters: {'n_estimators': 2833, 'max_depth': 4, 'min_samples_split': 80, 'min_samples_leaf': 60, 'criterion': 'entropy'}. Best is trial 0 with value: 0.2.[0m
[32m[I 2023-01-13 00:15:57,042][0m Trial 55 finished with value: 0.2 and parameters: {'n_estimators': 2465, 'max_depth': 17, 'min_samples_split': 101, 'min_samples_leaf': 46, 'criterion': 'entropy'}. Best is trial 0 with value: 0.2.[0m
[32m[I 2023-01-13 00:16:02,901][0m Trial 56 finished with value: 0.2 and parameters: {'n_estimators': 2650, 'max_depth': 5, 'min_samples_split': 87, 'min_samples_leaf': 84, 'criterion': 'gini'}. Best is trial 0 with value: 0.2.[0m
[32m[I 2023-01-13 00:16:07,336][0m Trial 57 finished with value: 0.2 and parameters: {'n_estimators': 2007, 'max_depth': 9, 'min_samples_split': 121, 'min_samples_leaf': 93, 'criterion': 'entropy'}. Best is trial 0 with value: 0.2.[0m
[32m[I 2023-01-13 00:16:09,850][0m Trial 58 finished with value: 0.2 and parameters: {'n_estimators': 1074, 'max_depth': 108, 'min_samples_split': 73, 'min_samples_leaf': 87, 'criterion': 'entropy'}. Best is trial 0 with value: 0.2.[0m
[32m[I 2023-01-13 00:16:16,410][0m Trial 59 finished with value: 0.2 and parameters: {'n_estimators': 2974, 'max_depth': 119, 'min_samples_split': 68, 'min_samples_leaf': 36, 'criterion': 'entropy'}. Best is trial 0 with value: 0.2.[0m
[32m[I 2023-01-13 00:16:17,627][0m Trial 60 finished with value: 0.2 and parameters: {'n_estimators': 548, 'max_depth': 96, 'min_samples_split': 109, 'min_samples_leaf': 43, 'criterion': 'entropy'}. Best is trial 0 with value: 0.2.[0m
[32m[I 2023-01-13 00:16:26,684][0m Trial 61 finished with value: 0.2 and parameters: {'n_estimators': 4107, 'max_depth': 118, 'min_samples_split': 18, 'min_samples_leaf': 121, 'criterion': 'entropy'}. Best is trial 0 with value: 0.2.[0m
[32m[I 2023-01-13 00:16:36,885][0m Trial 62 finished with value: 0.2 and parameters: {'n_estimators': 4619, 'max_depth': 58, 'min_samples_split': 23, 'min_samples_leaf': 73, 'criterion': 'entropy'}. Best is trial 0 with value: 0.2.[0m
[32m[I 2023-01-13 00:16:39,903][0m Trial 63 finished with value: 0.2 and parameters: {'n_estimators': 1410, 'max_depth': 96, 'min_samples_split': 9, 'min_samples_leaf': 72, 'criterion': 'entropy'}. Best is trial 0 with value: 0.2.[0m
[32m[I 2023-01-13 00:16:50,386][0m Trial 64 finished with value: 0.2 and parameters: {'n_estimators': 4807, 'max_depth': 85, 'min_samples_split': 33, 'min_samples_leaf': 122, 'criterion': 'entropy'}. Best is trial 0 with value: 0.2.[0m
[32m[I 2023-01-13 00:16:59,299][0m Trial 65 finished with value: 0.2 and parameters: {'n_estimators': 4201, 'max_depth': 45, 'min_samples_split': 29, 'min_samples_leaf': 104, 'criterion': 'entropy'}. Best is trial 0 with value: 0.2.[0m
[32m[I 2023-01-13 00:17:08,082][0m Trial 66 finished with value: 0.2 and parameters: {'n_estimators': 4079, 'max_depth': 85, 'min_samples_split': 16, 'min_samples_leaf': 78, 'criterion': 'gini'}. Best is trial 0 with value: 0.2.[0m
[32m[I 2023-01-13 00:17:17,553][0m Trial 67 finished with value: 0.2 and parameters: {'n_estimators': 4395, 'max_depth': 64, 'min_samples_split': 59, 'min_samples_leaf': 125, 'criterion': 'entropy'}. Best is trial 0 with value: 0.2.[0m
[32m[I 2023-01-13 00:17:27,004][0m Trial 68 finished with value: 0.2 and parameters: {'n_estimators': 4317, 'max_depth': 57, 'min_samples_split': 37, 'min_samples_leaf': 109, 'criterion': 'entropy'}. Best is trial 0 with value: 0.2.[0m
[32m[I 2023-01-13 00:17:37,067][0m Trial 69 finished with value: 0.2 and parameters: {'n_estimators': 4701, 'max_depth': 68, 'min_samples_split': 28, 'min_samples_leaf': 116, 'criterion': 'entropy'}. Best is trial 0 with value: 0.2.[0m
[32m[I 2023-01-13 00:17:43,926][0m Trial 70 finished with value: 0.2 and parameters: {'n_estimators': 3169, 'max_depth': 89, 'min_samples_split': 55, 'min_samples_leaf': 91, 'criterion': 'entropy'}. Best is trial 0 with value: 0.2.[0m
[32m[I 2023-01-13 00:17:48,946][0m Trial 71 finished with value: 0.2 and parameters: {'n_estimators': 2360, 'max_depth': 71, 'min_samples_split': 127, 'min_samples_leaf': 56, 'criterion': 'gini'}. Best is trial 0 with value: 0.2.[0m
[32m[I 2023-01-13 00:17:53,168][0m Trial 72 finished with value: 0.2 and parameters: {'n_estimators': 1986, 'max_depth': 27, 'min_samples_split': 119, 'min_samples_leaf': 50, 'criterion': 'gini'}. Best is trial 0 with value: 0.2.[0m
[32m[I 2023-01-13 00:17:58,462][0m Trial 73 finished with value: 0.2 and parameters: {'n_estimators': 2401, 'max_depth': 21, 'min_samples_split': 117, 'min_samples_leaf': 100, 'criterion': 'gini'}. Best is trial 0 with value: 0.2.[0m
[32m[I 2023-01-13 00:18:02,721][0m Trial 74 finished with value: 0.2 and parameters: {'n_estimators': 1995, 'max_depth': 11, 'min_samples_split': 123, 'min_samples_leaf': 53, 'criterion': 'gini'}. Best is trial 0 with value: 0.2.[0m
[32m[I 2023-01-13 00:18:09,824][0m Trial 75 finished with value: 0.2 and parameters: {'n_estimators': 3312, 'max_depth': 29, 'min_samples_split': 125, 'min_samples_leaf': 109, 'criterion': 'gini'}. Best is trial 0 with value: 0.2.[0m
[32m[I 2023-01-13 00:18:15,718][0m Trial 76 finished with value: 0.2 and parameters: {'n_estimators': 2771, 'max_depth': 15, 'min_samples_split': 4, 'min_samples_leaf': 61, 'criterion': 'gini'}. Best is trial 0 with value: 0.2.[0m
[32m[I 2023-01-13 00:18:21,752][0m Trial 77 finished with value: 0.2 and parameters: {'n_estimators': 2849, 'max_depth': 14, 'min_samples_split': 115, 'min_samples_leaf': 68, 'criterion': 'entropy'}. Best is trial 0 with value: 0.2.[0m
[32m[I 2023-01-13 00:18:30,062][0m Trial 78 finished with value: 0.2 and parameters: {'n_estimators': 3887, 'max_depth': 17, 'min_samples_split': 106, 'min_samples_leaf': 47, 'criterion': 'entropy'}. Best is trial 0 with value: 0.2.[0m
[32m[I 2023-01-13 00:18:35,413][0m Trial 79 finished with value: 0.2 and parameters: {'n_estimators': 2528, 'max_depth': 6, 'min_samples_split': 99, 'min_samples_leaf': 59, 'criterion': 'entropy'}. Best is trial 0 with value: 0.2.[0m
[32m[I 2023-01-13 00:18:40,293][0m Trial 80 finished with value: 0.2 and parameters: {'n_estimators': 2219, 'max_depth': 8, 'min_samples_split': 88, 'min_samples_leaf': 83, 'criterion': 'entropy'}. Best is trial 0 with value: 0.2.[0m
[32m[I 2023-01-13 00:18:42,964][0m Trial 81 finished with value: 0.2 and parameters: {'n_estimators': 1230, 'max_depth': 12, 'min_samples_split': 99, 'min_samples_leaf': 86, 'criterion': 'entropy'}. Best is trial 0 with value: 0.2.[0m
[32m[I 2023-01-13 00:18:44,552][0m Trial 82 finished with value: 0.2 and parameters: {'n_estimators': 729, 'max_depth': 4, 'min_samples_split': 70, 'min_samples_leaf': 33, 'criterion': 'entropy'}. Best is trial 0 with value: 0.2.[0m
[32m[I 2023-01-13 00:18:51,130][0m Trial 83 finished with value: 0.2 and parameters: {'n_estimators': 3015, 'max_depth': 108, 'min_samples_split': 84, 'min_samples_leaf': 25, 'criterion': 'entropy'}. Best is trial 0 with value: 0.2.[0m
[32m[I 2023-01-13 00:18:51,594][0m Trial 84 finished with value: 0.2 and parameters: {'n_estimators': 211, 'max_depth': 121, 'min_samples_split': 110, 'min_samples_leaf': 44, 'criterion': 'entropy'}. Best is trial 0 with value: 0.2.[0m
[32m[I 2023-01-13 00:18:53,153][0m Trial 85 finished with value: 0.2 and parameters: {'n_estimators': 702, 'max_depth': 104, 'min_samples_split': 76, 'min_samples_leaf': 33, 'criterion': 'entropy'}. Best is trial 0 with value: 0.2.[0m
[32m[I 2023-01-13 00:18:54,107][0m Trial 86 finished with value: 0.2 and parameters: {'n_estimators': 431, 'max_depth': 118, 'min_samples_split': 89, 'min_samples_leaf': 39, 'criterion': 'entropy'}. Best is trial 0 with value: 0.2.[0m
[32m[I 2023-01-13 00:18:56,710][0m Trial 87 finished with value: 0.2 and parameters: {'n_estimators': 1087, 'max_depth': 124, 'min_samples_split': 20, 'min_samples_leaf': 73, 'criterion': 'entropy'}. Best is trial 0 with value: 0.2.[0m
[32m[I 2023-01-13 00:18:59,455][0m Trial 88 finished with value: 0.2 and parameters: {'n_estimators': 1263, 'max_depth': 98, 'min_samples_split': 14, 'min_samples_leaf': 76, 'criterion': 'entropy'}. Best is trial 0 with value: 0.2.[0m
[32m[I 2023-01-13 00:19:01,285][0m Trial 89 finished with value: 0.2 and parameters: {'n_estimators': 863, 'max_depth': 96, 'min_samples_split': 10, 'min_samples_leaf': 85, 'criterion': 'gini'}. Best is trial 0 with value: 0.2.[0m
[32m[I 2023-01-13 00:19:11,526][0m Trial 90 finished with value: 0.2 and parameters: {'n_estimators': 4774, 'max_depth': 95, 'min_samples_split': 18, 'min_samples_leaf': 72, 'criterion': 'entropy'}. Best is trial 0 with value: 0.2.[0m
[32m[I 2023-01-13 00:19:14,667][0m Trial 91 finished with value: 0.2 and parameters: {'n_estimators': 1476, 'max_depth': 106, 'min_samples_split': 25, 'min_samples_leaf': 94, 'criterion': 'entropy'}. Best is trial 0 with value: 0.2.[0m
[32m[I 2023-01-13 00:19:23,355][0m Trial 92 finished with value: 0.2 and parameters: {'n_estimators': 4069, 'max_depth': 84, 'min_samples_split': 16, 'min_samples_leaf': 68, 'criterion': 'entropy'}. Best is trial 0 with value: 0.2.[0m
[32m[I 2023-01-13 00:19:32,410][0m Trial 93 finished with value: 0.2 and parameters: {'n_estimators': 4145, 'max_depth': 113, 'min_samples_split': 22, 'min_samples_leaf': 78, 'criterion': 'entropy'}. Best is trial 0 with value: 0.2.[0m
[32m[I 2023-01-13 00:19:42,075][0m Trial 94 finished with value: 0.2 and parameters: {'n_estimators': 4434, 'max_depth': 64, 'min_samples_split': 7, 'min_samples_leaf': 123, 'criterion': 'entropy'}. Best is trial 0 with value: 0.2.[0m
[32m[I 2023-01-13 00:19:52,345][0m Trial 95 finished with value: 0.2 and parameters: {'n_estimators': 4802, 'max_depth': 57, 'min_samples_split': 31, 'min_samples_leaf': 125, 'criterion': 'entropy'}. Best is trial 0 with value: 0.2.[0m
[32m[I 2023-01-13 00:20:02,306][0m Trial 96 finished with value: 0.2 and parameters: {'n_estimators': 4640, 'max_depth': 48, 'min_samples_split': 29, 'min_samples_leaf': 103, 'criterion': 'entropy'}. Best is trial 0 with value: 0.2.[0m
[32m[I 2023-01-13 00:20:11,586][0m Trial 97 finished with value: 0.2 and parameters: {'n_estimators': 4334, 'max_depth': 68, 'min_samples_split': 36, 'min_samples_leaf': 119, 'criterion': 'entropy'}. Best is trial 0 with value: 0.2.[0m
[32m[I 2023-01-13 00:20:22,268][0m Trial 98 finished with value: 0.2 and parameters: {'n_estimators': 4872, 'max_depth': 88, 'min_samples_split': 27, 'min_samples_leaf': 116, 'criterion': 'entropy'}. Best is trial 0 with value: 0.2.[0m
[32m[I 2023-01-13 00:20:31,922][0m Trial 99 finished with value: 0.2 and parameters: {'n_estimators': 4549, 'max_depth': 71, 'min_samples_split': 39, 'min_samples_leaf': 103, 'criterion': 'gini'}. Best is trial 0 with value: 0.2.[0m
Computing morgan fingerprints...
Loading model that can be used for inference only
Using a Transformer with 25.82 M parameters
╒═════════════════════════╤═══════════╤══════════════════╤═════════╤═════════════╤═════════╤═════════╤═════════╕
│ name                    │ class     │ transform        │ prior   │ trainable   │ shape   │ dtype   │   value │
╞═════════════════════════╪═══════════╪══════════════════╪═════════╪═════════════╪═════════╪═════════╪═════════╡
│ GPR.mean_function.c     │ Parameter │ Identity         │         │ True        │ ()      │ float64 │       0 │
├─────────────────────────┼───────────┼──────────────────┼─────────┼─────────────┼─────────┼─────────┼─────────┤
│ GPR.kernel.variance     │ Parameter │ Softplus         │         │ True        │ ()      │ float64 │       0 │
├─────────────────────────┼───────────┼──────────────────┼─────────┼─────────────┼─────────┼─────────┼─────────┤
│ GPR.likelihood.variance │ Parameter │ Softplus + Shift │         │ True        │ ()      │ float64 │       1 │
╘═════════════════════════╧═══════════╧══════════════════╧═════════╧═════════════╧═════════╧═════════╧═════════╛
Upload progress:   0%|          | 0.00/3.74k [00:00<?, ?it/s]Upload progress: 100%|██████████| 3.74k/3.74k [00:00<00:00, 1.56Mit/s]
[32m[I 2023-01-13 00:26:44,995][0m A new study created in memory with name: no-name-aeb5e8cd-2474-4f07-82ee-1eee135fc4dd[0m
/Users/kevinmaikjablonka/git/kjappelbaum/gptchem/src/gptchem/baselines/xgboost.py:38: FutureWarning: suggest_loguniform has been deprecated in v3.0.0. This feature will be removed in v6.0.0. See https://github.com/optuna/optuna/releases/tag/v3.0.0. Use :func:`~optuna.trial.Trial.suggest_float` instead.
  "learning_rate": trial.suggest_loguniform("learning_rate", 0.001, 0.05),
/Users/kevinmaikjablonka/git/kjappelbaum/gptchem/src/gptchem/baselines/xgboost.py:39: FutureWarning: suggest_loguniform has been deprecated in v3.0.0. This feature will be removed in v6.0.0. See https://github.com/optuna/optuna/releases/tag/v3.0.0. Use :func:`~optuna.trial.Trial.suggest_float` instead.
  "colsample_bytree": trial.suggest_loguniform(
/Users/kevinmaikjablonka/git/kjappelbaum/gptchem/src/gptchem/baselines/xgboost.py:42: FutureWarning: suggest_loguniform has been deprecated in v3.0.0. This feature will be removed in v6.0.0. See https://github.com/optuna/optuna/releases/tag/v3.0.0. Use :func:`~optuna.trial.Trial.suggest_float` instead.
  "subsample": trial.suggest_loguniform("subsample", 0.00001, 1),
/Users/kevinmaikjablonka/git/kjappelbaum/gptchem/src/gptchem/baselines/xgboost.py:43: FutureWarning: suggest_loguniform has been deprecated in v3.0.0. This feature will be removed in v6.0.0. See https://github.com/optuna/optuna/releases/tag/v3.0.0. Use :func:`~optuna.trial.Trial.suggest_float` instead.
  "alpha": trial.suggest_loguniform("alpha", 1e-8, 10.0),
/Users/kevinmaikjablonka/git/kjappelbaum/gptchem/src/gptchem/baselines/xgboost.py:44: FutureWarning: suggest_loguniform has been deprecated in v3.0.0. This feature will be removed in v6.0.0. See https://github.com/optuna/optuna/releases/tag/v3.0.0. Use :func:`~optuna.trial.Trial.suggest_float` instead.
  "lambda": trial.suggest_loguniform("lambda", 1e-8, 10.0),
[32m[I 2023-01-13 00:26:47,606][0m Trial 0 finished with value: 0.39999999999999997 and parameters: {'n_estimators': 5490, 'max_depth': 37, 'learning_rate': 0.010570046446158271, 'colsample_bytree': 0.48071425018349023, 'subsample': 0.0013130280280658588, 'alpha': 0.006502000785097662, 'lambda': 8.675307976899775e-05}. Best is trial 0 with value: 0.39999999999999997.[0m
/Users/kevinmaikjablonka/git/kjappelbaum/gptchem/src/gptchem/baselines/xgboost.py:38: FutureWarning: suggest_loguniform has been deprecated in v3.0.0. This feature will be removed in v6.0.0. See https://github.com/optuna/optuna/releases/tag/v3.0.0. Use :func:`~optuna.trial.Trial.suggest_float` instead.
  "learning_rate": trial.suggest_loguniform("learning_rate", 0.001, 0.05),
/Users/kevinmaikjablonka/git/kjappelbaum/gptchem/src/gptchem/baselines/xgboost.py:39: FutureWarning: suggest_loguniform has been deprecated in v3.0.0. This feature will be removed in v6.0.0. See https://github.com/optuna/optuna/releases/tag/v3.0.0. Use :func:`~optuna.trial.Trial.suggest_float` instead.
  "colsample_bytree": trial.suggest_loguniform(
/Users/kevinmaikjablonka/git/kjappelbaum/gptchem/src/gptchem/baselines/xgboost.py:42: FutureWarning: suggest_loguniform has been deprecated in v3.0.0. This feature will be removed in v6.0.0. See https://github.com/optuna/optuna/releases/tag/v3.0.0. Use :func:`~optuna.trial.Trial.suggest_float` instead.
  "subsample": trial.suggest_loguniform("subsample", 0.00001, 1),
/Users/kevinmaikjablonka/git/kjappelbaum/gptchem/src/gptchem/baselines/xgboost.py:43: FutureWarning: suggest_loguniform has been deprecated in v3.0.0. This feature will be removed in v6.0.0. See https://github.com/optuna/optuna/releases/tag/v3.0.0. Use :func:`~optuna.trial.Trial.suggest_float` instead.
  "alpha": trial.suggest_loguniform("alpha", 1e-8, 10.0),
/Users/kevinmaikjablonka/git/kjappelbaum/gptchem/src/gptchem/baselines/xgboost.py:44: FutureWarning: suggest_loguniform has been deprecated in v3.0.0. This feature will be removed in v6.0.0. See https://github.com/optuna/optuna/releases/tag/v3.0.0. Use :func:`~optuna.trial.Trial.suggest_float` instead.
  "lambda": trial.suggest_loguniform("lambda", 1e-8, 10.0),
[32m[I 2023-01-13 00:26:52,426][0m Trial 1 finished with value: 0.39999999999999997 and parameters: {'n_estimators': 8919, 'max_depth': 49, 'learning_rate': 0.00448183267887628, 'colsample_bytree': 0.7151910137131439, 'subsample': 0.004410365667970984, 'alpha': 0.001295391520396607, 'lambda': 2.13978305808933}. Best is trial 0 with value: 0.39999999999999997.[0m
/Users/kevinmaikjablonka/git/kjappelbaum/gptchem/src/gptchem/baselines/xgboost.py:38: FutureWarning: suggest_loguniform has been deprecated in v3.0.0. This feature will be removed in v6.0.0. See https://github.com/optuna/optuna/releases/tag/v3.0.0. Use :func:`~optuna.trial.Trial.suggest_float` instead.
  "learning_rate": trial.suggest_loguniform("learning_rate", 0.001, 0.05),
/Users/kevinmaikjablonka/git/kjappelbaum/gptchem/src/gptchem/baselines/xgboost.py:39: FutureWarning: suggest_loguniform has been deprecated in v3.0.0. This feature will be removed in v6.0.0. See https://github.com/optuna/optuna/releases/tag/v3.0.0. Use :func:`~optuna.trial.Trial.suggest_float` instead.
  "colsample_bytree": trial.suggest_loguniform(
/Users/kevinmaikjablonka/git/kjappelbaum/gptchem/src/gptchem/baselines/xgboost.py:42: FutureWarning: suggest_loguniform has been deprecated in v3.0.0. This feature will be removed in v6.0.0. See https://github.com/optuna/optuna/releases/tag/v3.0.0. Use :func:`~optuna.trial.Trial.suggest_float` instead.
  "subsample": trial.suggest_loguniform("subsample", 0.00001, 1),
/Users/kevinmaikjablonka/git/kjappelbaum/gptchem/src/gptchem/baselines/xgboost.py:43: FutureWarning: suggest_loguniform has been deprecated in v3.0.0. This feature will be removed in v6.0.0. See https://github.com/optuna/optuna/releases/tag/v3.0.0. Use :func:`~optuna.trial.Trial.suggest_float` instead.
  "alpha": trial.suggest_loguniform("alpha", 1e-8, 10.0),
/Users/kevinmaikjablonka/git/kjappelbaum/gptchem/src/gptchem/baselines/xgboost.py:44: FutureWarning: suggest_loguniform has been deprecated in v3.0.0. This feature will be removed in v6.0.0. See https://github.com/optuna/optuna/releases/tag/v3.0.0. Use :func:`~optuna.trial.Trial.suggest_float` instead.
  "lambda": trial.suggest_loguniform("lambda", 1e-8, 10.0),
